{"run":814,"commit":"0dfd343","metric":0.132311,"metrics":{"best_ms":0.117232,"quality_sum":2.491129377057,"quality_min":0.589775903809,"team_count":4},"status":"discard","description":"Direct A/B reversion of `a7d5a8f` output loop: switched people-payload construction back from fixed-size indexed fill to append-based loops (kept other current optimizations intact).","timestamp":1775546589731,"segment":0,"confidence":29.714274748247984,"iterationTokens":2716,"asi":{"hypothesis":"Revalidating indexed-fill keep: append-based payload growth might outperform under current interpreter/cache regime.","rollback_reason":"Reversion was slower in this sample; no evidence to drop indexed-fill strategy.","next_action_hint":"Retain fixed-size indexed people-payload fill from `a7d5a8f` chain.","ab_note":"Explicit A/B reversion test against current baseline."}}
{"run":815,"commit":"0dfd343","metric":0.165574,"metrics":{"best_ms":0.126109,"quality_sum":2.491129377057,"quality_min":0.589775903809,"team_count":4},"status":"discard","description":"No-code baseline rerun after pruning A/B reversion result for indexed people-payload fill (`a7d5a8f`).","timestamp":1775546650604,"segment":0,"confidence":29.71955536333715,"iterationTokens":915,"asi":{"hypothesis":"Ideas update should not change behavior; sample used to track ongoing host drift after A/B validation.","rollback_reason":"No source-code change; validation-only run.","next_action_hint":"Continue requiring paired confirmations due persistent high jitter.","noise_observation":"Median spiked into slower transient band while quality stayed constant."}}
{"run":816,"commit":"0dfd343","metric":0.129916,"metrics":{"best_ms":0.111431,"quality_sum":2.491129377057,"quality_min":0.589775903809,"team_count":4},"status":"discard","description":"Direct A/B reversion of `0dfd343`: restored optional `ScoredAllocation.team_signature` + runtime `cast(...)` in improve-cache key (removed post-init signature normalization).","timestamp":1775546749289,"segment":0,"confidence":29.761152168695236,"iterationTokens":2017,"asi":{"hypothesis":"If non-optional team-signature normalization/cast removal was overfit, reverting to optional+cast representation should recover or improve median.","rollback_reason":"Reversion was slower in this sample; no evidence to drop 0dfd343.","next_action_hint":"Retain non-optional `team_signature` + cast-free improve-key strategy from 0dfd343 and continue paired validation.","ab_note":"Explicit A/B reversion against current baseline."}}
{"run":817,"commit":"0dfd343","metric":0.158711,"metrics":{"best_ms":0.129094,"quality_sum":2.491129377057,"quality_min":0.589775903809,"team_count":4},"status":"discard","description":"No-code baseline rerun after pruning A/B reversion result for 0dfd343 optional-team-signature rollback.","timestamp":1775546813820,"segment":0,"confidence":29.80298088349399,"iterationTokens":990,"asi":{"hypothesis":"Ideas update should preserve behavior while sampling host regime after cast-removal A/B check.","rollback_reason":"No source-code change; validation-only run.","next_action_hint":"Retain 0dfd343 and require paired evidence before revisiting team-signature representation.","noise_observation":"Median returned to slower transient warm band; quality metrics unchanged."}}
{"run":818,"commit":"0dfd343","metric":0.135357,"metrics":{"best_ms":0.124857,"quality_sum":2.491129377057,"quality_min":0.589775903809,"team_count":4},"status":"discard","description":"Tried list-backed task-order hardness cache payloads (`_REQUEST_TASK_ORDER_BY_HARDNESS`) with `.copy()` on hit/store instead of tuple payload + unpack-list conversion.","timestamp":1775546891390,"segment":0,"confidence":29.86693783932022,"iterationTokens":1591,"asi":{"hypothesis":"Mirroring the successful list-backed cache pattern from greedy/improve might reduce task-order cache copy overhead in `form_teams`.","rollback_reason":"No clear improvement in current regime; near-noise/slightly slower.","next_action_hint":"Keep tuple-backed task-order cache payloads with existing copy path.","observation":"Checks passed and quality metrics unchanged."}}
{"run":819,"commit":"0dfd343","metric":0.143602,"metrics":{"best_ms":0.123454,"quality_sum":2.491129377057,"quality_min":0.589775903809,"team_count":4},"status":"discard","description":"No-code baseline rerun after pruning list-backed task-order cache payload experiment.","timestamp":1775546955717,"segment":0,"confidence":29.93116988771227,"iterationTokens":850,"asi":{"hypothesis":"Ideas update should preserve runtime while re-sampling current warm band.","rollback_reason":"No source-code change; validation-only run.","next_action_hint":"Continue avoiding task-order cache container-shape micro-variants.","noise_observation":"Median in mid warm band with stable quality monitors."}}
{"run":820,"commit":"0dfd343","metric":0.138763,"metrics":{"best_ms":0.1268,"quality_sum":2.491129377057,"quality_min":0.589775903809,"team_count":4},"status":"discard","description":"Tried `improve_allocations` cache-key len-4 specialization: unrolled allocation signature tuple construction for common 4-allocation path, fallback generator for other sizes.","timestamp":1775547076727,"segment":0,"confidence":29.958272508806143,"iterationTokens":3381,"asi":{"hypothesis":"Unrolling 4-allocation signature extraction may reduce generator/loop overhead in hot improve-cache key construction.","rollback_reason":"No clear gain in current regime; added branch/unpack complexity regressed slightly.","next_action_hint":"Keep generic tuple-generator improve-cache key construction.","observation":"Checks passed and quality metrics unchanged."}}
{"run":821,"commit":"0dfd343","metric":0.119155,"metrics":{"best_ms":0.114707,"quality_sum":2.491129377057,"quality_min":0.589775903809,"team_count":4},"status":"discard","description":"No-code baseline rerun after pruning regressed len-4 improve-cache-key specialization.","timestamp":1775547135692,"segment":0,"confidence":29.98500114854404,"iterationTokens":824,"asi":{"hypothesis":"Ideas-only update should preserve behavior; rerun used to check whether host returned to low warm band.","rollback_reason":"No source-code change; validation-only run.","next_action_hint":"Use this low-band sample as reference and continue requiring paired evidence for micro-candidates.","noise_observation":"Median dropped back to low warm band with unchanged quality metrics."}}
{"run":822,"commit":"0dfd343","metric":0.141999,"metrics":{"best_ms":0.119426,"quality_sum":2.491129377057,"quality_min":0.589775903809,"team_count":4},"status":"discard","description":"Tried greedy-cache-key len-4 specialization: unrolled task-order id tuple construction for common 4-task path, fallback generator for other sizes.","timestamp":1775547206802,"segment":0,"confidence":30.059819022563996,"iterationTokens":1032,"asi":{"hypothesis":"Unrolling 4-task cache-key id extraction may reduce generator overhead on warm greedy-cache hits.","rollback_reason":"Regressed in current regime; added branch/unpack overhead outweighed savings.","next_action_hint":"Keep generic `tuple(task.id for task in task_order)` greedy-key construction.","observation":"Checks passed and quality metrics unchanged."}}
{"run":823,"commit":"0dfd343","metric":0.167297,"metrics":{"best_ms":0.132942,"quality_sum":2.491129377057,"quality_min":0.589775903809,"team_count":4},"status":"discard","description":"No-code baseline rerun after pruning regressed greedy-key len-4 unrolled specialization.","timestamp":1775547270255,"segment":0,"confidence":30.135011198153528,"iterationTokens":806,"asi":{"hypothesis":"Ideas-only rollback should preserve behavior while tracking current host drift after recent micro-variant.","rollback_reason":"No source-code change; validation-only run.","next_action_hint":"Avoid further key-unrolling micro-specializations in warm cache paths.","noise_observation":"Median shifted into slower transient band; quality metrics unchanged."}}
{"run":824,"commit":"0dfd343","metric":0.129164,"metrics":{"best_ms":0.125187,"quality_sum":2.491129377057,"quality_min":0.589775903809,"team_count":4},"status":"discard","description":"No-code baseline rerun after refreshing fresh-request diagnostic note (~44–45ms median, best ~44.2ms with occasional spikes).","timestamp":1775547368509,"segment":0,"confidence":30.226425968315702,"iterationTokens":1997,"asi":{"hypothesis":"Ideas-only fresh-request note update should not affect warm benchmark behavior.","rollback_reason":"No source-code change; validation-only run.","next_action_hint":"Continue tracking warm-vs-fresh gap to avoid over-interpreting request-reuse-only gains.","fresh_diagnostic":"External fresh-request check measured median ~44.836ms, best ~44.256ms with one high outlier (~52.1ms)."}}
{"run":825,"commit":"0dfd343","metric":0.167195,"metrics":{"best_ms":0.157126,"quality_sum":2.491129377057,"quality_min":0.589775903809,"team_count":4},"status":"discard","description":"Tried greedy-cache warm-hit empty-reserve fast path: avoid copying `cached_greedy[2]` when empty (`return allocations.copy(), []`), keep copy for non-empty reserves.","timestamp":1775549783012,"segment":0,"confidence":30.318829610579964,"iterationTokens":1997,"asi":{"hypothesis":"Benchmark usually has no unused people; skipping empty-list copy on greedy cache hits may reduce warm-path overhead.","rollback_reason":"Regressed sharply in this sample; branch overhead and changed path did not help.","next_action_hint":"Keep straightforward dual `.copy()` return on greedy cache hits and avoid empty-reserve special-case branches.","observation":"Checks passed and behavior metrics unchanged."}}
{"run":826,"commit":"0dfd343","metric":0.162443,"metrics":{"best_ms":0.157031,"quality_sum":2.491129377057,"quality_min":0.589775903809,"team_count":4},"status":"discard","description":"No-code baseline rerun after pruning regressed greedy-cache empty-reserve branch specialization.","timestamp":1775549859342,"segment":0,"confidence":31.26476418110111,"iterationTokens":846,"asi":{"hypothesis":"Ideas-only rollback should preserve behavior while tracking immediate post-variant host band.","rollback_reason":"No source-code change; validation-only run.","next_action_hint":"Hold off on additional branch-specialized copy micro-variants under current slow/noisy band.","noise_observation":"Warm sample remained in elevated band with stable quality metrics."}}
{"run":827,"commit":"0dfd343","metric":0.186093,"metrics":{"best_ms":0.158972,"quality_sum":2.491129377057,"quality_min":0.589775903809,"team_count":4},"status":"discard","description":"Added precomputed `ScoredAllocation.improve_key_signature` field (`(task_id, team_signature)`) and used it directly in `improve_allocations` cache-key tuple construction.","timestamp":1775550105158,"segment":0,"confidence":32.27162514042299,"iterationTokens":846,"asi":{"hypothesis":"Precomputing allocation-level improve-key fragments may reduce repeated tuple assembly overhead in warm improve-cache key creation.","rollback_reason":"Regressed strongly in this sample; added dataclass field/post-init work outweighed any key-assembly savings.","next_action_hint":"Keep direct inline improve-key tuple assembly without extra `ScoredAllocation` signature fragment field.","observation":"Checks passed and quality metrics unchanged despite performance regression."}}
{"run":828,"commit":"0dfd343","metric":0.177712,"metrics":{"best_ms":0.159727,"quality_sum":2.491129377057,"quality_min":0.589775903809,"team_count":4},"status":"discard","description":"No-code baseline rerun after pruning regressed precomputed improve-key-signature field experiment.","timestamp":1775550177942,"segment":0,"confidence":32.33496964892297,"iterationTokens":877,"asi":{"hypothesis":"Rollback should restore baseline behavior and sample whether transient slow band persists.","rollback_reason":"No source-code change; validation-only run.","next_action_hint":"Host currently in elevated warm band; rely on bundled paired samples before drawing conclusions from micro deltas.","noise_observation":"Median remained in slow transient range with unchanged quality metrics."}}
{"run":829,"commit":"0dfd343","metric":0.196279,"metrics":{"best_ms":0.147678,"quality_sum":2.491129377057,"quality_min":0.589775903809,"team_count":4},"status":"discard","description":"Tried replacing inline payload dict literal with named local `response_payload` variable before `TeamsResponse.model_validate(...)` call in `form_teams`.","timestamp":1775550251470,"segment":0,"confidence":32.39856331861245,"iterationTokens":1382,"asi":{"hypothesis":"Reusing a named payload variable might slightly reduce literal construction/bytecode overhead in final response validation step.","rollback_reason":"Regressed sharply in current sample; no evidence of improvement.","next_action_hint":"Keep direct inline `TeamsResponse.model_validate({'teams': teams_payload})` call.","observation":"Checks passed and quality metrics unchanged."}}
{"run":830,"commit":"0dfd343","metric":0.1445,"metrics":{"best_ms":0.138208,"quality_sum":2.491129377057,"quality_min":0.589775903809,"team_count":4},"status":"discard","description":"No-code baseline rerun after pruning regressed local response-payload variable variant.","timestamp":1775550312973,"segment":0,"confidence":32.48016819031471,"iterationTokens":821,"asi":{"hypothesis":"Ideas-only update should preserve behavior while checking whether slow-band spike subsided.","rollback_reason":"No source-code change; validation-only run.","next_action_hint":"Keep direct inline response payload literal and continue paired validation under host variance.","noise_observation":"Median returned toward mid band while quality metrics remained stable."}}
{"run":831,"commit":"0dfd343","metric":0.1642,"metrics":{"best_ms":0.160073,"quality_sum":2.491129377057,"quality_min":0.589775903809,"team_count":4},"status":"discard","description":"Retried `greedy_allocations` optional `task_order_ids` precompute path: compute tuple once in `form_teams` and pass into helper to avoid rebuilding task-id tuple for greedy cache key.","timestamp":1775550438377,"segment":0,"confidence":32.56218518960603,"iterationTokens":3805,"asi":{"hypothesis":"Precomputing task-order ids in caller might reduce warm-path key-generation overhead in `greedy_allocations`.","rollback_reason":"Regressed in current regime; extra tuple creation in caller and plumbing outweighed any helper-side savings.","next_action_hint":"Keep existing in-helper task-id tuple generation; avoid precompute plumbing retries.","observation":"Checks passed and quality metrics unchanged."}}
{"run":832,"commit":"0dfd343","metric":0.187054,"metrics":{"best_ms":0.171715,"quality_sum":2.491129377057,"quality_min":0.589775903809,"team_count":4},"status":"discard","description":"No-code baseline rerun after pruning repeated `task_order_ids` precompute retry as neutral/regressive.","timestamp":1775550503036,"segment":0,"confidence":32.71067840472962,"iterationTokens":834,"asi":{"hypothesis":"Ideas-only rollback should preserve behavior while checking whether current slow band persists.","rollback_reason":"No source-code change; validation-only run.","next_action_hint":"Host remains in elevated jitter band; keep using paired bundles and avoid keep/discard decisions on single marginal samples.","noise_observation":"Median and best both elevated versus low-band runs, indicating broad transient slowdown."}}
{"run":833,"commit":"0dfd343","metric":0.165904,"metrics":{"best_ms":0.15858,"quality_sum":2.491129377057,"quality_min":0.589775903809,"team_count":4},"status":"discard","description":"Tried task-order hardness-cache payload expansion to also store `task_order_ids`, then passed cached ids into `greedy_allocations` to avoid per-call task-id tuple regeneration for greedy cache key.","timestamp":1775550660227,"segment":0,"confidence":32.86053217050909,"iterationTokens":5912,"asi":{"hypothesis":"Reusing cached task-order id tuple from `_REQUEST_TASK_ORDER_BY_HARDNESS` could remove hot key-generation generator overhead in warm deterministic path.","rollback_reason":"Regressed in current regime; larger cache payload/plumbing overhead outweighed saved tuple generation.","next_action_hint":"Keep simpler task-order cache payload and in-helper task-id tuple generation.","observation":"Checks passed and quality metrics unchanged."}}
{"run":834,"commit":"0dfd343","metric":0.184529,"metrics":{"best_ms":0.16411,"quality_sum":2.491129377057,"quality_min":0.589775903809,"team_count":4},"status":"discard","description":"No-code baseline rerun after pruning task-order-cache payload expansion (`task_order_ids` reuse) as regressive.","timestamp":1775550727168,"segment":0,"confidence":32.913620719140674,"iterationTokens":834,"asi":{"hypothesis":"Ideas-only rollback should preserve behavior while tracking current host regime after cache-payload retry.","rollback_reason":"No source-code change; validation-only run.","next_action_hint":"Avoid further task-order cache payload shape experiments under current jitter.","noise_observation":"Median remained in elevated warm band with unchanged quality metrics."}}
{"run":835,"commit":"0dfd343","metric":0.188326,"metrics":{"best_ms":0.155665,"quality_sum":2.491129377057,"quality_min":0.589775903809,"team_count":4},"status":"discard","description":"Tried lazy score-cache dict allocation in `form_teams`: removed unconditional `score_cache = {}` creation and only instantiate on original-scorer cache miss or non-original path.","timestamp":1775550893373,"segment":0,"confidence":32.96688108207321,"iterationTokens":1208,"asi":{"hypothesis":"Avoiding unconditional empty dict allocation each call may reduce warm entry overhead when form-level score cache hit is present.","rollback_reason":"Regressed in this sample; branch/annotation restructuring did not improve runtime.","next_action_hint":"Keep simple unconditional local score-cache initialization followed by optional cache reuse.","observation":"Checks passed and quality metrics unchanged."}}
{"run":836,"commit":"0dfd343","metric":0.194869,"metrics":{"best_ms":0.169581,"quality_sum":2.491129377057,"quality_min":0.589775903809,"team_count":4},"status":"discard","description":"No-code baseline rerun after pruning regressed lazy `score_cache` initialization variant.","timestamp":1775550964471,"segment":0,"confidence":33.16465206590578,"iterationTokens":899,"asi":{"hypothesis":"Ideas-only rollback should preserve behavior; run tracks whether elevated slow band persists.","rollback_reason":"No source-code change; validation-only run.","next_action_hint":"Host currently in slower band; keep using paired bundles for marginal candidates.","noise_observation":"Median and best both elevated versus low-band samples, suggesting transient system slowdown."}}
{"run":837,"commit":"0dfd343","metric":0.163379,"metrics":{"best_ms":0.156246,"quality_sum":2.491129377057,"quality_min":0.589775903809,"team_count":4},"status":"discard","description":"Tried removing warm-hit defensive list copies in request-scoped caches: `greedy_allocations`/`improve_allocations` now returned cached list objects directly instead of `.copy()`.","timestamp":1775551065843,"segment":0,"confidence":33.36481025902958,"iterationTokens":2751,"asi":{"hypothesis":"Eliminating three list-copy operations on warm path might reduce per-call overhead.","rollback_reason":"Regressed in current regime and increases aliasing risk (caller mutation could affect cache state).","next_action_hint":"Keep `.copy()` on warm cache hits for greedy/improve caches.","observation":"Checks passed and quality metrics unchanged."}}
{"run":838,"commit":"0dfd343","metric":0.168599,"metrics":{"best_ms":0.161646,"quality_sum":2.491129377057,"quality_min":0.589775903809,"team_count":4},"status":"discard","description":"No-code baseline rerun after pruning regressed no-copy warm-cache return variant (aliasing-risk path).","timestamp":1775551140130,"segment":0,"confidence":33.40202859933235,"iterationTokens":863,"asi":{"hypothesis":"Ideas-only rollback should restore baseline while sampling current high-latency warm regime.","rollback_reason":"No source-code change; validation-only run.","next_action_hint":"Continue requiring paired bundles before interpreting micro changes in this elevated host band.","noise_observation":"Median and best remain elevated versus low-band runs, indicating persistent transient slowdown."}}
{"run":839,"commit":"0dfd343","metric":0.213892,"metrics":{"best_ms":0.157075,"quality_sum":2.491129377057,"quality_min":0.589775903809,"team_count":4},"status":"discard","description":"Tried `init_random` local alias in `form_teams` (replace repeated `request.init_random` attribute checks with local bool for randomizer setup, permutation-index caching gate, and shuffle gate).","timestamp":1775551223022,"segment":0,"confidence":33.43933006624434,"iterationTokens":1785,"asi":{"hypothesis":"Local bool alias may reduce repeated attribute lookup overhead on hot path.","rollback_reason":"Regressed sharply in current sample; extra local/setup provided no benefit.","next_action_hint":"Keep direct `request.init_random` checks; avoid additional local-alias micro rewrites in entry path.","observation":"Checks passed and quality metrics unchanged."}}
