{"run":561,"commit":"5d6aa55","metric":1.149947,"metrics":{"best_ms":1.135441,"quality_sum":2.491129377057,"quality_min":0.589775903809,"team_count":4},"status":"discard","description":"No-code baseline rerun after ideas pruning/update on active 5d6aa55 baseline.","timestamp":1775466003876,"segment":0,"confidence":12.724818853303297,"iterationTokens":10868,"asi":{"hypothesis":"Metadata-only edits should leave runtime in current ~1.15ms band.","rollback_reason":"No code change; monitoring run.","next_action_hint":"Continue structural optimize-only path; avoid broad cache payload rewrites that recently regressed.","noise_observation":"Baseline remained stable in the low-1.15ms range with unchanged quality monitors."}}
{"run":562,"commit":"5d6aa55","metric":1.242393,"metrics":{"best_ms":1.211936,"quality_sum":2.491129377057,"quality_min":0.589775903809,"team_count":4},"status":"discard","description":"Tried bypassing `TeamsResponse.model_validate(...)` wrapper by caching and calling internal Pydantic validator entrypoint directly (`TeamsResponse.__pydantic_validator__.validate_python`) with casted return.","timestamp":1775466122205,"segment":0,"confidence":12.494205304812942,"iterationTokens":2232,"asi":{"hypothesis":"Direct validator invocation should trim method-wrapper overhead on the output validation path.","rollback_reason":"End-to-end median regressed substantially versus active baseline.","next_action_hint":"Keep public `TeamsResponse.model_validate(...)` path; direct internal validator dispatch is not beneficial here.","observation":"Any local microbench gain did not translate once integrated into full hot path."}}
{"run":563,"commit":"5d6aa55","metric":1.387398,"metrics":{"best_ms":1.221664,"quality_sum":2.491129377057,"quality_min":0.589775903809,"team_count":4},"status":"discard","description":"Added len-4 specialized manual swap-template construction blocks for left/right teams in `improve_allocations` (explicit tuple literals) with generic list-comprehension fallback for other sizes.","timestamp":1775466274196,"segment":0,"confidence":12.285759895132056,"iterationTokens":4882,"asi":{"hypothesis":"Manual fixed-shape template construction for 4-member teams should be faster than per-pair slicing comprehensions in the swap loop.","rollback_reason":"Large median regression despite occasional low best sample.","next_action_hint":"Keep generic slice-based template construction; explicit manual template literals add overhead/complexity in full run.","observation":"Microbenchmark win did not transfer; added branch/literal setup cost hurt end-to-end median."}}
{"run":564,"commit":"5d6aa55","metric":1.378291,"metrics":{"best_ms":1.310652,"quality_sum":2.491129377057,"quality_min":0.589775903809,"team_count":4},"status":"discard","description":"Added request-scoped cache for per-allocation `people` payload dict lists in final response construction (`_REQUEST_TEAM_PEOPLE_PAYLOADS`) keyed by `(id(request), id(assignments))` to reuse nested payload lists across repeated calls.","timestamp":1775466360664,"segment":0,"confidence":12.26921964600678,"iterationTokens":2804,"asi":{"hypothesis":"Reusing immutable people payload lists from persistent assignment dicts should reduce Python dict/list construction overhead before `TeamsResponse.model_validate`.","rollback_reason":"Primary median regressed strongly versus active baseline.","next_action_hint":"Do not add payload caching layer in final response path; cache lookup/validation interaction costs outweigh saved payload construction.","observation":"Extra global-cache lookups and branch checks in the return path were net-negative."}}
{"run":565,"commit":"5d6aa55","metric":1.144298,"metrics":{"best_ms":1.127184,"quality_sum":2.491129377057,"quality_min":0.589775903809,"team_count":4},"status":"discard","description":"No-code baseline rerun after recent regressing trials on active 5d6aa55 baseline.","timestamp":1775466412270,"segment":0,"confidence":12.250970233096668,"iterationTokens":699,"asi":{"hypothesis":"Baseline should remain in the low-1.1ms band after reverting regressing experiments.","rollback_reason":"No code change; stability check.","next_action_hint":"Keep using paired/no-code checks for any further marginal candidates.","noise_observation":"Baseline remains stable around ~1.14–1.15ms with unchanged quality outputs."}}
{"run":566,"commit":"5d6aa55","metric":1.363062,"metrics":{"best_ms":1.144928,"quality_sum":2.491129377057,"quality_min":0.589775903809,"team_count":4},"status":"discard","description":"Changed final response payload containers to tuples (teams tuple + per-team people tuple) before `TeamsResponse.model_validate`, replacing list containers.","timestamp":1775466571496,"segment":0,"confidence":12.208780513339088,"iterationTokens":3555,"asi":{"hypothesis":"Tuple payloads might reduce Pydantic container-normalization overhead versus lists in output validation.","rollback_reason":"Primary median regressed significantly in end-to-end benchmark.","next_action_hint":"Keep list-based payload construction for final `TeamsResponse.model_validate` path.","observation":"Microbench tuple advantage did not transfer; end-to-end median worsened materially."}}
{"run":567,"commit":"5d6aa55","metric":1.360166,"metrics":{"best_ms":1.251571,"quality_sum":2.491129377057,"quality_min":0.589775903809,"team_count":4},"status":"checks_failed","description":"Tried slimming greedy <=cap exact-bound cached tuples by dropping stored candidate index (`(exact_upper, candidate)` only), relying on stable sort by exact bound and insertion order instead of explicit index tie key.","timestamp":1775466661329,"segment":0,"confidence":12.151465726091507,"iterationTokens":2498,"asi":{"hypothesis":"Removing unused index payload in greedy cached tuples should reduce scan/unpack overhead with deterministic ordering preserved by stable sort.","rollback_reason":"Checks failed (Ruff B007 unused `index`) and median regressed materially.","next_action_hint":"Abandon greedy tuple-index removal path; retain current `(exact_upper, index, candidate)` representation.","error_excerpt":"Ruff B007 at formation.py:1778 (`index` unused)."}}
{"run":568,"commit":"5d6aa55","metric":1.089433,"metrics":{"best_ms":1.072571,"quality_sum":2.491129377057,"quality_min":0.589775903809,"team_count":4},"status":"checks_failed","description":"Made randomizer creation lazy across formation flow: `random.Random(seed)` now created only when `request.init_random` is true; threaded `randomizer: Random | None` through build_scored/greedy/exact helpers with asserts before shuffle sites.","timestamp":1775466872240,"segment":0,"confidence":12.099291962539333,"iterationTokens":8907,"asi":{"hypothesis":"`random.Random(seed)` initialization is pure overhead when `initRandom=false`; lazily creating it should remove deterministic per-call cost.","rollback_reason":"Checks failed (`ty` unresolved attribute) because `form_teams` task-order shuffle site lacked non-None narrowing for optional randomizer.","next_action_hint":"Retry with `assert randomizer is not None` (or equivalent narrowing) before `randomizer.shuffle(task_order)` in `form_teams`.","error_excerpt":"ty unresolved-attribute at formation.py:2786 (`randomizer.shuffle` on `None | Random`)."}}
{"run":569,"commit":"4406a7c","metric":1.11437,"metrics":{"best_ms":1.088752,"quality_sum":2.491129377057,"quality_min":0.589775903809,"team_count":4},"status":"keep","description":"Lazily instantiate `random.Random(seed)` only when `request.init_random` is true. Threaded `randomizer: Random | None` through `build_scored_candidates`, `greedy_allocations`, and `exact_allocations`, with explicit non-None asserts at all shuffle call sites.","timestamp":1775466945299,"segment":0,"confidence":12.047564312067689,"iterationTokens":1945,"asi":{"hypothesis":"For deterministic requests (`initRandom=false`), always constructing/seeding `Random` is pure overhead; making randomizer optional should remove per-call setup cost.","result":"Primary metric improved with checks passing and unchanged quality monitors.","safety_notes":"Random behavior is unchanged when `initRandom=true`; only initialization timing changed."}}
{"run":570,"commit":"4406a7c","metric":1.164756,"metrics":{"best_ms":1.147494,"quality_sum":2.491129377057,"quality_min":0.589775903809,"team_count":4},"status":"discard","description":"No-code confirmation rerun on kept lazy-randomizer-instantiation commit 4406a7c.","timestamp":1775467001999,"segment":0,"confidence":12.023899997687177,"iterationTokens":758,"asi":{"hypothesis":"If 4406a7c gain is robust, reruns should stay improved versus pre-change baseline with stable quality metrics.","rollback_reason":"No code change; validation-only rerun.","next_action_hint":"Keep 4406a7c as baseline but require additional paired confirmations for future marginal keeps due widened short-term variance.","noise_observation":"Rerun remained better than pre-4406a7c baseline but showed noticeable jitter vs keep sample."}}
{"run":571,"commit":"4406a7c","metric":1.27257,"metrics":{"best_ms":1.07181,"quality_sum":2.491129377057,"quality_min":0.589775903809,"team_count":4},"status":"discard","description":"Additional no-code baseline rerun on active 4406a7c to probe current variance after mixed confirmation samples.","timestamp":1775467046982,"segment":0,"confidence":12.000328465871297,"iterationTokens":713,"asi":{"hypothesis":"Extra baseline sample helps distinguish real regressions from host jitter before next code changes.","rollback_reason":"No code change; variance probe.","next_action_hint":"Treat single-run medians as noisy in current regime; keep strict paired comparisons and avoid keeping marginal deltas without repeat evidence.","noise_observation":"Observed very wide spread (best still low, median spiked), indicating transient host instability."}}
{"run":572,"commit":"4406a7c","metric":1.328205,"metrics":{"best_ms":1.275094,"quality_sum":2.491129377057,"quality_min":0.589775903809,"team_count":4},"status":"discard","description":"Third no-code baseline rerun on active 4406a7c while host appears unstable.","timestamp":1775467094513,"segment":0,"confidence":11.9700972034124,"iterationTokens":671,"asi":{"hypothesis":"Repeated baseline sampling is needed to estimate current noise floor before trusting new marginal code changes.","rollback_reason":"No code change; variance measurement.","next_action_hint":"Wait for regime stabilization or require multi-run paired evidence before additional keeps.","noise_observation":"Consecutive baseline medians drifted upward with large spread, confirming current instability."}}
{"run":573,"commit":"4406a7c","metric":1.287659,"metrics":{"best_ms":1.265837,"quality_sum":2.491129377057,"quality_min":0.589775903809,"team_count":4},"status":"discard","description":"Additional no-code baseline sample on active 4406a7c under unstable host conditions.","timestamp":1775467148546,"segment":0,"confidence":11.94001787556843,"iterationTokens":659,"asi":{"hypothesis":"Continue sampling baseline to track regime drift before interpreting new code deltas.","rollback_reason":"No code change; monitoring-only run.","next_action_hint":"Given sustained instability, avoid keeping marginal edits without repeated confirmation.","noise_observation":"Median remains elevated vs earlier low-band samples, indicating ongoing host pressure."}}
{"run":574,"commit":"4406a7c","metric":1.081378,"metrics":{"best_ms":1.066259,"quality_sum":2.491129377057,"quality_min":0.589775903809,"team_count":4},"status":"discard","description":"No-code baseline rerun after ideas pruning/update on active 4406a7c baseline.","timestamp":1775467305346,"segment":0,"confidence":11.775642281070215,"iterationTokens":3260,"asi":{"hypothesis":"Metadata-only updates should not affect runtime; run also rechecks current host band before next code change.","rollback_reason":"No code change; validation-only rerun.","next_action_hint":"Use 4406a7c baseline; continue only high-signal structural candidates and pair each keep with immediate confirmation.","noise_observation":"Host returned to low-1.08ms band, highlighting substantial short-term variance."}}
{"run":575,"commit":"4406a7c","metric":1.176178,"metrics":{"best_ms":1.102688,"quality_sum":2.491129377057,"quality_min":0.589775903809,"team_count":4},"status":"discard","description":"Tried splitting final response validation into per-team `TeamResult.model_validate(...)` plus outer `TeamsResponse.model_construct(teams=...)`, replacing single `TeamsResponse.model_validate({'teams': ...})`.","timestamp":1775467403830,"segment":0,"confidence":11.615731071529982,"iterationTokens":2415,"asi":{"hypothesis":"Validating each team payload and constructing the outer container without an extra full-model validation pass might reduce output-path overhead.","rollback_reason":"End-to-end median regressed versus active baseline.","next_action_hint":"Keep single batched `TeamsResponse.model_validate` construction path.","observation":"Microbenchmark improvement did not generalize in integrated workload."}}
{"run":576,"commit":"4406a7c","metric":1.286096,"metrics":{"best_ms":1.130872,"quality_sum":2.491129377057,"quality_min":0.589775903809,"team_count":4},"status":"discard","description":"No-code baseline rerun after recent output-path experiment to re-anchor current host regime.","timestamp":1775467452690,"segment":0,"confidence":11.538332707777908,"iterationTokens":667,"asi":{"hypothesis":"Reverted baseline should remain around prior band; this run checks immediate post-revert stability.","rollback_reason":"No code change; monitoring run.","next_action_hint":"Given persistent jitter, evaluate only large deltas and require paired confirmations.","noise_observation":"Median rose again while best stayed low, indicating continued multi-modal host variance."}}
{"run":577,"commit":"4406a7c","metric":1.287027,"metrics":{"best_ms":1.236121,"quality_sum":2.491129377057,"quality_min":0.589775903809,"team_count":4},"status":"discard","description":"Replaced final allocation ordering step (`original_order` map + `sorted(...)`) with direct task-order reconstruction via `allocations_by_task_id[task.id]` iteration over `request.tasks` before building response payload.","timestamp":1775467589221,"segment":0,"confidence":11.46195896395237,"iterationTokens":667,"asi":{"hypothesis":"For small fixed task counts, mapping allocations by task id and iterating request order should be cheaper than sorting allocations each call.","rollback_reason":"Large end-to-end median regression versus active baseline.","next_action_hint":"Keep existing `sorted` output-order path; this map/reconstruction rewrite is not beneficial in integrated run.","observation":"Extra dict materialization and nested comprehension overhead outweighed sort savings."}}
{"run":578,"commit":"4406a7c","metric":1.252221,"metrics":{"best_ms":1.226012,"quality_sum":2.491129377057,"quality_min":0.589775903809,"team_count":4},"status":"discard","description":"Added len-4 swap-pair iteration specialization in `improve_allocations`: precomputed fixed `(left_index, right_index, other_min)` tuples for the 6 pair combinations, with generic generator fallback for other allocation counts.","timestamp":1775467714989,"segment":0,"confidence":11.430880469525881,"iterationTokens":5402,"asi":{"hypothesis":"For dominant 4-allocation workload, replacing per-pair generator/min computation with fixed pair data should reduce swap-loop overhead.","rollback_reason":"End-to-end median regressed versus active baseline.","next_action_hint":"Do not pursue fixed pair-iteration specialization; keep generic pair loop/min path.","observation":"Added pair-setup scaffolding outweighed saved per-pair min/generator overhead."}}
{"run":579,"commit":"4406a7c","metric":1.33603,"metrics":{"best_ms":1.092439,"quality_sum":2.491129377057,"quality_min":0.589775903809,"team_count":4},"status":"discard","description":"Refactored task-order cache reuse in `form_teams` to avoid unconditional per-call list copy when `init_random=false`: reuse cached tuple directly as `task_order`, only materialize/shuffle a list when random init is enabled.","timestamp":1775467809066,"segment":0,"confidence":11.399970054742273,"iterationTokens":3286,"asi":{"hypothesis":"Eliminating repeated list-copy churn from cached task-order reuse should reduce deterministic per-call overhead.","rollback_reason":"Median regressed significantly versus active baseline.","next_action_hint":"Retain existing list-copy task-order path; tuple reuse here appears to hurt overall performance/locality.","observation":"Despite low best sample, median worsened sharply in integrated runs."}}
{"run":580,"commit":"169f4cc","metric":1.088952,"metrics":{"best_ms":1.064396,"quality_sum":2.491129377057,"quality_min":0.589775903809,"team_count":4},"status":"keep","description":"Rewrote final `form_teams` response payload assembly from nested comprehensions to explicit loops: precompute `ordered_allocations`, build `people_payload` via append in a tight loop, then append team payload dicts before `TeamsResponse.model_validate(...)`.","timestamp":1775467938733,"segment":0,"confidence":11.348495940493086,"iterationTokens":2361,"asi":{"hypothesis":"Output-path model validation became a significant share; replacing nested comprehensions with explicit append loops should reduce Python comprehension overhead and improve locality.","result":"Primary metric improved with checks passing and unchanged quality monitors.","safety_notes":"Payload shape and ordering are unchanged (`taskId`, ordered teams, per-person `id/skillIds`, `quality`); only construction mechanics changed."}}
{"run":581,"commit":"169f4cc","metric":1.270926,"metrics":{"best_ms":1.075757,"quality_sum":2.491129377057,"quality_min":0.589775903809,"team_count":4},"status":"discard","description":"No-code confirmation rerun on kept loop-based final payload assembly commit 169f4cc.","timestamp":1775467983135,"segment":0,"confidence":11.297484577386657,"iterationTokens":745,"asi":{"hypothesis":"If 169f4cc gain is robust, reruns should preserve lower-band best/median despite current host noise.","rollback_reason":"No code change; validation-only rerun.","next_action_hint":"Retain 169f4cc baseline but require additional paired checks for future marginal keeps under current jitter.","noise_observation":"Best sample remained near keep run while median spiked, indicating transient host variance rather than clear semantic regression."}}
{"run":582,"commit":"169f4cc","metric":1.345739,"metrics":{"best_ms":1.257001,"quality_sum":2.491129377057,"quality_min":0.589775903809,"team_count":4},"status":"discard","description":"Added pre-guard comparisons before `_objective_component_less(...)` calls in hot pruning paths (cap+1 exact-bound break, greedy <=cap exact-bound break, swap upper-bound product/min/sum checks) to skip helper calls unless `left < right` holds.","timestamp":1775468085625,"segment":0,"confidence":11.24932875410905,"iterationTokens":2951,"asi":{"hypothesis":"Simple pre-guards should avoid many hot comparator helper calls and reduce function-call overhead.","rollback_reason":"End-to-end median regressed heavily versus baseline.","next_action_hint":"Avoid adding guard branches around comparator helpers; keep direct helper-call form.","observation":"Additional branch scaffolding outweighed avoided function calls in this workload."}}
{"run":583,"commit":"169f4cc","metric":1.287859,"metrics":{"best_ms":1.232474,"quality_sum":2.491129377057,"quality_min":0.589775903809,"team_count":4},"status":"discard","description":"Tried local append-binding micro-optimization in final payload loop (`teams_payload_append`, `people_payload_append`) to reduce method-lookup overhead before `TeamsResponse.model_validate`.","timestamp":1775468243629,"segment":0,"confidence":11.201581719270639,"iterationTokens":5773,"asi":{"hypothesis":"Binding list append methods locally should speed hot payload construction in the output path.","rollback_reason":"End-to-end median regressed significantly despite favorable microbenchmark.","next_action_hint":"Do not pursue method-binding micro-optimizations in output loop; keep straightforward loop form.","observation":"Isolated microbench did not translate to integrated benchmark behavior."}}
{"run":584,"commit":"169f4cc","metric":1.298365,"metrics":{"best_ms":1.091123,"quality_sum":2.491129377057,"quality_min":0.589775903809,"team_count":4},"status":"discard","description":"Added request-scoped cache for request task-order index mapping (`_request_task_order_index_by_task_id`) and reused it in final allocation ordering sort key instead of rebuilding `{task.id: index}` per call.","timestamp":1775468384176,"segment":0,"confidence":11.132676724632349,"iterationTokens":4854,"asi":{"hypothesis":"Reusing immutable task-order index map across calls should trim repeated output-path setup overhead.","rollback_reason":"Median regressed significantly versus active baseline.","next_action_hint":"Do not add request-scoped cache for tiny output ordering map; per-call rebuild is faster in practice.","observation":"Cache lookup/branch overhead outweighed small dict-construction cost."}}
