{"run":252,"commit":"681e558","metric":115.178638,"metrics":{"best_ms":112.453406,"quality_sum":2.491129377057,"quality_min":0.589775903809,"team_count":4},"status":"checks_failed","description":"Retried first-pass score reuse with hashable keys: recorded scored allocations by candidate member-id tuple during `combination_scorer`, then reused in build_scored_candidates/greedy to avoid second cached_score_team calls. Benchmark improved relative to recent noisy highs but checks failed (Ruff B023 loop-variable closure).","timestamp":1775205519459,"segment":0,"confidence":56.849702734653334,"iterationTokens":3757,"asi":{"hypothesis":"Reusing first-pass scored allocations via hashable candidate-id keys should eliminate redundant cached_score_team lookups in greedy/exact candidate post-processing.","rollback_reason":"Style/lint failure (Ruff B023) from nested closure capturing loop-scoped dict variable; run invalid for keep.","next_action_hint":"Bind loop-scoped maps in nested function defaults or avoid nested closures; rerun to measure true performance."}}
{"run":253,"commit":"681e558","metric":175.443173,"metrics":{"best_ms":155.514653,"quality_sum":2.491129377057,"quality_min":0.589775903809,"team_count":4},"status":"checks_failed","description":"Second attempt at first-pass score reuse (candidate member-id map) with B023-safe default-bound closures. Benchmark passed but checks failed on Ruff E501 line-length in both `combination_quality` definitions.","timestamp":1775205587398,"segment":0,"confidence":56.765446609793464,"iterationTokens":3757,"asi":{"hypothesis":"Score reuse map can remove redundant cached_score_team invocations in candidate post-processing paths.","rollback_reason":"Checks failed (E501) due overly long typed default arguments in nested functions.","next_action_hint":"Reformat default-arg bindings across lines to satisfy 88-char limit before re-measuring."}}
{"run":254,"commit":"681e558","metric":190.335629,"metrics":{"best_ms":172.853215,"quality_sum":2.491129377057,"quality_min":0.589775903809,"team_count":4},"status":"discard","description":"Post-revert unchanged baseline probe after crash/check-fail iterations; runtime spiked to ~190ms, reinforcing extreme run-to-run variance and the need for replicate confirmation on any prospective improvement.","timestamp":1775205689676,"segment":0,"confidence":56.3079757004554,"iterationTokens":6882,"asi":{"hypothesis":"No-change run verifies state after automated reverts and tracks current noise envelope.","rollback_reason":"No code change; measurement-only run under volatile host conditions.","next_action_hint":"Prioritize only high-leverage structural experiments and require repeated wins before keep.","noise_observation":"bimodal/noisy behavior persists (~109ms to ~190ms unchanged)"}}
{"run":255,"commit":"681e558","metric":115.050508,"metrics":{"best_ms":110.626562,"quality_sum":2.491129377057,"quality_min":0.589775903809,"team_count":4},"status":"discard","description":"Added per-task phase cache in cached_score_team (TeamSignature -> ScoredAllocation) and threaded it through build_scored_candidates/greedy so candidates scored during shortlist ranking can be reused downstream without extra global score_cache lookups.","timestamp":1775318784366,"segment":0,"confidence":56.15840812023175,"iterationTokens":6882,"asi":{"hypothesis":"Per-task phase-local cache should eliminate redundant score_cache hits and candidate-key tuple builds after combination_scorer already evaluated the same candidate.","rollback_reason":"Primary metric did not beat incumbent best; observed runtime remains above known baseline in noisy environment.","next_action_hint":"Keep the structural idea in mind, but only revisit if combined with larger candidate_combinations changes that remove more scoring work.","result":"Checks passed and behavior metrics stayed stable, but end-to-end speedup was insufficient."}}
{"run":256,"commit":"681e558","metric":118.974797,"metrics":{"best_ms":118.165746,"quality_sum":2.491129377057,"quality_min":0.589775903809,"team_count":4},"status":"discard","description":"Structural score-reuse pass: candidate_combinations now eagerly invokes combination_scorer when total<=cap, and greedy/build_scored_candidates reuse first-pass scores via candidate-tuple object-id maps so each candidate is scored once per task-phase instead of doing a second cached_score_team lookup pass.","timestamp":1775319343919,"segment":0,"confidence":55.976039078982176,"iterationTokens":38252,"asi":{"hypothesis":"Eliminating second-pass cached_score_team lookups by reusing first-pass scored allocations (including total<=cap paths) should reduce closure/key-construction overhead in greedy/exact candidate handling.","rollback_reason":"Primary metric regressed versus incumbent; map bookkeeping plus eager scorer invocation cost more than saved cache-hit calls under this workload.","next_action_hint":"Keep the score-once objective but avoid per-candidate id-map writes in Python hot loops; consider integrating score payload directly into candidate_combinations outputs to remove extra map churn.","result":"Checks passed and quality metrics stayed stable; regression indicates this implementation shape is not net-positive."}}
{"run":257,"commit":"681e558","metric":98.757755,"metrics":{"best_ms":96.923842,"quality_sum":2.491129377057,"quality_min":0.589775903809,"team_count":4},"status":"checks_failed","description":"Greedy branch-and-bound for capped tasks where total combinations already fit under the cap (non-random COMPAT only): compute an admissible per-candidate upper bound (alpha*1 + exact cached non-skill components) and skip full score_team when the bound cannot beat current best.","timestamp":1775319581053,"segment":0,"confidence":55.25464512193578,"iterationTokens":15075,"asi":{"hypothesis":"When candidate_combinations returns all combos (total<=cap), many low-potential candidates can be skipped safely with an admissible upper bound before expensive compat assignment scoring.","rollback_reason":"Checks failed on Ruff E501 line length; performance signal is strong but patch was auto-reverted.","next_action_hint":"Reapply the same pruning logic with formatted multi-line scored-candidate construction and rerun checks/benchmark immediately.","result":"Benchmark improved dramatically (<100ms) with stable quality metrics, indicating substantial score_team-call reduction in later greedy tasks.","failure_surface":"src/team2form/formation.py line-length (E501)"}}
{"run":258,"commit":"5fa2d39","metric":92.750482,"metrics":{"best_ms":92.259723,"quality_sum":2.491129377057,"quality_min":0.589775903809,"team_count":4},"status":"keep","description":"Added a proof-safe greedy pruning path for non-random COMPAT tasks when `total_combinations <= max_candidate_teams`: compute an admissible candidate upper bound (`alpha*1.0 + exact cached personality/social/task-preference components`) and skip full `cached_score_team` calls when the bound is below current best quality.","timestamp":1775319657759,"segment":0,"confidence":56.82199523428061,"iterationTokens":3125,"asi":{"hypothesis":"Many capped greedy candidates in later tasks are clearly non-competitive; an admissible upper bound can prune expensive compat assignment scoring without changing selected teams.","result":"Large speedup with checks passing and identical quality/team-count metrics.","admissibility_basis":"Skill score is bounded by 1.0; other components are computed exactly (with existing team component caches), so bound never underestimates true quality.","search_space_effect":"Prunes only when upper_bound is strictly below incumbent best quality (tolerance-aware), preserving exact tie behavior."}}
{"run":259,"commit":"5fa2d39","metric":96.347461,"metrics":{"best_ms":93.45712,"quality_sum":2.491129377057,"quality_min":0.589775903809,"team_count":4},"status":"checks_failed","description":"Follow-up on greedy pruning commit: added selective first-pass score reuse only for pre-scored capped tasks (`task_total > cap`) by memoizing scored candidates by candidate tuple object-id to avoid second-pass cache lookups in greedy selection.","timestamp":1775319764180,"segment":0,"confidence":56.62497181530829,"iterationTokens":5712,"asi":{"hypothesis":"On pre-scored capped tasks, reusing first-pass scored allocations via object-id map should remove redundant cached_score_team hit overhead during greedy best selection.","rollback_reason":"Ruff B023 flagged closure capture of loop-scoped `reuse_prescored_candidates`; run reverted before validating net value.","next_action_hint":"If retried, bind the boolean via default arg in scored_candidate and only keep if it beats the new 92.75ms incumbent.","failure_surface":"src/team2form/formation.py B023 closure variable binding"}}
{"run":260,"commit":"5fa2d39","metric":94.535742,"metrics":{"best_ms":90.897854,"quality_sum":2.491129377057,"quality_min":0.589775903809,"team_count":4},"status":"discard","description":"Adjusted greedy admissible-pruning iteration order: precompute upper bounds for all candidates in `total<=cap` COMPAT tasks, sort candidates by descending bound, then score only candidates whose bound can still beat incumbent best.","timestamp":1775319962995,"segment":0,"confidence":55.79035553771932,"iterationTokens":13369,"asi":{"hypothesis":"Evaluating high-bound candidates first should tighten incumbent best earlier and increase safe pruning, reducing expensive score_team calls.","rollback_reason":"Despite fewer theoretical score_team evaluations, total runtime regressed due extra bound-list materialization + sort overhead.","next_action_hint":"Keep sequential bound evaluation; if revisiting ordering, avoid full precompute+sort and try lightweight priority heuristics with lower allocation cost.","result":"Checks passed with stable quality metrics but primary metric worsened versus the current best."}}
{"run":261,"commit":"5fa2d39","metric":94.080334,"metrics":{"best_ms":91.918673,"quality_sum":2.491129377057,"quality_min":0.589775903809,"team_count":4},"status":"discard","description":"Added an early zero-skill fast-fail in `_assign_task_skills_compat`: after member/task analysis, immediately return fallback-filled assignments with `skill_score=0.0` when any task skill has no positive-capable member.","timestamp":1775320082330,"segment":0,"confidence":55.2550156147343,"iterationTokens":8425,"asi":{"hypothesis":"Many candidate teams miss at least one required task skill; early detection should skip priority-ordering and assignment loops in those guaranteed-zero cases.","rollback_reason":"Primary metric regressed despite checks passing; the added per-call `any(...)` guard plus fallback path did not offset skipped work in aggregate.","next_action_hint":"Avoid this coarse zero-capability precheck; target finer-grained reductions inside the dominant non-zero assignment path instead.","result":"Behavior remained stable (checks/quality unchanged), but runtime worsened versus incumbent."}}
{"run":262,"commit":"5fa2d39","metric":97.366165,"metrics":{"best_ms":92.824918,"quality_sum":2.491129377057,"quality_min":0.589775903809,"team_count":4},"status":"discard","description":"In `_compat_candidate_quality_upper_bound`, replaced helper-based social-presence detection (`any(has_explicit_social_preferences(...))`) with an inlined nested-loop scan over member preferences to avoid helper-call overhead on cache misses.","timestamp":1775320147197,"segment":0,"confidence":55.78350546655803,"iterationTokens":1719,"asi":{"hypothesis":"Inlining social-presence checks inside the upper-bound helper should reduce per-candidate function-call/generator overhead in the new pruning path.","rollback_reason":"Primary metric regressed substantially; explicit nested-loop path is slower than existing helper-based check.","next_action_hint":"Keep helper-based social-presence detection in upper-bound helper and avoid manual loop inlining here.","result":"Checks passed and quality metrics were stable, but runtime worsened meaningfully."}}
{"run":263,"commit":"5fa2d39","metric":94.572456,"metrics":{"best_ms":92.189094,"quality_sum":2.491129377057,"quality_min":0.589775903809,"team_count":4},"status":"discard","description":"No-code-change confirmation run on the new greedy admissible-pruning baseline to re-check variance after the large improvement.","timestamp":1775320212117,"segment":0,"confidence":56.12909918966481,"iterationTokens":1447,"asi":{"hypothesis":"A replicate on unchanged HEAD should confirm the new baseline band before evaluating further micro-optimizations.","rollback_reason":"No code change; result used for variance tracking only.","next_action_hint":"Treat ~92–95ms as current noise band and require clear wins below this range before keeping additional changes.","noise_observation":"unchanged 5fa2d39 stayed in low-90s band, far below pre-pruning baselines"}}
{"run":264,"commit":"5fa2d39","metric":96.210467,"metrics":{"best_ms":93.736534,"quality_sum":2.491129377057,"quality_min":0.589775903809,"team_count":4},"status":"discard","description":"Tried admissible upper-bound pruning inside `improve_allocations` replacement/swap loops: compute per-team compat upper quality (`alpha*1 + exact cached non-skill components`) and skip rescoring trials whose upper objective cannot beat current objective.","timestamp":1775320388446,"segment":0,"confidence":55.79171089213034,"iterationTokens":10737,"asi":{"hypothesis":"Many swap/replacement trials in improve_allocations are non-competitive; objective-level upper bounds should prune expensive score calls safely.","rollback_reason":"Upper-bound computation overhead outweighed skipped rescoring work in this workload, leading to regression.","next_action_hint":"Do not run upper-bound helper inside improve loops; focus pruning where candidate fanout is larger relative to bound-computation cost.","result":"Checks passed and behavior metrics were stable, but runtime worsened versus incumbent."}}
{"run":265,"commit":"13df918","metric":91.382902,"metrics":{"best_ms":88.725992,"quality_sum":2.491129377057,"quality_min":0.589775903809,"team_count":4},"status":"keep","description":"Added an optional scored-results side channel to `candidate_combinations` and used it in greedy non-random capped scoring: when the scored-cap path already evaluated candidate qualities, pick the best team from pre-scored `(candidate, quality)` pairs and only fetch the winner allocation, avoiding the full second-pass `cached_score_team` scan.","timestamp":1775320598457,"segment":0,"confidence":55.73548024965713,"iterationTokens":10737,"asi":{"hypothesis":"Reusing candidate_combinations’ existing scored-cap qualities should remove ~1000 redundant cache-hit lookups in the first greedy task without changing tie semantics.","result":"New best total_ms with passing checks and unchanged quality/team-count metrics.","tie_semantics":"Best candidate is still selected by `(quality, sorted(member.id...))`, matching previous greedy behavior; only score reuse path changed.","hotspots_touched":["candidate_combinations scored path","greedy_allocations second-pass scoring"]}}
{"run":266,"commit":"13df918","metric":93.169124,"metrics":{"best_ms":91.20236,"quality_sum":2.491129377057,"quality_min":0.589775903809,"team_count":4},"status":"discard","description":"Two-stage greedy bound pruning tweak: `_compat_candidate_quality_upper_bound` now first computes a loose admissible bound using `social<=1.0` and early-returns when already below incumbent best, only computing social-presence/social-score upper terms for remaining borderline candidates.","timestamp":1775320772991,"segment":0,"confidence":55.890840496092316,"iterationTokens":13317,"asi":{"hypothesis":"Skipping social-presence/social-score work for obviously non-competitive candidates should reduce upper-bound helper overhead while preserving admissibility.","rollback_reason":"Primary metric regressed; the extra branch/math path did not offset helper overhead under this workload.","next_action_hint":"Keep the simpler exact-upper helper path; avoid layering coarse+exact stages unless social computation dominates more strongly.","result":"Checks passed and behavior metrics stayed stable, but runtime moved away from incumbent best."}}
{"run":267,"commit":"13df918","metric":95.232781,"metrics":{"best_ms":91.063808,"quality_sum":2.491129377057,"quality_min":0.589775903809,"team_count":4},"status":"discard","description":"No-code-change replicate on current best branch after recent candidate-bound experiments to check post-keep variance band.","timestamp":1775320826371,"segment":0,"confidence":56.111484833051655,"iterationTokens":789,"asi":{"hypothesis":"A baseline rerun on unchanged HEAD should validate current noise before committing more structural changes.","rollback_reason":"No code change; result logged for variance tracking only.","next_action_hint":"Require clear multi-ms wins below current low-90s band before keeping additional tweaks.","noise_observation":"unchanged 13df918 run landed at ~95ms median with ~91ms best sample"}}
{"run":268,"commit":"13df918","metric":92.900565,"metrics":{"best_ms":89.425256,"quality_sum":2.491129377057,"quality_min":0.589775903809,"team_count":4},"status":"discard","description":"Micro-optimized greedy pre-scored candidate tie handling: instead of `max(... key=(quality, sorted_ids))` over all pre-scored entries, scan only the top-quality prefix from already quality-sorted results and apply team-signature tie-break there.","timestamp":1775320910881,"segment":0,"confidence":55.72405933988381,"iterationTokens":3025,"asi":{"hypothesis":"Restricting signature sorting to the top-quality prefix should reduce tie-break overhead versus sorting IDs for every pre-scored candidate.","rollback_reason":"Primary metric regressed; the prefix-loop/branching variant was slower than the straightforward `max` key path.","next_action_hint":"Keep the simpler `max`-based tie selection for pre-scored candidates.","result":"Checks passed and behavior metrics remained unchanged, but runtime worsened."}}
{"run":269,"commit":"13df918","metric":96.132024,"metrics":{"best_ms":95.418723,"quality_sum":2.491129377057,"quality_min":0.589775903809,"team_count":4},"status":"discard","description":"Tried reducing rich-priority key list materialization by switching `_compat_member_priority_order` `rich_first_priority_key` to generator-based `sorted(...)` plus in-place reverse, instead of list-comprehension + `reverse=True`.","timestamp":1775320979031,"segment":0,"confidence":55.540775227029876,"iterationTokens":1626,"asi":{"hypothesis":"Generator-based sorted construction for rich priority keys might reduce temporary allocation overhead in the hot compat ordering path.","rollback_reason":"Primary metric regressed significantly; this formulation was slower than the existing list-comprehension + reverse sort path.","next_action_hint":"Keep current rich-priority key implementation; avoid this generator/reverse variant.","result":"Checks passed and behavior metrics stayed stable, but runtime worsened materially."}}
{"run":270,"commit":"13df918","metric":91.852512,"metrics":{"best_ms":91.476199,"quality_sum":2.491129377057,"quality_min":0.589775903809,"team_count":4},"status":"discard","description":"Refactored compat analysis tie metadata: `_compat_member_task_analysis` now records `unique_best_member_indices` per task, and `_assign_task_skills_compat` uses index checks to pick second-best `other_member_best` instead of per-candidate `math.isclose(...)` calls.","timestamp":1775321098708,"segment":0,"confidence":55.00114024105934,"iterationTokens":6289,"asi":{"hypothesis":"Replacing hot-loop `math.isclose` checks with precomputed unique-best member indices should reduce candidate-selection overhead in `_assign_task_skills_compat`.","rollback_reason":"Primary metric did not beat incumbent best; gain (if any) was below noise and net slower this run.","next_action_hint":"Keep existing best-value-count/isclose approach unless combined with a larger compat-loop simplification.","result":"Checks passed and behavior metrics remained stable, but end-to-end median was above current best."}}
{"run":271,"commit":"13df918","metric":91.601396,"metrics":{"best_ms":88.760207,"quality_sum":2.491129377057,"quality_min":0.589775903809,"team_count":4},"status":"discard","description":"Greedy path refactor for `total<=cap` tasks: bypass `shortlist_scorers` + `candidate_combinations` entirely under admissible upper-bound pruning and iterate `itertools.combinations(remaining_people, team_size)` directly.","timestamp":1775321261489,"segment":0,"confidence":54.47189055423273,"iterationTokens":8275,"asi":{"hypothesis":"When greedy already enumerates all combinations (`total<=cap`) and applies bound pruning, skipping shortlist/candidate_combinations scaffolding should cut overhead.","rollback_reason":"Primary metric did not beat incumbent; the structural simplification was effectively neutral/slightly slower on this workload.","next_action_hint":"Keep existing candidate generation flow; this bypass path is not a clear win.","result":"Checks passed with unchanged behavior metrics, but median remained above best."}}
