{"run":294,"commit":"664567a","metric":133.575772,"metrics":{"best_ms":131.091477,"quality_sum":2.551629599253,"quality_min":0.619513977267,"team_count":4},"status":"checks_failed","description":"Attempted a specialized `max_skills_per_member==1` assignment loop in `_assign_task_skills_compat` (remove per-member mask bookkeeping and precompute `has_member_without_positive`) to cut hot-path overhead.","timestamp":1775323948652,"segment":0,"confidence":48.5723277818157,"iterationTokens":3572,"asi":{"hypothesis":"The dominant singleton-capacity compat case can use a simpler per-member candidate-mask flow with less loop overhead while preserving tie semantics.","rollback_reason":"Behavior changed: singleton branch altered assignment distribution in overlap-heavy/partial-coverage cases, breaking tested compat tie/fallback semantics.","next_action_hint":"Do not branch-specialize member assignment selection for max_skills_per_member==1 unless the exact legacy task-choice behavior is formally reproduced.","failure_surface":"tests/test_team_quality.py overlap/partial-coverage assignment invariants; tests/test_form_teams.py partial compat overlap ranking"}}
{"run":295,"commit":"664567a","metric":122.782822,"metrics":{"best_ms":121.667711,"quality_sum":2.491129377057,"quality_min":0.589775903809,"team_count":4},"status":"discard","description":"No-code-change stability run to monitor active noise band before selecting the next structural branch.","timestamp":1775324049850,"segment":0,"confidence":48.09823956476246,"iterationTokens":4369,"asi":{"hypothesis":"Unchanged rerun confirms whether host conditions remain elevated and bimodal.","rollback_reason":"No code change; measurement-only run.","next_action_hint":"If low-80ms band returns, immediately re-validate promising deferred patches (especially tighter skill upper-bound pruning) with paired A/B runs.","noise_observation":"unchanged 664567a still ~122-123ms median"}}
{"run":296,"commit":"664567a","metric":123.253885,"metrics":{"best_ms":122.529633,"quality_sum":2.491129377057,"quality_min":0.589775903809,"team_count":4},"status":"discard","description":"Rewrote `_compat_member_task_analysis` from task-major to member-major traversal: accumulate per-member positive masks and per-task capable/best/second-best/count stats in one pass over each member’s value row.","timestamp":1775324158479,"segment":0,"confidence":47.95387402670821,"iterationTokens":3343,"asi":{"hypothesis":"Member-major traversal should reduce indexing/loop overhead and write each member’s positive mask once, speeding hot compat analysis.","rollback_reason":"No primary improvement observed; member-major rewrite was slightly slower in end-to-end benchmark.","next_action_hint":"Keep existing task-major analysis structure; this traversal order change is not beneficial here.","result":"Checks passed and behavior metrics were unchanged, but runtime did not beat incumbent."}}
{"run":297,"commit":"664567a","metric":122.347846,"metrics":{"best_ms":121.403368,"quality_sum":2.491129377057,"quality_min":0.589775903809,"team_count":4},"status":"discard","description":"No-code baseline check after analysis/priority-order experiments to keep tracking active environment noise band.","timestamp":1775324214968,"segment":0,"confidence":47.81037251365981,"iterationTokens":689,"asi":{"hypothesis":"An unchanged run after structural attempts helps confirm whether observed deltas are code-driven or ambient host variance.","rollback_reason":"No code change; measurement-only run.","next_action_hint":"Continue with only high-leverage candidates until host conditions stabilize.","noise_observation":"unchanged 664567a remains in ~122ms median band"}}
{"run":298,"commit":"664567a","metric":119.643616,"metrics":{"best_ms":118.92206,"quality_sum":2.491129377057,"quality_min":0.589775903809,"team_count":4},"status":"discard","description":"Added cross-call caching for rich compat member-priority task lists: `_compat_member_priority_order` now caches sorted rich-first positive-task tuples by `(task_skill_ids, task_capable_counts, member_task_values)` to reuse repeated key materialization.","timestamp":1775324437056,"segment":0,"confidence":47.36226688805641,"iterationTokens":689,"asi":{"hypothesis":"Rich-first priority-key construction repeats heavily across candidate teams; caching sorted positive-task tuples should reduce `_compat_member_priority_order` overhead.","rollback_reason":"Did not beat the incumbent all-time best metric; current gain appears only within elevated-noise host band and is not conclusive enough to keep.","next_action_hint":"Re-evaluate this cache design with paired A/B reruns when environment returns to low-latency baseline; keep only if improvement persists there.","signal":"In current high-latency band this variant trended faster (~119ms vs ~122ms unchanged), suggesting possible promise but insufficient evidence."}}
{"run":299,"commit":"664567a","metric":124.375626,"metrics":{"best_ms":123.544793,"quality_sum":2.491129377057,"quality_min":0.589775903809,"team_count":4},"status":"discard","description":"Threaded precomputed `task_skill_ids` into `_compat_fill_uncovered_assignments_single_capacity` so max=1 uncovered finalization can use direct id lookup instead of repeated `task_skills[index].id` attribute access.","timestamp":1775324551159,"segment":0,"confidence":46.92248306038105,"iterationTokens":4176,"asi":{"hypothesis":"Reusing already-available task-skill id tuples in the hot singleton finalizer should trim per-call attribute/index overhead.","rollback_reason":"Primary metric did not improve; added parameter branching/indirection offset tiny lookup savings.","next_action_hint":"Keep simpler single-capacity helper signature and avoid extra metadata threading in this path.","result":"Checks passed and behavior metrics stable, but runtime stayed above incumbent in current band."}}
{"run":300,"commit":"664567a","metric":122.263549,"metrics":{"best_ms":119.222652,"quality_sum":2.491129377057,"quality_min":0.589775903809,"team_count":4},"status":"discard","description":"Retried rich-priority key caching with type-safe implementation: cache sorted rich-first positive-task tuples by `(task_skill_ids, task_capable_counts, task_values)` inside `_compat_member_priority_order` to reuse repeated key materialization.","timestamp":1775324710339,"segment":0,"confidence":46.35388027105153,"iterationTokens":1546,"asi":{"hypothesis":"Cross-call caching of rich-first positive-task key tuples should reduce repeated sorting work in a hot compat ordering path.","rollback_reason":"With checks passing, median did not clearly improve over current baseline; earlier lower reading was likely noise/outlier.","next_action_hint":"Do not keep this cache variant as-is; revisit only with stronger evidence under stable host conditions.","result":"Behavior metrics unchanged, but primary metric remained in the same elevated noise band."}}
{"run":301,"commit":"664567a","metric":122.542868,"metrics":{"best_ms":122.035216,"quality_sum":2.491129377057,"quality_min":0.589775903809,"team_count":4},"status":"discard","description":"Replaced `_assign_task_skills_compat` final `geometric_mean([*matched_values, *rescued_values])` call with an inline log-sum geometric-mean computation to avoid list concatenation and extra helper/list materialization.","timestamp":1775324799244,"segment":0,"confidence":45.79889305299181,"iterationTokens":2388,"asi":{"hypothesis":"Inlining combined matched+rescued geometric mean should trim per-call finalize overhead in the dominant compat path.","rollback_reason":"No meaningful primary improvement observed in current band; rewrite did not beat baseline.","next_action_hint":"Keep existing geometric_mean call for clarity unless future profiling under stable conditions shows a measurable benefit.","result":"Checks passed and behavior metrics stayed stable, but runtime remained near unchanged baseline."}}
{"run":302,"commit":"664567a","metric":122.184599,"metrics":{"best_ms":120.875762,"quality_sum":2.491129377057,"quality_min":0.589775903809,"team_count":4},"status":"discard","description":"No-code baseline probe to monitor whether the environment exits the elevated ~120ms band.","timestamp":1775324870358,"segment":0,"confidence":44.844240945751395,"iterationTokens":1743,"asi":{"hypothesis":"Regular unchanged runs are needed to detect return to the low-latency baseline before trusting small optimization deltas.","rollback_reason":"No code change; measurement-only run.","next_action_hint":"Continue periodic baseline probes and hold keeps for only large, repeatable wins while high-latency band persists.","noise_observation":"unchanged 664567a remains ~122ms median"}}
{"run":303,"commit":"664567a","metric":122.054784,"metrics":{"best_ms":121.09147,"quality_sum":2.491129377057,"quality_min":0.589775903809,"team_count":4},"status":"discard","description":"Retested tighter greedy admissible skill bound with cheap precompute: per task, precompute each person’s max matching task-skill level and use `alpha * max_person_skill_upper` in `_compat_candidate_quality_upper_bound` instead of `alpha * 1.0`.","timestamp":1775324969878,"segment":0,"confidence":43.92857457286482,"iterationTokens":2676,"asi":{"hypothesis":"A tighter yet low-overhead skill upper bound should increase safe pruning in greedy total<=cap loops without expensive per-candidate scans.","rollback_reason":"Observed delta was marginal and within current elevated noise band; insufficient evidence to keep over incumbent.","next_action_hint":"Keep this as a deferred candidate for paired A/B validation when benchmark host returns to low-latency regime.","result":"Checks passed and quality metrics stable, but median did not convincingly improve."}}
{"run":304,"commit":"664567a","metric":121.776817,"metrics":{"best_ms":121.138198,"quality_sum":2.491129377057,"quality_min":0.589775903809,"team_count":4},"status":"discard","description":"No-code baseline probe to continue tracking active high-latency benchmark regime while pruning stale experiment branches.","timestamp":1775325060072,"segment":0,"confidence":43.31912320843816,"iterationTokens":2064,"asi":{"hypothesis":"Frequent unchanged probes are required to detect when host conditions return to low-latency baseline and to contextualize marginal experiment deltas.","rollback_reason":"No code change; measurement-only run.","next_action_hint":"Keep focusing on high-leverage structural candidates and re-validate deferred promising patches when low-80ms band returns.","noise_observation":"unchanged 664567a still clusters near ~122ms median"}}
{"run":305,"commit":"664567a","metric":124.072973,"metrics":{"best_ms":123.048926,"quality_sum":2.491129377057,"quality_min":0.589775903809,"team_count":4},"status":"discard","description":"No-code baseline probe to check whether the benchmark host exits the elevated latency regime before more structural experiments.","timestamp":1775325475518,"segment":0,"confidence":42.94620667367537,"iterationTokens":14755,"asi":{"hypothesis":"Another unchanged run should detect if the low-80ms baseline band has returned.","rollback_reason":"No code change; measurement-only run.","next_action_hint":"Continue periodic unchanged probes; only trust structural wins once host band stabilizes.","noise_observation":"unchanged 664567a remains in ~123-124ms median band"}}
{"run":306,"commit":"b33001a","metric":116.289143,"metrics":{"best_ms":116.020274,"quality_sum":2.491129377057,"quality_min":0.589775903809,"team_count":4},"status":"keep","description":"Combined two structural pruning/order wins: (1) tighten greedy COMPAT admissible bound with per-task precomputed `task_skill_upper_by_person_id` (`alpha * max_person_skill_upper` instead of `alpha * 1.0`), and (2) cache rich-first positive-task priority tuples across calls in `_compat_member_priority_order` keyed by `(task_skill_ids, task_capable_counts, task_values)`.","timestamp":1775325614992,"segment":0,"confidence":42.72670397194493,"iterationTokens":4324,"asi":{"hypothesis":"A tighter greedy upper bound plus cross-call rich-priority key reuse should cut both candidate rescoring volume and hot sorting/key materialization overhead.","result":"Large median/best improvement in the current benchmark regime with checks passing and unchanged quality metrics.","risk_note":"Improvement observed under elevated host-latency band; follow-up unchanged rerun on this commit is needed to confirm stability.","hotspots_touched":["_compat_candidate_quality_upper_bound","_compat_member_priority_order"]}}
{"run":307,"commit":"b33001a","metric":117.602078,"metrics":{"best_ms":117.355762,"quality_sum":2.491129377057,"quality_min":0.589775903809,"team_count":4},"status":"discard","description":"No-code confirmation run on the new combined pruning/order commit to validate that the gain persists across an immediate rerun.","timestamp":1775325670837,"segment":0,"confidence":42.50943366424966,"iterationTokens":1412,"asi":{"hypothesis":"If the combined patch is real, unchanged rerun should stay near the new ~116-118ms band rather than jumping back to ~122-124ms.","rollback_reason":"No code change; measurement-only confirmation run.","next_action_hint":"Treat ~116-118ms as the new active band under current host conditions and continue with structural follow-ups.","noise_observation":"unchanged b33001a stayed in improved band (~117.6ms median)."}}
{"run":308,"commit":"b33001a","metric":116.798146,"metrics":{"best_ms":115.197036,"quality_sum":2.491129377057,"quality_min":0.589775903809,"team_count":4},"status":"discard","description":"On top of combined pruning/order commit, precomputed per-task per-person logged task preferences and switched `_compat_candidate_quality_upper_bound` task-preference computation from `_task_preference_score(...)` to summed-log lookup.","timestamp":1775325804537,"segment":0,"confidence":42.324759536837895,"iterationTokens":4487,"asi":{"hypothesis":"Avoiding per-candidate dict+log task-preference work in the greedy upper-bound helper should further reduce pruning overhead.","rollback_reason":"Median delta vs current commit was small and likely within active noise; not enough evidence to keep.","next_action_hint":"Retest this micro-optimization only when host noise narrows or with paired A/B repeats on the same commit.","result":"Checks passed and quality metrics unchanged; improvement signal was marginal."}}
{"run":309,"commit":"b33001a","metric":117.252907,"metrics":{"best_ms":116.692116,"quality_sum":2.491129377057,"quality_min":0.589775903809,"team_count":4},"status":"discard","description":"No-code baseline confirmation on commit b33001a after follow-up upper-bound micro-optimization test.","timestamp":1775325861302,"segment":0,"confidence":42.14168303191305,"iterationTokens":818,"asi":{"hypothesis":"Unchanged rerun should verify that b33001a remains in the improved ~116-118ms band.","rollback_reason":"No code change; measurement-only confirmation run.","next_action_hint":"Use b33001a as the active baseline for subsequent structural experiments.","noise_observation":"unchanged b33001a remains stable around ~117ms median in current host conditions"}}
{"run":310,"commit":"b33001a","metric":119.870581,"metrics":{"best_ms":118.81342,"quality_sum":2.491129377057,"quality_min":0.589775903809,"team_count":4},"status":"discard","description":"Switched team-component cache signatures from sorted member-id strings to sorted member object identities (`TeamComponentSignature = tuple[int,...]`) in both `score_team` and greedy upper-bound helper caches.","timestamp":1775326112036,"segment":0,"confidence":42.05918574231373,"iterationTokens":9201,"asi":{"hypothesis":"Identity-based team signatures might be cheaper than repeated string-id sorting/comparison for personality/social/social-presence cache keys.","rollback_reason":"Primary metric regressed versus current baseline; identity-signature path did not pay off in this workload.","next_action_hint":"Keep string-id-based team-component signatures despite extra sorting, as prior variants remain faster.","result":"Checks passed and behavior metrics unchanged, but runtime worsened."}}
{"run":311,"commit":"b33001a","metric":117.878611,"metrics":{"best_ms":117.114545,"quality_sum":2.491129377057,"quality_min":0.589775903809,"team_count":4},"status":"discard","description":"No-code baseline rerun after team-signature key experiment to re-anchor current commit performance band.","timestamp":1775326174413,"segment":0,"confidence":41.97701081789652,"iterationTokens":686,"asi":{"hypothesis":"Unchanged rerun should verify that b33001a remains in its improved active band after reverting failed variants.","rollback_reason":"No code change; measurement-only run.","next_action_hint":"Use ~117ms as current operating baseline for b33001a while host remains in elevated regime.","noise_observation":"unchanged b33001a remains stable around ~117-118ms median"}}
{"run":312,"commit":"b33001a","metric":118.223554,"metrics":{"best_ms":116.81032,"quality_sum":2.491129377057,"quality_min":0.589775903809,"team_count":4},"status":"discard","description":"Added request-scoped precomputed COMPAT personality components and replaced upper-bound helper `team_personality_score(...)` calls with `_compat_personality_score_from_components(...)` while preserving the same formula.","timestamp":1775326724106,"segment":0,"confidence":41.77584514241899,"iterationTokens":686,"asi":{"hypothesis":"Avoid repeated personality attribute branching/list setup in greedy upper-bound pruning by using precomputed per-person COMPAT personality components.","rollback_reason":"Runtime was not better than current b33001a operating band; signal looked neutral-to-worse under current noise.","next_action_hint":"Keep existing upper-bound personality path; prioritize larger structural candidate-generation changes.","result":"Checks passed and quality metrics unchanged."}}
{"run":313,"commit":"b33001a","metric":112.725489,"metrics":{"best_ms":111.009813,"quality_sum":2.491129377057,"quality_min":0.589775903809,"team_count":4},"status":"checks_failed","description":"Changed score-cache key to use sorted member-id signatures and threaded precomputed team signatures into `score_team(...)` to remove duplicate canonicalization sorts.","timestamp":1775327014362,"segment":0,"confidence":41.57659835639343,"iterationTokens":23119,"asi":{"hypothesis":"Reusing one canonical string-id team signature for both `score_cache` and team-component caches should remove a full extra sort on cache misses.","rollback_reason":"Backpressure checks failed: tests monkeypatch `score_team` with old signature; cached wrapper passed new kwarg `team_signature` and raised TypeError.","next_action_hint":"Retry with monkeypatch-safe dispatch (only pass `team_signature` when calling original `score_team` implementation).","failure_details":"tests/test_form_teams.py failures in cached-score reuse and init_random tie-break monkeypatch tests due unexpected keyword argument"}}
{"run":314,"commit":"b57e04f","metric":112.314231,"metrics":{"best_ms":112.01247,"quality_sum":2.491129377057,"quality_min":0.589775903809,"team_count":4},"status":"keep","description":"Unified score-cache and team-component canonicalization: changed `score_cache` keys to `(task_id, sorted member-id tuple)`, threaded the same precomputed signature into `score_team(...)`, and added monkeypatch-safe fallback in `cached_score_team` for tests that replace `score_team`.","timestamp":1775327084745,"segment":0,"confidence":41.32782799347478,"iterationTokens":5029,"asi":{"hypothesis":"Eliminate duplicate team canonicalization sorts on cache misses by computing one sorted member-id signature and reusing it for both score-cache lookup and team-component caches.","result":"Large primary-metric improvement with checks passing and unchanged quality metrics.","notes":"Expected dominant gain source is fewer `sorted(...)` calls across hot `cached_score_team -> score_team` path."}}
{"run":315,"commit":"b57e04f","metric":111.886972,"metrics":{"best_ms":111.702664,"quality_sum":2.491129377057,"quality_min":0.589775903809,"team_count":4},"status":"discard","description":"No-code confirmation rerun on kept commit b57e04f to verify the new canonicalization change holds in repeat measurements.","timestamp":1775327131069,"segment":0,"confidence":41.32291989447682,"iterationTokens":871,"asi":{"hypothesis":"Unchanged rerun should stay near the new ~112ms band if the canonicalization improvement is real.","rollback_reason":"No code change; measurement-only confirmation run.","next_action_hint":"Use b57e04f as active baseline and continue with structural hotspots in `_assign_task_skills_compat` and candidate-generation flow.","noise_observation":"repeat run remained in the same improved band, strengthening confidence."}}
{"run":316,"commit":"0f0bc65","metric":100.16233,"metrics":{"best_ms":99.76623,"quality_sum":2.491129377057,"quality_min":0.589775903809,"team_count":4},"status":"keep","description":"Split scoring into internal lightweight components path: added `_calculate_team_quality_components_for_people(...)` (dataclass return) and switched `formation.score_team` hot path to it, avoiding per-candidate `QualityBreakdown` Pydantic model construction.","timestamp":1775327297415,"segment":0,"confidence":40.58621612272158,"iterationTokens":10976,"asi":{"hypothesis":"Bypassing `QualityBreakdown` model creation/validation in the internal candidate-scoring path should significantly cut hot-loop overhead without changing scoring semantics.","result":"Large primary metric gain with checks passing and unchanged quality metrics.","notes":"Public API behavior is preserved: `calculate_team_quality_for_people` still returns `QualityBreakdown`; only internal `score_team` now uses lightweight components."}}
