{"run":111,"commit":"6f6ee89","metric":144.6772,"metrics":{"best_ms":143.241292,"quality_sum":2.491129377057,"quality_min":0.589775903809,"team_count":4},"status":"discard","description":"Precomputed full shortlist scorer values for every person once per task (including personality/social potentials) and switched primary/alternate scorer keys to direct tuple lookups, but this regressed versus lazy cached scorer functions.","timestamp":1775189256671,"segment":0,"confidence":73.57214335261565,"iterationTokens":1480,"asi":{"hypothesis":"Materializing per-person scorer tuples once should reduce repeated key-function overhead across primary and alternate rankings.","rollback_reason":"Eager precompute and lambda lookup indirection cost more than existing lazy cached scorer closures.","next_action_hint":"Keep existing shortlist_scorers lazily cached design; avoid eager full precompute."}}
{"run":112,"commit":"6f6ee89","metric":161.390567,"metrics":{"best_ms":148.811487,"quality_sum":2.491129377057,"quality_min":0.589775903809,"team_count":4},"status":"discard","description":"Added optional `team_signature` field to ScoredAllocation and threaded score_team’s existing sorted-id signature into allocations so greedy deterministic tie-break could reuse it instead of sorting member ids per candidate, but this regressed badly.","timestamp":1775189340447,"segment":0,"confidence":73.09649927943063,"iterationTokens":1481,"asi":{"hypothesis":"Reusing precomputed team signatures from score_team should remove repeated tie-break sorting in greedy candidate selection.","rollback_reason":"Larger allocation objects and extra attribute plumbing outweighed tie-break sort savings.","next_action_hint":"Do not extend ScoredAllocation for this tie-break optimization; keep existing key expression."}}
{"run":113,"commit":"6f6ee89","metric":141.486591,"metrics":{"best_ms":139.596273,"quality_sum":2.491129377057,"quality_min":0.589775903809,"team_count":4},"status":"discard","description":"Rewrote rich_first_priority_key in _compat_member_priority_order from list-comprehension+sorted into explicit append loop + in-place sort (then tuple conversion) to reduce intermediate construction overhead, but it remained slower than current best.","timestamp":1775189425095,"segment":0,"confidence":73.38050782603985,"iterationTokens":1461,"asi":{"hypothesis":"Manual loop + in-place sort for rich priority tasks might beat nested comprehension/sorted construction in a hotspot.","rollback_reason":"Python loop overhead offset any construction savings; median still regressed.","next_action_hint":"Keep existing rich_first_priority_key comprehension form unless combined with a larger helper redesign."}}
{"run":114,"commit":"6f6ee89","metric":140.755597,"metrics":{"best_ms":140.141465,"quality_sum":2.491129377057,"quality_min":0.589775903809,"team_count":4},"status":"discard","description":"Added identity-keyed symmetric pair-score cache only in candidate_social_potential (wired from shortlist_scorers) so social pair values are computed once per unordered pair and reused across both directions; result was very close but still slower than best.","timestamp":1775189532535,"segment":0,"confidence":74.0408900029193,"iterationTokens":2350,"asi":{"hypothesis":"Social potential recomputes mirrored pair scores and explicit-preference checks; caching pair results should reduce has_explicit/team_social overhead.","rollback_reason":"Pair-cache keying and lookup overhead still outweighed saved recomputation on this workload.","next_action_hint":"Do not keep social pair cache; if revisited, consider narrower caching keyed by shortlist callsite characteristics."}}
{"run":115,"commit":"6f6ee89","metric":141.17923,"metrics":{"best_ms":140.128471,"quality_sum":2.491129377057,"quality_min":0.589775903809,"team_count":4},"status":"discard","description":"Changed _compat_sort_member_assignments to sort assignment lists in place (`list.sort`) instead of creating new lists via sorted(...) per member, aiming to cut allocations, but it was still slower than best.","timestamp":1775189615192,"segment":0,"confidence":74.88477828614906,"iterationTokens":1785,"asi":{"hypothesis":"In-place sort should reduce per-call list allocations in a frequently called compat helper.","rollback_reason":"In-place mutation path did not outperform existing sorted(...) reassignment in end-to-end benchmark.","next_action_hint":"Keep existing sorted(...) assignment form in _compat_sort_member_assignments."}}
{"run":116,"commit":"6f6ee89","metric":0,"metrics":{"best_ms":0,"quality_sum":0,"quality_min":0,"team_count":0},"status":"crash","description":"Attempted greedy-only local scored-candidate memoization keyed directly by candidate tuple objects to avoid repeated cached_score_team lookups after candidate_combinations scoring, but Person objects are unhashable so this crashed.","timestamp":1775189662704,"segment":0,"confidence":74.88477828614906,"iterationTokens":1466,"asi":{"hypothesis":"A local greedy-task memo could bypass duplicate score-cache key canonicalization for already-scored candidate tuples.","rollback_reason":"Candidate tuples contain unhashable Person objects, causing TypeError when used as dict keys.","next_action_hint":"If retried, key local memo by an explicit hashable identity tuple (e.g., tuple(id(person) for person in candidate))."}}
{"run":117,"commit":"6f6ee89","metric":143.992845,"metrics":{"best_ms":143.571117,"quality_sum":2.491129377057,"quality_min":0.589775903809,"team_count":4},"status":"discard","description":"Retried greedy-only local scored-candidate memoization with hashable identity keys (`tuple(id(person) for person in candidate)`) to avoid duplicate cached_score_team calls after candidate_combinations scoring, but this still regressed.","timestamp":1775189746873,"segment":0,"confidence":74.02297940048788,"iterationTokens":1122,"asi":{"hypothesis":"A local per-task memo should reduce repeated score-cache canonicalization overhead for candidates already scored during combination ranking.","rollback_reason":"Extra local key construction/dictionary operations outweighed any saved cached_score_team lookup cost.","next_action_hint":"Do not add local memo layer in greedy_allocations; rely on global score_cache only."}}
{"run":118,"commit":"d58c8db","metric":139.357871,"metrics":{"best_ms":138.988784,"quality_sum":2.491129377057,"quality_min":0.589775903809,"team_count":4},"status":"keep","description":"In candidate_combinations scored top-k path, replaced `ranked.sort(key=lambda item: (item[0], item[1]), reverse=True)` with direct tuple sort `ranked.sort(reverse=True)` since `(score, -index, combination)` is already ordered by the desired tie-break components and `-index` is unique.","timestamp":1775189823896,"segment":0,"confidence":72.79738759890098,"iterationTokens":1135,"asi":{"hypothesis":"Removing key-function calls from final heap result sorting should shave overhead in scored candidate selection without changing ordering semantics.","result":"Small but real median/best improvement with unchanged quality/team-count metrics.","proof_obligation":"`-index` uniqueness preserves deterministic order; direct tuple reverse sort matches previous `(item[0], item[1])` ordering intent."}}
{"run":119,"commit":"d58c8db","metric":140.874773,"metrics":{"best_ms":139.739664,"quality_sum":2.491129377057,"quality_min":0.589775903809,"team_count":4},"status":"discard","description":"Tried split-phase scored top-k selection in candidate_combinations: prefill heap with first `max_candidate_teams` combinations via `itertools.islice`, then process remainder without per-iteration len checks. This regressed vs current best.","timestamp":1775189907551,"segment":0,"confidence":70.89821278572872,"iterationTokens":1764,"asi":{"hypothesis":"Removing repeated heap-size checks in the scored loop should slightly reduce candidate ranking overhead.","rollback_reason":"Iterator/islice split and extra control flow outweighed any savings from avoiding len checks.","next_action_hint":"Keep the original single-loop heap fill/replace structure with direct len check."}}
{"run":120,"commit":"d58c8db","metric":140.247215,"metrics":{"best_ms":139.682255,"quality_sum":2.491129377057,"quality_min":0.589775903809,"team_count":4},"status":"discard","description":"Inlined singleton-set social-preference checks directly inside candidate_social_potential (local person/teammate preference scans) to avoid has_explicit_social_preferences calls and `{id}` allocations, but this remained slower than best.","timestamp":1775189989199,"segment":0,"confidence":69.40066620885113,"iterationTokens":1666,"asi":{"hypothesis":"Inlining one-to-one preference checks should reduce call/allocation overhead in candidate_social_potential hotspot.","rollback_reason":"Inline generator scans and extra local setup still underperformed existing helper-based implementation.","next_action_hint":"Keep current helper-based social preference checks."}}
{"run":121,"commit":"d58c8db","metric":155.64956,"metrics":{"best_ms":154.149491,"quality_sum":2.491129377057,"quality_min":0.589775903809,"team_count":4},"status":"discard","description":"Changed final scored-candidate extraction from tuple-unpacking list comprehension to index-based form (`[entry[2] for entry in ranked]`) after reverse sort, but this regressed heavily.","timestamp":1775190074737,"segment":0,"confidence":70.89821278572872,"iterationTokens":985,"asi":{"hypothesis":"Index-based list extraction might be marginally cheaper than tuple unpacking in candidate_combinations return path.","rollback_reason":"No micro-win; measured substantially slower end-to-end.","next_action_hint":"Keep tuple-unpacking comprehension for ranked combination extraction."}}
{"run":122,"commit":"d58c8db","metric":148.69577,"metrics":{"best_ms":145.865491,"quality_sum":2.491129377057,"quality_min":0.589775903809,"team_count":4},"status":"discard","description":"Tried shrinking scored top-k heap entries in candidate_combinations from `(score, -index, combination)` to `(score, -index)` plus a side dict `index->combination` to avoid carrying combination tuples in heap comparisons/sorts, but dict bookkeeping made it slower.","timestamp":1775190182208,"segment":0,"confidence":70.74221389475153,"iterationTokens":1823,"asi":{"hypothesis":"Smaller numeric heap entries should reduce top-k maintenance overhead if combination objects are stored out-of-band.","rollback_reason":"Extra dict insert/pop/lookups outweighed savings from smaller heap entries.","next_action_hint":"Keep direct `(score, -index, combination)` heap entries."}}
{"run":123,"commit":"d58c8db","metric":166.076689,"metrics":{"best_ms":153.510509,"quality_sum":2.491129377057,"quality_min":0.589775903809,"team_count":4},"status":"discard","description":"Added request-scoped cache mapping sorted person-identity signatures to sorted person-id team signatures, and used it in score_team to avoid repeated string signature sorting across tasks. Despite high theoretical reuse, this regressed heavily.","timestamp":1775190373162,"segment":0,"confidence":70.89821278572872,"iterationTokens":924,"asi":{"hypothesis":"Caching team_signature by identity signature would amortize expensive sorted(member.id) work across many score_team calls for repeated team compositions.","rollback_reason":"Extra identity sorting and cache indirection per score_team call outweighed saved string sorts.","next_action_hint":"Do not add team_signature cache layer; keep direct team_signature construction."}}
{"run":124,"commit":"d58c8db","metric":155.50566,"metrics":{"best_ms":148.87057,"quality_sum":2.491129377057,"quality_min":0.589775903809,"team_count":4},"status":"discard","description":"Reworked candidate_combinations shortlist ordering to track shortlist as input indices (append index per selected person, then integer-sort and rebuild shortlist) instead of person list + sort-by-position dict key, but this regressed.","timestamp":1775190472297,"segment":0,"confidence":72.79738759890098,"iterationTokens":1623,"asi":{"hypothesis":"Sorting integer indices and rebuilding shortlist should be cheaper than sorting Person objects with dict-lookup keys.","rollback_reason":"Extra index mapping and rebuild overhead outweighed any sorting simplification.","next_action_hint":"Keep original shortlist person list + position-key sort approach."}}
{"run":125,"commit":"d58c8db","metric":151.396594,"metrics":{"best_ms":147.277028,"quality_sum":2.491129377057,"quality_min":0.589775903809,"team_count":4},"status":"discard","description":"Applied local-binding micro-optimizations in _compat_member_task_values (cache alias, member id alias, cache write through local) to reduce global lookups in this hotspot, but runtime regressed.","timestamp":1775190562801,"segment":0,"confidence":73.0565439761126,"iterationTokens":1494,"asi":{"hypothesis":"Local aliases in _compat_member_task_values hit path should shave lookup overhead across many cache accesses.","rollback_reason":"Micro-binding changes did not help and slowed end-to-end performance.","next_action_hint":"Keep the original simpler _compat_member_task_values implementation."}}
{"run":126,"commit":"d58c8db","metric":157.490751,"metrics":{"best_ms":148.924503,"quality_sum":2.491129377057,"quality_min":0.589775903809,"team_count":4},"status":"checks_failed","description":"Tried transposing member_task_values with `zip(*member_task_values)` in _compat_member_task_analysis to reduce nested row indexing in per-task scans, but Ruff failed on missing `strict=` and the benchmark trend was slower anyway.","timestamp":1775190666254,"segment":0,"confidence":75.37117018183638,"iterationTokens":2180,"asi":{"hypothesis":"Column-oriented iteration in _compat_member_task_analysis should lower indexing overhead in the hotspot.","rollback_reason":"Lint failure (B905 zip strict) blocked validation; measured runtime also regressed relative to best.","next_action_hint":"Even if retried with strict=True, this transpose approach is unlikely to beat the current row-index loop.","failure_surface":"src/team2form/scoring.py B905"}}
{"run":127,"commit":"d58c8db","metric":148.711039,"metrics":{"best_ms":144.876021,"quality_sum":2.491129377057,"quality_min":0.589775903809,"team_count":4},"status":"discard","description":"Refactored _compat_member_priority_order rich path to precompute per-member ranking tuples into a list, sort that list once, and return member indices (instead of sorted(range(...), key=...)); this regressed.","timestamp":1775190825840,"segment":0,"confidence":75.44921521552534,"iterationTokens":4832,"asi":{"hypothesis":"Precomputing rich ranking tuples and sorting once should reduce key-function overhead in _compat_member_priority_order.","rollback_reason":"Extra tuple/list materialization and broader refactor overhead outweighed saved key-function calls.","next_action_hint":"Keep existing sorted(range, key=rich_first_priority_key, reverse=True) implementation."}}
{"run":128,"commit":"d58c8db","metric":149.933039,"metrics":{"best_ms":149.180056,"quality_sum":2.491129377057,"quality_min":0.589775903809,"team_count":4},"status":"discard","description":"In candidate_combinations scored top-k loop, replaced Python-level `if entry > ranked[0]: heapreplace(...)` gate with unconditional `heapq.heappushpop(...)` after heap fill, to push comparison into C, but this regressed.","timestamp":1775190911338,"segment":0,"confidence":77.70854370984982,"iterationTokens":1084,"asi":{"hypothesis":"heappushpop could reduce Python branching/comparison overhead once the top-k heap is full.","rollback_reason":"Unconditional heappushpop did extra heap work for non-competitive entries and slowed runtime.","next_action_hint":"Keep explicit `entry > ranked[0]` gate with heapreplace."}}
{"run":129,"commit":"d58c8db","metric":164.894388,"metrics":{"best_ms":153.820561,"quality_sum":2.491129377057,"quality_min":0.589775903809,"team_count":4},"status":"discard","description":"In candidate_social_potential, precomputed explicit preference IDs for the focal person and reused a prebuilt `{person.id}` set so only teammate-side checks call has_explicit_social_preferences; this significantly regressed runtime.","timestamp":1775191104011,"segment":0,"confidence":75.44921521552534,"iterationTokens":2014,"asi":{"hypothesis":"Eliminating repeated scans of `person.preferences` for each teammate should reduce social-potential hotspot cost.","rollback_reason":"Building per-person sets and mixed check paths increased overhead more than expected.","next_action_hint":"Keep original symmetric helper calls in candidate_social_potential."}}
{"run":130,"commit":"d58c8db","metric":152.450196,"metrics":{"best_ms":150.330753,"quality_sum":2.491129377057,"quality_min":0.589775903809,"team_count":4},"status":"discard","description":"Added per-task mapping from candidate tuple object id to scored allocation during combination_scorer evaluation in build_scored_candidates/greedy_allocations, then reused those scored objects when iterating returned candidates to avoid second cached_score_team calls. This regressed.","timestamp":1775191317498,"segment":0,"confidence":77.70854370984982,"iterationTokens":2554,"asi":{"hypothesis":"candidate_combinations and subsequent loops share tuple objects, so reusing first-pass scored allocations by object id should avoid repeated score-cache canonicalization/lookups.","rollback_reason":"Extra object-id dictionary bookkeeping and lookup overhead outweighed saved cached_score_team calls.","next_action_hint":"Keep existing simple rescoring via cached_score_team hit path."}}
{"run":131,"commit":"d58c8db","metric":156.160982,"metrics":{"best_ms":154.810835,"quality_sum":2.491129377057,"quality_min":0.589775903809,"team_count":4},"status":"discard","description":"Added request-scoped team-signature cache keyed by `id(people)` (with object-identity guard) so score_team can reuse precomputed `tuple(sorted(member.id ...))` for repeated people tuple objects, but this regressed significantly.","timestamp":1775191520579,"segment":0,"confidence":76.60874674497235,"iterationTokens":4147,"asi":{"hypothesis":"Since score_team sees high repetition of the same people tuple objects, caching team_signature by tuple object identity should remove many repeated ID sorts.","rollback_reason":"Extra cache lookup/guard bookkeeping outweighed saved team-signature sorts.","next_action_hint":"Keep direct team_signature construction in score_team; this cache layer is not beneficial."}}
{"run":132,"commit":"d58c8db","metric":154.456575,"metrics":{"best_ms":150.617225,"quality_sum":2.491129377057,"quality_min":0.589775903809,"team_count":4},"status":"discard","description":"Added singleton-set fast path in has_explicit_social_preferences (`len(teammate_ids)==1` direct equality check) to speed dominant one-to-one social checks in candidate_social_potential, but this regressed.","timestamp":1775191653011,"segment":0,"confidence":75.53964585499249,"iterationTokens":2040,"asi":{"hypothesis":"Most calls pass singleton teammate sets, so avoiding generic set-membership checks should reduce has_explicit_social_preferences overhead.","rollback_reason":"Extra branching/iter overhead outweighed any membership simplification.","next_action_hint":"Keep the existing generic set-membership implementation."}}
{"run":133,"commit":"d58c8db","metric":161.907733,"metrics":{"best_ms":155.306514,"quality_sum":2.491129377057,"quality_min":0.589775903809,"team_count":4},"status":"discard","description":"Switched shortlist input-order restoration map from person.id keys to object-identity keys (`id(person)`) in candidate_combinations to avoid string-key lookups, but this regressed heavily.","timestamp":1775191742519,"segment":0,"confidence":75.44543233124759,"iterationTokens":978,"asi":{"hypothesis":"Identity-keyed position maps might be cheaper than string-keyed maps for shortlist sorting.","rollback_reason":"id(...) calls and identity-key mapping were significantly slower than the existing string-id approach.","next_action_hint":"Keep person.id-based input position mapping in candidate_combinations."}}
{"run":134,"commit":"d58c8db","metric":152.158944,"metrics":{"best_ms":146.867786,"quality_sum":2.491129377057,"quality_min":0.589775903809,"team_count":4},"status":"discard","description":"Refactored individual_fit to accept pre-resolved Weights from shortlist_scorers (removing per-call resolve_weights inside individual_fit), but this regressed runtime.","timestamp":1775191897939,"segment":0,"confidence":75.53964585499249,"iterationTokens":3271,"asi":{"hypothesis":"Eliminating repeated resolve_weights calls in individual_fit should reduce shortlist scoring overhead.","rollback_reason":"Signature/plumbing refactor still underperformed the prior implementation in end-to-end benchmark.","next_action_hint":"Keep current individual_fit shape; this refactor is not beneficial."}}
