{"run":735,"commit":"15ddcb5","metric":0.109307,"metrics":{"best_ms":0.104398,"quality_sum":2.491129377057,"quality_min":0.589775903809,"team_count":4},"status":"keep","description":"Added optional `assignment_items` cache on `ScoredAllocation` (populated once in `score_team`) and reused it in final response assembly, falling back to `tuple(assignments.items())` only when absent.","timestamp":1775540541021,"segment":0,"confidence":24.509333626104002,"iterationTokens":3053,"asi":{"hypothesis":"Warm-path output loop repeatedly iterates `allocation.assignments.items()`; caching immutable assignment-item tuples per scored allocation should reduce per-call output overhead on reused allocations.","result":"Primary metric improved to near floor with checks passing and unchanged quality monitors.","safety_notes":"`assignment_items` is optional with fallback to live dict items, preserving compatibility with external/manual `ScoredAllocation` constructions and monkeypatch scenarios."}}
{"run":736,"commit":"15ddcb5","metric":0.133633,"metrics":{"best_ms":0.122492,"quality_sum":2.491129377057,"quality_min":0.589775903809,"team_count":4},"status":"discard","description":"No-code confirmation rerun on kept assignment-items cache commit 15ddcb5.","timestamp":1775540602685,"segment":0,"confidence":24.646174838419373,"iterationTokens":755,"asi":{"hypothesis":"If 15ddcb5 is robust, follow-up sample should remain in low warm band with unchanged quality.","rollback_reason":"No code change; validation-only rerun.","next_action_hint":"Retain 15ddcb5 while continuing paired sampling due ongoing host volatility.","noise_observation":"Median increased from keep outlier but remained within observed warm-band variance; quality unchanged."}}
{"run":737,"commit":"15ddcb5","metric":0.143772,"metrics":{"best_ms":0.125448,"quality_sum":2.491129377057,"quality_min":0.589775903809,"team_count":4},"status":"discard","description":"No-code baseline rerun after ideas update for new keep head 15ddcb5.","timestamp":1775540730511,"segment":0,"confidence":24.69710727160955,"iterationTokens":4288,"asi":{"hypothesis":"Ideas maintenance should keep performance behavior unchanged while tracking current host drift.","rollback_reason":"No source-code change; validation-only run.","next_action_hint":"Continue with paired confirmations and prioritize only candidates with expected effect above current noise floor.","noise_observation":"Median remains in slower transient band; quality metrics stable."}}
{"run":738,"commit":"15ddcb5","metric":0.160234,"metrics":{"best_ms":0.127452,"quality_sum":2.491129377057,"quality_min":0.589775903809,"team_count":4},"status":"checks_failed","description":"Tried output-path branch for original scorer: iterate cached `assignment_items` directly (with cast) and fallback to `assignments.items()` only in non-original-score branch.","timestamp":1775540941674,"segment":0,"confidence":24.748250649071625,"iterationTokens":4288,"asi":{"hypothesis":"Branching on `score_team is _ORIGINAL_SCORE_TEAM` could remove per-allocation `assignment_items is None` checks in hot output loop.","rollback_reason":"Checks failed: some test paths build `ScoredAllocation` without `assignment_items` while keeping original scorer, causing `NoneType` iteration TypeError.","next_action_hint":"Preserve per-allocation fallback (`assignment_items if present else assignments.items()`) even on original-score branch to keep monkeypatch/manual-allocation compatibility.","error_excerpt":"TypeError: 'NoneType' object is not iterable at formation.py output assembly loop."}}
{"run":739,"commit":"15ddcb5","metric":0.134475,"metrics":{"best_ms":0.128774,"quality_sum":2.491129377057,"quality_min":0.589775903809,"team_count":4},"status":"discard","description":"No-code baseline rerun after pruning failed original-score-only assignment_items branch experiment.","timestamp":1775540994888,"segment":0,"confidence":24.787062323324474,"iterationTokens":1723,"asi":{"hypothesis":"Rollback from checks-failed branch and ideas update should restore stable behavior/perf.","rollback_reason":"No source-code change; validation-only run.","next_action_hint":"Keep per-allocation assignment-item fallback for compatibility; pursue other structural candidates.","noise_observation":"Warm median returned to low-mid band with stable quality metrics."}}
{"run":740,"commit":"15ddcb5","metric":0.149223,"metrics":{"best_ms":0.129044,"quality_sum":2.491129377057,"quality_min":0.589775903809,"team_count":4},"status":"discard","description":"Added `ScoredAllocation.__post_init__` auto-population for `assignment_items`/`team_signature` and removed per-call `assignment_items is None` fallback in output loop (direct casted iteration).","timestamp":1775541090214,"segment":0,"confidence":24.825995922325166,"iterationTokens":5213,"asi":{"hypothesis":"Normalizing optional `ScoredAllocation` fields at construction time could eliminate hot-path fallback checks while preserving monkeypatched/manual allocation compatibility.","rollback_reason":"Regressed in end-to-end warm benchmark despite passing checks; upfront normalization overhead and extra sorting likely outweighed saved branch work.","next_action_hint":"Keep lightweight optional-field approach with output-loop fallback check; avoid constructor-level normalization of `team_signature`/`assignment_items`.","observation":"Quality metrics remained unchanged."}}
{"run":741,"commit":"15ddcb5","metric":0.145155,"metrics":{"best_ms":0.12665,"quality_sum":2.491129377057,"quality_min":0.589775903809,"team_count":4},"status":"discard","description":"No-code baseline rerun after pruning regressed ScoredAllocation `__post_init__` normalization attempt.","timestamp":1775541137724,"segment":0,"confidence":24.82839544666398,"iterationTokens":942,"asi":{"hypothesis":"Rollback should restore prior behavior; run used to sample current host band after pruning.","rollback_reason":"No source-code change; validation-only run.","next_action_hint":"Avoid additional constructor-normalization rewrites; pursue higher-leverage structural ideas or paired stability checks.","noise_observation":"Median remains in mid-to-slow warm band with unchanged quality metrics."}}
{"run":742,"commit":"15ddcb5","metric":0.146418,"metrics":{"best_ms":0.127011,"quality_sum":2.491129377057,"quality_min":0.589775903809,"team_count":4},"status":"discard","description":"Retried output-path people payload list-comprehension rewrite (`people_payload = [{...} for ... in assignment_items]`) with assignment-items cache baseline.","timestamp":1775541200594,"segment":0,"confidence":24.83079543489343,"iterationTokens":2599,"asi":{"hypothesis":"With cached assignment-item tuples, list comprehension might beat append-loop payload construction.","rollback_reason":"Regressed in current warm regime; comprehension overhead still worse.","next_action_hint":"Keep explicit append-loop payload assembly; avoid further comprehension rewrites unless broader output redesign is attempted.","observation":"Checks passed and quality metrics unchanged."}}
{"run":743,"commit":"15ddcb5","metric":0.145666,"metrics":{"best_ms":0.122993,"quality_sum":2.491129377057,"quality_min":0.589775903809,"team_count":4},"status":"discard","description":"No-code baseline rerun after pruning repeated output payload comprehension retry.","timestamp":1775541248784,"segment":0,"confidence":25.32852901408491,"iterationTokens":885,"asi":{"hypothesis":"Ideas-only update should not affect behavior/perf; run also tracks current warm-band drift.","rollback_reason":"No source-code change; validation-only run.","next_action_hint":"Avoid additional output payload comprehension/container rewrites; focus on larger structural candidates.","noise_observation":"Median remains in elevated warm band with stable quality monitors."}}
{"run":744,"commit":"15ddcb5","metric":0.163731,"metrics":{"best_ms":0.130657,"quality_sum":2.491129377057,"quality_min":0.589775903809,"team_count":4},"status":"discard","description":"Tried empty-branch fast path for improve-cache key unused-people signature (`unused_people_signature = ()` when no reserves) instead of unconditional `tuple(person.id for person in unused_people)`.","timestamp":1775541306747,"segment":0,"confidence":25.84594089247529,"iterationTokens":1286,"asi":{"hypothesis":"Benchmark usually has no unused people; explicit empty-tuple fast path might remove tiny generator overhead in `improve_allocations` cache-key construction.","rollback_reason":"Regressed in current regime; extra branch/local setup outweighed any generator savings.","next_action_hint":"Keep unconditional tuple construction for unused-people signature; avoid further branchy micro-fast-paths here.","observation":"Checks passed and quality metrics unchanged."}}
{"run":745,"commit":"15ddcb5","metric":0.127712,"metrics":{"best_ms":0.115629,"quality_sum":2.491129377057,"quality_min":0.589775903809,"team_count":4},"status":"discard","description":"No-code baseline rerun after pruning regressed unused-people fast-path branch experiment.","timestamp":1775541353505,"segment":0,"confidence":25.855141258245602,"iterationTokens":872,"asi":{"hypothesis":"Ideas-only update should leave behavior unchanged; rerun checks whether host band returned lower.","rollback_reason":"No source-code change; validation-only run.","next_action_hint":"Continue paired validation and avoid branchy micro-fast-path rewrites in improve-cache key setup.","noise_observation":"Median returned to lower warm band while quality metrics remained stable."}}
{"run":746,"commit":"15ddcb5","metric":0,"metrics":{"best_ms":0,"quality_sum":0,"quality_min":0,"team_count":0},"status":"crash","description":"Attempted custom fresh-request diagnostic via `run_experiment` inline Python command; harness rejected non-`autoresearch.sh` command because project enforces `./autoresearch.sh` only.","timestamp":1775541386038,"segment":0,"confidence":25.855141258245602,"iterationTokens":872,"asi":{"hypothesis":"Periodic fresh-request diagnostics are needed to avoid overfitting warm-request benchmark wins.","rollback_reason":"Experiment command blocked by harness policy requiring `./autoresearch.sh`; no benchmark run executed.","next_action_hint":"Collect fresh-request diagnostics outside `run_experiment` (read-only tooling) while keeping official experiment loop on `./autoresearch.sh` only.","error_details":"run_experiment policy error: autoresearch.sh exists — must run it instead of custom command."}}
{"run":747,"commit":"15ddcb5","metric":0.141378,"metrics":{"best_ms":0.127241,"quality_sum":2.491129377057,"quality_min":0.589775903809,"team_count":4},"status":"discard","description":"Recovery no-code baseline run after harness-policy crash on non-`autoresearch.sh` command.","timestamp":1775541427746,"segment":0,"confidence":25.86434817644695,"iterationTokens":3791,"asi":{"hypothesis":"Returning to official `./autoresearch.sh` loop should restore normal metrics after command-policy crash.","rollback_reason":"No source-code change; validation-only run.","next_action_hint":"Keep all timed experiments on `./autoresearch.sh`; do fresh-request diagnostics via non-experiment tooling.","observation":"Baseline behavior/quality returned to expected values."}}
{"run":748,"commit":"410fb2e","metric":0.129856,"metrics":{"best_ms":0.126099,"quality_sum":2.491129377057,"quality_min":0.589775903809,"team_count":4},"status":"keep","description":"Switched final output assembly to consume an iterable of ordered allocations: deterministic permutation-index path now uses a generator (`allocations[idx] for idx in indices`) instead of materializing an intermediate list before payload construction.","timestamp":1775541509353,"segment":0,"confidence":25.901979626685804,"iterationTokens":2821,"asi":{"hypothesis":"Avoiding intermediate `ordered_allocations` list materialization on deterministic path can reduce warm output overhead before response payload loops.","result":"Primary metric improved in current regime with checks passing and unchanged quality monitors.","safety_notes":"Ordering semantics unchanged; both paths still iterate allocations in identical task order."}}
{"run":749,"commit":"410fb2e","metric":0.130858,"metrics":{"best_ms":0.125928,"quality_sum":2.491129377057,"quality_min":0.589775903809,"team_count":4},"status":"discard","description":"Immediate no-code confirmation rerun on kept ordered-allocation iterable/generator commit 410fb2e.","timestamp":1775541556882,"segment":0,"confidence":25.93972074057739,"iterationTokens":794,"asi":{"hypothesis":"If 410fb2e is real, follow-up sample should stay in same lower warm band with stable behavior metrics.","rollback_reason":"No code change; validation-only rerun.","next_action_hint":"Retain 410fb2e baseline and continue with paired validation for any further micro-output changes.","noise_observation":"Confirmation stayed in low warm band and preserved all quality monitors."}}
{"run":750,"commit":"410fb2e","metric":0.12172,"metrics":{"best_ms":0.118715,"quality_sum":2.491129377057,"quality_min":0.589775903809,"team_count":4},"status":"discard","description":"No-code baseline rerun after ideas update for new keep head 410fb2e.","timestamp":1775541609325,"segment":0,"confidence":26.034662048721543,"iterationTokens":1653,"asi":{"hypothesis":"Ideas maintenance should preserve runtime/behavior while sampling current host band.","rollback_reason":"No source-code change; validation-only run.","next_action_hint":"Use this lower-band sample as reference and continue only with candidates likely to exceed noise floor.","noise_observation":"Host returned to lower warm band with stable quality monitors."}}
{"run":751,"commit":"bc7b580","metric":0.126099,"metrics":{"best_ms":0.122402,"quality_sum":2.491129377057,"quality_min":0.589775903809,"team_count":4},"status":"keep","description":"Refined final output assembly by splitting into branch-specific loops: deterministic permutation-index path iterates indices directly (`for task_index in task_order_original_indices`) instead of creating an intermediate generator iterable.","timestamp":1775541667559,"segment":0,"confidence":26.130300894410222,"iterationTokens":2039,"asi":{"hypothesis":"Direct branch-specific iteration can remove generator-object overhead introduced by iterable-based reordering while retaining no-materialization behavior.","result":"Primary metric improved in current low warm band with checks passing and stable quality monitors.","safety_notes":"Task ordering semantics unchanged; both branches emit identical ordered payloads."}}
{"run":752,"commit":"bc7b580","metric":0.150184,"metrics":{"best_ms":0.115458,"quality_sum":2.491129377057,"quality_min":0.589775903809,"team_count":4},"status":"discard","description":"Immediate no-code confirmation rerun on kept branch-specific output-loop commit bc7b580.","timestamp":1775541706991,"segment":0,"confidence":26.13360639004267,"iterationTokens":745,"asi":{"hypothesis":"If bc7b580 is robust, follow-up sample should stay near prior low-band result.","rollback_reason":"No code change; validation-only rerun.","next_action_hint":"Retain bc7b580 for now but require additional paired samples before attributing durable gain due renewed host drift.","noise_observation":"Median jumped back into slower band while best time stayed low, indicating high transient variance."}}
{"run":753,"commit":"bc7b580","metric":0.120087,"metrics":{"best_ms":0.111291,"quality_sum":2.491129377057,"quality_min":0.589775903809,"team_count":4},"status":"discard","description":"No-code baseline rerun after ideas update for new keep head bc7b580.","timestamp":1775541766571,"segment":0,"confidence":26.136800760843048,"iterationTokens":2045,"asi":{"hypothesis":"Ideas maintenance should not change runtime; rerun used to sample drift after confirming bc7b580.","rollback_reason":"No source-code change; validation-only run.","next_action_hint":"Continue with bundled paired validation before making further output-path micro changes.","noise_observation":"Sample returned to low warm band; quality metrics unchanged."}}
{"run":754,"commit":"bc7b580","metric":0.146999,"metrics":{"best_ms":0.127251,"quality_sum":2.491129377057,"quality_min":0.589775903809,"team_count":4},"status":"discard","description":"Tried branchless assignment-items selection in output loops (`allocation.assignment_items or allocation.assignments.items()`) replacing explicit `is None` fallback branch.","timestamp":1775541835424,"segment":0,"confidence":26.201344950466357,"iterationTokens":2344,"asi":{"hypothesis":"Replacing explicit None-check with short-circuit expression may reduce branch overhead in final payload assembly loops.","rollback_reason":"Regressed in current warm regime; short-circuit/object-truthiness path was slower.","next_action_hint":"Keep explicit `is None` fallback branch for assignment-items selection.","observation":"Checks passed and quality metrics unchanged."}}
{"run":755,"commit":"bc7b580","metric":0.129636,"metrics":{"best_ms":0.120077,"quality_sum":2.491129377057,"quality_min":0.589775903809,"team_count":4},"status":"discard","description":"No-code baseline rerun after pruning regressed branchless assignment-items fallback variant.","timestamp":1775541883142,"segment":0,"confidence":26.266095638166796,"iterationTokens":842,"asi":{"hypothesis":"Ideas-only update should preserve baseline behavior and re-sample current warm band.","rollback_reason":"No source-code change; validation-only run.","next_action_hint":"Keep explicit assignment-items fallback branch and continue with larger-signal experiments only.","noise_observation":"Median returned toward lower warm band with stable quality metrics."}}
{"run":756,"commit":"bc7b580","metric":0.122141,"metrics":{"best_ms":0.116742,"quality_sum":2.491129377057,"quality_min":0.589775903809,"team_count":4},"status":"discard","description":"Retried deterministic form-level shortcut: direct `_REQUEST_GREEDY_ALLOCATIONS` probe in `form_teams` to skip exact-check/`greedy_allocations` call when warm greedy cache hit is present.","timestamp":1775541960205,"segment":0,"confidence":26.268993827187725,"iterationTokens":3415,"asi":{"hypothesis":"Bypassing `capped_candidate_search_is_exact` and `greedy_allocations(...)` wrapper on deterministic warm hits may reduce entry overhead.","rollback_reason":"Inconclusive/near-noise with added branching/duplication complexity; no clear gain over current baseline.","next_action_hint":"Keep existing exact/greedy flow and avoid additional form-level shortcut duplication unless supported by stronger paired evidence.","observation":"Checks passed and quality metrics unchanged."}}
{"run":757,"commit":"bc7b580","metric":0.137301,"metrics":{"best_ms":0.122492,"quality_sum":2.491129377057,"quality_min":0.589775903809,"team_count":4},"status":"discard","description":"No-code baseline rerun after pruning repeated deterministic form-level greedy-cache shortcut retry.","timestamp":1775542010563,"segment":0,"confidence":26.272363068904532,"iterationTokens":1056,"asi":{"hypothesis":"Ideas-only update should preserve baseline while tracking current warm-band movement.","rollback_reason":"No source-code change; validation-only run.","next_action_hint":"Avoid further form-level greedy shortcut duplication without materially different design/proof.","noise_observation":"Median drifted upward again while quality remained stable."}}
{"run":758,"commit":"bc7b580","metric":0.14234,"metrics":{"best_ms":0.118815,"quality_sum":2.491129377057,"quality_min":0.589775903809,"team_count":4},"status":"discard","description":"Tried inverting final output branch to make deterministic path primary (`if task_order_original_indices is not None`) and move sorted fallback to else.","timestamp":1775542069079,"segment":0,"confidence":26.310461333207925,"iterationTokens":1628,"asi":{"hypothesis":"Making deterministic path the direct/first branch may reduce branch overhead in the dominant warm workload.","rollback_reason":"Regressed in current regime; branch inversion did not help.","next_action_hint":"Keep existing branch layout from bc7b580.","observation":"Checks passed and quality metrics unchanged."}}
{"run":759,"commit":"bc7b580","metric":0.125297,"metrics":{"best_ms":0.116241,"quality_sum":2.491129377057,"quality_min":0.589775903809,"team_count":4},"status":"discard","description":"No-code baseline rerun after pruning regressed deterministic-first output branch inversion.","timestamp":1775542114699,"segment":0,"confidence":26.348556469857964,"iterationTokens":797,"asi":{"hypothesis":"Ideas-only rollback should restore prior baseline and sample current warm band.","rollback_reason":"No source-code change; validation-only run.","next_action_hint":"Keep original branch layout from bc7b580 and avoid further branch-order micro-tweaks.","noise_observation":"Median returned to lower warm band with stable quality monitors."}}
{"run":760,"commit":"a7d5a8f","metric":0.115729,"metrics":{"best_ms":0.114337,"quality_sum":2.491129377057,"quality_min":0.589775903809,"team_count":4},"status":"keep","description":"Rewrote output `people_payload` construction to fixed-size indexed fill: preallocate list length from `assignment_items` and assign dict entries by `enumerate` index instead of append-loop growth (applied in both output-order branches).","timestamp":1775542187893,"segment":0,"confidence":26.394416618159507,"iterationTokens":2343,"asi":{"hypothesis":"For tiny fixed team sizes, pre-sized indexed list fill may beat repeated `append` calls in final payload assembly.","result":"Primary metric improved to a new low-band sample with checks passing and stable quality monitors.","safety_notes":"Output payload content/order remains unchanged; only list-building mechanics changed."}}
