{"run":466,"commit":"78ce3d9","metric":18.561357,"metrics":{"best_ms":17.670289,"quality_sum":2.491129377057,"quality_min":0.589775903809,"team_count":4},"status":"discard","description":"No-code baseline rerun after ideas update; re-check whether host exits slow regime.","timestamp":1775399765416,"segment":0,"confidence":19.083609337714535,"iterationTokens":1934,"asi":{"hypothesis":"Baseline should remain elevated if environmental slowdown persists.","rollback_reason":"No code change; monitoring-only run.","next_action_hint":"Hold off on marginal code experiments until benchmark returns closer to low-12ms historical band; prioritize only high-signal structural hypotheses.","noise_observation":"Latency remained in ~18.6ms band, indicating sustained external throttling."}}
{"run":467,"commit":"78ce3d9","metric":18.885411,"metrics":{"best_ms":18.269614,"quality_sum":2.491129377057,"quality_min":0.589775903809,"team_count":4},"status":"discard","description":"Added a cheap pre-check in swap-phase COMPAT pruning: after computing `left_upper_bound`, test pair objective against a global compat quality cap (`alpha + gamma + delta + beta*1.32`) before computing `right_upper_bound`, skipping right-bound work when impossible to beat current objective.","timestamp":1775399902586,"segment":0,"confidence":19.081766311124312,"iterationTokens":2610,"asi":{"hypothesis":"A left-bound + global-right-cap pre-check could prune many swap candidates before calculating right-team upper bounds.","rollback_reason":"No observed gain in current runs; extra objective evaluation branch likely outweighed skipped right-bound computations.","next_action_hint":"Do not add global-cap pre-check in swap loop unless profiling shows substantial right-bound call elimination.","result":"Checks passed and quality unchanged."}}
{"run":468,"commit":"78ce3d9","metric":17.151997,"metrics":{"best_ms":17.107162,"quality_sum":2.491129377057,"quality_min":0.589775903809,"team_count":4},"status":"discard","description":"No-code baseline rerun after discarding swap-loop global-cap pre-check experiment.","timestamp":1775399962176,"segment":0,"confidence":19.07602198053277,"iterationTokens":725,"asi":{"hypothesis":"Rollback baseline should quantify current slow-band level after failed swap pre-check.","rollback_reason":"No code change; baseline anchoring run.","next_action_hint":"Keep 78ce3d9 as active head; continue only high-signal structural ideas while host remains slow.","noise_observation":"Environment remains above historical low-12ms band, but this sample improved versus prior ~18.9ms."}}
{"run":469,"commit":"78ce3d9","metric":19.152407,"metrics":{"best_ms":18.940655,"quality_sum":2.491129377057,"quality_min":0.589775903809,"team_count":4},"status":"discard","description":"No-code baseline rerun while monitoring for host recovery after latest stale-idea pruning updates.","timestamp":1775400077563,"segment":0,"confidence":19.065721092503704,"iterationTokens":4043,"asi":{"hypothesis":"If host remains constrained, baseline medians will stay near current high-latency band regardless of code changes.","rollback_reason":"No code change; environment monitoring run.","next_action_hint":"Continue treating this as unstable/slow regime; require clear, large wins before accepting new keeps.","noise_observation":"Baseline remained near ~19ms, indicating sustained slowdown relative to earlier low-12ms periods."}}
{"run":470,"commit":"78ce3d9","metric":19.226944,"metrics":{"best_ms":18.434523,"quality_sum":2.491129377057,"quality_min":0.589775903809,"team_count":4},"status":"discard","description":"In generic (`len(team)>2`) `team_personality_score`, replaced two `max(...)` introvert clamps with a single branch-derived `introvert_component` reused for COMPAT and PAPER introvert terms.","timestamp":1775400589537,"segment":0,"confidence":19.055431323252716,"iterationTokens":4043,"asi":{"hypothesis":"`team_personality_score` generic path is a major source of `max` calls; replacing clamp calls with branch-derived scalar reuse should reduce hot-path overhead.","rollback_reason":"No primary improvement observed in current regime; runtime slightly worsened versus nearby baseline anchors.","next_action_hint":"Keep existing max-based introvert clamps for now; revisit only with tighter paired A/B when host stabilizes.","result":"Checks passed and quality unchanged."}}
{"run":471,"commit":"78ce3d9","metric":21.215961,"metrics":{"best_ms":20.729249,"quality_sum":2.491129377057,"quality_min":0.589775903809,"team_count":4},"status":"discard","description":"Tightened `_compat_candidate_quality_upper_bound` skill upper bound for square teams by applying `_compat_has_perfect_positive_matching(...)`: when no positive perfect matching exists, force `skill_score_upper=0.0` before objective bound composition.","timestamp":1775401275192,"segment":0,"confidence":19.024316510785543,"iterationTokens":15597,"asi":{"hypothesis":"Many swap upper-bound candidates lack a positive perfect matching; zeroing skill upper in those cases should tighten bounds and prune rescoring.","rollback_reason":"Regression outweighed pruning gains; additional matching checks in upper-bound path added too much overhead in this workload.","next_action_hint":"Do not add per-candidate perfect-matching checks inside `_compat_candidate_quality_upper_bound` without a much cheaper prefilter or stronger pruning leverage.","result":"Checks passed and quality unchanged but runtime worsened substantially."}}
{"run":472,"commit":"78ce3d9","metric":18.825173,"metrics":{"best_ms":18.32787,"quality_sum":2.491129377057,"quality_min":0.589775903809,"team_count":4},"status":"discard","description":"No-code baseline rerun after discarding perfect-matching-tightened upper-bound experiment.","timestamp":1775401419378,"segment":0,"confidence":18.99330314480827,"iterationTokens":721,"asi":{"hypothesis":"Rollback should return to prior slow-band baseline after failed matching-check bound tightening.","rollback_reason":"No code change; baseline anchoring run.","next_action_hint":"Treat current baseline as ~18–19ms under constrained host; pursue only high-signal structural ideas.","noise_observation":"Runtime returned from >21ms regression sample to the prevailing slow band."}}
{"run":473,"commit":"3662dfa","metric":17.88362,"metrics":{"best_ms":17.312157,"quality_sum":2.491129377057,"quality_min":0.589775903809,"team_count":4},"status":"keep","description":"Added `mode=COMPAT && len(team)==4` fast path in `team_personality_score`: manual 4-member stddev + ETJ/introvert aggregation without generic list/set scaffolding, with existing generic/PAPER fallback unchanged.","timestamp":1775402114638,"segment":0,"confidence":18.951409487958887,"iterationTokens":9174,"asi":{"hypothesis":"Most hot-path personality upper-bound evaluations are 4-member COMPAT teams; a dedicated len-4 path should reduce per-candidate overhead in `team_personality_score`.","result":"Primary metric improved in current slow regime with checks passing and unchanged quality monitors.","safety_notes":"Formula/weights preserved; optimization only restructures computation order for COMPAT len-4 path and keeps existing fallback for all other cases."}}
{"run":474,"commit":"3662dfa","metric":17.781657,"metrics":{"best_ms":17.430772,"quality_sum":2.491129377057,"quality_min":0.589775903809,"team_count":4},"status":"discard","description":"No-code confirmation rerun on kept COMPAT len-4 personality fast-path commit 3662dfa.","timestamp":1775402244413,"segment":0,"confidence":18.88478517544339,"iterationTokens":1250,"asi":{"hypothesis":"If 3662dfa improvement is real, immediate rerun should remain near improved ~17.7–17.9ms band in current host regime.","rollback_reason":"No code change; validation-only rerun.","next_action_hint":"Use 3662dfa as active baseline and continue with shape-gated COMPAT team-size-4 hot-path reductions.","noise_observation":"Repeat remained in the same improved band with unchanged quality metrics."}}
{"run":475,"commit":"3662dfa","metric":20.910059,"metrics":{"best_ms":20.695422,"quality_sum":2.491129377057,"quality_min":0.589775903809,"team_count":4},"status":"discard","description":"Added `len(team)==4` fast path in `team_social_score` with direct per-member mapping lookups and fixed 4-member score aggregation, bypassing generic mapping/teammate loops.","timestamp":1775403589861,"segment":0,"confidence":18.833376403867216,"iterationTokens":9127,"asi":{"hypothesis":"A dedicated 4-member social-score path should reduce overhead from generic dict-comprehension + nested-loop scaffolding in frequent COMPAT bound evaluations.","rollback_reason":"End-to-end runtime regressed substantially in this window; extra explicit mapping setup did not outperform generic path.","next_action_hint":"Do not keep this 4-member team_social rewrite; retain existing generic implementation.","result":"Checks passed and quality unchanged."}}
{"run":476,"commit":"3662dfa","metric":17.512817,"metrics":{"best_ms":17.428346,"quality_sum":2.491129377057,"quality_min":0.589775903809,"team_count":4},"status":"discard","description":"No-code baseline rerun after discarding `team_social_score` len-4 fast-path experiment.","timestamp":1775403735878,"segment":0,"confidence":18.782246765658865,"iterationTokens":669,"asi":{"hypothesis":"Rollback should restore current 3662dfa baseline behavior after failed social len-4 specialization.","rollback_reason":"No code change; baseline anchoring run.","next_action_hint":"Use ~17.5ms as current baseline anchor; continue exploring COMPAT len-4 personality/bound-adjacent changes with strict tie safety.","noise_observation":"Run returned to improved mid/high-17ms band, confirming prior 20.9ms sample was not persistent."}}
{"run":477,"commit":"3662dfa","metric":17.627434,"metrics":{"best_ms":17.521292,"quality_sum":2.491129377057,"quality_min":0.589775903809,"team_count":4},"status":"discard","description":"Added `len(team)==4` fast path in `_compat_gender_bonus`: single-pass gender counting with precomputed constants for minority fractions (0/8,1/8,2/8,3/8,4/8), avoiding generic sum/sine path for dominant 4-member COMPAT teams.","timestamp":1775404921667,"segment":0,"confidence":18.680968300346827,"iterationTokens":9105,"asi":{"hypothesis":"`_compat_gender_bonus` is called frequently from COMPAT len-4 personality scoring; replacing generic counts+sin with shape-specialized constant mapping should trim overhead.","rollback_reason":"No primary improvement observed versus current baseline; result was slightly worse in this run.","next_action_hint":"Keep generic len>2 `_compat_gender_bonus` path (plus existing len-2 fast path); avoid further len-4 gender micro-specializations.","result":"Checks passed and quality unchanged."}}
{"run":478,"commit":"3662dfa","metric":12.427806,"metrics":{"best_ms":12.016186,"quality_sum":2.491129377057,"quality_min":0.589775903809,"team_count":4},"status":"discard","description":"In COMPAT len-4 personality fast path, inlined gender-bonus computation directly (replace `_compat_gender_bonus(team)` call with local 4-member count/minority math).","timestamp":1775405325891,"segment":0,"confidence":18.610266541720467,"iterationTokens":4038,"asi":{"hypothesis":"Removing the `_compat_gender_bonus` function call from the hot len-4 COMPAT personality path may shave overhead.","rollback_reason":"Result is confounded by abrupt host regime shift to a much faster band; need same-regime baseline before attributing gain to code.","next_action_hint":"Treat as inconclusive; rerun no-code baseline on reverted head in current fast regime before reconsidering this direction.","noise_observation":"Metric dropped from prior slow-band runs (~17–19ms) to ~12.4ms suddenly, indicating environmental change."}}
{"run":479,"commit":"3662dfa","metric":13.468367,"metrics":{"best_ms":12.929266,"quality_sum":2.491129377057,"quality_min":0.589775903809,"team_count":4},"status":"discard","description":"No-code baseline rerun after discarding inlined len-4 gender-bonus experiment, to re-anchor new fast host regime.","timestamp":1775405457931,"segment":0,"confidence":18.590975405327722,"iterationTokens":1045,"asi":{"hypothesis":"Reverted baseline in new regime should show whether prior 12.43ms sample was mostly environmental.","rollback_reason":"No code change; baseline anchoring run.","next_action_hint":"Use ~12.9–13.5ms as current regime band; require immediate paired reruns for any marginal keep.","noise_observation":"Host has shifted from prior 17–19ms band into ~13ms band."}}
{"run":480,"commit":"3662dfa","metric":14.423504,"metrics":{"best_ms":13.882921,"quality_sum":2.491129377057,"quality_min":0.589775903809,"team_count":4},"status":"discard","description":"Retested inline gender-bonus math inside COMPAT len-4 personality fast path (replace `_compat_gender_bonus(team)` call with local 4-member count/minority formula) under refreshed fast host regime.","timestamp":1775406325821,"segment":0,"confidence":18.560344098668878,"iterationTokens":7689,"asi":{"hypothesis":"Inlining len-4 gender bonus inside the hot COMPAT personality fast path may remove helper-call overhead.","rollback_reason":"Regressed in same fast regime; inline gender math is slower than helper-call path.","next_action_hint":"Keep calling `_compat_gender_bonus(team)` from len-4 COMPAT personality fast path.","result":"Checks passed and quality unchanged."}}
{"run":481,"commit":"3662dfa","metric":16.995666,"metrics":{"best_ms":13.976708,"quality_sum":2.491129377057,"quality_min":0.589775903809,"team_count":4},"status":"discard","description":"No-code baseline rerun after discarding inline len-4 gender-bonus retest.","timestamp":1775406486654,"segment":0,"confidence":18.546348431031948,"iterationTokens":669,"asi":{"hypothesis":"Baseline should recover after reverting failed inline-gender experiment.","rollback_reason":"No code change; baseline anchoring run.","next_action_hint":"Given broad spread (best still low-14ms, median spiked), continue requiring paired confirmations before keep decisions.","noise_observation":"Large within-run variance observed; median spiked while best stayed in fast band."}}
{"run":482,"commit":"fc8b7b4","metric":13.000447,"metrics":{"best_ms":12.365415,"quality_sum":2.491129377057,"quality_min":0.589775903809,"team_count":4},"status":"keep","description":"Optimized COMPAT len-4 `team_personality_score` stddev math: replaced four `(x-mean)^2` accumulations with equivalent sum/sum-of-squares variance formula for SN/TF axes (`var = E[x^2] - E[x]^2`, clamped at 0 before sqrt).","timestamp":1775406905711,"segment":0,"confidence":18.53847355218808,"iterationTokens":2084,"asi":{"hypothesis":"The new len-4 COMPAT personality fast path still spends many ops in repeated `(x-mean)^2`; equivalent sum-of-squares variance should reduce arithmetic overhead while preserving output.","result":"Primary metric improved in the current fast regime with checks passing and quality monitors unchanged.","safety_notes":"Algebraically equivalent population variance computation; non-positive rounding artifacts are clamped to 0 before sqrt to preserve valid stddev behavior."}}
{"run":483,"commit":"fc8b7b4","metric":13.964443,"metrics":{"best_ms":13.324731,"quality_sum":2.491129377057,"quality_min":0.589775903809,"team_count":4},"status":"discard","description":"No-code confirmation rerun on kept COMPAT len-4 variance-formula optimization commit fc8b7b4.","timestamp":1775457054876,"segment":0,"confidence":18.446136000321243,"iterationTokens":2084,"asi":{"hypothesis":"If fc8b7b4 gain is robust, repeated runs should remain near low-13ms band.","rollback_reason":"No code change; validation-only rerun.","next_action_hint":"Use fc8b7b4 as active baseline but require additional paired checks due continuing host spread.","noise_observation":"Rerun remained in fast regime but with higher median than initial keep sample, indicating ongoing variance."}}
{"run":484,"commit":"fc8b7b4","metric":13.159661,"metrics":{"best_ms":12.649566,"quality_sum":2.491129377057,"quality_min":0.589775903809,"team_count":4},"status":"discard","description":"Additional no-code baseline rerun on active head fc8b7b4 for paired confirmation in current fast regime.","timestamp":1775457104214,"segment":0,"confidence":18.339294179685027,"iterationTokens":2084,"asi":{"hypothesis":"Current baseline should center in low-13ms band if fc8b7b4 remains beneficial.","rollback_reason":"No code change; baseline characterization run.","next_action_hint":"Proceed with further COMPAT len-4 path experiments, but validate with immediate reruns due persistent spread.","noise_observation":"Run returned closer to initial keep sample (~13.16ms), supporting fc8b7b4 as plausible improvement despite variance."}}
{"run":485,"commit":"fc8b7b4","metric":14.641862,"metrics":{"best_ms":13.534615,"quality_sum":2.491129377057,"quality_min":0.589775903809,"team_count":4},"status":"discard","description":"Added per-loop 4-value skill-upper memoization in COMPAT pruning cheap stages (`_best_scored_shortlist_candidate_with_compat_pruning` and greedy <=cap branch): cache `geometric_mean` by `(best0,best1,best2,best3)` to reuse repeated 4x4 skill-best vectors.","timestamp":1775457474300,"segment":0,"confidence":18.21827646708253,"iterationTokens":16726,"asi":{"hypothesis":"4x4 skill-best vectors repeat heavily inside pruning loops; local memoization of their geometric means should cut repeated log/exp work.","rollback_reason":"No net gain in end-to-end benchmark; tuple-key cache overhead and extra dict lookups outweighed reuse benefits.","next_action_hint":"Avoid local skill-upper memoization dictionaries in cheap pruning loops.","result":"Checks passed and quality unchanged."}}
{"run":486,"commit":"fc8b7b4","metric":13.535647,"metrics":{"best_ms":12.215417,"quality_sum":2.491129377057,"quality_min":0.589775903809,"team_count":4},"status":"discard","description":"No-code baseline rerun after discarding 4-value skill-upper memoization attempt.","timestamp":1775457526868,"segment":0,"confidence":18.09884543263033,"iterationTokens":723,"asi":{"hypothesis":"Rollback should return to fc8b7b4 baseline once local skill-upper memo caches are removed.","rollback_reason":"No code change; baseline anchoring run.","next_action_hint":"Treat current fast-band baseline as roughly low/mid-13ms with occasional outliers; keep requiring paired confirmations.","noise_observation":"Median returned near baseline while best sample remained low, indicating continued variance."}}
{"run":487,"commit":"fc8b7b4","metric":13.477326,"metrics":{"best_ms":12.403482,"quality_sum":2.491129377057,"quality_min":0.589775903809,"team_count":4},"status":"discard","description":"Adjusted `_compat_candidate_social_upper_bound` hot path to check `social_cache` first (key `(0.5, team_signature)`) and early-return on cache hit before consulting social-preference-presence cache.","timestamp":1775457685399,"segment":0,"confidence":17.98267695163831,"iterationTokens":6957,"asi":{"hypothesis":"After warm-up, most COMPAT social upper bounds are already cached; checking social-cache first should avoid an extra presence-cache lookup on the common path.","rollback_reason":"No clear end-to-end improvement in benchmark; effect is neutral within noise.","next_action_hint":"Keep existing helper order unless combined with a larger pruning-stage restructuring.","result":"Checks passed and quality unchanged."}}
{"run":488,"commit":"fc8b7b4","metric":14.722094,"metrics":{"best_ms":14.073485,"quality_sum":2.491129377057,"quality_min":0.589775903809,"team_count":4},"status":"discard","description":"No-code baseline rerun after discarding social-cache-first helper ordering experiment.","timestamp":1775457737636,"segment":0,"confidence":17.867990228062443,"iterationTokens":681,"asi":{"hypothesis":"Rollback should maintain fc8b7b4 baseline behavior after neutral helper-order test.","rollback_reason":"No code change; baseline monitoring run.","next_action_hint":"Current host variance remains high (13–15ms swings); prioritize only larger structural hypotheses and always pair-validate.","noise_observation":"Observed another upward median swing despite unchanged code, reinforcing unstable environment."}}
{"run":489,"commit":"fc8b7b4","metric":16.980832,"metrics":{"best_ms":12.810864,"quality_sum":2.491129377057,"quality_min":0.589775903809,"team_count":4},"status":"discard","description":"No-code baseline rerun after ideas pruning update to monitor current noise floor.","timestamp":1775457808141,"segment":0,"confidence":17.712423903924435,"iterationTokens":983,"asi":{"hypothesis":"Baseline should remain within known volatile band after metadata-only updates.","rollback_reason":"No code change; monitoring run.","next_action_hint":"Given extreme within-run spread (low best with high median), rely on multiple paired confirmations before interpreting small deltas.","noise_observation":"Observed very high median with low best sample in same run, indicating transient host jitter dominates."}}
