{"run":86,"commit":"6f6ee89","metric":152.49124,"metrics":{"best_ms":150.144976,"quality_sum":2.491129377057,"quality_min":0.589775903809,"team_count":4},"status":"discard","description":"Removed greedy_allocations temporary list materialization by taking max() directly over scored_candidate generator expressions (both random and deterministic branches), but this regressed runtime.","timestamp":1775186605965,"segment":0,"confidence":61.76778623954448,"iterationTokens":1579,"asi":{"hypothesis":"Avoiding creation of `scored_candidates` lists should reduce allocation overhead in greedy candidate selection.","rollback_reason":"Generator-based max path was slower than list materialization in this workload.","next_action_hint":"Keep explicit scored_candidates lists in greedy_allocations."}}
{"run":87,"commit":"6f6ee89","metric":148.611713,"metrics":{"best_ms":142.513985,"quality_sum":2.491129377057,"quality_min":0.589775903809,"team_count":4},"status":"discard","description":"Added global cache for square compat perfect-positive-matching feasibility keyed by per-member positive-task masks to reuse _compat_has_perfect_positive_matching results across repeated evaluations, but this regressed runtime.","timestamp":1775186697906,"segment":0,"confidence":62.12493680070324,"iterationTokens":1937,"asi":{"hypothesis":"Perfect-matching feasibility depends only on positive mask structure, so caching by member mask signatures should avoid repeated recursive matching work.","rollback_reason":"Cache lookup/signature overhead outweighed avoided matching work on this workload.","next_action_hint":"Do not add global perfect-matching cache; keep direct feasibility check."}}
{"run":88,"commit":"6f6ee89","metric":146.551973,"metrics":{"best_ms":143.390385,"quality_sum":2.491129377057,"quality_min":0.589775903809,"team_count":4},"status":"discard","description":"Added request-scoped cache for `has_team_social_preferences` keyed by team signature to avoid repeated explicit-preference scans in compat score_team, but this regressed runtime.","timestamp":1775186816222,"segment":0,"confidence":62.281672986973575,"iterationTokens":3498,"asi":{"hypothesis":"Caching per-team social-preference existence should reduce repeated has_explicit_social_preferences scans across task evaluations.","rollback_reason":"Extra cache plumbing/lookups and duplicate team-signature handling outweighed saved scans.","next_action_hint":"Keep direct has_team_social_preferences computation path; this cache layer is not worthwhile."}}
{"run":89,"commit":"6f6ee89","metric":156.549876,"metrics":{"best_ms":151.660858,"quality_sum":2.491129377057,"quality_min":0.589775903809,"team_count":4},"status":"discard","description":"Replaced generator-based ranked_lists.extend(...) with explicit append loop for alternate scorer rankings in candidate_combinations, but this regressed runtime.","timestamp":1775186891789,"segment":0,"confidence":62.12493680070324,"iterationTokens":901,"asi":{"hypothesis":"Avoiding generator-to-extend overhead when building alternate ranked lists could slightly reduce candidate_combinations setup cost.","rollback_reason":"Explicit append loop was slower in this benchmark.","next_action_hint":"Keep original extend(generator) form for ranked_lists construction."}}
{"run":90,"commit":"6f6ee89","metric":149.983962,"metrics":{"best_ms":149.574597,"quality_sum":2.491129377057,"quality_min":0.589775903809,"team_count":4},"status":"discard","description":"Switched cached_score_team canonical key construction from `sorted(generator)` to `sorted(list-comprehension)` for person identities, but this regressed runtime.","timestamp":1775186972023,"segment":0,"confidence":62.8819071573799,"iterationTokens":801,"asi":{"hypothesis":"Materializing identity values via list comprehension before sorting might outperform generator-based sorted in cached_score_team.","rollback_reason":"List-comprehension variant was slower than the current generator-based implementation.","next_action_hint":"Keep generator-based sorted identity key construction."}}
{"run":91,"commit":"6f6ee89","metric":170.351344,"metrics":{"best_ms":160.838628,"quality_sum":2.491129377057,"quality_min":0.589775903809,"team_count":4},"status":"discard","description":"Added safe pair-swap pruning in improve_allocations (skip objective recomputation when both swapped team qualities are <= their originals), but this regressed heavily.","timestamp":1775187051900,"segment":0,"confidence":62.12493680070324,"iterationTokens":1027,"asi":{"hypothesis":"Many pair swaps worsen both teams; skipping trial allocation/objective work for these cases should reduce improve_allocations cost.","rollback_reason":"The additional branch and comparisons in the innermost swap loop outweighed saved objective calculations.","next_action_hint":"Avoid extra pruning checks in improve_allocations without stronger evidence."}}
{"run":92,"commit":"6f6ee89","metric":150.820606,"metrics":{"best_ms":146.794211,"quality_sum":2.491129377057,"quality_min":0.589775903809,"team_count":4},"status":"discard","description":"Replaced repeated integer ceil divisions (`math.ceil(len(a)/len(b))`) with pure-integer formulas (`(len(a)+len(b)-1)//len(b)`) across compat/partitioned assignment helpers, but this regressed runtime.","timestamp":1775187165143,"segment":0,"confidence":62.8819071573799,"iterationTokens":4733,"asi":{"hypothesis":"Integer ceil formulas should avoid float conversion overhead in hot assignment-size calculations.","rollback_reason":"Arithmetic rewrite did not translate to speedup and was slower end-to-end.","next_action_hint":"Keep original math.ceil-based expressions in assignment helpers."}}
{"run":93,"commit":"6f6ee89","metric":159.230603,"metrics":{"best_ms":155.313605,"quality_sum":2.491129377057,"quality_min":0.589775903809,"team_count":4},"status":"discard","description":"Added a near-budget scored-candidate special case in candidate_combinations for `C(shortlist, team_size) == max_candidate_teams + 1` (score all, drop single worst, then sort) to avoid heap maintenance, but this regressed strongly.","timestamp":1775187282201,"segment":0,"confidence":62.90713056237116,"iterationTokens":1951,"asi":{"hypothesis":"When scored combinations exceed budget by only one, direct drop-worst selection should be cheaper than heap-based top-k maintenance.","rollback_reason":"Full materialization/min+sort work was slower than the existing heap path.","next_action_hint":"Keep current heap-based top-k selection even in near-budget cases."}}
{"run":94,"commit":"6f6ee89","metric":153.653311,"metrics":{"best_ms":149.844488,"quality_sum":2.491129377057,"quality_min":0.589775903809,"team_count":4},"status":"discard","description":"Added request-scoped cache for `valid_person_ids` and reused it in individual_fit/score_team instead of rebuilding `{candidate.id}` sets per call, but this regressed runtime.","timestamp":1775187365689,"segment":0,"confidence":64.19128835118256,"iterationTokens":1552,"asi":{"hypothesis":"Caching request-wide valid person IDs should reduce repeated set construction in hot formation/scoring paths.","rollback_reason":"Extra cache indirection outweighed tiny set-construction cost in this workload.","next_action_hint":"Keep direct local valid_person_ids construction where currently used."}}
{"run":95,"commit":"6f6ee89","metric":157.854758,"metrics":{"best_ms":153.002088,"quality_sum":2.491129377057,"quality_min":0.589775903809,"team_count":4},"status":"discard","description":"Tried replacing sorted-identity tuple score_cache keys with request-scoped identity-bitmask keys (`task_id + team_mask`) using cached `id(person)->bit` mapping to avoid per-call sorting, but this regressed badly.","timestamp":1775187508670,"segment":0,"confidence":64.73405071590949,"iterationTokens":1552,"asi":{"hypothesis":"Bitmask keys built from cached identity bits should provide cheaper order-insensitive score_cache key construction than sorting identities each call.","rollback_reason":"Dictionary lookups plus bit accumulation still cost more than sorted identity tuples on this workload.","next_action_hint":"Keep sorted identity tuple keys in cached_score_team."}}
{"run":96,"commit":"6f6ee89","metric":170.800284,"metrics":{"best_ms":169.407095,"quality_sum":2.491129377057,"quality_min":0.589775903809,"team_count":4},"status":"discard","description":"Rekeyed compat member-task value cache from `(id(member), task_skill_ids tuple)` to `(id(member), task_signature int)` via a global task-skill-signature table to reduce tuple-of-strings hashing on hot lookups, but this regressed drastically.","timestamp":1775187638017,"segment":0,"confidence":62.818080367657394,"iterationTokens":3635,"asi":{"hypothesis":"Integer task signatures should be cheaper cache-key components than task-skill-id tuples in _compat_member_task_values.","rollback_reason":"Global signature lookup/management overhead outweighed any key-hash savings; end-to-end performance collapsed.","next_action_hint":"Keep direct tuple-based task-skill keying in _compat_member_task_values."}}
{"run":97,"commit":"6f6ee89","metric":165.121549,"metrics":{"best_ms":163.735284,"quality_sum":2.491129377057,"quality_min":0.589775903809,"team_count":4},"status":"discard","description":"Replaced inline lambda `combination_scorer` callsites with named local `combination_quality(...)` functions in build_scored_candidates/greedy_allocations to reduce lambda call overhead, but this regressed substantially.","timestamp":1775187744549,"segment":0,"confidence":62.646664717534755,"iterationTokens":2621,"asi":{"hypothesis":"Named local scorer functions might execute marginally faster than inline lambdas across thousands of candidate scoring calls.","rollback_reason":"Function indirection/layout change performed significantly worse in practice.","next_action_hint":"Keep original lambda-based combination_scorer callsites."}}
{"run":98,"commit":"6f6ee89","metric":161.880812,"metrics":{"best_ms":161.378501,"quality_sum":2.491129377057,"quality_min":0.589775903809,"team_count":4},"status":"discard","description":"Reworked candidate_combinations shortlist dedup/order restoration to use per-person index booleans (`seen_positions`) and input-order rebuild instead of id-set + final sort-by-input-position, but this regressed strongly.","timestamp":1775187835364,"segment":0,"confidence":62.9635913960517,"iterationTokens":1606,"asi":{"hypothesis":"Boolean position tracking plus direct input-order reconstruction might be cheaper than set membership + shortlist sort.","rollback_reason":"Extra index mapping and full input scan were slower than the original approach.","next_action_hint":"Keep existing seen-id set and final shortlist sort path."}}
{"run":99,"commit":"6f6ee89","metric":159.215315,"metrics":{"best_ms":150.867716,"quality_sum":2.491129377057,"quality_min":0.589775903809,"team_count":4},"status":"checks_failed","description":"Tried replacing log/exp geometric_mean with a product-and-root implementation (including fast paths for n=2 and n=4) to reduce math.log overhead, but this changed objective ordering enough to break greedy-fallback improvement behavior tests.","timestamp":1775187939622,"segment":0,"confidence":63.262067563547376,"iterationTokens":2442,"asi":{"hypothesis":"Direct product roots should compute geometric means faster than log/exp in hot scoring paths.","rollback_reason":"Numerical behavior changed objective comparisons in swap improvement, causing regression test failure in capped greedy fallback improvement.","next_action_hint":"Keep current log/exp geometric_mean for behavioral stability; avoid numerically different formulations.","failure_surface":"tests/test_form_teams.py::test_form_teams_improves_greedy_fallback_for_capped_search"}}
{"run":100,"commit":"6f6ee89","metric":147.634152,"metrics":{"best_ms":144.66526,"quality_sum":2.491129377057,"quality_min":0.589775903809,"team_count":4},"status":"discard","description":"Extended request-level team component cache to include precomputed `valid_person_ids` and reused it in score_team compat task-preference filtering (removing per-score set construction), but this still regressed runtime.","timestamp":1775188044776,"segment":0,"confidence":62.9635913960517,"iterationTokens":3031,"asi":{"hypothesis":"Piggybacking valid_person_ids onto the already-used request cache should save per-call set allocations in score_team with minimal extra overhead.","rollback_reason":"Added cache tuple size/handling and data access did not pay off; median was slower than current best.","next_action_hint":"Keep existing score_team setup; avoid expanding request cache payload for tiny derived sets."}}
{"run":101,"commit":"6f6ee89","metric":151.837314,"metrics":{"best_ms":150.48876,"quality_sum":2.491129377057,"quality_min":0.589775903809,"team_count":4},"status":"discard","description":"Rewrote has_explicit_social_preferences from generator-based any(...) to an explicit for-loop with local bindings to reduce generator overhead in a measured hotspot, but this regressed runtime.","timestamp":1775188158530,"segment":0,"confidence":63.012765513130624,"iterationTokens":3456,"asi":{"hypothesis":"A manual loop with local variable bindings should outperform generator-based any() for repeated social-preference membership checks.","rollback_reason":"Despite hotspot targeting, explicit loop form was slower end-to-end.","next_action_hint":"Keep the original any(...) implementation for has_explicit_social_preferences."}}
{"run":102,"commit":"6f6ee89","metric":150.876585,"metrics":{"best_ms":146.845811,"quality_sum":2.491129377057,"quality_min":0.589775903809,"team_count":4},"status":"discard","description":"Extended has_explicit_social_preferences to accept a single teammate-id string and updated candidate_social_potential to pass ids directly (avoiding singleton-set allocations), but this still regressed runtime.","timestamp":1775188236095,"segment":0,"confidence":64.00068060807975,"iterationTokens":1223,"asi":{"hypothesis":"Avoiding `{id}` allocations in candidate_social_potential by supporting string teammate ids in has_explicit_social_preferences should reduce social-check overhead.","rollback_reason":"Type-branching and alternate generator path in has_explicit_social_preferences outweighed allocation savings.","next_action_hint":"Keep original set-based call pattern for has_explicit_social_preferences."}}
{"run":103,"commit":"6f6ee89","metric":141.693313,"metrics":{"best_ms":139.726589,"quality_sum":2.491129377057,"quality_min":0.589775903809,"team_count":4},"status":"discard","description":"Added pairwise score caches in shortlist_scorers for candidate_social_potential and candidate_personality_potential so symmetric two-person scores are computed once per unordered pair and reused across both member directions; this was close but still slower than the current best.","timestamp":1775188426596,"segment":0,"confidence":64.73405071590949,"iterationTokens":1223,"asi":{"hypothesis":"Caching symmetric pair scores should cut repeated team_social_score/team_personality_score calls during shortlist ranking.","rollback_reason":"Despite reducing repeated pair computations, added pair-key/cache bookkeeping left median above current best.","next_action_hint":"If revisiting, consider lighter key representation for pair caches or selective caching only for the personality path."}}
{"run":104,"commit":"6f6ee89","metric":142.213679,"metrics":{"best_ms":141.394077,"quality_sum":2.491129377057,"quality_min":0.589775903809,"team_count":4},"status":"discard","description":"Added an identity-keyed pair cache only for candidate_personality_potential (without social-path changes) to reuse symmetric two-person personality scores across both directions, but runtime remained slower than best.","timestamp":1775188512772,"segment":0,"confidence":65.01016717895853,"iterationTokens":1716,"asi":{"hypothesis":"Personality potential recomputes symmetric pair scores; caching by unordered person identity pair should reduce duplicate team_personality_score calls with lower overhead than full social+personality caching.","rollback_reason":"Pair-cache bookkeeping still outweighed saved personality pair recomputation.","next_action_hint":"Do not pursue pair-score caches in shortlist potentials further unless coupled with a broader ranking redesign."}}
{"run":105,"commit":"6f6ee89","metric":153.848653,"metrics":{"best_ms":150.279043,"quality_sum":2.491129377057,"quality_min":0.589775903809,"team_count":4},"status":"discard","description":"Tried reducing singleton-set churn in candidate_social_potential by prebuilding `{person.id}` and per-teammate singleton-id sets once per call and reusing them in has_explicit_social_preferences checks, but this regressed.","timestamp":1775188594870,"segment":0,"confidence":65.52896712907784,"iterationTokens":1166,"asi":{"hypothesis":"Eliminating repeated `{id}` allocations inside social potential loops should reduce has_explicit_social_preferences overhead.","rollback_reason":"Building and indexing singleton-set maps introduced more overhead than the original direct literals.","next_action_hint":"Keep the simpler direct singleton-set usage in candidate_social_potential."}}
{"run":106,"commit":"6f6ee89","metric":141.870579,"metrics":{"best_ms":140.479836,"quality_sum":2.491129377057,"quality_min":0.589775903809,"team_count":4},"status":"discard","description":"Changed scored top-k selection in candidate_combinations to prefill with `islice(..., max_candidate_teams)` + `heapify` (instead of N heappushes for the initial window), then process remainder with heapreplace; this was close but still slower than current best.","timestamp":1775188680735,"segment":0,"confidence":68.56740195382233,"iterationTokens":1443,"asi":{"hypothesis":"Heapifying an initial scored window should reduce top-k maintenance overhead in near-budget scored candidate selection.","rollback_reason":"The list materialization + heapify path did not beat incremental heappush/heappreplace in end-to-end runtime.","next_action_hint":"Keep existing heap update loop for scored candidate selection."}}
{"run":107,"commit":"6f6ee89","metric":154.131619,"metrics":{"best_ms":147.109481,"quality_sum":2.491129377057,"quality_min":0.589775903809,"team_count":4},"status":"discard","description":"Added equality-first fast paths around math.isclose in _compat_member_task_analysis (`value == best` / `value == second_best` checks before isclose, plus equality short-circuit in unique-best detection), but this regressed runtime.","timestamp":1775188762777,"segment":0,"confidence":71.3217155381503,"iterationTokens":1206,"asi":{"hypothesis":"Many compat values are exact repeats, so equality short-circuits should cut expensive isclose calls in the hottest analysis loop.","rollback_reason":"Extra branching and compound conditions outweighed reduced isclose calls; net slowdown.","next_action_hint":"Keep the simpler existing isclose-based comparisons."}}
{"run":108,"commit":"6f6ee89","metric":150.825958,"metrics":{"best_ms":142.809267,"quality_sum":2.491129377057,"quality_min":0.589775903809,"team_count":4},"status":"discard","description":"In greedy_allocations, bypassed shortlist_scorers/candidate_combinations for uncapped tasks (`C(remaining, team_size) <= max_candidate_teams`) and used direct itertools.combinations instead, to avoid scorer setup on later tasks, but this regressed.","timestamp":1775188941545,"segment":0,"confidence":73.09403937851366,"iterationTokens":6970,"asi":{"hypothesis":"Later greedy tasks often fall below the cap and don't need shortlist machinery, so directly enumerating combinations should save overhead.","rollback_reason":"Branching and path split overhead outweighed any saved shortlist setup in this workload.","next_action_hint":"Keep uniform candidate_combinations usage in greedy_allocations."}}
{"run":109,"commit":"6f6ee89","metric":147.322895,"metrics":{"best_ms":144.131201,"quality_sum":2.491129377057,"quality_min":0.589775903809,"team_count":4},"status":"discard","description":"Bound heap operations to locals (`heappush`, `heapreplace`) inside candidate_combinations scored top-k loop to reduce global attribute lookups, but this regressed runtime.","timestamp":1775189034008,"segment":0,"confidence":72.81468068419846,"iterationTokens":1905,"asi":{"hypothesis":"Local binding of heap functions in the hottest candidate ranking loop should shave Python lookup overhead.","rollback_reason":"Local-binding micro-optimization did not pay off and measured slower end-to-end.","next_action_hint":"Keep direct heapq calls in candidate_combinations."}}
{"run":110,"commit":"6f6ee89","metric":152.023787,"metrics":{"best_ms":148.940751,"quality_sum":2.491129377057,"quality_min":0.589775903809,"team_count":4},"status":"discard","description":"Replaced string/id tie-break components in _assign_task_skills_compat candidate priority tuples with precomputed integer tie ranks (`task_tie_ranks`) to reduce inner-loop tuple comparison cost, but this regressed runtime.","timestamp":1775189117903,"segment":0,"confidence":74.02047398668752,"iterationTokens":1480,"asi":{"hypothesis":"Integer tie-rank comparisons should be cheaper than repeated string/-index tuple components in compat candidate selection.","rollback_reason":"Added precomputation and changed comparison shape slowed end-to-end performance.","next_action_hint":"Keep original task_skill_id/-task_index tie-break tuple in compat candidate priority."}}
