{"run":317,"commit":"0f0bc65","metric":103.889395,"metrics":{"best_ms":102.787319,"quality_sum":2.491129377057,"quality_min":0.589775903809,"team_count":4},"status":"discard","description":"No-code confirmation rerun on kept commit 0f0bc65 after internal lightweight scoring split.","timestamp":1775327342400,"segment":0,"confidence":39.866182801937285,"iterationTokens":775,"asi":{"hypothesis":"Unchanged rerun should remain materially below prior ~112ms baseline if the lightweight scoring split is robust.","rollback_reason":"No code change; measurement-only confirmation run.","next_action_hint":"Use 0f0bc65 as active baseline; pursue next structural wins in `_assign_task_skills_compat` and candidate-loop overhead.","noise_observation":"repeat stayed in ~100-104ms band, confirming substantial improvement despite run-to-run variance."}}
{"run":318,"commit":"0f0bc65","metric":99.926393,"metrics":{"best_ms":99.469508,"quality_sum":2.491129377057,"quality_min":0.589775903809,"team_count":4},"status":"checks_failed","description":"Introduced quality-only scoring path in greedy candidate evaluation (`cached_score_team_quality` + `include_assignments=False`) to avoid full assignment materialization for non-winning candidates.","timestamp":1775327616299,"segment":0,"confidence":39.54508472266997,"iterationTokens":24640,"asi":{"hypothesis":"Computing quality without assignments for candidate ranking should reduce `_assign_task_skills_compat` overhead and speed greedy search.","rollback_reason":"Backpressure test failed: monkeypatched `score_team` call-count contract in `test_greedy_allocations_reuses_cached_team_scores` was broken (expected 6, observed 1).","next_action_hint":"Reapply with monkeypatch-safe fallback so quality-only path is enabled only when `score_team` is original implementation.","failure_details":"`tests/test_form_teams.py::test_greedy_allocations_reuses_cached_team_scores` failed due reduced `score_team` invocation count under monkeypatch."}}
{"run":319,"commit":"0f0bc65","metric":103.847776,"metrics":{"best_ms":103.336348,"quality_sum":2.491129377057,"quality_min":0.589775903809,"team_count":4},"status":"discard","description":"Reintroduced greedy quality-only ranking path with monkeypatch-safe fallback: added `include_assignments` plumbing in compat assignment/scoring, `score_team_quality`/`cached_score_team_quality`, and used quality cache for candidate ranking before scoring only the selected team.","timestamp":1775327780263,"segment":0,"confidence":39.22911781795582,"iterationTokens":11956,"asi":{"hypothesis":"Quality-only candidate ranking should reduce assignment-building overhead while preserving tests by falling back to full `score_team` under monkeypatch.","rollback_reason":"Primary metric was not better than current 0f0bc65 operating band after adding safety fallbacks; extra branching/duplication offset expected gains.","next_action_hint":"Keep 0f0bc65 baseline; if revisiting quality-only scoring, reduce duplicated score-path logic via shared helper to cut branch overhead.","result":"Checks passed and behavior metrics unchanged, but no convincing speedup."}}
{"run":320,"commit":"0f0bc65","metric":100.320539,"metrics":{"best_ms":99.378295,"quality_sum":2.491129377057,"quality_min":0.589775903809,"team_count":4},"status":"discard","description":"No-code baseline rerun after reverting quality-only ranking experiment to re-anchor commit 0f0bc65 performance.","timestamp":1775327826289,"segment":0,"confidence":38.77257076459263,"iterationTokens":882,"asi":{"hypothesis":"Reverted baseline should return to ~100ms band if prior discard rollback was clean.","rollback_reason":"No code change; measurement-only confirmation run.","next_action_hint":"Continue from 0f0bc65 and prioritize lower-risk structural reductions in compat assignment hot path.","noise_observation":"unchanged baseline returned to ~100ms, confirming prior experiment overhead caused the slowdown."}}
{"run":321,"commit":"27eed6d","metric":96.129686,"metrics":{"best_ms":96.024215,"quality_sum":2.491129377057,"quality_min":0.589775903809,"team_count":4},"status":"keep","description":"Reduced deterministic tie-break overhead in `greedy_allocations`: replaced tuple-key `max(...)` patterns that sorted member ids for every candidate with one-pass lazy tie handling (compute sorted ids only on exact quality ties) in upper-bound and non-random selection paths.","timestamp":1775327951838,"segment":0,"confidence":38.32652801864677,"iterationTokens":7256,"asi":{"hypothesis":"Most candidates have distinct qualities, so avoiding unconditional `tuple(sorted(member.id ...))` key construction should materially cut hot-loop sorting overhead while preserving exact tie semantics.","result":"Large speedup with checks passing and unchanged quality metrics.","notes":"Random-init tie behavior is preserved by leaving the random branch quality-only/stable-order selection unchanged."}}
{"run":322,"commit":"27eed6d","metric":97.409989,"metrics":{"best_ms":96.801968,"quality_sum":2.491129377057,"quality_min":0.589775903809,"team_count":4},"status":"discard","description":"No-code confirmation rerun on kept commit 27eed6d after lazy deterministic tie-break optimization.","timestamp":1775328000253,"segment":0,"confidence":37.90063595574348,"iterationTokens":766,"asi":{"hypothesis":"Unchanged rerun should remain in the new sub-100ms band if lazy tie-key construction is robust.","rollback_reason":"No code change; measurement-only confirmation run.","next_action_hint":"Use 27eed6d as the new baseline and continue structural hotspot work only.","noise_observation":"repeat stayed close to 96-97ms, confirming the new improvement band."}}
{"run":323,"commit":"27eed6d","metric":99.218973,"metrics":{"best_ms":98.447884,"quality_sum":2.491129377057,"quality_min":0.589775903809,"team_count":4},"status":"discard","description":"Typed compat task-value matrices as tuples and removed per-call `tuple(...)` conversion in `_compat_member_priority_order` rich-priority cache keys.","timestamp":1775328091368,"segment":0,"confidence":37.4841050655805,"iterationTokens":4185,"asi":{"hypothesis":"Avoiding repeated tuple materialization for rich-priority cache keys should trim hotspot overhead in compat member ordering.","rollback_reason":"Primary metric regressed versus the current 27eed6d baseline; change did not improve end-to-end time.","next_action_hint":"Leave current Sequence→tuple conversion behavior unchanged and focus on larger algorithmic reductions in `_assign_task_skills_compat`.","result":"Checks passed and quality unchanged, but runtime worsened."}}
{"run":324,"commit":"27eed6d","metric":99.15376,"metrics":{"best_ms":97.170426,"quality_sum":2.491129377057,"quality_min":0.589775903809,"team_count":4},"status":"discard","description":"No-code baseline rerun after reverting tuple-typing/key-conversion experiment.","timestamp":1775328138601,"segment":0,"confidence":37.261469321253664,"iterationTokens":676,"asi":{"hypothesis":"Reverted baseline should remain in the post-27eed6d improved band.","rollback_reason":"No code change; measurement-only run.","next_action_hint":"Track additional baselines to watch current host-noise envelope before judging marginal deltas.","noise_observation":"observed temporary drift toward ~99ms median while still well below pre-27eed6d levels."}}
{"run":325,"commit":"27eed6d","metric":96.979671,"metrics":{"best_ms":95.851786,"quality_sum":2.491129377057,"quality_min":0.589775903809,"team_count":4},"status":"discard","description":"Added request/task-scoped precomputed COMPAT member-task value maps and threaded them into scoring (`compat_member_task_values_by_member_id`) to bypass repeated `_compat_member_task_values` cache lookups in hot scoring calls.","timestamp":1775328354872,"segment":0,"confidence":37.1985927643036,"iterationTokens":11178,"asi":{"hypothesis":"Precomputing per-task member-task compat values once should remove repeated cache-key tuple creation and lookups inside `_assign_task_skills_compat`.","rollback_reason":"End-to-end metric did not clearly beat current best commit in the present noise envelope; observed result was neutral.","next_action_hint":"Revisit only with paired A/B repeats if host noise narrows; prioritize larger algorithmic reductions first.","result":"Checks passed and quality unchanged."}}
{"run":326,"commit":"27eed6d","metric":97.551764,"metrics":{"best_ms":97.36984,"quality_sum":2.491129377057,"quality_min":0.589775903809,"team_count":4},"status":"discard","description":"No-code baseline rerun after reverting precomputed compat member-task map experiment.","timestamp":1775328400189,"segment":0,"confidence":37.11986141741628,"iterationTokens":860,"asi":{"hypothesis":"Reverted baseline should stay within the post-27eed6d operating band.","rollback_reason":"No code change; measurement-only run.","next_action_hint":"Treat ~96-99ms as current noise envelope when evaluating marginal follow-up changes.","noise_observation":"current host band remains elevated relative to best sample but clearly below pre-27eed6d baseline."}}
{"run":327,"commit":"27eed6d","metric":98.267129,"metrics":{"best_ms":97.57049,"quality_sum":2.491129377057,"quality_min":0.589775903809,"team_count":4},"status":"discard","description":"Guarded `improve_allocations` replacement pass behind `if unused_people:` to skip the no-op replacement loop when there are no unassigned people.","timestamp":1775328507716,"segment":0,"confidence":36.962082920834014,"iterationTokens":5151,"asi":{"hypothesis":"Current workload has no unused people, so bypassing the replacement phase should remove avoidable loop overhead in `improve_allocations`.","rollback_reason":"Primary metric did not improve versus current baseline; change appears neutral-to-worse under current conditions.","next_action_hint":"Avoid further micro-guards in improve loop; focus on larger candidate-scoring or assignment-path reductions.","result":"Checks passed and quality unchanged, but no speedup observed."}}
{"run":328,"commit":"27eed6d","metric":98.126171,"metrics":{"best_ms":97.717899,"quality_sum":2.491129377057,"quality_min":0.589775903809,"team_count":4},"status":"discard","description":"No-code baseline rerun on current head 27eed6d to track post-discard noise envelope.","timestamp":1775328558536,"segment":0,"confidence":36.88536333447406,"iterationTokens":872,"asi":{"hypothesis":"Unchanged baseline should help track whether current host regime sits near ~97-99ms.","rollback_reason":"No code change; measurement-only run.","next_action_hint":"Use paired A/B when testing marginal ideas while baseline remains in this broader band.","noise_observation":"current unchanged runs cluster around high-97 to 99ms medians."}}
{"run":329,"commit":"27eed6d","metric":99.491577,"metrics":{"best_ms":99.035603,"quality_sum":2.491129377057,"quality_min":0.589775903809,"team_count":4},"status":"discard","description":"Added a specialized fast path in `_compat_member_task_analysis` for the dominant 4x4 matrix case (explicit member/task extraction and mask updates) with fallback to generic logic.","timestamp":1775328648667,"segment":0,"confidence":36.80896157129042,"iterationTokens":3885,"asi":{"hypothesis":"The benchmark’s fixed 4-person/4-skill teams should benefit from an unrolled 4x4 analysis path that reduces loop/enumerate overhead.","rollback_reason":"Primary metric regressed; added Python-level branching/unrolled logic did not outperform the simpler generic loops.","next_action_hint":"Do not pursue further Python-level unrolling in compat analysis; focus on reducing the number of scoring calls instead.","result":"Checks passed and quality unchanged, but runtime worsened."}}
{"run":330,"commit":"27eed6d","metric":96.846018,"metrics":{"best_ms":96.171742,"quality_sum":2.491129377057,"quality_min":0.589775903809,"team_count":4},"status":"discard","description":"Added a 4x4 specialized existence check in `_compat_has_perfect_positive_matching` (bitmask permutation search) with fallback to the generic augmenting-path matcher for other sizes.","timestamp":1775328891912,"segment":0,"confidence":36.627071864311276,"iterationTokens":3885,"asi":{"hypothesis":"The benchmark's dominant 4x4 compat matching checks should run faster with a tiny bitmask-permutation existence test than recursive matching.","rollback_reason":"Result was near current noise envelope and did not beat the strongest existing head convincingly.","next_action_hint":"Only reconsider with paired A/B repeats if host noise tightens; prioritize broader candidate-generation reductions first.","result":"Checks passed and quality metrics were unchanged."}}
{"run":331,"commit":"27eed6d","metric":97.55502,"metrics":{"best_ms":97.157087,"quality_sum":2.491129377057,"quality_min":0.589775903809,"team_count":4},"status":"discard","description":"No-code baseline rerun after discarding 4x4 matching fast-path attempt.","timestamp":1775328945154,"segment":0,"confidence":36.44697091668001,"iterationTokens":963,"asi":{"hypothesis":"Unchanged run should re-anchor the current 27eed6d operating band after revert.","rollback_reason":"No code change; measurement-only baseline.","next_action_hint":"Treat ~96-99ms as active noise envelope when judging marginal deltas.","noise_observation":"baseline currently around high-97ms median in this host regime."}}
{"run":332,"commit":"27eed6d","metric":97.650351,"metrics":{"best_ms":97.041288,"quality_sum":2.491129377057,"quality_min":0.589775903809,"team_count":4},"status":"discard","description":"Switched team-signature canonicalization to request-order signatures with monotonic fast path: added request-scoped `person_id -> order index` cache, `_team_signature_for_people(...)`, and reused it in `cached_score_team`, `score_team`, and COMPAT upper-bound cache keys.","timestamp":1775329222544,"segment":0,"confidence":36.22003456841022,"iterationTokens":16475,"asi":{"hypothesis":"Most hot-path candidate tuples are already in request order, so request-order canonicalization with monotonic shortcut should avoid many expensive sorts.","rollback_reason":"Did not produce a clear primary-metric win in the current envelope; extra index-map lookups/branching likely offset sort savings.","next_action_hint":"Do not pursue signature-canonicalization rewrites further unless paired A/B data shows clear gain.","result":"Checks passed and quality unchanged, but runtime was neutral-to-worse."}}
{"run":333,"commit":"27eed6d","metric":99.658532,"metrics":{"best_ms":97.409735,"quality_sum":2.491129377057,"quality_min":0.589775903809,"team_count":4},"status":"discard","description":"No-code baseline rerun after reverting request-order signature experiment.","timestamp":1775329271682,"segment":0,"confidence":35.995906762235236,"iterationTokens":741,"asi":{"hypothesis":"Unchanged run should re-anchor baseline after rollback.","rollback_reason":"No code change; measurement-only run.","next_action_hint":"Host noise is still wide; use paired repeats for marginal candidates.","noise_observation":"observed temporary high-median run near 100ms despite similar best_ms, indicating current variance remains non-trivial."}}
{"run":334,"commit":"27eed6d","metric":76.55977,"metrics":{"best_ms":76.100881,"quality_sum":2.491129377057,"quality_min":0.589775903809,"team_count":4},"status":"checks_failed","description":"Added COMPAT non-random scored-shortlist best-only branch for `task_total > max_candidate_teams` when `shortlist_total == max_candidate_teams + 1`: reconstruct shortlist, use admissible upper-bound pruning over all shortlist combinations, and choose best directly (with all-equal tie-safe fallback for first-k semantics).","timestamp":1775329608922,"segment":0,"confidence":35.97762531642654,"iterationTokens":23027,"asi":{"hypothesis":"First task scored-capped path can skip most expensive exact scoring by selecting the best candidate directly with admissible pruning instead of scoring nearly all shortlist combinations for top-k maintenance.","rollback_reason":"Backpressure checks failed due Ruff E501 line length in new helper (`formation.py:643`).","next_action_hint":"Reapply the branch with lint-compliant formatting and rerun checks; behavior checks did not report semantic failures before lint stopped.","failure_details":"Ruff E501 only; benchmark and quality metrics were unchanged."}}
{"run":335,"commit":"f65fc94","metric":75.824948,"metrics":{"best_ms":75.459917,"quality_sum":2.491129377057,"quality_min":0.589775903809,"team_count":4},"status":"keep","description":"Added a COMPAT/non-random scored-shortlist fast path in `greedy_allocations` for `task_total > max_candidate_teams` when shortlisted combinations are exactly `cap+1`: build the same shortlist, run admissible upper-bound pruning over shortlist combinations, and select best directly (with all-equal first-k fallback to preserve existing cap tie semantics).","timestamp":1775329739136,"segment":0,"confidence":36.475539397558016,"iterationTokens":5463,"asi":{"hypothesis":"For cap+1 scored-shortlist cases (dominant first task), selecting only the best candidate with admissible pruning can avoid most full `score_team` evaluations while preserving behavior.","result":"Large primary-metric improvement with checks passing and unchanged quality metrics.","safety_notes":"Fast path is gated to COMPAT, non-random, original `score_team` implementation, and `shortlist_total == cap+1`; otherwise existing candidate_combinations flow is used."}}
{"run":336,"commit":"f65fc94","metric":77.477437,"metrics":{"best_ms":76.046607,"quality_sum":2.491129377057,"quality_min":0.589775903809,"team_count":4},"status":"discard","description":"No-code confirmation rerun on kept commit f65fc94 scored-shortlist fast path.","timestamp":1775329788330,"segment":0,"confidence":35.783039472930376,"iterationTokens":863,"asi":{"hypothesis":"Unchanged rerun should remain in the new ~76-78ms band if the scored-shortlist best-only pruning win is robust.","rollback_reason":"No code change; measurement-only confirmation run.","next_action_hint":"Use f65fc94 as active baseline and avoid micro-tuning until a clear structural candidate appears.","noise_observation":"repeat stayed in the same strongly improved band, confirming the new fast path impact."}}
{"run":337,"commit":"fc920ef","metric":62.264662,"metrics":{"best_ms":61.889021,"quality_sum":2.491129377057,"quality_min":0.589775903809,"team_count":4},"status":"keep","description":"Improved the new scored-shortlist COMPAT fast path by precomputing upper bounds for all shortlist combinations, sorting by descending bound, and breaking once `upper_bound < best_quality`; this halves+ exact scoring in the cap+1 branch while retaining first-k tie fallback semantics.","timestamp":1775329996278,"segment":0,"confidence":35.99729406008772,"iterationTokens":10095,"asi":{"hypothesis":"In the cap+1 shortcut branch, evaluating candidates in descending admissible upper-bound order should reach a strong incumbent earlier and prune most remaining exact scores.","result":"Very large additional primary-metric improvement with checks passing and unchanged quality metrics.","safety_notes":"Branch remains gated to COMPAT/non-random/original score_team and `shortlist_total == cap+1`; all-equal path still returns first-k-consistent winner."}}
{"run":338,"commit":"fc920ef","metric":62.730234,"metrics":{"best_ms":62.241459,"quality_sum":2.491129377057,"quality_min":0.589775903809,"team_count":4},"status":"discard","description":"No-code confirmation rerun on kept commit fc920ef after bound-sorted cap+1 pruning branch update.","timestamp":1775330051123,"segment":0,"confidence":35.87188534136264,"iterationTokens":793,"asi":{"hypothesis":"Unchanged rerun should remain in the new ~62-63ms band if the bound-sorted cap+1 pruning branch is stable.","rollback_reason":"No code change; measurement-only confirmation run.","next_action_hint":"Use fc920ef as active baseline; only pursue high-leverage structural changes from here.","noise_observation":"repeat stayed tightly in the same dramatically improved band."}}
{"run":339,"commit":"db23c35","metric":48.757538,"metrics":{"best_ms":47.899534,"quality_sum":2.491129377057,"quality_min":0.589775903809,"team_count":4},"status":"keep","description":"Tightened COMPAT admissible skill upper bound in `_compat_candidate_quality_upper_bound` from `max_member_skill` to `geometric_mean(per-task best member skill values)` using cached `_compat_member_task_values`; threaded per-task member-task value vectors into both greedy <=cap pruning and the new scored-shortlist cap+1 fast path.","timestamp":1775330377780,"segment":0,"confidence":36.61875057659692,"iterationTokens":14232,"asi":{"hypothesis":"A much tighter but still admissible skill bound should drastically increase pruning efficiency in both COMPAT pruning branches, cutting expensive exact scoring calls.","result":"Large primary-metric improvement with checks passing and unchanged quality metrics.","safety_notes":"Upper bound remains admissible because each task contribution in actual compat skill score is bounded by the best candidate member value for that task."}}
{"run":340,"commit":"db23c35","metric":47.075944,"metrics":{"best_ms":46.391258,"quality_sum":2.491129377057,"quality_min":0.589775903809,"team_count":4},"status":"discard","description":"No-code confirmation rerun on kept commit db23c35 (tighter per-task geometric skill upper bound).","timestamp":1775330427916,"segment":0,"confidence":36.547144916782976,"iterationTokens":798,"asi":{"hypothesis":"Unchanged rerun should stay in the new sub-50ms band if tighter admissible skill bounds robustly prune exact scoring.","rollback_reason":"No code change; measurement-only confirmation run.","next_action_hint":"Use db23c35 as active baseline and prioritize only semantics-safe structural wins from this point.","noise_observation":"repeat improved further into ~47ms median, reinforcing robustness of the new pruning strategy."}}
