{"run":840,"commit":"0dfd343","metric":0.1753,"metrics":{"best_ms":0.156194,"quality_sum":2.491129377057,"quality_min":0.589775903809,"team_count":4},"status":"discard","description":"No-code baseline rerun after pruning regressed local `init_random` alias micro-variant in `form_teams`.","timestamp":1775551290986,"segment":0,"confidence":33.49972813116589,"iterationTokens":823,"asi":{"hypothesis":"Ideas-only rollback should preserve behavior while sampling post-variant host regime.","rollback_reason":"No source-code change; validation-only run.","next_action_hint":"De-prioritize entry-path local-alias micro-tuning; require stronger structural candidates.","noise_observation":"Sample remained in elevated warm band with stable quality metrics."}}
{"run":841,"commit":"0dfd343","metric":0.168849,"metrics":{"best_ms":0.154983,"quality_sum":2.491129377057,"quality_min":0.589775903809,"team_count":4},"status":"discard","description":"Tried request-scoped cached headcount guard: added `_request_total_requested_seats(request)` cache and replaced per-call seat-accumulation loop in `form_teams`.","timestamp":1775551501835,"segment":0,"confidence":33.5603447726582,"iterationTokens":2402,"asi":{"hypothesis":"Caching total requested seats per request might remove repeated headcount-loop overhead on warm calls.","rollback_reason":"Regressed in current regime; extra cache lookup/state outweighed tiny loop cost.","next_action_hint":"Keep direct local seat-accumulation headcount guard (`requested_seats += task.team_size`).","observation":"Checks passed and behavior metrics unchanged."}}
{"run":842,"commit":"0dfd343","metric":0.191181,"metrics":{"best_ms":0.161154,"quality_sum":2.491129377057,"quality_min":0.589775903809,"team_count":4},"status":"discard","description":"No-code baseline rerun after pruning regressed request-scoped cached headcount guard attempt.","timestamp":1775551568061,"segment":0,"confidence":33.60595622001169,"iterationTokens":863,"asi":{"hypothesis":"Ideas-only update should preserve behavior while re-sampling current host band after rollback.","rollback_reason":"No source-code change; validation-only run.","next_action_hint":"Avoid further headcount-guard caching micro-variants and continue paired validation under high jitter.","noise_observation":"Median remained in elevated warm band; quality metrics unchanged."}}
{"run":843,"commit":"0dfd343","metric":0.200891,"metrics":{"best_ms":0.156808,"quality_sum":2.491129377057,"quality_min":0.589775903809,"team_count":4},"status":"discard","description":"No-code baseline sample to monitor continuing host-latency drift after recent regressive micro-variant pruning.","timestamp":1775551646589,"segment":0,"confidence":33.65169181599615,"iterationTokens":1864,"asi":{"hypothesis":"Repeated baseline sampling is required while host remains volatile and candidate deltas are near noise floor.","rollback_reason":"No source-code change; validation-only run.","next_action_hint":"Continue paired bundles; avoid keep/discard decisions from single-sample micro deltas in current slow band.","noise_observation":"Median increased further while quality remained constant, consistent with transient platform slowdown."}}
{"run":844,"commit":"0dfd343","metric":0.177086,"metrics":{"best_ms":0.164252,"quality_sum":2.491129377057,"quality_min":0.589775903809,"team_count":4},"status":"discard","description":"Additional no-code baseline sample to verify whether elevated warm-band drift is easing.","timestamp":1775551703429,"segment":0,"confidence":34.176372512090985,"iterationTokens":602,"asi":{"hypothesis":"If slowdown is transient, back-to-back baseline samples should begin returning toward prior low band.","rollback_reason":"No source-code change; validation-only run.","next_action_hint":"Wait for clearer stabilization before trusting any marginal candidate keeps.","noise_observation":"Median improved from prior spike but remains above low-band floor; quality unchanged."}}
{"run":845,"commit":"0dfd343","metric":0,"metrics":{"best_ms":0,"quality_sum":0,"quality_min":0,"team_count":0},"status":"crash","description":"Tried deterministic-path cached-assignment-items fast branch using first-allocation sentinel; runtime failed due missing `cast` import.","timestamp":1775551866123,"segment":0,"confidence":34.176372512090985,"iterationTokens":1245,"asi":{"hypothesis":"A cheaper single-sentinel check (`allocations[0].assignment_items is not None`) may enable a no-fallback deterministic output loop with lower overhead than full per-allocation fallback.","rollback_reason":"Crash: `NameError: name 'cast' is not defined` in deterministic output branch.","next_action_hint":"If retried, add required `cast` import first and immediately verify checks; otherwise keep current fallback loop.","error_details":"Benchmark failed before metrics due NameError in form_teams output assembly."}}
{"run":846,"commit":"0dfd343","metric":0.206782,"metrics":{"best_ms":0.165484,"quality_sum":2.491129377057,"quality_min":0.589775903809,"team_count":4},"status":"discard","description":"Recovery no-code baseline run after crash/revert from first-allocation-sentinel deterministic output fast-path attempt.","timestamp":1775551939271,"segment":0,"confidence":34.71767347204592,"iterationTokens":884,"asi":{"hypothesis":"Post-crash revert should restore benchmark behavior; run used to confirm recovery and sample current host band.","rollback_reason":"No source-code change; validation-only run.","next_action_hint":"Continue only with low-risk candidates while host remains in elevated jitter band.","noise_observation":"Recovered functional baseline with unchanged quality; median currently in slow transient band."}}
{"run":847,"commit":"0dfd343","metric":0.175894,"metrics":{"best_ms":0.153321,"quality_sum":2.491129377057,"quality_min":0.589775903809,"team_count":4},"status":"discard","description":"No-code baseline sample while elevated host-latency regime persists; monitoring drift before trying further micro-candidates.","timestamp":1775552023350,"segment":0,"confidence":34.77841555721825,"iterationTokens":2252,"asi":{"hypothesis":"Additional baseline samples are needed to separate host drift from candidate effects under current volatility.","rollback_reason":"No source-code change; validation-only run.","next_action_hint":"Continue paired bundles and avoid single-sample micro keeps until baseline stabilizes.","noise_observation":"Median remains above low-band floor with stable quality metrics."}}
{"run":848,"commit":"0dfd343","metric":0.177306,"metrics":{"best_ms":0.151928,"quality_sum":2.491129377057,"quality_min":0.589775903809,"team_count":4},"status":"discard","description":"No-code baseline monitoring run to track persistent elevated warm-band latency before next candidate batch.","timestamp":1775552168571,"segment":0,"confidence":34.83937056377535,"iterationTokens":7016,"asi":{"hypothesis":"Additional baseline-only samples reduce risk of overfitting keep/discard decisions to transient host noise.","rollback_reason":"No source-code change; validation-only run.","next_action_hint":"Continue paired/no-code bundles and defer marginal micro-candidates until band stabilizes.","noise_observation":"Median remains elevated relative to low-band floor while quality metrics are stable."}}
{"run":849,"commit":"0dfd343","metric":0.196062,"metrics":{"best_ms":0.162718,"quality_sum":2.491129377057,"quality_min":0.589775903809,"team_count":4},"status":"discard","description":"Retried precomputed improve-cache tuple fragment strategy: added `ScoredAllocation.improve_key_signature` field (pre-filled in `score_team`/post-init) and reused it directly in `improve_allocations` key assembly.","timestamp":1775552348115,"segment":0,"confidence":34.878806361469614,"iterationTokens":7016,"asi":{"hypothesis":"Reusing precomputed `(task_id, team_signature)` tuples should reduce per-call improve-cache key tuple construction overhead on warm path.","rollback_reason":"Regressed strongly in current regime; added dataclass payload/initialization complexity did not translate into key-build speedup.","next_action_hint":"Keep direct inline improve-key tuple construction and avoid additional precomputed key-fragment fields.","observation":"Checks passed and quality metrics unchanged."}}
{"run":850,"commit":"0dfd343","metric":0.183908,"metrics":{"best_ms":0.151477,"quality_sum":2.491129377057,"quality_min":0.589775903809,"team_count":4},"status":"discard","description":"No-code baseline rerun after pruning repeated precomputed improve-key-signature retry as strongly regressive.","timestamp":1775552431647,"segment":0,"confidence":34.918331537615316,"iterationTokens":1075,"asi":{"hypothesis":"Ideas-only update should preserve behavior while monitoring current warm-band drift.","rollback_reason":"No source-code change; validation-only run.","next_action_hint":"Avoid further improve-key fragment precompute variants; prioritize materially different structural paths.","noise_observation":"Median remains elevated versus low-band floor; quality metrics unchanged."}}
{"run":851,"commit":"0dfd343","metric":0.161436,"metrics":{"best_ms":0.150725,"quality_sum":2.491129377057,"quality_min":0.589775903809,"team_count":4},"status":"discard","description":"Retried deterministic-path first-allocation-sentinel assignment-items fast branch with proper `cast` import and fallback branch for non-cached/manual allocations.","timestamp":1775552545018,"segment":0,"confidence":35.07159082831631,"iterationTokens":2594,"asi":{"hypothesis":"A cheap one-time sentinel (`allocations[0].assignment_items is not None`) might enable a faster no-fallback deterministic output loop than per-allocation None checks.","rollback_reason":"Regressed in current regime; extra branch structure and cast path did not improve warm output assembly.","next_action_hint":"Keep simple per-allocation fallback loop on deterministic output path.","observation":"Checks passed; this confirms prior crash-prone variant is also performance-negative when fixed."}}
{"run":852,"commit":"0dfd343","metric":0.174241,"metrics":{"best_ms":0.148171,"quality_sum":2.491129377057,"quality_min":0.589775903809,"team_count":4},"status":"discard","description":"No-code baseline rerun after pruning deterministic first-allocation-sentinel output fast-path variant as regressive.","timestamp":1775552638270,"segment":0,"confidence":35.22620138387414,"iterationTokens":967,"asi":{"hypothesis":"Ideas-only rollback should preserve behavior and track current warm-band drift.","rollback_reason":"No source-code change; validation-only run.","next_action_hint":"Avoid further deterministic assignment-items global-guard variants; keep per-allocation fallback path.","noise_observation":"Median remains elevated above low-band floor; quality metrics unchanged."}}
{"run":853,"commit":"0dfd343","metric":0.160483,"metrics":{"best_ms":0.156887,"quality_sum":2.491129377057,"quality_min":0.589775903809,"team_count":4},"status":"discard","description":"No-code baseline sample for regime tracking after recent regressive fast-path retries.","timestamp":1775552738383,"segment":0,"confidence":35.34231094417121,"iterationTokens":2296,"asi":{"hypothesis":"Additional baseline points are needed to decide when host variance has stabilized enough for trustworthy marginal candidate evaluations.","rollback_reason":"No source-code change; validation-only run.","next_action_hint":"Continue paired baseline sampling until warm band narrows; then resume higher-signal structural experiments.","noise_observation":"Median improved from prior spike but remains above low-band floor."}}
{"run":854,"commit":"0dfd343","metric":0.156436,"metrics":{"best_ms":0.14269,"quality_sum":2.491129377057,"quality_min":0.589775903809,"team_count":4},"status":"discard","description":"No-code baseline follow-up sample to confirm whether warm regime is drifting back toward mid band.","timestamp":1775552812069,"segment":0,"confidence":35.45918845631872,"iterationTokens":1696,"asi":{"hypothesis":"Repeated baseline monitoring can identify stabilization windows for meaningful candidate evaluation.","rollback_reason":"No source-code change; validation-only run.","next_action_hint":"If band continues narrowing, resume only higher-signal structural candidate attempts.","noise_observation":"Median improved versus recent elevated samples but remains above low-band floor."}}
{"run":855,"commit":"0dfd343","metric":0.186693,"metrics":{"best_ms":0.157608,"quality_sum":2.491129377057,"quality_min":0.589775903809,"team_count":4},"status":"discard","description":"Additional no-code baseline sample after partial recovery signal; used to quantify ongoing volatility.","timestamp":1775552873317,"segment":0,"confidence":35.831236551765556,"iterationTokens":581,"asi":{"hypothesis":"Another baseline point helps avoid overfitting decisions to temporary improvements in a noisy regime.","rollback_reason":"No source-code change; validation-only run.","next_action_hint":"Maintain strict paired validation and avoid attributing wins to micro changes until variance narrows.","noise_observation":"Median rebounded upward, confirming instability persists."}}
{"run":856,"commit":"0dfd343","metric":0.170433,"metrics":{"best_ms":0.156356,"quality_sum":2.491129377057,"quality_min":0.589775903809,"team_count":4},"status":"discard","description":"No-code baseline rerun after updating ideas note for widened current warm-band volatility (~0.12–0.21ms).","timestamp":1775552954642,"segment":0,"confidence":36.21098320681772,"iterationTokens":835,"asi":{"hypothesis":"Ideas-note maintenance should not affect runtime; run validates ongoing baseline while tracking widened noise band.","rollback_reason":"No source-code change; validation-only run.","next_action_hint":"Continue deferring marginal micro keeps until host variance contracts or bundled A/B evidence is strong.","noise_observation":"Median remains in elevated portion of recent warm band with stable quality monitors."}}
{"run":857,"commit":"0dfd343","metric":0.168079,"metrics":{"best_ms":0.160845,"quality_sum":2.491129377057,"quality_min":0.589775903809,"team_count":4},"status":"discard","description":"Replaced non-optional `team_signature` post-init normalization with lazy accessor method (`ScoredAllocation.improve_cache_signature()`) and used it for improve-cache key tuple construction (removes per-object post-init normalization).","timestamp":1775553119021,"segment":0,"confidence":36.37816374953524,"iterationTokens":835,"asi":{"hypothesis":"Shifting team-signature normalization from every `ScoredAllocation` construction to lazy improve-key access (few allocations) might reduce overall warm-path overhead.","rollback_reason":"Regressed in current regime; lazy method + optional field did not beat current non-optional post-init approach.","next_action_hint":"Keep 0dfd343 non-optional `team_signature` + cast-free direct field keying.","observation":"Checks passed and quality metrics unchanged."}}
{"run":858,"commit":"0dfd343","metric":0.164772,"metrics":{"best_ms":0.145836,"quality_sum":2.491129377057,"quality_min":0.589775903809,"team_count":4},"status":"discard","description":"No-code baseline rerun after pruning lazy team-signature accessor retry as regressive.","timestamp":1775553196100,"segment":0,"confidence":36.546895146036064,"iterationTokens":911,"asi":{"hypothesis":"Ideas update should preserve behavior while confirming post-rollback baseline in current warm regime.","rollback_reason":"No source-code change; validation-only run.","next_action_hint":"Retain 0dfd343 representation and avoid further team-signature representation rewrites without stronger signal.","noise_observation":"Median remains above low-band floor with stable quality monitors."}}
{"run":859,"commit":"0dfd343","metric":0.209307,"metrics":{"best_ms":0.1585,"quality_sum":2.491129377057,"quality_min":0.589775903809,"team_count":4},"status":"discard","description":"Added selective greedy-cache no-copy path: `greedy_allocations(copy_cached_results=False)` only when `swap_rounds>0` (default benchmark path), keeping copy-on-hit for `swap_rounds==0`.","timestamp":1775555499019,"segment":0,"confidence":36.56309719369137,"iterationTokens":911,"asi":{"hypothesis":"When swap improvement runs, copying cached greedy allocations may be unnecessary; skipping that copy could reduce warm-path overhead.","rollback_reason":"Regressed in this sample; extra branch/plumbing overhead outweighed any saved copy.","next_action_hint":"Keep simple unconditional greedy cache hit copying and avoid more copy-flag variants.","observation":"Checks passed and quality metrics unchanged."}}
{"run":860,"commit":"0dfd343","metric":0.183347,"metrics":{"best_ms":0.155824,"quality_sum":2.491129377057,"quality_min":0.589775903809,"team_count":4},"status":"discard","description":"No-code baseline rerun after pruning selective copy-flag retry as regressive.","timestamp":1775555597091,"segment":0,"confidence":36.5793136131708,"iterationTokens":871,"asi":{"hypothesis":"Ideas-only update should preserve behavior while continuing to monitor current elevated warm band.","rollback_reason":"No source-code change; validation-only run.","next_action_hint":"Maintain conservative paired validation and avoid additional cache-copy flag experiments.","noise_observation":"Median remains elevated above low-band floor with stable quality metrics."}}
{"run":861,"commit":"0dfd343","metric":0.19067,"metrics":{"best_ms":0.164862,"quality_sum":2.491129377057,"quality_min":0.589775903809,"team_count":4},"status":"discard","description":"No-code baseline monitoring run while warm-latency regime remains elevated/noisy.","timestamp":1775555658204,"segment":0,"confidence":36.66555239981474,"iterationTokens":811,"asi":{"hypothesis":"Additional baseline points are required to avoid overfitting to transient sample swings before evaluating marginal candidates.","rollback_reason":"No source-code change; validation-only run.","next_action_hint":"Continue baseline bundling until warm band narrows materially, then resume candidate attempts.","noise_observation":"Median rebounded upward; regime remains unstable."}}
{"run":862,"commit":"0dfd343","metric":0.209647,"metrics":{"best_ms":0.188867,"quality_sum":2.491129377057,"quality_min":0.589775903809,"team_count":4},"status":"discard","description":"Additional no-code baseline sample to quantify upper edge of current warm-band slowdown.","timestamp":1775555721104,"segment":0,"confidence":36.75219877767194,"iterationTokens":587,"asi":{"hypothesis":"Bundled baseline monitoring helps distinguish host-level slowdowns from candidate effects under high jitter.","rollback_reason":"No source-code change; validation-only run.","next_action_hint":"Pause marginal micro-candidate exploration until host returns closer to low-band baseline.","noise_observation":"Both median and best rose sharply, indicating broad temporary slowdown rather than isolated outlier."}}
{"run":863,"commit":"0dfd343","metric":0.172242,"metrics":{"best_ms":0.168355,"quality_sum":2.491129377057,"quality_min":0.589775903809,"team_count":4},"status":"discard","description":"No-code baseline sample to continue tracking elevated warm-band volatility after repeated micro-regressions.","timestamp":1775555905587,"segment":0,"confidence":37.23439301614679,"iterationTokens":587,"asi":{"hypothesis":"Additional baseline samples are required before trusting any marginal micro-optimization signals in the current noisy regime.","rollback_reason":"No source-code change; validation-only run.","next_action_hint":"Favor only clearly higher-leverage candidate classes; otherwise continue no-code monitoring until latency band tightens.","noise_observation":"Best and median are both elevated, suggesting broad host slowdown rather than isolated outlier."}}
{"run":864,"commit":"0dfd343","metric":0.210775,"metrics":{"best_ms":0.179877,"quality_sum":2.491129377057,"quality_min":0.589775903809,"team_count":4},"status":"discard","description":"No-code baseline rerun after refreshing fresh-request diagnostics note (current fresh band ~49–63ms samples; median ~55.6ms).","timestamp":1775556022190,"segment":0,"confidence":37.72991889035685,"iterationTokens":2387,"asi":{"hypothesis":"Ideas-only update should preserve warm benchmark behavior while recording fresh-request regime drift for anti-overfit context.","rollback_reason":"No source-code change; validation-only run.","next_action_hint":"Given both warm and fresh regimes are currently elevated/volatile, avoid interpreting marginal micro deltas as real without stronger paired bundles.","fresh_diagnostic":"External fresh-request run: samples 62.8, 59.5, 56.2, 55.6, 53.9, 51.7, 49.1 ms; median 55.6 ms."}}
{"run":865,"commit":"0dfd343","metric":0.16925,"metrics":{"best_ms":0.162297,"quality_sum":2.491129377057,"quality_min":0.589775903809,"team_count":4},"status":"discard","description":"No-code baseline follow-up to re-sample warm regime after refreshed fresh-request slowdown diagnostics.","timestamp":1775556081509,"segment":0,"confidence":37.97999756745077,"iterationTokens":717,"asi":{"hypothesis":"Back-to-back baseline monitoring helps quantify whether warm-path slowdown is stabilizing before new code trials.","rollback_reason":"No source-code change; validation-only run.","next_action_hint":"Continue baseline bundling until warm metrics tighten; then resume only high-signal candidates.","noise_observation":"Median improved from prior spike but remains above historic low band."}}
