{"run":537,"commit":"5fcc95d","metric":1.563672,"metrics":{"best_ms":1.489572,"quality_sum":2.491129377057,"quality_min":0.589775903809,"team_count":4},"status":"discard","description":"No-code baseline check on active 5fcc95d after a sequence of regressing trials to re-anchor current host regime.","timestamp":1775463506095,"segment":0,"confidence":14.063108725497353,"iterationTokens":809,"asi":{"hypothesis":"Baseline should remain near prior band; this run re-establishes current noise/regime before further comparisons.","rollback_reason":"No code change; monitoring-only rerun.","next_action_hint":"Use immediate paired A/B runs in the current slower regime before concluding on marginal edits.","noise_observation":"Observed regime shift upward vs earlier ~1.06ms samples, indicating significant host variance."}}
{"run":538,"commit":"5fcc95d","metric":1.519979,"metrics":{"best_ms":1.502506,"quality_sum":2.491129377057,"quality_min":0.589775903809,"team_count":4},"status":"discard","description":"Second no-code baseline rerun on active 5fcc95d to sample current slow-host regime.","timestamp":1775463549630,"segment":0,"confidence":14.001262367829439,"iterationTokens":1197,"asi":{"hypothesis":"A second baseline sample helps quantify current variance before evaluating further micro-optimizations.","rollback_reason":"No code change; variance probe.","next_action_hint":"Require tightly paired candidate-vs-baseline comparisons while host remains in this slower band.","noise_observation":"Run remained in ~1.5ms band, confirming temporary regime drift from earlier ~1.06ms measurements."}}
{"run":539,"commit":"5fcc95d","metric":1.533405,"metrics":{"best_ms":1.495744,"quality_sum":2.491129377057,"quality_min":0.589775903809,"team_count":4},"status":"discard","description":"Hoisted swap-team-size checks out of inner member-pair loop in `improve_allocations` (`left_size_is_four` / `right_size_is_four`) so per-swap signature fast-path branches no longer recompute `len(...)==4` each iteration.","timestamp":1775463661003,"segment":0,"confidence":13.93995760083339,"iterationTokens":3716,"asi":{"hypothesis":"Removing repeated `len(...)==4` checks in the hottest swap loop should slightly reduce branch/lookup overhead while preserving signature semantics.","rollback_reason":"No clear primary-metric improvement in current paired regime.","next_action_hint":"Treat this hoist as neutral/noise; prioritize larger structural changes over branch-hoist micro-tweaks.","observation":"Delta remained within current slow-band jitter (~1.52–1.56ms)."}}
{"run":540,"commit":"c589e94","metric":1.392257,"metrics":{"best_ms":1.38317,"quality_sum":2.491129377057,"quality_min":0.589775903809,"team_count":4},"status":"keep","description":"Reordered cached COMPAT cheap-bounded candidate lists by exact upper bound (`entry[1]`) first (then cheap/index), and simplified pruning loops to a single monotonic break on `exact_upper_bound < best_quality` for cap+1 shortlist path and greedy <=cap path. This removes redundant cheap-bound checks and lets best-first traversal follow the tighter admissible bound.","timestamp":1775463877595,"segment":0,"confidence":13.862543721133553,"iterationTokens":3716,"asi":{"hypothesis":"With exact upper bounds now cached, sorting by the tighter bound and pruning on that monotonic order should reduce scored candidates and comparator overhead without changing correctness.","result":"Primary metric improved with checks passing and unchanged quality monitors.","safety_notes":"`exact_upper_bound` is an admissible upper bound; descending exact order makes break condition sound (all later candidates have <= bound). Tie semantics preserved via unchanged quality/id tie-break logic and index retention."}}
{"run":541,"commit":"c589e94","metric":1.366208,"metrics":{"best_ms":1.353855,"quality_sum":2.491129377057,"quality_min":0.589775903809,"team_count":4},"status":"discard","description":"No-code confirmation rerun on kept exact-upper-bound sort/pruning-order commit c589e94.","timestamp":1775463919339,"segment":0,"confidence":13.785984910271482,"iterationTokens":849,"asi":{"hypothesis":"If c589e94 is robust, immediate rerun should stay in the improved ~1.36–1.40ms band with unchanged quality metrics.","rollback_reason":"No code change; validation-only rerun.","next_action_hint":"Use c589e94 as active baseline and continue only structural pruning/candidate-volume reductions.","noise_observation":"Confirmation run improved further, indicating the new ordering/pruning change is stable in current regime."}}
{"run":542,"commit":"2dfb8d2","metric":1.357691,"metrics":{"best_ms":1.324219,"quality_sum":2.491129377057,"quality_min":0.589775903809,"team_count":4},"status":"keep","description":"Added `_sorted_team_signature(...)` with a len-4 compare-network fast path and switched `cached_score_team` cache-key canonicalization to use it, replacing generic `tuple(sorted(person.id for person in people))` on the hot scoring path.","timestamp":1775464078414,"segment":0,"confidence":13.692892948349549,"iterationTokens":7542,"asi":{"hypothesis":"`cached_score_team` canonical sorting dominates nearly all `sorted(...)` calls; specializing the common 4-member case should reduce cache-key overhead without changing canonical ordering semantics.","result":"Primary metric improved with checks passing and unchanged quality monitors.","safety_notes":"Fast path implements exact ascending lexicographic sort for four IDs; fallback keeps generic sorted behavior for other team sizes."}}
{"run":543,"commit":"2dfb8d2","metric":1.339517,"metrics":{"best_ms":1.319088,"quality_sum":2.491129377057,"quality_min":0.589775903809,"team_count":4},"status":"discard","description":"No-code confirmation rerun on kept len-4 sorted-team-signature fast-path commit 2dfb8d2.","timestamp":1775464122244,"segment":0,"confidence":13.601049788989094,"iterationTokens":751,"asi":{"hypothesis":"If 2dfb8d2 gain is robust, rerun should remain in the improved ~1.34–1.36ms band.","rollback_reason":"No code change; validation-only rerun.","next_action_hint":"Use 2dfb8d2 as active baseline; continue structural reductions around improve_allocations/cache lookup churn.","noise_observation":"Rerun improved further with unchanged quality, supporting real signal."}}
{"run":544,"commit":"2dfb8d2","metric":1.750485,"metrics":{"best_ms":1.652199,"quality_sum":2.491129377057,"quality_min":0.589775903809,"team_count":4},"status":"discard","description":"Replaced swap upper-bound triple-min call (`min(other_min, left_upper_bound, right_upper_bound)`) with manual branch-based minimum updates to avoid built-in `min` overhead in hot loop.","timestamp":1775464264052,"segment":0,"confidence":13.543996855157555,"iterationTokens":7471,"asi":{"hypothesis":"Manual branch min for three values should beat built-in `min(...)` in the swap bound loop and lower comparison overhead.","rollback_reason":"Large end-to-end regression versus active baseline.","next_action_hint":"Do not replace this hot triple-min call with manual branches; keep built-in `min` form.","observation":"Interpreter-level branch overhead/local writes outweighed any built-in call savings here."}}
{"run":545,"commit":"2dfb8d2","metric":1.570034,"metrics":{"best_ms":1.524318,"quality_sum":2.491129377057,"quality_min":0.589775903809,"team_count":4},"status":"discard","description":"Tried signature-construction refactor in swap loop: precomputed prefix/suffix ID tuples in swap templates and built swapped signatures via tuple concatenation (`prefix_ids + (member.id,) + suffix_ids`) instead of per-swap branchy signature extraction from swapped team tuples.","timestamp":1775464395827,"segment":0,"confidence":13.487420566922385,"iterationTokens":3884,"asi":{"hypothesis":"Reusing precomputed ID slices should reduce repeated member-id extraction/signature assembly overhead in swap inner loops.","rollback_reason":"End-to-end median regressed noticeably versus active baseline.","next_action_hint":"Avoid adding ID-slice metadata to swap templates; keep simpler tuple template + direct signature extraction path.","observation":"Extra template payload/materialization overhead outweighed inner-loop signature savings."}}
{"run":546,"commit":"249d86c","metric":1.341751,"metrics":{"best_ms":1.314279,"quality_sum":2.491129377057,"quality_min":0.589775903809,"team_count":4},"status":"keep","description":"Inlined len-4 canonical team-signature sort network directly into `cached_score_team` and removed the helper-call layer (`_sorted_team_signature`), keeping the same compare-swap ordering with sorted fallback for non-4-member teams.","timestamp":1775464469554,"segment":0,"confidence":13.436124617191046,"iterationTokens":1799,"asi":{"hypothesis":"After adding the len-4 canonicalization fast path, the remaining helper call overhead became noticeable in hot cache-key construction; inlining should shave additional overhead.","result":"Primary metric improved with checks passing and unchanged quality monitors.","safety_notes":"Canonical ordering logic is unchanged from the previous kept compare-network implementation; only call structure changed."}}
{"run":547,"commit":"249d86c","metric":1.365306,"metrics":{"best_ms":1.337373,"quality_sum":2.491129377057,"quality_min":0.589775903809,"team_count":4},"status":"discard","description":"No-code confirmation rerun on kept inlined len-4 cached-score signature canonicalization commit 249d86c.","timestamp":1775464518430,"segment":0,"confidence":13.385217371138612,"iterationTokens":745,"asi":{"hypothesis":"If 249d86c gain is stable, rerun should remain in the improved low-1.3ms band with unchanged quality.","rollback_reason":"No code change; validation-only rerun.","next_action_hint":"Use 249d86c as active baseline and continue only higher-signal structural work.","noise_observation":"Rerun remained near the kept level, consistent with current host variance."}}
{"run":548,"commit":"230a65b","metric":1.306975,"metrics":{"best_ms":1.262441,"quality_sum":2.491129377057,"quality_min":0.589775903809,"team_count":4},"status":"keep","description":"Deferred swap upper-bound secondary objective math in `improve_allocations`: compute `upper_trial_min` only when product bound is tolerance-close to current product, and compute `upper_trial_sum` only when both product and min are close. This avoids unconditional min/sum work on the dominant product-decisive path.","timestamp":1775464610640,"segment":0,"confidence":13.370533810987512,"iterationTokens":2977,"asi":{"hypothesis":"Most swap upper-bound decisions are resolved at the product component; lazily computing min/sum only on close-product cases should remove hot dead work while preserving lexicographic objective semantics.","result":"Primary metric improved with checks passing and unchanged quality monitors.","safety_notes":"Decision order remains identical (product → min → sum with same tolerance helpers); only evaluation is short-circuited when earlier components already decide."}}
{"run":549,"commit":"230a65b","metric":1.318928,"metrics":{"best_ms":1.277049,"quality_sum":2.491129377057,"quality_min":0.589775903809,"team_count":4},"status":"discard","description":"No-code confirmation rerun on kept lazy swap upper-bound min/sum computation commit 230a65b.","timestamp":1775464649933,"segment":0,"confidence":13.355882431214429,"iterationTokens":780,"asi":{"hypothesis":"If 230a65b gain is robust, rerun should stay in ~1.31–1.33ms band with unchanged quality metrics.","rollback_reason":"No code change; validation-only rerun.","next_action_hint":"Use 230a65b as active baseline; continue removing dead secondary-objective work in hot loops where lexicographic early exits dominate.","noise_observation":"Rerun stayed tightly in the improved band, confirming stability."}}
{"run":550,"commit":"230a65b","metric":1.27793,"metrics":{"best_ms":1.231382,"quality_sum":2.491129377057,"quality_min":0.589775903809,"team_count":4},"status":"checks_failed","description":"Refactored replacement and swap acceptance comparisons in `improve_allocations` to lazy lexicographic branching on objective components: evaluate product first, compute min only on product ties, and compute sum only on product+min ties (equivalent to tuple `>` semantics).","timestamp":1775464733091,"segment":0,"confidence":13.210451219071786,"iterationTokens":2466,"asi":{"hypothesis":"Most acceptance decisions are resolved by product; deferring min/sum evaluation in replacement/swap acceptance checks should remove dead work and reduce min/sum calls.","rollback_reason":"Checks failed on Ruff F841: `current_objective` became unused after branch refactor.","next_action_hint":"Retry exactly this change with `current_objective` assignment removed and remeasure.","error_excerpt":"Ruff F841 at formation.py:2412 (`current_objective` unused)."}}
{"run":551,"commit":"c4c3d0d","metric":1.275466,"metrics":{"best_ms":1.249066,"quality_sum":2.491129377057,"quality_min":0.589775903809,"team_count":4},"status":"keep","description":"Completed lazy lexicographic branching for actual move acceptance in `improve_allocations` (replacement and swap phases): decide by product first, compute min only on exact product ties, and compute sum only on product+min ties. Removed now-unused `current_objective` tuple.","timestamp":1775464809233,"segment":0,"confidence":13.068153070573754,"iterationTokens":3228,"asi":{"hypothesis":"Like the upper-bound check, real move acceptance should usually be decided by product; deferring min/sum work should cut dead computations in hot loops while preserving tuple-order semantics.","result":"Primary metric improved with checks passing and unchanged quality monitors.","safety_notes":"Branch logic is algebraically equivalent to Python tuple lexicographic `>` on `(product, min, sum)` with exact float comparisons."}}
{"run":552,"commit":"c4c3d0d","metric":1.246952,"metrics":{"best_ms":1.223207,"quality_sum":2.491129377057,"quality_min":0.589775903809,"team_count":4},"status":"discard","description":"No-code confirmation rerun on kept lazy lexicographic move-acceptance branching commit c4c3d0d.","timestamp":1775464850247,"segment":0,"confidence":13.02587364379558,"iterationTokens":761,"asi":{"hypothesis":"If c4c3d0d is robust, rerun should remain in the improved ~1.24–1.28ms band.","rollback_reason":"No code change; validation-only rerun.","next_action_hint":"Use c4c3d0d as active baseline and continue exploiting lexicographic early-exit opportunities in remaining hot paths.","noise_observation":"Rerun improved further, reinforcing strong signal for this change."}}
{"run":553,"commit":"7501309","metric":1.245609,"metrics":{"best_ms":1.236892,"quality_sum":2.491129377057,"quality_min":0.589775903809,"team_count":4},"status":"keep","description":"Slimmed cached COMPAT cheap-bounded candidate tuple payloads (cap+1 and greedy <=cap paths) from five fields to only what exact-stage scans now need: `(exact_upper_bound, index, candidate)`. Updated cache/list types, sort keys, loop unpacking, and fallback indexing accordingly.","timestamp":1775465106707,"segment":0,"confidence":12.983866908239305,"iterationTokens":4673,"asi":{"hypothesis":"After switching scans to exact-bound-monotonic pruning, carrying unused `cheap_upper`/`team_signature` fields in cached lists adds avoidable per-iteration unpack/memory overhead; trimming tuple shape should reduce scan cost.","result":"Primary metric improved with checks passing and unchanged quality monitors.","safety_notes":"Pruning criterion/order remains exact-upper based; index is retained for deterministic ordering and first-k semantics."}}
{"run":554,"commit":"7501309","metric":1.268021,"metrics":{"best_ms":1.234638,"quality_sum":2.491129377057,"quality_min":0.589775903809,"team_count":4},"status":"discard","description":"No-code confirmation rerun on kept slimmed exact-stage cached candidate tuple payloads commit 7501309.","timestamp":1775465150614,"segment":0,"confidence":12.96954227975136,"iterationTokens":906,"asi":{"hypothesis":"If 7501309 gain is robust, rerun should remain near the improved ~1.25–1.27ms range.","rollback_reason":"No code change; validation-only rerun.","next_action_hint":"Use 7501309 as active baseline; further gains should focus on remaining improve_allocations dead-work elimination.","noise_observation":"Rerun stayed within nearby band, consistent with host jitter and prior keep signal."}}
{"run":555,"commit":"27c948a","metric":1.231692,"metrics":{"best_ms":1.174224,"quality_sum":2.491129377057,"quality_min":0.589775903809,"team_count":4},"status":"keep","description":"Guarded `improve_allocations` replacement phase behind `if unused_people:` so no-reserve requests skip dead work entirely (including `min_without_index` precompute and replacement-loop scaffolding). Swap phase remains unchanged.","timestamp":1775465257397,"segment":0,"confidence":12.955249224114255,"iterationTokens":4603,"asi":{"hypothesis":"In seat-saturated requests (like benchmark 16 seats/16 people), replacement phase cannot produce moves; skipping its setup/loops should remove pure overhead.","result":"Primary metric improved with checks passing and unchanged quality monitors.","safety_notes":"Behavior is equivalent: when `unused_people` is empty, prior inner loops had zero iterations and could not set `improved`; guard only removes unreachable work."}}
{"run":556,"commit":"27c948a","metric":1.210993,"metrics":{"best_ms":1.163073,"quality_sum":2.491129377057,"quality_min":0.589775903809,"team_count":4},"status":"discard","description":"No-code confirmation rerun on kept no-unused replacement-phase guard commit 27c948a.","timestamp":1775465302000,"segment":0,"confidence":12.886637251730315,"iterationTokens":726,"asi":{"hypothesis":"If 27c948a is robust, reruns should remain in the improved ~1.21–1.24ms band.","rollback_reason":"No code change; validation-only rerun.","next_action_hint":"Use 27c948a as active baseline; continue pruning dead work in swap loops with strict semantic equivalence.","noise_observation":"Rerun improved further with stable quality metrics, confirming strong signal."}}
{"run":557,"commit":"27c948a","metric":1.185055,"metrics":{"best_ms":1.147063,"quality_sum":2.491129377057,"quality_min":0.589775903809,"team_count":4},"status":"checks_failed","description":"Switched final response construction in `form_teams` to a single `TeamsResponse.model_validate({'teams': ...})` over raw payload dicts, avoiding per-team/per-member Python model constructor calls (`TeamResult(...)` + `assigned_people_from_assignments(...)`).","timestamp":1775465414270,"segment":0,"confidence":12.818748199021796,"iterationTokens":5917,"asi":{"hypothesis":"Batch validation of nested output payload through one Pydantic entrypoint should be cheaper than constructing nested models in Python loops for every run.","rollback_reason":"Checks failed on Ruff F401 due now-unused `assigned_people_from_assignments` import after response-construction rewrite.","next_action_hint":"Retry with the unused scoring import removed and remeasure.","error_excerpt":"Ruff F401 at formation.py:18 (`assigned_people_from_assignments` unused)."}}
{"run":558,"commit":"5d6aa55","metric":1.151521,"metrics":{"best_ms":1.135961,"quality_sum":2.491129377057,"quality_min":0.589775903809,"team_count":4},"status":"keep","description":"Reworked final `form_teams` response construction to validate one nested payload (`TeamsResponse.model_validate({'teams': ...})`) instead of constructing nested `TeamResult` + `AssignedPerson` models in Python loops. Removed now-unused `TeamResult` and `assigned_people_from_assignments` imports.","timestamp":1775465470938,"segment":0,"confidence":12.810146000602431,"iterationTokens":1355,"asi":{"hypothesis":"A single nested Pydantic validation pass should be cheaper than many per-object Python model constructor calls in the hot return path.","result":"Primary metric improved substantially with checks passing and unchanged quality monitors.","safety_notes":"Output schema/content unchanged (`taskId`, `people[{id,skillIds}]`, `quality`); only construction pathway changed."}}
{"run":559,"commit":"5d6aa55","metric":1.146692,"metrics":{"best_ms":1.133827,"quality_sum":2.491129377057,"quality_min":0.589775903809,"team_count":4},"status":"discard","description":"No-code confirmation rerun on kept batched `TeamsResponse.model_validate(...)` output-construction commit 5d6aa55.","timestamp":1775465522922,"segment":0,"confidence":12.80155533968931,"iterationTokens":777,"asi":{"hypothesis":"If 5d6aa55 gain is robust, reruns should remain in the improved ~1.14–1.16ms band.","rollback_reason":"No code change; validation-only rerun.","next_action_hint":"Use 5d6aa55 as active baseline; continue structural dead-work removal while guarding semantics.","noise_observation":"Rerun slightly improved and stayed tightly in-band, supporting a strong real gain."}}
{"run":560,"commit":"5d6aa55","metric":1.16142,"metrics":{"best_ms":1.078012,"quality_sum":2.491129377057,"quality_min":0.589775903809,"team_count":4},"status":"discard","description":"Changed swap upper-bound caches to store `(raw_upper_bound, clamped_upper_bound)` tuples per signature, then reused preclamped values in `upper_trial_product` to remove repeated `max(..., 1e-12)` calls on cache hits.","timestamp":1775465674394,"segment":0,"confidence":12.763071755235961,"iterationTokens":8274,"asi":{"hypothesis":"Upper-bound cache hits dominate timed runs; storing preclamped bounds should eliminate hot clamp calls in swap pruning and reduce max-call overhead.","rollback_reason":"Primary median regressed vs active baseline despite lower single-sample best.","next_action_hint":"Keep simpler float-only upper-bound cache; tuple payload/unpack overhead outweighed clamp elimination.","observation":"Added tuple allocation/unpacking on every lookup appears more expensive than repeated `max`."}}
