{"run":341,"commit":"c5f708d","metric":45.973096,"metrics":{"best_ms":44.75533,"quality_sum":2.491129377057,"quality_min":0.589775903809,"team_count":4},"status":"keep","description":"Added precomputed per-task per-person logged task preferences into COMPAT upper-bound evaluation (`task_preference_logs_by_person_id`) and switched `_compat_candidate_quality_upper_bound` task-preference term to fast log-sum path when available; used in both <=cap greedy pruning and cap+1 scored-shortlist fast path.","timestamp":1775330586778,"segment":0,"confidence":36.654754022657286,"iterationTokens":7258,"asi":{"hypothesis":"Now that upper-bound evaluation dominates the optimized flow, replacing repeated per-candidate `_task_preference_score` log work with cached logs should provide meaningful additional speedup.","result":"Primary metric improved with checks passing and unchanged quality metrics.","safety_notes":"Fallback to original `_task_preference_score` remains when precomputed logs are not provided."}}
{"run":342,"commit":"c5f708d","metric":45.133457,"metrics":{"best_ms":44.924851,"quality_sum":2.491129377057,"quality_min":0.589775903809,"team_count":4},"status":"discard","description":"No-code confirmation rerun on kept commit c5f708d after upper-bound task-preference log caching.","timestamp":1775330638536,"segment":0,"confidence":36.55358618303472,"iterationTokens":770,"asi":{"hypothesis":"Unchanged rerun should remain in mid-40ms band if the latest upper-bound optimization is stable.","rollback_reason":"No code change; measurement-only confirmation run.","next_action_hint":"Use c5f708d as active baseline; avoid broad redesign unless it can beat this new regime convincingly.","noise_observation":"repeat remained tightly in the new ~45ms band, confirming robustness."}}
{"run":343,"commit":"e70bfe0","metric":44.495559,"metrics":{"best_ms":44.390269,"quality_sum":2.491129377057,"quality_min":0.589775903809,"team_count":4},"status":"keep","description":"Removed repeated team-signature sorting inside COMPAT upper-bound evaluation by passing prebuilt candidate-order signatures (`tuple(member.id for member in candidate)`) at both pruning call sites; `_compat_candidate_quality_upper_bound` now accepts optional `team_signature` and falls back to sorting only when absent.","timestamp":1775330775791,"segment":0,"confidence":36.547402827515626,"iterationTokens":3494,"asi":{"hypothesis":"In the new pruning-heavy regime, avoiding per-candidate signature sorting in `_compat_candidate_quality_upper_bound` should reduce overhead without changing admissibility or selection behavior.","result":"Primary metric improved with checks passing and unchanged quality metrics.","safety_notes":"Bound-cache keys are internal; candidate-order signatures are deterministic within these pruning loops, and fallback sorted signature preserves behavior for other callers."}}
{"run":344,"commit":"e70bfe0","metric":44.959567,"metrics":{"best_ms":44.323412,"quality_sum":2.491129377057,"quality_min":0.589775903809,"team_count":4},"status":"discard","description":"No-code confirmation rerun on kept commit e70bfe0 after upper-bound signature-sort elimination.","timestamp":1775330832083,"segment":0,"confidence":36.35845154272089,"iterationTokens":777,"asi":{"hypothesis":"Unchanged rerun should stay around mid-40ms if the latest upper-bound signature optimization is stable.","rollback_reason":"No code change; measurement-only confirmation run.","next_action_hint":"Use e70bfe0 as active baseline and continue only high-confidence structural changes.","noise_observation":"repeat remained in the same ~44-45ms band, supporting stability."}}
{"run":345,"commit":"3aa0fc3","metric":33.554205,"metrics":{"best_ms":32.974122,"quality_sum":2.491129377057,"quality_min":0.589775903809,"team_count":4},"status":"keep","description":"In the cap+1 scored-shortlist fast path, introduced a two-stage admissible bound pipeline: precompute/sort candidates by a cheap upper bound (`geometric skill + task preference + personality/social maxima`), break early on cheap-bound cutoff, then evaluate exact upper bound only for survivors before exact scoring.","timestamp":1775368169500,"segment":0,"confidence":36.86349935546875,"iterationTokens":777,"asi":{"hypothesis":"A cheap admissible pre-bound should filter most candidates before expensive exact bound (personality/social) evaluation, reducing overall pruning overhead while keeping correctness.","result":"Very large primary-metric improvement with checks passing and unchanged quality metrics.","safety_notes":"Both stages are admissible upper bounds; exact scoring is still used for final selection, and cap+1 first-k all-equal fallback remains intact."}}
{"run":346,"commit":"3aa0fc3","metric":34.309815,"metrics":{"best_ms":33.330179,"quality_sum":2.491129377057,"quality_min":0.589775903809,"team_count":4},"status":"discard","description":"No-code confirmation rerun on kept commit 3aa0fc3 after two-stage cap+1 admissible-bound pipeline.","timestamp":1775368221224,"segment":0,"confidence":35.881144335777364,"iterationTokens":790,"asi":{"hypothesis":"Unchanged rerun should remain in the new low-30ms band if two-stage admissible filtering is robust.","rollback_reason":"No code change; measurement-only confirmation run.","next_action_hint":"Use 3aa0fc3 as baseline and avoid undoing safety gates while exploring further structural reductions.","noise_observation":"repeat stayed close (33-34ms), confirming the new regime."}}
{"run":347,"commit":"901632c","metric":30.612973,"metrics":{"best_ms":30.028249,"quality_sum":2.491129377057,"quality_min":0.589775903809,"team_count":4},"status":"keep","description":"Tightened the cap+1 fast path cheap admissible stage by using exact cached COMPAT personality scores per candidate (instead of constant 1.32), storing them under the candidate signature and reusing them in the exact-bound stage.","timestamp":1775368409671,"segment":0,"confidence":35.12616584800698,"iterationTokens":9510,"asi":{"hypothesis":"A much tighter cheap bound (exact personality + geometric skill + task preference + social max) should dramatically shrink expensive exact-bound evaluations while preserving admissibility.","result":"Large further primary-metric gain with checks passing and unchanged quality metrics.","safety_notes":"Cheap stage remains admissible and exact scoring still determines the winner; personality cache reuse avoids duplicate personality recomputation."}}
{"run":348,"commit":"901632c","metric":30.365323,"metrics":{"best_ms":29.81886,"quality_sum":2.491129377057,"quality_min":0.589775903809,"team_count":4},"status":"discard","description":"No-code confirmation rerun on kept commit 901632c after personality-tightened cheap admissible stage.","timestamp":1775368458813,"segment":0,"confidence":34.87754073096242,"iterationTokens":730,"asi":{"hypothesis":"Unchanged rerun should remain in ~30ms band if the personality-tightened cheap stage is stable.","rollback_reason":"No code change; measurement-only confirmation run.","next_action_hint":"Use 901632c as active baseline; continue only with semantics-safe structural pruning improvements.","noise_observation":"repeat stayed in the same low-30ms regime, confirming stability."}}
{"run":349,"commit":"901632c","metric":29.235875,"metrics":{"best_ms":29.043009,"quality_sum":2.491129377057,"quality_min":0.589775903809,"team_count":4},"status":"checks_failed","description":"Extended the two-stage cheap+exact admissible-bound pipeline from the cap+1 shortcut into the `use_upper_bound_pruning` (`task_total <= cap`) greedy path: cheap bound pre-sort + early break + exact-bound survivor check before scoring.","timestamp":1775368632640,"segment":0,"confidence":34.63241044439681,"iterationTokens":8330,"asi":{"hypothesis":"Applying the same cheap-first admissible filtering to <=cap pruning tasks should reduce exact bound work and scoring calls further.","rollback_reason":"Backpressure checks failed on type checking: `task_preference_logs_by_person_id` considered optional in branch-local indexing.","next_action_hint":"Reapply with branch-local non-None narrowing (e.g., local alias/assert) before indexing and rerun.","failure_details":"ty error at `formation.py:1294` (`not-subscriptable` on optional map)."}}
{"run":350,"commit":"a86592c","metric":29.625211,"metrics":{"best_ms":29.240875,"quality_sum":2.491129377057,"quality_min":0.589775903809,"team_count":4},"status":"keep","description":"Extended two-stage admissible filtering into the <=cap COMPAT greedy pruning branch: precompute/sort candidates by cheap admissible bound (geometric skill + exact personality + task preference + social max), early-break on cheap cutoff, then run exact bound only for survivors before exact scoring.","timestamp":1775368720744,"segment":0,"confidence":34.0737357638513,"iterationTokens":3817,"asi":{"hypothesis":"Applying the cheap-first admissible pipeline to <=cap pruning tasks should further cut exact bound/scoring work, complementing the cap+1 shortcut path.","result":"Primary metric improved with checks passing and unchanged quality metrics.","safety_notes":"Cheap and exact stages are both admissible upper bounds; deterministic tie semantics remain unchanged because final winner still chosen from exact scores with existing tie rules."}}
{"run":351,"commit":"a86592c","metric":29.664585,"metrics":{"best_ms":29.543837,"quality_sum":2.491129377057,"quality_min":0.589775903809,"team_count":4},"status":"discard","description":"No-code confirmation rerun on kept commit a86592c after extending two-stage admissible filtering to <=cap branch.","timestamp":1775368768273,"segment":0,"confidence":34.054602927295385,"iterationTokens":765,"asi":{"hypothesis":"Unchanged rerun should remain in sub-30ms band if the <=cap two-stage extension is stable.","rollback_reason":"No code change; measurement-only confirmation run.","next_action_hint":"Use a86592c as active baseline and avoid broad refactors that could destabilize tie semantics.","noise_observation":"repeat stayed in same ~29.5-29.7ms regime, indicating stable gains."}}
{"run":352,"commit":"e33e541","metric":21.027898,"metrics":{"best_ms":20.693235,"quality_sum":2.491129377057,"quality_min":0.589775903809,"team_count":4},"status":"keep","description":"Added COMPAT swap-phase admissible objective pruning in `improve_allocations`: precompute per-task upper-bound inputs, estimate upper-bound qualities for `swapped_left/right` via `_compat_candidate_quality_upper_bound`, and skip expensive rescoring when even the upper-bound objective cannot beat `current_objective`.","timestamp":1775368943177,"segment":0,"confidence":33.82962379733957,"iterationTokens":9613,"asi":{"hypothesis":"Swap evaluation in `improve_allocations` dominates at the new baseline; admissible objective upper bounds can eliminate most hopeless swaps before any `score_team` call.","result":"Very large additional primary-metric improvement with checks passing and unchanged quality metrics.","safety_notes":"Pruning uses admissible upper bounds and only skips swaps proven unable to improve the objective tuple; accepted swaps still use exact rescoring."}}
{"run":353,"commit":"e33e541","metric":21.118656,"metrics":{"best_ms":20.575288,"quality_sum":2.491129377057,"quality_min":0.589775903809,"team_count":4},"status":"discard","description":"No-code confirmation rerun on kept commit e33e541 after swap-phase admissible pruning.","timestamp":1775368990559,"segment":0,"confidence":33.26071059418314,"iterationTokens":784,"asi":{"hypothesis":"Unchanged rerun should remain near ~21ms if swap-phase upper-bound objective pruning is stable.","rollback_reason":"No code change; measurement-only confirmation run.","next_action_hint":"Use e33e541 as active baseline; remaining work should focus on similarly proof-safe pruning opportunities.","noise_observation":"repeat remained in the same low-21ms band, indicating stable behavior."}}
{"run":354,"commit":"e33e541","metric":22.08527,"metrics":{"best_ms":20.783356,"quality_sum":2.491129377057,"quality_min":0.589775903809,"team_count":4},"status":"discard","description":"Rewrote `scoring.geometric_mean(...)` to add a `Sequence` fast path (no list materialization/generator chains) and iterative log accumulation.","timestamp":1775369133486,"segment":0,"confidence":33.04188542363524,"iterationTokens":5067,"asi":{"hypothesis":"A lower-overhead `geometric_mean` implementation should reduce hotspot cost now that pruning-heavy paths call it frequently.","rollback_reason":"Primary metric regressed in end-to-end benchmark despite microbenchmark wins; integration overhead/branching did not pay off in real flow.","next_action_hint":"Do not pursue geometric_mean micro-optimizations further without profile evidence under full workload.","result":"Checks passed and quality unchanged, but runtime worsened."}}
{"run":355,"commit":"e33e541","metric":20.682675,"metrics":{"best_ms":20.639653,"quality_sum":2.491129377057,"quality_min":0.589775903809,"team_count":4},"status":"discard","description":"No-code baseline rerun after reverting geometric_mean rewrite.","timestamp":1775369185017,"segment":0,"confidence":32.6104269708121,"iterationTokens":686,"asi":{"hypothesis":"Reverted baseline should recover prior low-20ms regime if geometric_mean rewrite was the source of regression.","rollback_reason":"No code change; measurement-only run.","next_action_hint":"Anchor active baseline near ~20.7ms and evaluate only high-leverage structural changes.","noise_observation":"baseline improved further, confirming regression belonged to discarded geometric_mean change."}}
{"run":356,"commit":"e33e541","metric":31.668904,"metrics":{"best_ms":30.750014,"quality_sum":2.491129377057,"quality_min":0.589775903809,"team_count":4},"status":"discard","description":"Plumbed optional precomputed overrides (`task_preference_score_override`, `skill_score_upper_override`) into `_compat_candidate_quality_upper_bound` without fully exploiting them in pruning call sites.","timestamp":1775375872920,"segment":0,"confidence":32.27702562948725,"iterationTokens":7730,"asi":{"hypothesis":"Allowing call sites to bypass repeated task-preference/skill-upper recomputation in exact-bound stage could reduce upper-bound overhead.","rollback_reason":"As implemented, extra optional-branch plumbing added overhead without compensating call-site savings, causing a clear regression.","next_action_hint":"If revisiting, wire overrides end-to-end in one change and validate with paired A/B; otherwise keep simpler bound helper.","result":"Checks passed and quality unchanged, but runtime regressed materially."}}
{"run":357,"commit":"e33e541","metric":30.950801,"metrics":{"best_ms":30.455696,"quality_sum":2.491129377057,"quality_min":0.589775903809,"team_count":4},"status":"discard","description":"Completed override-plumbing experiment: pass precomputed `task_preference_score` and `skill_score_upper` from cheap-stage tuples into `_compat_candidate_quality_upper_bound` in both cap+1 and <=cap COMPAT pruning paths to avoid recomputation in exact stage.","timestamp":1775376115444,"segment":0,"confidence":31.831995620250815,"iterationTokens":7730,"asi":{"hypothesis":"End-to-end reusing cheap-stage task-preference and skill upper-bound terms inside exact-bound evaluation should lower upper-bound helper overhead.","rollback_reason":"Despite eliminating recomputation, larger candidate tuple payload and override branching increased total overhead; benchmark regressed materially.","next_action_hint":"Revert to e33e541 baseline and avoid widening cheap-stage candidate records unless profiling shows bound-evaluation dominates after pruning.","result":"Checks passed, quality unchanged, but runtime moved back to ~31ms band."}}
{"run":358,"commit":"e33e541","metric":31.13977,"metrics":{"best_ms":30.618201,"quality_sum":2.491129377057,"quality_min":0.589775903809,"team_count":4},"status":"discard","description":"No-code baseline rerun after reverting override-plumbing experiment; re-anchor current host regime.","timestamp":1775376164081,"segment":0,"confidence":31.63312114175852,"iterationTokens":1130,"asi":{"hypothesis":"If regression was isolated to discarded code, baseline commit e33e541 should be stable again.","rollback_reason":"No code change; confirmation-only run.","next_action_hint":"Treat current regime as ~31ms and evaluate only larger structural wins; keep paired no-code checks to avoid overfitting.","noise_observation":"Host now appears in a slower band than earlier ~21ms confirmations."}}
{"run":359,"commit":"b197ee3","metric":27.784513,"metrics":{"best_ms":27.156966,"quality_sum":2.491129377057,"quality_min":0.589775903809,"team_count":4},"status":"keep","description":"Rewrote `scoring.geometric_mean(...)` to a single-pass implementation (accumulate `log_sum` + count directly over iterable) to remove list materialization and extra `any/sum` generator traversals.","timestamp":1775376289836,"segment":0,"confidence":31.53110673526296,"iterationTokens":8646,"asi":{"hypothesis":"`geometric_mean` remains a hot function; a single-pass loop should cut overhead across upper-bound and scoring paths while preserving behavior.","result":"Large primary-metric improvement in current host regime with checks passing and unchanged quality monitors.","safety_notes":"Semantics preserved for empty/non-positive inputs and generic iterables; only evaluation strategy changed."}}
{"run":360,"commit":"b197ee3","metric":27.277806,"metrics":{"best_ms":27.013987,"quality_sum":2.491129377057,"quality_min":0.589775903809,"team_count":4},"status":"discard","description":"No-code confirmation rerun on kept geometric_mean single-pass commit b197ee3.","timestamp":1775376332510,"segment":0,"confidence":31.45351542300584,"iterationTokens":831,"asi":{"hypothesis":"If b197ee3 improvement is real, repeat should remain in high-20ms band with unchanged quality.","rollback_reason":"No code change; validation-only rerun.","next_action_hint":"Use b197ee3 as active baseline and continue structural pruning/search-order work.","noise_observation":"Second run stayed in same improved regime, strengthening confidence."}}
{"run":361,"commit":"b197ee3","metric":27.600502,"metrics":{"best_ms":26.662707,"quality_sum":2.491129377057,"quality_min":0.589775903809,"team_count":4},"status":"checks_failed","description":"Attempted shortlist_scorers pairwise potential precompute (compute personality/social pair scores once per person-pair, then derive per-person top-partner potentials).","timestamp":1775376464020,"segment":0,"confidence":31.37630504461248,"iterationTokens":12600,"asi":{"hypothesis":"Precomputing pairwise personality/social scores once per unordered pair should cut scorer overhead versus per-person recomputation.","rollback_reason":"Implementation failed checks: did not handle `person.preferences is None` while building explicit preference id sets, triggering TypeError in multiple tests.","next_action_hint":"If retried, guard nullable preferences and preserve all existing monkeypatch/tie behavior before measuring performance.","error_excerpt":"TypeError: 'NoneType' object is not iterable at formation.py:364 in shortlist_scorers precompute path."}}
{"run":362,"commit":"6c7a58d","metric":26.501769,"metrics":{"best_ms":26.278606,"quality_sum":2.491129377057,"quality_min":0.589775903809,"team_count":4},"status":"keep","description":"Precomputed shortlist per-person personality/social potentials from unordered person-pair scores in `shortlist_scorers` (including nullable-preferences-safe explicit social checks), so pair team scores are computed once per pair and reused for both members.","timestamp":1775376540192,"segment":0,"confidence":31.004021920438944,"iterationTokens":3808,"asi":{"hypothesis":"`shortlist_scorers` still spent significant time recomputing pair personality/social scores per person; pairwise precompute should halve this repeated work.","result":"Checks passed and primary metric improved to mid-26ms band with unchanged quality monitors.","safety_notes":"Preserves existing scorer semantics and COMPAT explicit-social gating; only evaluation order/caching changed.","fixes_from_failed_attempt":"Handled nullable `person.preferences` via `(person.preferences or [])` while constructing explicit-preference id sets."}}
{"run":363,"commit":"6c7a58d","metric":28.578348,"metrics":{"best_ms":27.529905,"quality_sum":2.491129377057,"quality_min":0.589775903809,"team_count":4},"status":"discard","description":"No-code confirmation rerun on kept shortlist pairwise-potential precompute commit 6c7a58d.","timestamp":1775376587651,"segment":0,"confidence":30.4209036653872,"iterationTokens":892,"asi":{"hypothesis":"If 6c7a58d gain is robust, repeats should remain around the improved ~26.5ms band.","rollback_reason":"No code change; validation-only run.","next_action_hint":"Run another no-code sample before making further code changes to estimate current host-noise envelope and avoid overfitting.","noise_observation":"Observed a slower repeat (~28.6ms), indicating notable host variance."}}
{"run":364,"commit":"6c7a58d","metric":28.850613,"metrics":{"best_ms":28.476235,"quality_sum":2.491129377057,"quality_min":0.589775903809,"team_count":4},"status":"discard","description":"Second no-code confirmation rerun on commit 6c7a58d to assess host variance.","timestamp":1775376633838,"segment":0,"confidence":30.30730218484711,"iterationTokens":728,"asi":{"hypothesis":"Additional repeat should clarify whether 6c7a58d improvement persists beyond one fast sample.","rollback_reason":"No code change; measurement-only run.","next_action_hint":"Perform an explicit A/B against parent b197ee3 in current regime before investing further on top of 6c7a58d.","noise_observation":"Consecutive repeats remained in high-28ms band, suggesting the 26.5ms sample may have been optimistic."}}
