{"run":36,"commit":"019c673","metric":151.412092,"metrics":{"best_ms":150.461451,"quality_sum":2.491129377057,"quality_min":0.589775903809,"team_count":4},"status":"keep","description":"Add a fast path in _compat_fill_uncovered_assignments for max_skills_per_member==1 (the common equal-team-size compat case): directly fill uncovered skills into empty members and return without the generic rebalance/sort passes.","timestamp":1775181664328,"segment":0,"confidence":26.838455155842116,"iterationTokens":3075,"asi":{"hypothesis":"When each member can hold at most one task skill, the generic uncovered rebalance loops and final sort are unnecessary overhead.","result":"Meaningful median improvement with unchanged quality metrics and passing checks.","hotspot":"_compat_fill_uncovered_assignments","branch_frequency":"with_uncovered path is dominant in benchmark (~84% of calls)"}}
{"run":37,"commit":"019c673","metric":155.025761,"metrics":{"best_ms":153.323064,"quality_sum":2.491129377057,"quality_min":0.589775903809,"team_count":4},"status":"discard","description":"Tried broadening the uncovered-assignment fast-path guard to `len(task_skills) <= len(assignments)` (instead of using computed max_skills_per_member==1), but this variant regressed despite equivalent behavior/checks.","timestamp":1775181752750,"segment":0,"confidence":25.687511912782043,"iterationTokens":2285,"asi":{"hypothesis":"Checking len(task_skills)<=len(assignments) directly would be a cheaper trigger for the one-skill-per-member fast path.","rollback_reason":"This guard/flow shape was slower in practice (likely branch/layout effects) versus the prior explicit max_skills_per_member path.","next_action_hint":"Keep the previous max_skills_per_member==1 fast-path implementation from the kept commit."}}
{"run":38,"commit":"019c673","metric":169.870259,"metrics":{"best_ms":168.52141,"quality_sum":2.491129377057,"quality_min":0.589775903809,"team_count":4},"status":"discard","description":"Attempted to fold compat member-priority tuple precomputation into _compat_member_task_analysis (returning prebuilt scarce/rich priority tuples) and simplify _compat_member_priority_order to index sorting, but this added too much work to the analysis pass and regressed heavily.","timestamp":1775181892216,"segment":0,"confidence":26.389242494079266,"iterationTokens":7931,"asi":{"hypothesis":"Precomputing priority tuples during existing analysis loops would remove repeated member/task scans in _compat_member_priority_order.","rollback_reason":"The expanded analysis phase and extra tuple/list allocations outweighed saved scans.","next_action_hint":"Keep priority computation separate; avoid heavy tuple materialization in _compat_member_task_analysis."}}
{"run":39,"commit":"96a4b17","metric":149.465842,"metrics":{"best_ms":146.968395,"quality_sum":2.491129377057,"quality_min":0.589775903809,"team_count":4},"status":"keep","description":"Switch score_cache keys from string-id tuples to object-identity tuples (`tuple(id(person) for person in people)`) to cut hot-path key construction overhead in cached_score_team while keeping per-form-request cache scope unchanged.","timestamp":1775182013451,"segment":0,"confidence":25.080721741164705,"iterationTokens":3878,"asi":{"hypothesis":"Identity-based candidate keys are cheaper to build than repeatedly reading person.id strings for every cached_score_team lookup.","result":"Clear median/best improvement with unchanged quality metrics and passing checks.","hotspots_touched":["cached_score_team","greedy/exact/improve score_cache call paths"]}}
{"run":40,"commit":"96a4b17","metric":150.768051,"metrics":{"best_ms":148.806938,"quality_sum":2.491129377057,"quality_min":0.589775903809,"team_count":4},"status":"discard","description":"Changed greedy tie-break key to use candidate.people insertion order instead of sorting member IDs per candidate (to reduce per-candidate sorting overhead), but runtime regressed slightly.","timestamp":1775182095067,"segment":0,"confidence":25.038114425405222,"iterationTokens":1907,"asi":{"hypothesis":"Dropping sorted(member.id) in greedy tie-break should save repeated tiny sorts during best-candidate selection.","rollback_reason":"The alternate tie-break shape was slightly slower overall and not worth behavioral risk.","next_action_hint":"Keep existing sorted-ID tie-break; focus on larger hotspots."}}
{"run":41,"commit":"96a4b17","metric":149.538088,"metrics":{"best_ms":147.98652,"quality_sum":2.491129377057,"quality_min":0.589775903809,"team_count":4},"status":"discard","description":"Added a fixed-size (len==4) fast path for cached_score_team key construction to avoid generator/tuple-building overhead on the benchmark’s common team size, but median result was effectively unchanged and slightly worse.","timestamp":1775182166882,"segment":0,"confidence":23.765527494573693,"iterationTokens":1022,"asi":{"hypothesis":"Manual tuple construction for 4-person teams should shave overhead from the hottest cache-key path.","rollback_reason":"No consistent improvement over the current best; likely within noise/branch overhead.","next_action_hint":"Keep generic identity-tuple key path unless a broader small-team specialization proves faster."}}
{"run":42,"commit":"6f6ee89","metric":139.608704,"metrics":{"best_ms":139.281926,"quality_sum":2.491129377057,"quality_min":0.589775903809,"team_count":4},"status":"keep","description":"Make score_cache keys order-insensitive by sorting person object identities (`tuple(sorted(id(person) ...))`) so equivalent teams in different member orders reuse cached score_team results.","timestamp":1775182254936,"segment":0,"confidence":27.177722776863064,"iterationTokens":2181,"asi":{"hypothesis":"Many cached_score_team calls revisit the same team composition in different order; canonicalized keys should increase cache-hit rate enough to offset tiny sort cost.","evidence":"Observed ordered-vs-unordered key cardinality gap during instrumentation (~1857 vs ~1765 unique keys per form_teams run).","result":"Large improvement with unchanged quality metrics and passing checks."}}
{"run":43,"commit":"6f6ee89","metric":147.286794,"metrics":{"best_ms":145.886654,"quality_sum":2.491129377057,"quality_min":0.589775903809,"team_count":4},"status":"discard","description":"Tried replacing `tuple(sorted(...))` canonical key construction with list-build + in-place `.sort()` in cached_score_team, but this was slower despite equivalent semantics.","timestamp":1775182321061,"segment":0,"confidence":27.428261368710203,"iterationTokens":1157,"asi":{"hypothesis":"List+sort might be a cheaper canonicalization path than sorted(generator) for order-insensitive score-cache keys.","rollback_reason":"Extra list allocation/mutation overhead outweighed any generator savings; median regressed.","next_action_hint":"Keep the tuple(sorted(...)) canonicalization that produced the large cache-hit win."}}
{"run":44,"commit":"6f6ee89","metric":144.125697,"metrics":{"best_ms":143.365478,"quality_sum":2.491129377057,"quality_min":0.589775903809,"team_count":4},"status":"discard","description":"Changed request-level personality/social cache signatures from sorted member ID strings to sorted member object identities, aiming to avoid string-property work in score_team, but this regressed runtime.","timestamp":1775182400624,"segment":0,"confidence":26.575051458463847,"iterationTokens":2107,"asi":{"hypothesis":"Identity-based team signatures should be cheaper than sorting member.id strings for component-cache keys.","rollback_reason":"Cache-key identity canonicalization here underperformed; likely due reduced locality/lookup characteristics versus string IDs.","next_action_hint":"Keep string-id team signatures for personality/social caches while retaining order-insensitive identity keys for score_cache."}}
{"run":45,"commit":"6f6ee89","metric":153.425193,"metrics":{"best_ms":151.219429,"quality_sum":2.491129377057,"quality_min":0.589775903809,"team_count":4},"status":"checks_failed","description":"Tried conditional canonicalization of score-cache member identity tuples (only sort when IDs are out of order) to avoid unnecessary sorts, but lint rejected zip() without strict= and benchmark performance regressed.","timestamp":1775182486715,"segment":0,"confidence":25.82895766410608,"iterationTokens":1981,"asi":{"hypothesis":"Most candidate tuples are already monotonic by object id, so sorting only on inversions should preserve cache hits while reducing sort overhead.","rollback_reason":"Implementation hit Ruff B905 (missing strict=) and showed no runtime benefit anyway.","next_action_hint":"Abandon conditional-sort variant; keep unconditional tuple(sorted(...)) canonicalization from the kept change."}}
{"run":46,"commit":"6f6ee89","metric":148.3237,"metrics":{"best_ms":145.016312,"quality_sum":2.491129377057,"quality_min":0.589775903809,"team_count":4},"status":"discard","description":"Added dual score-cache lookup (ordered identity key first, canonical sorted key second) and backfilled aliases to avoid sorting on exact-order repeats, but this increased cache bookkeeping overhead and regressed runtime.","timestamp":1775182581986,"segment":0,"confidence":25.76243346015825,"iterationTokens":2966,"asi":{"hypothesis":"Two-tier ordered→canonical cache keys would cut repeated canonical-sort work while preserving order-insensitive reuse.","rollback_reason":"Extra dictionary operations/alias writes outweighed saved sorting in this workload.","next_action_hint":"Keep single canonical key lookup path (sorted identities) for score_cache."}}
{"run":47,"commit":"6f6ee89","metric":151.017634,"metrics":{"best_ms":147.147298,"quality_sum":2.491129377057,"quality_min":0.589775903809,"team_count":4},"status":"discard","description":"Removed sorted() from score_team’s personality/social cache team signature (using tuple(member.id) insertion order instead), but poorer cross-task cache reuse outweighed the saved sort cost and runtime regressed.","timestamp":1775182679125,"segment":0,"confidence":26.046632331561945,"iterationTokens":4046,"asi":{"hypothesis":"With order-insensitive score_cache keys, score_team could avoid sorting member IDs for component-cache keys.","rollback_reason":"Order-sensitive signatures reduced component-cache hit rate enough to outweigh sort savings.","next_action_hint":"Keep sorted member-id signatures for personality/social caches."}}
{"run":48,"commit":"6f6ee89","metric":151.535415,"metrics":{"best_ms":149.243366,"quality_sum":2.491129377057,"quality_min":0.589775903809,"team_count":4},"status":"discard","description":"Tried replacing score_cache task key from task_id string to id(task_id) integer identity in cached_score_team, but this regressed runtime.","timestamp":1775182750989,"segment":0,"confidence":27.452876235322744,"iterationTokens":1112,"asi":{"hypothesis":"Integer task identity keys might hash/compare faster than task_id strings in hot score_cache lookups.","rollback_reason":"No speedup observed; identity-key variant performed worse.","next_action_hint":"Keep string task_id component in score_cache keys."}}
{"run":49,"commit":"6f6ee89","metric":151.751394,"metrics":{"best_ms":146.345731,"quality_sum":2.491129377057,"quality_min":0.589775903809,"team_count":4},"status":"discard","description":"Specialized _assign_task_skills_compat member assignment loop for max_skills_per_member==1 to bypass per-member inner-loop scaffolding, but the duplicated branch path increased overhead and regressed runtime.","timestamp":1775182841525,"segment":0,"confidence":29.467294257027753,"iterationTokens":3325,"asi":{"hypothesis":"A dedicated single-assignment path in _assign_task_skills_compat should reduce inner-loop overhead in the common square-team workload.","rollback_reason":"Extra branch duplication and code-path overhead outweighed loop simplification.","next_action_hint":"Keep generic member assignment loop; the fill-stage fast path is the profitable specialization."}}
{"run":50,"commit":"6f6ee89","metric":152.017925,"metrics":{"best_ms":149.362317,"quality_sum":2.491129377057,"quality_min":0.589775903809,"team_count":4},"status":"discard","description":"Replaced sorted identity-tuple score_cache keys with request-scoped team bitmask keys (order-insensitive int masks via cached person-id->bit map), but map lookups/bit assembly regressed runtime.","timestamp":1775182920760,"segment":0,"confidence":30.426626999415998,"iterationTokens":1956,"asi":{"hypothesis":"Bitmask team keys should avoid per-call identity sorting while keeping order-insensitive score-cache hits.","rollback_reason":"Per-call person_id map lookups and mask accumulation were slower than tuple(sorted(id(...))) in this workload.","next_action_hint":"Retain sorted-identity tuple keys for score_cache; bitmasking is not a win here."}}
{"run":51,"commit":"6f6ee89","metric":147.740226,"metrics":{"best_ms":146.000533,"quality_sum":2.491129377057,"quality_min":0.589775903809,"team_count":4},"status":"discard","description":"Inlined individual_fit logic into shortlist_scorers with precomputed task/similarity/preference invariants to avoid repeated per-person lookups, but this increased per-scorer work/allocation overhead and regressed runtime.","timestamp":1775183014629,"segment":0,"confidence":29.37545019272057,"iterationTokens":3563,"asi":{"hypothesis":"Precomputing shortlist invariants once should reduce candidate scoring overhead inside scorer().","rollback_reason":"The inlined path added enough Python-level list/sort work that it underperformed the existing function-based path.","next_action_hint":"Keep current shortlist scorer implementation; avoid large scorer rewrites unless supported by fresh profiling evidence."}}
{"run":52,"commit":"6f6ee89","metric":150.696793,"metrics":{"best_ms":147.056601,"quality_sum":2.491129377057,"quality_min":0.589775903809,"team_count":4},"status":"discard","description":"Added optional precomputed task/similarity/preferences/weights inputs to individual_fit and wired shortlist_scorers to pass them, but the broader call signature/plumbing overhead regressed median runtime.","timestamp":1775183097724,"segment":0,"confidence":30.125683799731316,"iterationTokens":2936,"asi":{"hypothesis":"Reusing shortlist-level invariants in individual_fit would reduce repeated lookup/resolve work during candidate ranking.","rollback_reason":"Extra argument plumbing and branching inside individual_fit offset the intended savings.","next_action_hint":"Keep the simpler individual_fit call path; avoid adding many optional precompute branches there."}}
{"run":53,"commit":"6f6ee89","metric":151.584118,"metrics":{"best_ms":146.711343,"quality_sum":2.491129377057,"quality_min":0.589775903809,"team_count":4},"status":"discard","description":"Added an early set-based uncovered-skill fast path in _compat_fill_uncovered_assignments for the one-skill-per-member regime (unique task skill IDs + <=1 assignment per member), but extra guards/set work regressed median runtime.","timestamp":1775183188234,"segment":0,"confidence":32.74335820175926,"iterationTokens":2572,"asi":{"hypothesis":"When each member has at most one assignment, uncovered detection can use set membership instead of count/decrement bookkeeping.","rollback_reason":"Guard checks and set construction overhead outweighed savings from simplified uncovered detection.","next_action_hint":"Stick with the existing max_skills_per_member==1 fast path; avoid additional precheck-heavy branches."}}
{"run":54,"commit":"6f6ee89","metric":151.112466,"metrics":{"best_ms":146.35538,"quality_sum":2.491129377057,"quality_min":0.589775903809,"team_count":4},"status":"discard","description":"Added per-task local scored-candidate memoization keyed by candidate tuple object id in build_scored_candidates/greedy_allocations (with loop-safe default binding) to avoid repeated cached_score_team lookups, but end-to-end runtime still regressed.","timestamp":1775183276126,"segment":0,"confidence":37.50540559676021,"iterationTokens":1955,"asi":{"hypothesis":"candidate_combinations returns the same tuple objects later consumed by callers, so id(candidate)-keyed local memoization should skip duplicate cache lookups cheaply.","rollback_reason":"Local memo bookkeeping overhead outweighed saved lookups in this workload.","next_action_hint":"Do not add extra per-task memo layers on top of score_cache here."}}
{"run":55,"commit":"6f6ee89","metric":147.351625,"metrics":{"best_ms":146.429199,"quality_sum":2.491129377057,"quality_min":0.589775903809,"team_count":4},"status":"discard","description":"Replaced math.isclose checks with direct float equality in _compat_member_task_analysis (best/second-best tracking and unique-best detection), but this regressed runtime.","timestamp":1775183378313,"segment":0,"confidence":39.7128621952514,"iterationTokens":3498,"asi":{"hypothesis":"Direct equality comparisons on cached compat skill levels should be cheaper than repeated math.isclose calls in hot analysis loops.","rollback_reason":"Despite cheaper comparisons, this rewrite slowed end-to-end performance in the benchmark.","next_action_hint":"Keep existing math.isclose-based analysis logic; avoid this micro substitution."}}
{"run":56,"commit":"6f6ee89","metric":142.790922,"metrics":{"best_ms":141.461674,"quality_sum":2.491129377057,"quality_min":0.589775903809,"team_count":4},"status":"discard","description":"Switched canonical score-cache identity tuple construction from `sorted(id(person) for person in people)` to `sorted(map(id, people))`, but this alternative was slower in end-to-end runtime.","timestamp":1775183451987,"segment":0,"confidence":38.795137832307645,"iterationTokens":954,"asi":{"hypothesis":"Using map(id, people) might reduce generator overhead in canonical score-cache key construction.","rollback_reason":"No benefit observed; this variant regressed relative to the current best.","next_action_hint":"Keep the existing `sorted(id(person) for person in people)` implementation."}}
{"run":57,"commit":"6f6ee89","metric":146.207639,"metrics":{"best_ms":142.818444,"quality_sum":2.491129377057,"quality_min":0.589775903809,"team_count":4},"status":"discard","description":"Precomputed explicit social-preference neighbor sets in shortlist_scorers and threaded them into candidate_social_potential to avoid repeated has_explicit_social_preferences scans, but added set/dict overhead regressed runtime.","timestamp":1775183535928,"segment":0,"confidence":38.36186019071371,"iterationTokens":2251,"asi":{"hypothesis":"Replacing repeated preference-list scans with prebuilt neighbor sets would speed candidate_social_potential in compat mode.","rollback_reason":"Set materialization/lookups and extra branching were slower than the current path on this workload.","next_action_hint":"Keep existing social-potential checks; this precompute strategy is not profitable here."}}
{"run":58,"commit":"6f6ee89","metric":155.734307,"metrics":{"best_ms":152.769148,"quality_sum":2.491129377057,"quality_min":0.589775903809,"team_count":4},"status":"discard","description":"Added request-scoped cache of canonical people-key tuples keyed by tuple-object identity to avoid repeated `tuple(sorted(id(...)))` work in cached_score_team, but cache lookup/identity-guard overhead regressed runtime.","timestamp":1775183677064,"segment":0,"confidence":38.795137832307645,"iterationTokens":2251,"asi":{"hypothesis":"Reusing canonicalized score-cache people keys for repeated candidate tuple objects should cut sort overhead in cached_score_team.","rollback_reason":"Extra dictionary and identity-guard bookkeeping outweighed saved key canonicalization cost.","next_action_hint":"Keep direct canonicalization path in cached_score_team; focus on larger hotspots such as _compat_member_priority_order or candidate_combinations."}}
{"run":59,"commit":"6f6ee89","metric":155.273839,"metrics":{"best_ms":152.228271,"quality_sum":2.491129377057,"quality_min":0.589775903809,"team_count":4},"status":"discard","description":"Tried reducing tuple materialization in _compat_member_priority_order by keeping priority lists as sorted lists (and switching rich path to generator-based sorted input), but this regressed runtime significantly.","timestamp":1775183779204,"segment":0,"confidence":39.10716180262567,"iterationTokens":2606,"asi":{"hypothesis":"Avoiding tuple(...) wrapping in member-priority keys should cut allocation overhead in a hot compat helper.","rollback_reason":"List-based keys and generator shape were slower than the original tuple-based implementation.","next_action_hint":"Keep existing tuple-based priority keys; this helper is sensitive to Python comparison/allocation tradeoffs."}}
{"run":60,"commit":"6f6ee89","metric":148.992783,"metrics":{"best_ms":146.548494,"quality_sum":2.491129377057,"quality_min":0.589775903809,"team_count":4},"status":"discard","description":"Replaced full ranking sorts in candidate_combinations with `heapq.nlargest(shortlist_size, ...)` for primary and alternate scorers to avoid sorting entire people lists, but this regressed runtime.","timestamp":1775183852628,"segment":0,"confidence":40.74909949107557,"iterationTokens":1210,"asi":{"hypothesis":"Since shortlist extraction only consumes top shortlist_size entries, nlargest should be cheaper than full sorted(..., reverse=True).","rollback_reason":"For this workload (small people lists, many invocations), nlargest overhead outweighed full-sort costs.","next_action_hint":"Keep full sorted rankings in candidate_combinations."}}
