{"run":761,"commit":"a7d5a8f","metric":0.141548,"metrics":{"best_ms":0.115619,"quality_sum":2.491129377057,"quality_min":0.589775903809,"team_count":4},"status":"discard","description":"Immediate no-code confirmation rerun on kept fixed-size indexed people-payload fill commit a7d5a8f.","timestamp":1775542231637,"segment":0,"confidence":26.440913153893543,"iterationTokens":774,"asi":{"hypothesis":"If a7d5a8f is robust, rerun should remain near low-band sample.","rollback_reason":"No code change; validation-only rerun.","next_action_hint":"Retain a7d5a8f but require additional paired samples before claiming durable effect due ongoing host variance.","noise_observation":"Median returned to slower band while best remained low, indicating high transient jitter."}}
{"run":762,"commit":"a7d5a8f","metric":0.133172,"metrics":{"best_ms":0.127932,"quality_sum":2.491129377057,"quality_min":0.589775903809,"team_count":4},"status":"discard","description":"No-code baseline rerun after ideas update for new keep head a7d5a8f.","timestamp":1775542297784,"segment":0,"confidence":26.448036699151032,"iterationTokens":1748,"asi":{"hypothesis":"Ideas maintenance should preserve behavior/performance while re-sampling current warm regime.","rollback_reason":"No source-code change; validation-only run.","next_action_hint":"Continue collecting paired confirmations for a7d5a8f before extrapolating durable gains.","noise_observation":"Median settled in mid-band with stable quality metrics."}}
{"run":763,"commit":"a7d5a8f","metric":0.156717,"metrics":{"best_ms":0.129926,"quality_sum":2.491129377057,"quality_min":0.589775903809,"team_count":4},"status":"discard","description":"Additional no-code baseline sample to gauge stability of current a7d5a8f head under host variance.","timestamp":1775542340108,"segment":0,"confidence":26.45516408380482,"iterationTokens":642,"asi":{"hypothesis":"Repeated baseline samples help determine whether recent keep-level gains hold across transient regime shifts.","rollback_reason":"No source-code change; validation-only run.","next_action_hint":"Treat current delta as provisional until more paired samples in a stable host window.","noise_observation":"Median drifted back into slower band while quality metrics remained constant."}}
{"run":764,"commit":"a7d5a8f","metric":0.153831,"metrics":{"best_ms":0.131409,"quality_sum":2.491129377057,"quality_min":0.589775903809,"team_count":4},"status":"discard","description":"Tried fixed-size payload preallocation variant using `cast(list[dict[str, object]], [None] * len(assignment_items))` instead of placeholder-dict list before indexed fill.","timestamp":1775542407036,"segment":0,"confidence":26.455592246549628,"iterationTokens":2117,"asi":{"hypothesis":"Avoiding placeholder dict allocations in indexed payload fill may further improve output-loop cost.","rollback_reason":"Regressed in current warm regime; cast + `[None]*n` variant slower than placeholder-dict indexed fill baseline.","next_action_hint":"Keep current a7d5a8f indexed-fill implementation; avoid None-cast preallocation variants.","observation":"Checks passed and quality metrics unchanged."}}
{"run":765,"commit":"a7d5a8f","metric":0.173959,"metrics":{"best_ms":0.144764,"quality_sum":2.491129377057,"quality_min":0.589775903809,"team_count":4},"status":"discard","description":"No-code baseline rerun after pruning regressed `[None]*n` cast preallocation payload variant.","timestamp":1775542460195,"segment":0,"confidence":26.45602042315383,"iterationTokens":856,"asi":{"hypothesis":"Ideas-only rollback should restore baseline while tracking current host drift.","rollback_reason":"No source-code change; validation-only run.","next_action_hint":"Stick with current a7d5a8f payload fill and avoid further preallocation-shape micro-variants for now.","noise_observation":"Host drifted into a slower transient band; quality metrics remained unchanged."}}
{"run":766,"commit":"a7d5a8f","metric":0.13176,"metrics":{"best_ms":0.124957,"quality_sum":2.491129377057,"quality_min":0.589775903809,"team_count":4},"status":"discard","description":"Tried list-comprehension staging for `improve_allocations` memo key: build `allocation_signatures` list first, then tuple-wrap, replacing direct tuple generator construction.","timestamp":1775542721103,"segment":0,"confidence":26.470899362036043,"iterationTokens":13307,"asi":{"hypothesis":"For tiny allocation count, list-comprehension staging might reduce generator overhead in improve-cache key construction.","rollback_reason":"No clear gain in current regime; added temporary list/object churn for near-noise result.","next_action_hint":"Keep direct tuple-generator construction for improve-cache key signatures.","observation":"Checks passed and quality metrics unchanged."}}
{"run":767,"commit":"a7d5a8f","metric":0.133964,"metrics":{"best_ms":0.129375,"quality_sum":2.491129377057,"quality_min":0.589775903809,"team_count":4},"status":"discard","description":"No-code baseline rerun after pruning temporary-list improve-cache-key staging variant.","timestamp":1775542777658,"segment":0,"confidence":26.485795046248445,"iterationTokens":958,"asi":{"hypothesis":"Ideas-only update should preserve behavior while re-sampling warm-band variance.","rollback_reason":"No source-code change; validation-only run.","next_action_hint":"Continue testing only candidates with plausible signal above current jitter floor.","noise_observation":"Median remained in mid warm band; quality metrics unchanged."}}
{"run":768,"commit":"a7d5a8f","metric":0.156867,"metrics":{"best_ms":0.133232,"quality_sum":2.491129377057,"quality_min":0.589775903809,"team_count":4},"status":"discard","description":"Tried replacing tuple-unpack list copies on warm cache hits with `list(...)` constructors in `greedy_allocations` and `improve_allocations` return paths.","timestamp":1775542858737,"segment":0,"confidence":26.55389114685517,"iterationTokens":2160,"asi":{"hypothesis":"`list(tuple_value)` might be cheaper than unpack-based list copy (`[*tuple_value]`) on hot warm-cache return paths.","rollback_reason":"Regressed in current regime; constructor-based copying was slower.","next_action_hint":"Keep unpack-based list copies for cached greedy/improve return values.","observation":"Checks passed and quality metrics unchanged."}}
{"run":769,"commit":"a7d5a8f","metric":0.157258,"metrics":{"best_ms":0.125527,"quality_sum":2.491129377057,"quality_min":0.589775903809,"team_count":4},"status":"discard","description":"No-code baseline rerun after pruning regressed warm-cache list-copy constructor variant.","timestamp":1775542907284,"segment":0,"confidence":26.622338305964565,"iterationTokens":846,"asi":{"hypothesis":"Ideas-only update should preserve behavior while sampling current host band after rollback.","rollback_reason":"No source-code change; validation-only run.","next_action_hint":"De-prioritize container-copy micro-variants and focus on higher-leverage structural work.","noise_observation":"Median stayed in slower warm band while quality remained stable."}}
{"run":770,"commit":"a7d5a8f","metric":0.147009,"metrics":{"best_ms":0.129425,"quality_sum":2.491129377057,"quality_min":0.589775903809,"team_count":4},"status":"discard","description":"Tried fixed-size indexed fill for `teams_payload` list itself (preallocate by allocation count and assign by payload index) instead of append-based team payload construction.","timestamp":1775542976801,"segment":0,"confidence":26.726580217228864,"iterationTokens":2304,"asi":{"hypothesis":"Mirroring the kept indexed-fill pattern used for `people_payload` might reduce output-loop overhead for top-level teams list.","rollback_reason":"Regressed in current warm regime; extra placeholder allocation/index assignment outweighed append path.","next_action_hint":"Keep append-based `teams_payload` construction while retaining indexed-fill only for `people_payload`.","observation":"Checks passed and quality metrics unchanged."}}
{"run":771,"commit":"a7d5a8f","metric":0.15297,"metrics":{"best_ms":0.124556,"quality_sum":2.491129377057,"quality_min":0.589775903809,"team_count":4},"status":"discard","description":"No-code baseline rerun after pruning regressed top-level teams-payload indexed-fill variant.","timestamp":1775543024477,"segment":0,"confidence":26.831641672694396,"iterationTokens":823,"asi":{"hypothesis":"Ideas-only update should preserve behavior; rerun tracks current post-rollback host band.","rollback_reason":"No source-code change; validation-only run.","next_action_hint":"Avoid further top-level payload container shape micro-tuning; prioritize higher-signal changes.","noise_observation":"Median remains in slower transient warm band while quality monitors are stable."}}
{"run":772,"commit":"a7d5a8f","metric":0.145966,"metrics":{"best_ms":0.132771,"quality_sum":2.491129377057,"quality_min":0.589775903809,"team_count":4},"status":"discard","description":"Replaced `math.comb` calls in `capped_candidate_search_is_exact` with small team-size arithmetic fast paths (`k` 0..4) plus fallback to `math.comb` for larger sizes.","timestamp":1775543105571,"segment":0,"confidence":26.84007788764688,"iterationTokens":3115,"asi":{"hypothesis":"Exactness guard runs every call; avoiding repeated `math.comb` for common small team sizes might reduce warm entry overhead.","rollback_reason":"Regressed in current regime; added branching/arithmetic complexity did not beat direct `math.comb` path.","next_action_hint":"Keep simpler `math.comb`-based exactness guard.","observation":"Checks passed and quality metrics unchanged."}}
{"run":773,"commit":"a7d5a8f","metric":0.127852,"metrics":{"best_ms":0.126379,"quality_sum":2.491129377057,"quality_min":0.589775903809,"team_count":4},"status":"discard","description":"No-code baseline rerun after pruning regressed small-`k` exactness-arithmetic fast-path rewrite.","timestamp":1775543160162,"segment":0,"confidence":26.8476994636254,"iterationTokens":889,"asi":{"hypothesis":"Ideas-only rollback should preserve behavior and re-sample current warm-band floor.","rollback_reason":"No source-code change; validation-only run.","next_action_hint":"Avoid further exactness-guard arithmetic micro-variants; keep focus on larger structural opportunities.","noise_observation":"Median returned to lower warm band with stable quality metrics."}}
{"run":774,"commit":"a7d5a8f","metric":0.147649,"metrics":{"best_ms":0.119687,"quality_sum":2.491129377057,"quality_min":0.589775903809,"team_count":4},"status":"discard","description":"Tried `len(assignment_items)==4` unrolled people-payload list-literal fast path (direct 4-slot dict construction) with indexed-fill fallback for other sizes.","timestamp":1775543234815,"segment":0,"confidence":26.864982131388437,"iterationTokens":2619,"asi":{"hypothesis":"Benchmark teams are size 4, so unrolled 4-entry people payload construction might beat generic indexed fill loop.","rollback_reason":"Regressed in current regime; branch + repeated indexed tuple access outweighed loop savings.","next_action_hint":"Keep generic indexed-fill people payload construction from a7d5a8f.","observation":"Checks passed and quality metrics unchanged."}}
{"run":775,"commit":"a7d5a8f","metric":0.128514,"metrics":{"best_ms":0.111641,"quality_sum":2.491129377057,"quality_min":0.589775903809,"team_count":4},"status":"discard","description":"No-code baseline rerun after pruning regressed `len==4` unrolled people-payload fast path.","timestamp":1775543283189,"segment":0,"confidence":26.88203025420054,"iterationTokens":836,"asi":{"hypothesis":"Ideas-only rollback should preserve behavior and re-sample warm-band baseline.","rollback_reason":"No source-code change; validation-only run.","next_action_hint":"Keep a7d5a8f payload path unchanged and deprioritize further unrolled output micro-tuning.","noise_observation":"Median returned toward lower warm band; quality metrics stable."}}
{"run":776,"commit":"a7d5a8f","metric":0.133543,"metrics":{"best_ms":0.130868,"quality_sum":2.491129377057,"quality_min":0.589775903809,"team_count":4},"status":"discard","description":"Tried placeholder-list creation rewrite for indexed people payload fill (`[{} for _ in range(n)]` -> `[{}] * n`) in both output-order branches.","timestamp":1775543370398,"segment":0,"confidence":26.894910221146834,"iterationTokens":2633,"asi":{"hypothesis":"List multiplication may reduce placeholder-allocation overhead before indexed dict assignment.","rollback_reason":"No clear improvement in current regime; near-noise/slightly slower.","next_action_hint":"Keep list-comprehension placeholder allocation in people payload indexed-fill path.","observation":"Checks passed and quality metrics unchanged."}}
{"run":777,"commit":"a7d5a8f","metric":0.149513,"metrics":{"best_ms":0.134956,"quality_sum":2.491129377057,"quality_min":0.589775903809,"team_count":4},"status":"discard","description":"No-code baseline rerun after pruning placeholder-list multiplication variant in indexed people-payload path.","timestamp":1775543421123,"segment":0,"confidence":26.90836884372579,"iterationTokens":810,"asi":{"hypothesis":"Ideas-only update should preserve behavior while re-sampling host drift.","rollback_reason":"No source-code change; validation-only run.","next_action_hint":"Stop iterating placeholder-container micro-variants; focus on higher-signal structural paths.","noise_observation":"Median moved back into slower transient warm band; quality metrics unchanged."}}
{"run":778,"commit":"a7d5a8f","metric":0.14251,"metrics":{"best_ms":0.125728,"quality_sum":2.491129377057,"quality_min":0.589775903809,"team_count":4},"status":"discard","description":"No-code baseline rerun after updating ideas with fresh-request diagnostic refresh (~44–45ms median, best ~43.8ms).","timestamp":1775543506154,"segment":0,"confidence":26.945964036423565,"iterationTokens":2549,"asi":{"hypothesis":"Ideas-only diagnostic update should not affect warm benchmark behavior.","rollback_reason":"No source-code change; validation-only run.","next_action_hint":"Continue tracking warm-vs-fresh gap to avoid over-attributing request-reuse-specific wins.","fresh_diagnostic":"External fresh-request check (non-primary harness) measured ~44.053ms median, ~43.792ms best over 7 samples."}}
{"run":779,"commit":"a7d5a8f","metric":0.123745,"metrics":{"best_ms":0.109568,"quality_sum":2.491129377057,"quality_min":0.589775903809,"team_count":4},"status":"checks_failed","description":"Attempted to remove runtime `typing.cast(...)` call in improve-cache key by using raw `allocation.team_signature` expression and dropping `cast` import.","timestamp":1775543592120,"segment":0,"confidence":26.983405678199954,"iterationTokens":2538,"asi":{"hypothesis":"Eliminating per-allocation `cast(...)` runtime calls in warm improve-cache key construction may shave overhead.","rollback_reason":"Type checks failed (`ty` invalid-assignment/invalid-argument-type) because `allocation.team_signature` remains optional in key tuple type.","next_action_hint":"Keep typed `cast(...)` or introduce a type-safe narrowing strategy that passes `ty` without runtime regressions.","error_details":"`ty` flagged optional team_signature in improve_cache_key and reported unused type-ignore."}}
{"run":780,"commit":"a7d5a8f","metric":0.135246,"metrics":{"best_ms":0.122382,"quality_sum":2.491129377057,"quality_min":0.589775903809,"team_count":4},"status":"discard","description":"Recovery no-code baseline run after pruning failed cast-removal (`team_signature` optional typing) attempt.","timestamp":1775543641677,"segment":0,"confidence":27.004473460490622,"iterationTokens":1908,"asi":{"hypothesis":"Rollback from checks-failed cast-removal experiment should restore baseline behavior/performance.","rollback_reason":"No source-code change; validation-only run.","next_action_hint":"Keep type-safe cast path for improve-cache key unless a proven, ty-clean narrowing approach emerges.","noise_observation":"Warm median returned to mid band with stable quality metrics."}}
{"run":781,"commit":"a7d5a8f","metric":0.133964,"metrics":{"best_ms":0.122652,"quality_sum":2.491129377057,"quality_min":0.589775903809,"team_count":4},"status":"discard","description":"Retried deterministic form-level greedy warm-hit shortcut with lower duplication: precompute/probe greedy cache key in `form_teams`, skip exact-check on hit, and pass optional `precomputed_cache_key` into `greedy_allocations` on miss.","timestamp":1775543778507,"segment":0,"confidence":27.025574166591714,"iterationTokens":6814,"asi":{"hypothesis":"Skipping `capped_candidate_search_is_exact` and reusing a precomputed greedy cache key may reduce warm-path overhead without contract changes.","rollback_reason":"No clear gain in current regime; extra precheck/typing complexity for near-noise result.","next_action_hint":"Keep existing exact→greedy flow and avoid additional form-level greedy shortcut plumbing unless stronger signal appears.","observation":"Checks passed and quality metrics unchanged."}}
{"run":782,"commit":"a7d5a8f","metric":0.146227,"metrics":{"best_ms":0.13171,"quality_sum":2.491129377057,"quality_min":0.589775903809,"team_count":4},"status":"discard","description":"No-code baseline rerun after pruning repeated deterministic form-level greedy shortcut retry (with precomputed key plumbing).","timestamp":1775543834927,"segment":0,"confidence":27.060109163884476,"iterationTokens":995,"asi":{"hypothesis":"Ideas-only update should preserve baseline and re-sample current host regime.","rollback_reason":"No source-code change; validation-only run.","next_action_hint":"Stop revisiting deterministic form-level greedy shortcut variants without materially new approach.","noise_observation":"Median drifted into slower warm band; quality metrics remained stable."}}
{"run":783,"commit":"a7d5a8f","metric":0.131619,"metrics":{"best_ms":0.127081,"quality_sum":2.491129377057,"quality_min":0.589775903809,"team_count":4},"status":"discard","description":"Tried indexed people-payload fill loop rewrite from `enumerate(assignment_items)` to `for index in range(len(...))` + indexed tuple unpack in both output-order branches.","timestamp":1775543906692,"segment":0,"confidence":27.09473253613979,"iterationTokens":2160,"asi":{"hypothesis":"Range-based indexed access may reduce tuple-unpack iterator overhead versus enumerate in tiny fixed-size payload loops.","rollback_reason":"No clear improvement; near-noise/slightly slower in current regime.","next_action_hint":"Keep `enumerate(...)`-based indexed people payload fill.","observation":"Checks passed and quality metrics unchanged."}}
{"run":784,"commit":"a7d5a8f","metric":0.14768,"metrics":{"best_ms":0.134174,"quality_sum":2.491129377057,"quality_min":0.589775903809,"team_count":4},"status":"discard","description":"No-code baseline rerun after pruning regressed enumerate->range indexed people-payload rewrite.","timestamp":1775543957298,"segment":0,"confidence":27.192501151673145,"iterationTokens":822,"asi":{"hypothesis":"Ideas-only update should preserve behavior while re-checking current warm band.","rollback_reason":"No source-code change; validation-only run.","next_action_hint":"De-prioritize further payload-loop iterator-form micro-tweaks.","noise_observation":"Median in slower warm band; quality metrics unchanged."}}
{"run":785,"commit":"a7d5a8f","metric":0.13202,"metrics":{"best_ms":0.114787,"quality_sum":2.491129377057,"quality_min":0.589775903809,"team_count":4},"status":"discard","description":"Tried task-order warm-cache copy rewrite in `form_teams` (`[*cached_task_order[1]]` -> `list(cached_task_order[1])`).","timestamp":1775544014922,"segment":0,"confidence":27.29097789884763,"iterationTokens":853,"asi":{"hypothesis":"`list(tuple_value)` might copy cached task-order tuples faster than unpack-list syntax on warm path.","rollback_reason":"No clear gain; near-noise/slightly slower in current regime.","next_action_hint":"Keep unpack-based task-order cache copy (`[*cached_task_order[1]]`).","observation":"Checks passed and quality metrics unchanged."}}
{"run":786,"commit":"a7d5a8f","metric":0.14787,"metrics":{"best_ms":0.131418,"quality_sum":2.491129377057,"quality_min":0.589775903809,"team_count":4},"status":"discard","description":"No-code baseline rerun after pruning regressed task-order cache copy constructor variant.","timestamp":1775544066125,"segment":0,"confidence":27.29577864486241,"iterationTokens":897,"asi":{"hypothesis":"Ideas-only update should preserve warm-path behavior while tracking host drift.","rollback_reason":"No source-code change; validation-only run.","next_action_hint":"Avoid additional task-order cache copy micro-variants.","noise_observation":"Median remained in slower warm band with stable quality monitors."}}
{"run":787,"commit":"a7d5a8f","metric":0.153681,"metrics":{"best_ms":0.135828,"quality_sum":2.491129377057,"quality_min":0.589775903809,"team_count":4},"status":"discard","description":"No-code baseline sample to monitor current warm-band drift after recent micro-variant pruning.","timestamp":1775544130147,"segment":0,"confidence":27.300581080169323,"iterationTokens":1434,"asi":{"hypothesis":"Repeated baseline sampling is needed while host variance remains high and remaining micro-candidates are low-signal.","rollback_reason":"No source-code change; validation-only run.","next_action_hint":"Require bundled/paired evidence before any future keep decisions in this volatile regime.","noise_observation":"Sample remained in slower transient band with unchanged quality monitors."}}
