{"run":158,"commit":"d58c8db","metric":143.741041,"metrics":{"best_ms":143.28096,"quality_sum":2.491129377057,"quality_min":0.589775903809,"team_count":4},"status":"discard","description":"Retested gating `_compat_has_perfect_positive_matching` behind `rescued_values` in square-team compat assignment (skip matching check when greedy already produced full positive cover). Repeat run remained ~143.7ms and still above incumbent best.","timestamp":1775194497560,"segment":0,"confidence":81.87647639695906,"iterationTokens":569,"asi":{"hypothesis":"Perfect-matching verification is redundant when no rescue values were needed in square-team compat assignments.","rollback_reason":"Consistent improvement versus many recent trials but still not enough to beat incumbent best commit metric.","next_action_hint":"Keep this as a combination candidate only if paired with additional compat-path reductions; alone it is insufficient."}}
{"run":159,"commit":"d58c8db","metric":147.628171,"metrics":{"best_ms":145.049949,"quality_sum":2.491129377057,"quality_min":0.589775903809,"team_count":4},"status":"discard","description":"Precomputed per-person explicit teammate-id sets once in shortlist_scorers and used set membership in candidate_social_potential (instead of repeated has_explicit_social_preferences scans) for COMPAT social gating. This regressed.","timestamp":1775194579922,"segment":0,"confidence":83.44449742995972,"iterationTokens":3009,"asi":{"hypothesis":"Precomputing explicit-preference ID sets should reduce repeated preference-list scans in candidate_social_potential.","rollback_reason":"Building and consulting per-person sets added overhead that outweighed direct list-scan checks.","next_action_hint":"Avoid explicit-preference set precomputation in shortlist_scorers."}}
{"run":160,"commit":"d58c8db","metric":151.872156,"metrics":{"best_ms":149.045996,"quality_sum":2.491129377057,"quality_min":0.589775903809,"team_count":4},"status":"discard","description":"Introduced `_top_partner_mean` with fixed-size top-k fast paths (k=1/2/3) and replaced full `sorted(..., reverse=True)[:k]` in candidate social/personality potentials. This regressed.","timestamp":1775194684656,"segment":0,"confidence":84.35600524026317,"iterationTokens":4494,"asi":{"hypothesis":"Avoiding full list sorts for tiny partner counts should reduce shortlist potential-scoring overhead.","rollback_reason":"Manual top-k logic added Python branching overhead and was slower than built-in sorted for these small lists.","next_action_hint":"Keep existing sorted-slice implementation for candidate potentials."}}
{"run":161,"commit":"d58c8db","metric":149.1068,"metrics":{"best_ms":146.383494,"quality_sum":2.491129377057,"quality_min":0.589775903809,"team_count":4},"status":"discard","description":"Switched request-scoped personality/social component cache signatures from sorted member-id strings to sorted member object identities (`tuple[int, ...]`) to avoid string sorting/comparison in score_team cache keys. This regressed.","timestamp":1775194767260,"segment":0,"confidence":85.45751024043881,"iterationTokens":2006,"asi":{"hypothesis":"Integer identity signatures for team-component caches should be cheaper than string-id signatures while preserving per-request correctness.","rollback_reason":"Identity-signature construction/lookup did not outperform existing string-signature path.","next_action_hint":"Keep team-component cache keys based on member.id signatures."}}
{"run":162,"commit":"d58c8db","metric":155.07957,"metrics":{"best_ms":150.162309,"quality_sum":2.491129377057,"quality_min":0.589775903809,"team_count":4},"status":"checks_failed","description":"Tried a greedy-selection redesign: when candidate_combinations already used scored ranking (`total_candidates > max_candidate_teams`), evaluate candidates only until quality drops below the top score and apply deterministic tie-break only within that top-quality prefix. Initial version failed Ruff E501 and benchmark trend regressed.","timestamp":1775194903673,"segment":0,"confidence":85.07374962345999,"iterationTokens":5046,"asi":{"hypothesis":"For non-random capped tasks, candidate_combinations returns quality-sorted candidates, so rescoring all candidates in greedy_allocations is unnecessary; only top-quality ties need evaluation.","rollback_reason":"Implementation failed lint (E501) and showed slower runtime trend.","next_action_hint":"If retried, keep lint-safe formatting and validate that prefix-only rescoring actually reduces overhead before broader adoption.","failure_surface":"src/team2form/formation.py E501"}}
{"run":163,"commit":"d58c8db","metric":159.215411,"metrics":{"best_ms":154.210033,"quality_sum":2.491129377057,"quality_min":0.589775903809,"team_count":4},"status":"discard","description":"Tried reducing `math.isclose` calls in `_compat_member_task_analysis` by adding exact-equality short-circuits (`value == best_value`) before tolerance checks and applying the same pattern in `other_member_best_values` construction. This regressed heavily.","timestamp":1775194988603,"segment":0,"confidence":84.40504654383854,"iterationTokens":2182,"asi":{"hypothesis":"Many task values are exactly equal (especially 0.0), so short-circuiting equality before `math.isclose` should cut hot-path tolerance checks.","rollback_reason":"Extra branching/boolean logic increased overhead more than it reduced `math.isclose` usage.","next_action_hint":"Keep the original concise `math.isclose` conditions in compat analysis."}}
{"run":164,"commit":"d58c8db","metric":150.192897,"metrics":{"best_ms":147.147701,"quality_sum":2.491129377057,"quality_min":0.589775903809,"team_count":4},"status":"discard","description":"Replaced scored top-k heap maintenance in `candidate_combinations` with full materialize+sort of all scored shortlist combinations, then sliced top `max_candidate_teams`. This regressed.","timestamp":1775195081294,"segment":0,"confidence":85.07374962345999,"iterationTokens":1472,"asi":{"hypothesis":"When shortlist combination count is near cap, a single full sort may beat repeated Python-level heappush/heapreplace operations.","rollback_reason":"Materializing and sorting the full scored list was slower than incremental heap selection.","next_action_hint":"Keep heap-based top-k path in `candidate_combinations` for scored ranking."}}
{"run":165,"commit":"d58c8db","metric":161.123603,"metrics":{"best_ms":158.627276,"quality_sum":2.491129377057,"quality_min":0.589775903809,"team_count":4},"status":"discard","description":"Tried a broader shortlist redesign by disabling alternate scorer ranked lists when `combination_scorer` is present (scored capped path), keeping only primary scorer ordering before combination ranking. This regressed heavily.","timestamp":1775195179576,"segment":0,"confidence":84.40504654383854,"iterationTokens":2810,"asi":{"hypothesis":"In scored capped search, alternate shortlist rankings may be redundant because combination_scorer re-ranks teams anyway; dropping alternates should reduce shortlist sorting overhead.","rollback_reason":"Alternate-ranked shortlist diversity appears performance-critical; removing it degraded end-to-end runtime substantially.","next_action_hint":"Do not disable alternate_scorers in scored candidate_combinations path."}}
{"run":166,"commit":"d58c8db","metric":147.921687,"metrics":{"best_ms":142.625368,"quality_sum":2.491129377057,"quality_min":0.589775903809,"team_count":4},"status":"discard","description":"Added optional `ranked_output` capture in `candidate_combinations` and used it in non-random `greedy_allocations` to select the best candidate from top-quality ties without rescoring every returned candidate; fallback rescoring remains for random mode and unranked paths. This regressed.","timestamp":1775195344748,"segment":0,"confidence":85.07374962345999,"iterationTokens":2810,"asi":{"hypothesis":"Reusing candidate_combinations' computed quality ordering should remove many redundant cached_score_team calls in greedy selection.","rollback_reason":"Extra ranked-output plumbing/signature scans outweighed saved rescoring lookups in this workload.","next_action_hint":"Do not add ranked-output side channel to candidate_combinations in current form."}}
{"run":167,"commit":"d58c8db","metric":145.497606,"metrics":{"best_ms":144.243802,"quality_sum":2.491129377057,"quality_min":0.589775903809,"team_count":4},"status":"discard","description":"Rewrote `_task_preference_score` to avoid geometric_mean generator/list overhead: return `compat_default` directly when no task preferences and otherwise compute log-sum in a direct loop with early zero guard. This improved over many recent trials but still missed incumbent best.","timestamp":1775195467944,"segment":0,"confidence":85.45751024043881,"iterationTokens":5134,"asi":{"hypothesis":"`_task_preference_score` is hot; direct log-sum and constant-default fast path should reduce geometric_mean overhead without changing semantics.","rollback_reason":"Despite a decent gain, median runtime remained above current best commit.","next_action_hint":"Consider combining this task-preference fast path with a separate compat-assignment reduction in one experiment."}}
{"run":168,"commit":"d58c8db","metric":142.930797,"metrics":{"best_ms":142.053615,"quality_sum":2.491129377057,"quality_min":0.589775903809,"team_count":4},"status":"discard","description":"Refactored `improve_allocations` trial evaluation to compute objective deltas from cached quality aggregates (product/min/sum) instead of rebuilding `trial_allocations` and re-running `allocation_objective` on each attempted swap/replacement. This was a strong relative gain vs recent attempts but still above incumbent best.","timestamp":1775195588135,"segment":0,"confidence":85.84474877051905,"iterationTokens":5175,"asi":{"hypothesis":"Avoiding repeated list copies and full objective recomputation inside swap loops should reduce improve_allocations overhead without changing swap decisions.","rollback_reason":"Despite a sizable speedup versus recent variants, median runtime still did not beat the existing best kept commit.","next_action_hint":"Potentially combine this objective-delta approach with other independent wins; standalone it is insufficient."}}
{"run":169,"commit":"d58c8db","metric":141.175373,"metrics":{"best_ms":137.094476,"quality_sum":2.491129377057,"quality_min":0.589775903809,"team_count":4},"status":"discard","description":"Combined three previously promising reductions: (1) `_task_preference_score` direct fast path/log loop, (2) gate square-team `_compat_has_perfect_positive_matching` behind non-empty `rescued_values`, and (3) objective-delta trial evaluation in `improve_allocations` to avoid per-trial allocation copies/objective recomputation. Combined result improved strongly but still did not beat incumbent best.","timestamp":1775195683125,"segment":0,"confidence":84.05028557352402,"iterationTokens":3971,"asi":{"hypothesis":"These near-win changes target independent hotspots (_task_preference_score, compat perfect-matching checks, and swap objective evaluation) and should stack to exceed any single-change gain.","rollback_reason":"Even combined, median metric remained above current best kept run.","next_action_hint":"If revisited, pair this bundle with a genuinely new candidate-generation/compat-analysis reduction rather than more micro-tweaks."}}
{"run":170,"commit":"d58c8db","metric":152.27549,"metrics":{"best_ms":145.819366,"quality_sum":2.491129377057,"quality_min":0.589775903809,"team_count":4},"status":"discard","description":"Reworked scored top-k heap entries in `candidate_combinations` to store integer combination indices (`(score, -index, index)`) plus a side `all_combinations` list, avoiding tuple[Person,...] objects in heap comparisons. This regressed.","timestamp":1775195807290,"segment":0,"confidence":85.84474877051905,"iterationTokens":12634,"asi":{"hypothesis":"Using integer-backed heap entries should reduce comparison overhead in top-k maintenance versus carrying full combination tuples.","rollback_reason":"Extra side-list append/index indirection outweighed any heap-comparison savings.","next_action_hint":"Keep direct `(score, -index, combination)` heap entries."}}
{"run":171,"commit":"d58c8db","metric":141.872884,"metrics":{"best_ms":140.902436,"quality_sum":2.491129377057,"quality_min":0.589775903809,"team_count":4},"status":"discard","description":"Removed precomputed `other_member_best_values` matrix allocation from `_compat_member_task_analysis`; now it returns best/second-best/count vectors, and `_assign_task_skills_compat` computes `other_member_best` lazily per candidate task during priority evaluation. This improved significantly but remained above incumbent best.","timestamp":1775195888027,"segment":0,"confidence":84.05028557352402,"iterationTokens":1840,"asi":{"hypothesis":"Eliminating per-call member×task matrix materialization should reduce compat-analysis overhead, especially since assignment loop only needs a subset of entries.","rollback_reason":"Despite strong relative improvement, median still did not beat best kept commit.","next_action_hint":"Consider combining this lazy-other-member-best approach with another independent compat-path reduction."}}
{"run":172,"commit":"231b7b6","metric":136.520629,"metrics":{"best_ms":135.541806,"quality_sum":2.491129377057,"quality_min":0.589775903809,"team_count":4},"status":"keep","description":"Combined four independent hotspot reductions into one patchset: (1) `_task_preference_score` direct fast path/log loop (avoids geometric_mean generator/list overhead), (2) square-team compat perfect-matching check gated behind non-empty `rescued_values`, (3) `_compat_member_task_analysis` no longer materializes `other_member_best_values` matrix (lazy per-candidate computation in `_assign_task_skills_compat`), and (4) `improve_allocations` uses objective-delta math instead of per-trial list-copy+allocation_objective recomputation. This produced a clear new best while preserving quality metrics/checks.","timestamp":1775195982437,"segment":0,"confidence":82.5019048689958,"iterationTokens":3549,"asi":{"hypothesis":"Stacking several near-win, behavior-preserving reductions across independent hot paths should compound into a true end-to-end win.","combined_changes":["_task_preference_score direct computation","conditional perfect-matching check","lazy other-member-best in compat priority","objective-delta improve_allocations"],"observed_effect":"Large cumulative speedup with unchanged quality metrics and passing checks."}}
{"run":173,"commit":"231b7b6","metric":140.949585,"metrics":{"best_ms":137.733376,"quality_sum":2.491129377057,"quality_min":0.589775903809,"team_count":4},"status":"discard","description":"Inlined singleton explicit-social checks directly inside `candidate_social_potential` (removed set construction and `has_explicit_social_preferences` helper calls for COMPAT pair gating). This regressed versus new best.","timestamp":1775196071955,"segment":0,"confidence":82.39690673719396,"iterationTokens":3676,"asi":{"hypothesis":"Direct inline preference scans should reduce per-pair social-gating overhead versus helper+singleton-set calls.","rollback_reason":"Expanded inline loops/branching were slower than the existing helper-based approach in aggregate.","next_action_hint":"Keep current helper-based social gating."}}
{"run":174,"commit":"231b7b6","metric":138.05787,"metrics":{"best_ms":134.540461,"quality_sum":2.491129377057,"quality_min":0.589775903809,"team_count":4},"status":"discard","description":"In `_assign_task_skills_compat`, avoided `_compat_fill_uncovered_assignments` full assigned-count/uncovered scan when `covered_mask` already covers all task skills: use direct `_compat_sort_member_assignments` in no-uncovered path and reuse a single `finalized_assignments` object across subsequent return branches. This regressed vs current best.","timestamp":1775196162937,"segment":0,"confidence":82.20952852343025,"iterationTokens":3623,"asi":{"hypothesis":"Many compat teams have no uncovered skills; bypassing `_compat_fill_uncovered_assignments` in that case should cut redundant counting/scanning work.","rollback_reason":"Despite a decent runtime, this path still underperformed the current kept baseline.","next_action_hint":"Keep current unified finalize path unless paired with broader `_compat_fill_uncovered_assignments` redesign."}}
{"run":175,"commit":"13df519","metric":135.640353,"metrics":{"best_ms":131.943974,"quality_sum":2.491129377057,"quality_min":0.589775903809,"team_count":4},"status":"keep","description":"Optimized the new objective-delta `improve_allocations` path by precomputing per-round helper data (`clamped_qualities`, `min_without_index`, and per-pair `other_min`) so inner swap/replacement loops avoid repeated per-trial scans and repeated `max(..., 1e-12)` work. This produced a further best with checks/quality unchanged.","timestamp":1775196260906,"segment":0,"confidence":81.93563229322628,"iterationTokens":3487,"asi":{"hypothesis":"After moving to objective deltas, remaining overhead is repeated min/product support work inside inner loops; precomputing those per round should compound the gain.","followup_from":"231b7b6 objective-delta improve_allocations refactor","observed_effect":"Additional measurable win on top of prior keep."}}
{"run":176,"commit":"13df519","metric":139.96663,"metrics":{"best_ms":138.541492,"quality_sum":2.491129377057,"quality_min":0.589775903809,"team_count":4},"status":"discard","description":"Special-cased `_compat_fill_uncovered_assignments` for `max_skills_per_member==1` earlier in the flow: compute `max_skills_per_member` up front and return assignments directly when no uncovered skills (skipping `_compat_sort_member_assignments`), while preserving duplicate-skill count handling. This regressed.","timestamp":1775196392029,"segment":0,"confidence":80.3535928012592,"iterationTokens":5803,"asi":{"hypothesis":"Dominant square-team compat case has one skill per member, so bypassing no-op sort/extra branch work in `_compat_fill_uncovered_assignments` should reduce overhead.","rollback_reason":"Restructured branching and earlier max-skills handling slowed the overall path despite the singleton fast path.","next_action_hint":"Keep `_compat_fill_uncovered_assignments` structure from 13df519; singleton early-return tweak is not beneficial."}}
{"run":177,"commit":"13df519","metric":144.377592,"metrics":{"best_ms":140.849982,"quality_sum":2.491129377057,"quality_min":0.589775903809,"team_count":4},"status":"discard","description":"In `improve_allocations` replacement phase, replaced repeated `list(unused_people)` creation with a per-allocation immutable snapshot (`tuple(unused_people)`) to reduce loop allocation churn. This regressed strongly.","timestamp":1775196463203,"segment":0,"confidence":78.60632198004313,"iterationTokens":1182,"asi":{"hypothesis":"Avoiding repeated list copies in inner replacement loops should reduce overhead after objective-delta refactor.","rollback_reason":"Tuple snapshot creation/iteration pattern performed worse than existing list copy approach in this workload.","next_action_hint":"Keep `list(unused_people)` iteration in replacement loops."}}
{"run":178,"commit":"13df519","metric":140.578197,"metrics":{"best_ms":139.048902,"quality_sum":2.491129377057,"quality_min":0.589775903809,"team_count":4},"status":"checks_failed","description":"Retried uncapped-task greedy shortcut with a materially different approach: bypassed `shortlist_scorers`/`candidate_combinations` entirely when `C(remaining_people, team_size) <= max_candidate_teams` by directly enumerating `itertools.combinations`. This showed slower trend and hit Ruff E501 formatting.","timestamp":1775196570640,"segment":0,"confidence":77.32489953644345,"iterationTokens":3707,"asi":{"hypothesis":"Direct combination enumeration in uncapped tasks should remove unnecessary scorer setup and candidate_combinations overhead.","rollback_reason":"Benchmark regressed and lint failed due long combination_scorer lambda line.","next_action_hint":"Do not pursue uncapped greedy shortcut further without clear profiling evidence; prior variants consistently regress.","failure_surface":"src/team2form/formation.py E501"}}
{"run":179,"commit":"13df519","metric":148.513853,"metrics":{"best_ms":142.167207,"quality_sum":2.491129377057,"quality_min":0.589775903809,"team_count":4},"status":"discard","description":"Replaced `_compat_member_task_analysis` and related assignment-path `math.isclose` comparisons with exact float equality checks (`==`) to remove tolerance-call overhead. This regressed heavily.","timestamp":1775196653679,"segment":0,"confidence":78.60632198004313,"iterationTokens":1644,"asi":{"hypothesis":"Compat task values are sourced directly from member skill levels, so exact equality might be sufficient and faster than repeated `math.isclose` calls.","rollback_reason":"Exact-equality path performed substantially worse despite fewer tolerance calls.","next_action_hint":"Keep `math.isclose` logic in compat analysis/priority tie handling."}}
