{"run":272,"commit":"664567a","metric":83.474287,"metrics":{"best_ms":82.591024,"quality_sum":2.491129377057,"quality_min":0.589775903809,"team_count":4},"status":"keep","description":"For compat `max_skills_per_member==1` paths, replaced generic uncovered-fill finalization with a bitmask-driven single-capacity finalizer (`_compat_fill_uncovered_assignments_single_capacity`) that reuses `_assign_task_skills_compat`’s existing uncovered mask instead of rebuilding assignment-count dictionaries.","timestamp":1775321408042,"segment":0,"confidence":55.26645775145041,"iterationTokens":8158,"asi":{"hypothesis":"Most remaining compat finalize calls are singleton-capacity with uncovered skills; reusing the already-computed uncovered bitmask should remove repeated count/reconciliation overhead in `_compat_fill_uncovered_assignments`.","result":"Major new best with checks passing and unchanged quality/team-count metrics.","structural_change":"Introduced dedicated single-capacity uncovered finalizer and routed all max_skills_per_member==1 finalize/zero-score branches through it.","hotspots_touched":["_assign_task_skills_compat","_compat_fill_uncovered_assignments"]}}
{"run":273,"commit":"664567a","metric":82.72567,"metrics":{"best_ms":82.210163,"quality_sum":2.491129377057,"quality_min":0.589775903809,"team_count":4},"status":"discard","description":"No-code-change confirmation run after singleton-capacity bitmask finalizer keep, to validate the new baseline band under current host conditions.","timestamp":1775321460356,"segment":0,"confidence":55.26179824498639,"iterationTokens":867,"asi":{"hypothesis":"A replicate on unchanged HEAD should confirm whether the large gain is stable and not a transient outlier.","rollback_reason":"No code change; run logged for variance tracking only.","next_action_hint":"Treat low-80ms as the new baseline band; require clear additional wins before keeping follow-up tweaks.","noise_observation":"unchanged 664567a remained in ~82–83ms range, reinforcing stability of the latest keep"}}
{"run":274,"commit":"664567a","metric":84.35773,"metrics":{"best_ms":84.311292,"quality_sum":2.491129377057,"quality_min":0.589775903809,"team_count":4},"status":"discard","description":"Added heuristic seeding for greedy admissible-pruning tasks (`task_total<=128`): score a strong initial team from top `member_scorer` picks before scanning all combinations, to raise incumbent best earlier and increase safe pruning.","timestamp":1775321595366,"segment":0,"confidence":55.25540631374518,"iterationTokens":7605,"asi":{"hypothesis":"A better initial incumbent in small total<=cap tasks should prune more candidates and reduce expensive score_team calls.","rollback_reason":"Primary metric regressed; seeding overhead (additional scorer sorting + seed scoring) outweighed any extra pruning gains.","next_action_hint":"Keep incumbent-free scan in upper-bound branch; this heuristic seed does not pay off on benchmark workload.","result":"Checks passed and quality metrics stayed stable, but runtime increased versus best."}}
{"run":275,"commit":"664567a","metric":123.990959,"metrics":{"best_ms":122.083767,"quality_sum":2.491129377057,"quality_min":0.589775903809,"team_count":4},"status":"discard","description":"Refactored `_compat_member_priority_order` to define only the needed key function per branch (`require_all_members` vs rich-first), avoiding unconditional creation of both nested key closures each call.","timestamp":1775321670758,"segment":0,"confidence":54.9622503379642,"iterationTokens":1953,"asi":{"hypothesis":"Skipping unused closure creation in the hot priority-order helper should trim per-call overhead in compat assignment.","rollback_reason":"Primary metric regressed drastically; this branch-local function layout performed much worse under benchmark conditions.","next_action_hint":"Keep original dual-key-definition structure; avoid this closure-layout refactor.","result":"Checks passed with stable behavior metrics, but runtime degraded heavily."}}
{"run":276,"commit":"664567a","metric":122.039134,"metrics":{"best_ms":121.368212,"quality_sum":2.491129377057,"quality_min":0.589775903809,"team_count":4},"status":"discard","description":"Added `_geometric_mean_two_lists(first, second)` and switched `_assign_task_skills_compat` final score computation from `geometric_mean([*matched_values, *rescued_values])` to the dedicated two-list geometric mean helper to avoid list concatenation.","timestamp":1775321748445,"segment":0,"confidence":54.729073848252334,"iterationTokens":1947,"asi":{"hypothesis":"Avoiding per-call list concatenation for matched+rescued values should reduce compat scoring overhead in a hot return path.","rollback_reason":"Primary metric regressed heavily; this helper path is slower than existing list-concat + geometric_mean.","next_action_hint":"Keep existing geometric_mean call on concatenated list; do not pursue this helper specialization.","result":"Checks passed and quality metrics were stable, but runtime degraded significantly."}}
{"run":277,"commit":"664567a","metric":123.685691,"metrics":{"best_ms":122.659999,"quality_sum":2.491129377057,"quality_min":0.589775903809,"team_count":4},"status":"discard","description":"No-code-change stability probe on current best commit after a cluster of large regressions to detect host/runtime drift.","timestamp":1775321800381,"segment":0,"confidence":54.62458892377534,"iterationTokens":803,"asi":{"hypothesis":"A baseline rerun should confirm whether recent large slowdowns were code effects or environment variance.","rollback_reason":"No code change; result indicates the environment has shifted into a high-latency band.","next_action_hint":"Require repeated confirmation in the current run band before evaluating marginal optimizations.","noise_observation":"unchanged 664567a jumped from low-80ms to ~123ms median, confirming strong host variance"}}
{"run":278,"commit":"664567a","metric":125.521066,"metrics":{"best_ms":124.911132,"quality_sum":2.491129377057,"quality_min":0.589775903809,"team_count":4},"status":"discard","description":"Second no-code-change stability run on unchanged best commit to confirm current benchmark band after large drift.","timestamp":1775321856020,"segment":0,"confidence":54.61607081225645,"iterationTokens":723,"asi":{"hypothesis":"Repeated unchanged run should verify whether the elevated latency band persists.","rollback_reason":"No code change; measurement-only run.","next_action_hint":"Use this new high-latency band as temporary baseline and only keep changes that win clearly within it, then re-verify when host load normalizes.","noise_observation":"unchanged 664567a remained high (~125ms), indicating sustained environment shift"}}
{"run":279,"commit":"664567a","metric":123.670232,"metrics":{"best_ms":122.852053,"quality_sum":2.491129377057,"quality_min":0.589775903809,"team_count":4},"status":"discard","description":"Micro-tuned `_compat_fill_uncovered_assignments_single_capacity` by removing intermediate `uncovered_skill_ids` list materialization and assigning uncovered bitmask skills directly during member iteration.","timestamp":1775321956153,"segment":0,"confidence":54.561249598769,"iterationTokens":4066,"asi":{"hypothesis":"Direct bit-iteration assignment should be cheaper than building an uncovered-skill list before filling empty members in the singleton-capacity finalizer.","rollback_reason":"No primary improvement observed in current band; change did not beat incumbent best.","next_action_hint":"Keep existing helper shape unless retested under stabilized low-latency conditions.","result":"Checks passed and quality metrics remained stable, but runtime stayed in elevated band."}}
{"run":280,"commit":"664567a","metric":123.345627,"metrics":{"best_ms":123.140169,"quality_sum":2.491129377057,"quality_min":0.589775903809,"team_count":4},"status":"discard","description":"No-code-change baseline run to confirm the sustained high-latency benchmark band on current best commit.","timestamp":1775322010466,"segment":0,"confidence":54.005590280223416,"iterationTokens":694,"asi":{"hypothesis":"Unchanged rerun verifies whether current elevated measurements are environment-driven.","rollback_reason":"No code change; measurement-only run.","next_action_hint":"Continue only with high-leverage structural ideas until benchmark host conditions normalize.","noise_observation":"unchanged 664567a remains around ~123ms median in current environment window"}}
{"run":281,"commit":"664567a","metric":124.835288,"metrics":{"best_ms":124.050592,"quality_sum":2.491129377057,"quality_min":0.589775903809,"team_count":4},"status":"discard","description":"Tightened greedy admissible upper bound by replacing COMPAT skill term `alpha*1.0` with `alpha*max_matching_skill_level` per candidate (max task-skill level among team members for the current task), while keeping exact non-skill terms.","timestamp":1775322437355,"segment":0,"confidence":53.42159288866462,"iterationTokens":694,"asi":{"hypothesis":"A tighter but still admissible skill upper bound should prune more full score_team evaluations in greedy total<=cap tasks.","rollback_reason":"Did not beat incumbent best metric under current high-latency benchmark band; improvement signal is inconclusive/noisy.","next_action_hint":"Potentially revisit when host noise normalizes and validate with paired A/B runs, since candidate-level scored-count simulation suggested stronger pruning.","admissibility_basis":"Every compat assigned/rescued skill value is bounded by the maximum matching task-skill level present in the candidate team, so geometric-mean skill_score is bounded by that max."}}
{"run":282,"commit":"664567a","metric":121.836049,"metrics":{"best_ms":121.253125,"quality_sum":2.491129377057,"quality_min":0.589775903809,"team_count":4},"status":"discard","description":"No-code-change baseline run to track current environment drift while evaluating post-keep experiments.","timestamp":1775322505718,"segment":0,"confidence":52.95474978766518,"iterationTokens":1855,"asi":{"hypothesis":"Unchanged baseline rerun helps distinguish host variance from real code effects.","rollback_reason":"No code change; measurement-only run in ongoing high-latency band.","next_action_hint":"Continue prioritizing only structural/high-leverage ideas until benchmark host conditions return near low-80ms band.","noise_observation":"unchanged 664567a remained ~122ms median"}}
{"run":283,"commit":"664567a","metric":122.771221,"metrics":{"best_ms":121.506596,"quality_sum":2.491129377057,"quality_min":0.589775903809,"team_count":4},"status":"discard","description":"Candidate-combinations scored-path branch: for small shortlist totals (`C(shortlist, team_size) <= 2 * max_candidate_teams`), replaced heap top-k maintenance with full score-materialize + reverse sort + slice, preserving `(quality, -index)` tie semantics exactly.","timestamp":1775322645425,"segment":0,"confidence":52.49599534156708,"iterationTokens":5793,"asi":{"hypothesis":"When shortlist totals are only slightly above cap (e.g. 1001 vs 1000), full sort may be cheaper than per-entry heap maintenance in scored capped ranking.","rollback_reason":"No primary improvement observed under current elevated benchmark band; not enough evidence to keep.","next_action_hint":"If revisited, re-evaluate under stabilized low-latency conditions with paired A/B runs, since this change targets first-task scored ranking overhead.","tie_semantics":"Ranking remains based on the same `(score, -index)` ordering and output ordering."}}
{"run":284,"commit":"664567a","metric":121.864414,"metrics":{"best_ms":121.149089,"quality_sum":2.491129377057,"quality_min":0.589775903809,"team_count":4},"status":"discard","description":"No-code-change baseline run to monitor current noise floor before next structural attempt.","timestamp":1775322699403,"segment":0,"confidence":52.40006413208262,"iterationTokens":767,"asi":{"hypothesis":"Unchanged rerun should confirm whether host conditions remain in the elevated latency band.","rollback_reason":"No code change; measurement-only run.","next_action_hint":"Continue treating ~121–125ms as temporary noise band and focus on high-leverage algorithmic changes.","noise_observation":"unchanged 664567a stayed near ~122ms median"}}
{"run":285,"commit":"664567a","metric":122.806639,"metrics":{"best_ms":121.887437,"quality_sum":2.491129377057,"quality_min":0.589775903809,"team_count":4},"status":"discard","description":"No-code-change stability run to monitor whether benchmark host latency band has shifted back from elevated ~120ms range.","timestamp":1775322851669,"segment":0,"confidence":51.62687709347714,"iterationTokens":767,"asi":{"hypothesis":"Repeated unchanged runs should detect when environment noise/load returns near prior low-80ms band before judging marginal optimizations.","rollback_reason":"No code change; measurement-only run.","next_action_hint":"Continue periodic no-change probes; avoid interpreting small deltas while high-latency band persists.","noise_observation":"unchanged 664567a remains in ~122-125ms median band"}}
{"run":286,"commit":"664567a","metric":126.486748,"metrics":{"best_ms":122.403755,"quality_sum":2.491129377057,"quality_min":0.589775903809,"team_count":4},"status":"discard","description":"Tried a canonical team-identity key fast path in `cached_score_team`: for 4-person teams, avoid sorting when person object ids are already nondecreasing (`(id0,id1,id2,id3)`), otherwise fall back to sorted tuple.","timestamp":1775323058988,"segment":0,"confidence":51.49388622615617,"iterationTokens":8514,"asi":{"hypothesis":"Most candidate tuples are already in stable order; skipping per-call sort in hot cache-key construction could reduce `cached_score_team` overhead.","rollback_reason":"Primary metric regressed; extra branching/helper overhead outweighed avoided sorts in this implementation.","next_action_hint":"Keep current straightforward sorted-key construction for cached_score_team.","result":"Checks passed and behavior metrics unchanged, but runtime worsened in current band."}}
{"run":287,"commit":"664567a","metric":123.879941,"metrics":{"best_ms":123.163554,"quality_sum":2.491129377057,"quality_min":0.589775903809,"team_count":4},"status":"discard","description":"No-code-change stability run after key-construction experiment to re-establish current baseline band.","timestamp":1775323110001,"segment":0,"confidence":51.37342778489843,"iterationTokens":713,"asi":{"hypothesis":"A fresh unchanged run is needed to separate true regressions from the current elevated host-noise regime.","rollback_reason":"No code change; measurement-only run.","next_action_hint":"Continue prioritizing only large structural changes while environment remains around ~122-126ms.","noise_observation":"unchanged 664567a remained in elevated ~124ms median band"}}
{"run":288,"commit":"664567a","metric":121.700917,"metrics":{"best_ms":121.347347,"quality_sum":2.491129377057,"quality_min":0.589775903809,"team_count":4},"status":"checks_failed","description":"Greedy upper-bound helper rewrite: precompute per-task per-person log task-preference values in `greedy_allocations` and have `_compat_candidate_quality_upper_bound` compute exact geometric-mean task preference via summed logs, avoiding repeated dict+`math.log` work per candidate.","timestamp":1775323271304,"segment":0,"confidence":51.102325263375356,"iterationTokens":5933,"asi":{"hypothesis":"Replacing per-candidate `_task_preference_score` calls in the upper-bound helper with precomputed logged preferences should reduce bound-evaluation overhead.","rollback_reason":"Checks failed on Ruff E501 line length in the walrus-expression comprehension; run auto-reverted.","next_action_hint":"If retrying, split the value retrieval/log conversion across multiple lines without walrus to satisfy lint and rerun.","failure_surface":"src/team2form/formation.py E501 line length"}}
{"run":289,"commit":"664567a","metric":122.210632,"metrics":{"best_ms":122.122155,"quality_sum":2.491129377057,"quality_min":0.589775903809,"team_count":4},"status":"discard","description":"Retried greedy upper-bound task-preference optimization with lint-safe implementation: precompute per-person logged task preferences per task and compute exact geometric-mean task preference in `_compat_candidate_quality_upper_bound` via summed logs instead of calling `_task_preference_score`.","timestamp":1775323364557,"segment":0,"confidence":50.86756525856191,"iterationTokens":2405,"asi":{"hypothesis":"Precomputing task-preference logs should reduce repeated dict+log overhead in upper-bound evaluation for greedy total<=cap tasks.","rollback_reason":"Did not beat incumbent best metric; result remained within current elevated noise band.","next_action_hint":"Defer this optimization until host latency normalizes and reassess with paired reruns against unchanged baseline.","result":"Checks passed and behavior metrics stayed stable, but no convincing end-to-end gain."}}
{"run":290,"commit":"664567a","metric":124.811609,"metrics":{"best_ms":124.490992,"quality_sum":2.491129377057,"quality_min":0.589775903809,"team_count":4},"status":"discard","description":"No-code-change stability probe to monitor whether benchmark host conditions have exited the elevated ~120ms latency band.","timestamp":1775323427387,"segment":0,"confidence":50.152574082247256,"iterationTokens":958,"asi":{"hypothesis":"Repeated unchanged runs are needed to detect environment normalization before trusting sub-ms optimization deltas.","rollback_reason":"No code change; measurement-only run.","next_action_hint":"Continue with high-leverage algorithmic experiments and defer micro-tuning until baseline returns near low-80ms regime.","noise_observation":"unchanged 664567a remains in ~122-125ms band"}}
{"run":291,"commit":"664567a","metric":124.733151,"metrics":{"best_ms":123.380738,"quality_sum":2.491129377057,"quality_min":0.589775903809,"team_count":4},"status":"discard","description":"Additional no-code baseline confirmation under current environment to track persistence of high-latency band.","timestamp":1775323482266,"segment":0,"confidence":49.45740403995685,"iterationTokens":765,"asi":{"hypothesis":"Another unchanged run should verify whether the current ~120ms regime is stable enough to compare structural experiments within-band.","rollback_reason":"No code change; measurement-only run.","next_action_hint":"Treat elevated band as active baseline for now; prioritize only changes with expected multi-ms impact.","noise_observation":"unchanged 664567a continues clustering around ~124ms median"}}
{"run":292,"commit":"664567a","metric":121.119624,"metrics":{"best_ms":120.878607,"quality_sum":2.491129377057,"quality_min":0.589775903809,"team_count":4},"status":"discard","description":"Tightened greedy admissible bound with low-overhead precompute: per task, precompute each person’s max matching task-skill level and use `alpha * max_person_skill_upper` (instead of `alpha * 1.0`) inside `_compat_candidate_quality_upper_bound`, with exact non-skill components unchanged.","timestamp":1775323751786,"segment":0,"confidence":49.25581109026006,"iterationTokens":1426,"asi":{"hypothesis":"A tighter skill upper bound with cheap per-person precompute should increase safe pruning in greedy total<=cap tasks without paying the heavy per-candidate skill scan cost.","rollback_reason":"Did not beat incumbent all-time best (low-80ms regime); despite looking stronger in current high-latency band, signal is not sufficient for keep.","next_action_hint":"Re-test this patch with paired A/B repeats when host conditions return to low-latency baseline; keep only with confirmed primary improvement across environments.","admissibility_basis":"Compat assigned/rescued values are bounded by the maximum matching task-skill level present in the candidate team, so geometric-mean skill_score cannot exceed this bound."}}
{"run":293,"commit":"664567a","metric":123.98023,"metrics":{"best_ms":123.666807,"quality_sum":2.491129377057,"quality_min":0.589775903809,"team_count":4},"status":"discard","description":"Replaced `rich_first_priority_key` task sorting with a tiny stable insertion-sort over positive tasks (<=4 items) to avoid per-member `sorted(..., reverse=True)` overhead in `_compat_member_priority_order`.","timestamp":1775323851561,"segment":0,"confidence":49.05585489200145,"iterationTokens":2831,"asi":{"hypothesis":"For very small positive-task lists, manual insertion sort should be cheaper than Python’s generic sorted in the hot rich-first key path.","rollback_reason":"Primary metric did not improve; manual sort path was not faster end-to-end in current environment.","next_action_hint":"Keep built-in sorted-based key construction for rich-first ordering.","result":"Checks passed with unchanged behavior metrics, but no performance gain."}}
