{"run":514,"commit":"8f30a80","metric":1.603367,"metrics":{"best_ms":1.539054,"quality_sum":2.491129377057,"quality_min":0.589775903809,"team_count":4},"status":"discard","description":"No-code confirmation rerun on kept unrolled objective-comparison helpers commit 8f30a80.","timestamp":1775460629775,"segment":0,"confidence":16.06159813822938,"iterationTokens":772,"asi":{"hypothesis":"If 8f30a80 gain is robust, immediate rerun should remain near ~1.6ms band.","rollback_reason":"No code change; validation-only rerun.","next_action_hint":"Use 8f30a80 as active baseline and target only high-confidence reductions in remaining improve_allocations hot spots.","noise_observation":"Rerun matched/improved initial keep sample, supporting stability of this optimization."}}
{"run":515,"commit":"8f30a80","metric":1.463602,"metrics":{"best_ms":1.42064,"quality_sum":2.491129377057,"quality_min":0.589775903809,"team_count":4},"status":"checks_failed","description":"Precomputed and cached exact upper bounds in COMPAT cheap-bounded candidate caches (cap+1 and greedy <=cap) by computing social upper at cache-build time and storing `(cheap_upper, exact_upper, ...)`, then reused exact upper directly in pruning loops.","timestamp":1775460801093,"segment":0,"confidence":16.0216898750459,"iterationTokens":8051,"asi":{"hypothesis":"Once candidate caches are request-scoped, exact social upper recomputation each run is redundant; storing exact upper in cache should remove repeated `_compat_candidate_social_upper_bound` calls.","rollback_reason":"Checks failed on Ruff B007 (unused loop variable `team_signature` in two loops) after pruning-loop refactor.","next_action_hint":"Retry with Ruff-compliant `_team_signature` loop variable names and remeasure.","error_excerpt":"Ruff B007 at formation.py:1098 and formation.py:1935."}}
{"run":516,"commit":"2bcdb61","metric":1.404881,"metrics":{"best_ms":1.397547,"quality_sum":2.491129377057,"quality_min":0.589775903809,"team_count":4},"status":"keep","description":"Extended COMPAT cheap-bounded candidate caches (cap+1 shortlist path and greedy <=cap path) to store precomputed exact upper bounds at cache-build time: each cached entry now carries `(cheap_upper, exact_upper, ...)`, eliminating per-run `_compat_candidate_social_upper_bound` calls in pruning loops.","timestamp":1775460900329,"segment":0,"confidence":15.99440156055417,"iterationTokens":3236,"asi":{"hypothesis":"After request-scoped candidate-list caching, repeated exact-bound social lookups remained redundant; caching exact upper bounds alongside cheap bounds should reduce remaining pruning-loop overhead.","result":"Primary metric improved with checks passing and unchanged quality monitors.","safety_notes":"Exact upper bound is deterministic for cached request/task/candidate/config and is algebraically identical to prior per-iteration computation, so pruning/tie semantics are unchanged."}}
{"run":517,"commit":"2bcdb61","metric":1.415441,"metrics":{"best_ms":1.405491,"quality_sum":2.491129377057,"quality_min":0.589775903809,"team_count":4},"status":"discard","description":"No-code confirmation rerun on kept cached-exact-upper-bound candidate-cache commit 2bcdb61.","timestamp":1775460949889,"segment":0,"confidence":15.985189216551648,"iterationTokens":787,"asi":{"hypothesis":"If 2bcdb61 gain is robust, reruns should remain around ~1.4ms with stable quality.","rollback_reason":"No code change; validation-only rerun.","next_action_hint":"Use 2bcdb61 as active baseline; remaining opportunities are likely tiny and should be validated with strict paired runs.","noise_observation":"Rerun matched keep sample closely, indicating stable post-cache behavior."}}
{"run":518,"commit":"2847375","metric":1.400322,"metrics":{"best_ms":1.368161,"quality_sum":2.491129377057,"quality_min":0.589775903809,"team_count":4},"status":"keep","description":"Inlined tolerance check in `_objective_component_less` / `_objective_component_greater` by calling `math.isclose(...)` directly, removing an extra `_objective_component_close(...)` function-call layer on hot objective comparisons.","timestamp":1775461091942,"segment":0,"confidence":15.976105916577609,"iterationTokens":5535,"asi":{"hypothesis":"Objective comparison helpers dominate the remaining hot path; removing the extra helper-call indirection in less/greater comparisons should trim overhead while preserving tolerance semantics.","result":"Primary metric improved with checks passing and unchanged quality monitors.","safety_notes":"Comparison semantics are unchanged (`left<right`/`left>right` plus the same `math.isclose` tolerance constants)."}}
{"run":519,"commit":"2847375","metric":1.391787,"metrics":{"best_ms":1.374624,"quality_sum":2.491129377057,"quality_min":0.589775903809,"team_count":4},"status":"discard","description":"No-code confirmation rerun on kept inlined objective less/greater tolerance-check commit 2847375.","timestamp":1775461144091,"segment":0,"confidence":15.935931069778896,"iterationTokens":1048,"asi":{"hypothesis":"If 2847375 gain is robust, reruns should stay in ~1.39–1.40ms band.","rollback_reason":"No code change; validation-only rerun.","next_action_hint":"Use 2847375 as active baseline; remaining wins likely require reducing improve_allocations candidate-loop volume rather than micro helper tweaks.","noise_observation":"Rerun slightly improved and remained tightly clustered, supporting stability."}}
{"run":520,"commit":"2847375","metric":1.507356,"metrics":{"best_ms":1.402116,"quality_sum":2.491129377057,"quality_min":0.589775903809,"team_count":4},"status":"discard","description":"No-code baseline rerun after ideas update on active 2847375 baseline.","timestamp":1775461206048,"segment":0,"confidence":15.895957770185696,"iterationTokens":985,"asi":{"hypothesis":"Metadata-only changes should keep runtime in current low-1ms regime.","rollback_reason":"No code change; monitoring run.","next_action_hint":"Given diminishing returns and very low absolute latency, focus next on larger algorithmic-volume cuts or stop criteria discussion.","noise_observation":"Observed slight median uptick with stable best sample, indicating residual jitter at this scale."}}
{"run":521,"commit":"2847375","metric":1.447813,"metrics":{"best_ms":1.389743,"quality_sum":2.491129377057,"quality_min":0.589775903809,"team_count":4},"status":"discard","description":"Added non-negative finite fast path in `_objective_component_less/_greater` that replaces `math.isclose` with direct tolerance arithmetic (`diff > max(rel*larger, abs_tol)`) and falls back to `math.isclose` for negative/inf inputs.","timestamp":1775461732657,"segment":0,"confidence":15.84355237903154,"iterationTokens":985,"asi":{"hypothesis":"Most objective components are non-negative finite; bypassing `math.isclose` with equivalent arithmetic in that domain should reduce hot comparison overhead.","rollback_reason":"End-to-end median regressed versus active baseline despite microbench speedup.","next_action_hint":"Avoid branch-heavy domain-specialized tolerance checks here; prioritize call-count/algorithmic reductions in swap and frontier loops.","observation":"Extra branching and inf guards likely outweighed saved `math.isclose` calls in real workload."}}
{"run":522,"commit":"2847375","metric":1.409119,"metrics":{"best_ms":1.376138,"quality_sum":2.491129377057,"quality_min":0.589775903809,"team_count":4},"status":"discard","description":"Added scalar `_objective_better_values(...)` helper and used it in swap upper-bound pruning to avoid per-iteration tuple construction for `(product, min, sum)` objective comparisons.","timestamp":1775461793989,"segment":0,"confidence":15.791491389994922,"iterationTokens":2140,"asi":{"hypothesis":"Tuple construction/unpack overhead in swap upper-bound comparison is measurable in hot loops; scalar helper should reduce overhead with identical comparison semantics.","rollback_reason":"Median regressed slightly versus active baseline.","next_action_hint":"Do not pursue tuple-allocation micro-optimizations further here; focus on reducing loop iterations or rescoring volume.","observation":"Saved allocations did not offset extra helper indirection under real benchmark."}}
{"run":523,"commit":"db57a18","metric":1.354867,"metrics":{"best_ms":1.339147,"quality_sum":2.491129377057,"quality_min":0.589775903809,"team_count":4},"status":"keep","description":"Inlined swap-loop upper-bound objective comparison in `improve_allocations`: replaced `_objective_better((upper_trial_product, upper_trial_min, upper_trial_sum), current_objective)` with direct staged product/min/sum tolerance checks against `current_product/current_min/current_sum`, removing hot helper+tuple overhead in bound-pruning path.","timestamp":1775461900646,"segment":0,"confidence":15.711711830701466,"iterationTokens":8177,"asi":{"hypothesis":"Swap bound-pruning is still hot; avoiding per-iteration tuple construction and `_objective_better` call overhead should cut comparison cost while preserving lexicographic/tolerance semantics.","result":"Primary metric improved with checks passing and unchanged quality monitors.","safety_notes":"The inlined logic keeps identical priority order (product→min→sum) and uses the same `_objective_component_less/_close` tolerance helpers."}}
{"run":524,"commit":"db57a18","metric":1.36147,"metrics":{"best_ms":1.335269,"quality_sum":2.491129377057,"quality_min":0.589775903809,"team_count":4},"status":"discard","description":"No-code confirmation rerun on kept swap upper-bound comparison inlining commit db57a18.","timestamp":1775461934665,"segment":0,"confidence":15.560390644562876,"iterationTokens":829,"asi":{"hypothesis":"If db57a18 gain is robust, immediate rerun should remain near ~1.35–1.36ms with stable quality metrics.","rollback_reason":"No code change; validation-only rerun.","next_action_hint":"Use db57a18 as active baseline; continue targeting reduce-swap-loop work with semantics-safe pruning and paired validation.","noise_observation":"Rerun closely matched keep sample, supporting stability of the inlined comparison win."}}
{"run":525,"commit":"7a9bfc9","metric":1.31418,"metrics":{"best_ms":1.301526,"quality_sum":2.491129377057,"quality_min":0.589775903809,"team_count":4},"status":"keep","description":"Replaced `_objective_component_less/_greater` `math.isclose` calls with direct tolerance arithmetic for objective components: for `left<right`, use `(right-left) > max(rel_tol*right, abs_tol)` and symmetrically for `left>right` with `left` scale. This is algebraically equivalent for non-negative objective values and removes hot `math.isclose` call overhead.","timestamp":1775462139625,"segment":0,"confidence":15.22833199382305,"iterationTokens":8479,"asi":{"hypothesis":"Objective compare helpers are still hot after prior pruning tweaks; replacing repeated `math.isclose` calls with equivalent branch arithmetic should reduce comparison overhead materially.","result":"Primary metric improved with checks passing and unchanged quality monitors.","safety_notes":"Objective components in this code path are non-negative quality aggregates/bounds; in that domain the direct tolerance inequality is equivalent to the prior `not math.isclose(...)` checks."}}
{"run":526,"commit":"7a9bfc9","metric":1.320421,"metrics":{"best_ms":1.299732,"quality_sum":2.491129377057,"quality_min":0.589775903809,"team_count":4},"status":"discard","description":"No-code confirmation rerun on kept direct-tolerance objective comparator commit 7a9bfc9.","timestamp":1775462174870,"segment":0,"confidence":14.909204421436083,"iterationTokens":902,"asi":{"hypothesis":"If 7a9bfc9 is robust, reruns should remain in ~1.31–1.32ms band with unchanged quality metrics.","rollback_reason":"No code change; validation-only rerun.","next_action_hint":"Use 7a9bfc9 as active baseline; next gains likely require cutting swap tuple-generation overhead.","noise_observation":"Rerun remained tightly clustered with same quality outputs, confirming stability."}}
{"run":527,"commit":"5fcc95d","metric":1.086809,"metrics":{"best_ms":1.039579,"quality_sum":2.491129377057,"quality_min":0.589775903809,"team_count":4},"status":"keep","description":"Refactored `improve_allocations` swap candidate construction to use per-team index-slice templates instead of per-swap generator/id-match scans. For each allocation pair, precompute `(member, prefix, suffix)` tuples once, then build swapped teams via tuple concatenation (`prefix + (other_member,) + suffix`) in inner loops.","timestamp":1775462441851,"segment":0,"confidence":14.851677897725555,"iterationTokens":3198,"asi":{"hypothesis":"Swap-loop tuple-comprehension/id-compare generators are the dominant remaining hotspot; replacing them with pre-sliced tuple templates should cut inner-loop Python overhead significantly without changing swap semantics.","result":"Large primary-metric improvement with checks passing and unchanged quality monitors.","safety_notes":"Swap candidates preserve exact member order except at the replaced index, matching prior semantics with unique team members."}}
{"run":528,"commit":"5fcc95d","metric":1.062884,"metrics":{"best_ms":1.043046,"quality_sum":2.491129377057,"quality_min":0.589775903809,"team_count":4},"status":"discard","description":"No-code confirmation rerun on kept swap tuple-slice template refactor commit 5fcc95d.","timestamp":1775462480865,"segment":0,"confidence":14.78917038152335,"iterationTokens":840,"asi":{"hypothesis":"If 5fcc95d is robust, reruns should stay near ~1.06–1.09ms with unchanged quality metrics.","rollback_reason":"No code change; validation-only rerun.","next_action_hint":"Use 5fcc95d as baseline; inspect remaining swap-loop overhead (signatures/cache lookups/objective checks) with paired validation for further gains.","noise_observation":"Rerun improved further and remained tightly clustered, indicating strong signal."}}
{"run":529,"commit":"5fcc95d","metric":1.566617,"metrics":{"best_ms":1.543323,"quality_sum":2.491129377057,"quality_min":0.589775903809,"team_count":4},"status":"checks_failed","description":"Tried bypassing `assigned_people_from_assignments(...)` in `form_teams` by passing raw `people=[{'id', 'skillIds'}...]` dicts directly into `TeamResult` construction to reduce nested `AssignedPerson` model-creation overhead.","timestamp":1775462933024,"segment":0,"confidence":14.689782100501878,"iterationTokens":14257,"asi":{"hypothesis":"Avoiding explicit `AssignedPerson` object creation and letting `TeamResult` parse nested dicts in one pass might reduce response-construction overhead.","rollback_reason":"Backpressure checks failed (`ty` invalid-argument-type) and median runtime regressed.","next_action_hint":"If revisiting output-model construction, use a typed helper or overload-preserving API shape; prioritize hot swap/improve paths first.","error_excerpt":"ty: expected `list[AssignedPerson]` for `TeamResult.people`, found list of dicts at formation.py:2814."}}
{"run":530,"commit":"5fcc95d","metric":1.591996,"metrics":{"best_ms":1.51487,"quality_sum":2.491129377057,"quality_min":0.589775903809,"team_count":4},"status":"discard","description":"Moved swap tuple-slice template construction out of per-pair loop to per-round precompute (`swap_templates_by_allocation`) and reused per-allocation templates across all allocation pairs.","timestamp":1775463010432,"segment":0,"confidence":14.555179346801793,"iterationTokens":3126,"asi":{"hypothesis":"Reusing per-allocation swap templates across pair iterations should remove repeated slicing/list-construction overhead from the swap loop.","rollback_reason":"Large end-to-end regression versus active baseline.","next_action_hint":"Keep template generation localized per-pair as in 5fcc95d; global precompute adds overhead/indirection that outweighs reuse at current task counts.","observation":"Extra list-of-lists materialization each round appears more expensive than rebuilding tiny per-pair templates."}}
{"run":531,"commit":"5fcc95d","metric":1.523837,"metrics":{"best_ms":1.448754,"quality_sum":2.491129377057,"quality_min":0.589775903809,"team_count":4},"status":"discard","description":"Replaced repeated `_objective_component_less(..., best_quality)` calls in COMPAT cap+1 and greedy <=cap pruning loops with precomputed per-incumbent `best_quality_less_cutoff` scalar (`best_quality - tolerance`) and direct `<` checks.","timestamp":1775463185607,"segment":0,"confidence":14.447857824032681,"iterationTokens":8713,"asi":{"hypothesis":"Since right-hand side (`best_quality`) is constant between incumbent updates, precomputing the strict-less cutoff should remove hot comparator-call overhead in pruning loops.","rollback_reason":"Large end-to-end regression despite intended call-count reduction.","next_action_hint":"Abandon cutoff precompute path in shortlist/greedy pruning; retain direct comparator helper usage.","observation":"Likely reduced pruning effectiveness or added overhead in incumbent-update path outweighed comparator savings."}}
{"run":532,"commit":"5fcc95d","metric":0,"metrics":{"best_ms":0,"quality_sum":0,"quality_min":0,"team_count":0},"status":"crash","description":"Attempted to precompute per-round objective less-cutoff scalars in `improve_allocations` (`current_product_less_cutoff`, `current_min_less_cutoff`, `current_sum_less_cutoff`) and use direct `< cutoff` checks in swap upper-bound comparison block.","timestamp":1775463233711,"segment":0,"confidence":14.447857824032681,"iterationTokens":2715,"asi":{"hypothesis":"Replacing repeated `_objective_component_less` calls against round-constant objective components with precomputed cutoffs should reduce swap-loop comparator overhead.","rollback_reason":"Runtime NameError: `_objective_component_less_cutoff` not defined (helper not present after prior revert).","next_action_hint":"Retry with self-contained local cutoff computation (no missing helper) or inline tolerance math directly in `improve_allocations` block.","error_excerpt":"formation.py:2407 NameError `_objective_component_less_cutoff`."}}
{"run":533,"commit":"5fcc95d","metric":1.503147,"metrics":{"best_ms":1.454265,"quality_sum":2.491129377057,"quality_min":0.589775903809,"team_count":4},"status":"discard","description":"Retried per-round cutoff precompute in `improve_allocations` with self-contained local tolerance scalars (`current_*_less_cutoff`) and direct `< cutoff` checks for product/min/sum in swap upper-bound comparison block.","timestamp":1775463286770,"segment":0,"confidence":14.34210737148575,"iterationTokens":1812,"asi":{"hypothesis":"Using round-constant precomputed less-cutoffs should remove repeated `_objective_component_less` calls in swap bound checks and reduce comparator overhead.","rollback_reason":"Large end-to-end regression versus active baseline.","next_action_hint":"Do not pursue cutoff-precompute substitutions in swap objective checks; keep direct comparator helper calls.","observation":"Extra per-round tolerance prep and altered branch profile outweighed any call-count reduction."}}
{"run":534,"commit":"5fcc95d","metric":1.788988,"metrics":{"best_ms":1.480625,"quality_sum":2.491129377057,"quality_min":0.589775903809,"team_count":4},"status":"checks_failed","description":"Replaced swap-loop `other_min` generator+`min(...)` computation with explicit loop/branch update to avoid generator overhead.","timestamp":1775463339074,"segment":0,"confidence":14.26427307447927,"iterationTokens":1091,"asi":{"hypothesis":"Manual loop for `other_min` should be cheaper than generator-based `min(...)` in hot swap pair loop.","rollback_reason":"Checks failed on Ruff SIM109 and benchmark median regressed strongly.","next_action_hint":"Do not pursue manual-loop rewrite here; generator/min form is better in this workload.","error_excerpt":"Ruff SIM109 at formation.py:2483 (`quality_index in (left_index, right_index)` suggestion)."}}
{"run":535,"commit":"5fcc95d","metric":1.558252,"metrics":{"best_ms":1.532072,"quality_sum":2.491129377057,"quality_min":0.589775903809,"team_count":4},"status":"discard","description":"Applied tuple-slice replacement-template construction to `improve_allocations` replacement phase (member→unused swap) to replace per-candidate generator/id-match tuple rebuilds.","timestamp":1775463397267,"segment":0,"confidence":14.187279027444633,"iterationTokens":2131,"asi":{"hypothesis":"Mirroring the kept swap-phase slice-template pattern in replacement phase should reduce tuple-construction overhead there too.","rollback_reason":"Large end-to-end regression versus active baseline.","next_action_hint":"Do not extend slice-template strategy to replacement phase; keep existing generator form in this path.","observation":"Replacement-phase candidate volume and extra template/list setup made this transformation net-negative."}}
{"run":536,"commit":"5fcc95d","metric":1.521973,"metrics":{"best_ms":1.489381,"quality_sum":2.491129377057,"quality_min":0.589775903809,"team_count":4},"status":"discard","description":"Changed replacement-phase iteration to snapshot `unused_people` once per allocation (`unused_people_snapshot = tuple(unused_people)`) instead of rebuilding `list(unused_people)` per member loop.","timestamp":1775463450385,"segment":0,"confidence":14.124920990590267,"iterationTokens":1293,"asi":{"hypothesis":"Avoiding repeated `list(unused_people)` copies in replacement loops should reduce overhead with unchanged semantics.","rollback_reason":"Large regression versus active baseline.","next_action_hint":"Keep per-member `list(unused_people)` approach; this snapshot rewrite is net-negative under current workload.","observation":"Tuple snapshot likely hurt branch/locality behavior and did not save meaningful work."}}
