{"run":61,"commit":"6f6ee89","metric":147.447046,"metrics":{"best_ms":145.016513,"quality_sum":2.491129377057,"quality_min":0.589775903809,"team_count":4},"status":"discard","description":"In _compat_fill_uncovered_assignments, moved max_skills_per_member computation earlier and skipped _compat_sort_member_assignments when no uncovered skills and max_skills_per_member==1 (single-skill lists already ordered), but median runtime still regressed.","timestamp":1775183946347,"segment":0,"confidence":40.43030895880904,"iterationTokens":2011,"asi":{"hypothesis":"Avoiding unnecessary sorting in no-uncovered single-skill cases should shave hot-path overhead.","rollback_reason":"Reordered branching/math checks did not produce a net win and measured slower end-to-end.","next_action_hint":"Keep existing no-uncovered return path; this micro-branch is not worthwhile."}}
{"run":62,"commit":"6f6ee89","metric":142.91426,"metrics":{"best_ms":141.909257,"quality_sum":2.491129377057,"quality_min":0.589775903809,"team_count":4},"status":"discard","description":"Switched order-insensitive score_cache keys from sorted identity tuples to frozensets of person identities to avoid per-call sorting, but frozenset hashing/allocation was slower overall.","timestamp":1775184019329,"segment":0,"confidence":40.09354868428368,"iterationTokens":1200,"asi":{"hypothesis":"frozenset-based team keys could replace sorted-tuple canonicalization with cheaper order-insensitive key construction.","rollback_reason":"frozenset creation/hash overhead outweighed saved sort work in this benchmark.","next_action_hint":"Keep sorted identity tuple keys for score_cache."}}
{"run":63,"commit":"6f6ee89","metric":0,"metrics":{"best_ms":0,"quality_sum":0,"quality_min":0,"team_count":0},"status":"crash","description":"Attempted local-binding micro-optimization (`isclose = math.isclose`) inside _compat_member_task_analysis, but introduced a syntax/indentation error and benchmark could not run.","timestamp":1775184074036,"segment":0,"confidence":40.09354868428368,"iterationTokens":2053,"asi":{"hypothesis":"Binding math.isclose locally in the hot analysis helper might reduce function lookup overhead.","rollback_reason":"Patch introduced IndentationError in scoring.py, causing benchmark crash before measurement.","next_action_hint":"Retry only with a clean, syntax-checked local alias patch if still desired."}}
{"run":64,"commit":"6f6ee89","metric":0,"metrics":{"best_ms":0,"quality_sum":0,"quality_min":0,"team_count":0},"status":"crash","description":"Retried local `isclose` binding optimization in _compat_member_task_analysis, but automated text replacement malformed indentation around conditional branches and benchmark crashed again.","timestamp":1775184126155,"segment":0,"confidence":40.09354868428368,"iterationTokens":1883,"asi":{"hypothesis":"Local-binding `math.isclose` in the hottest compat-analysis loop could reduce global lookup overhead.","rollback_reason":"Patch application error collapsed line breaks in the if/elif block, causing another IndentationError.","next_action_hint":"Use a single block replacement for the full loop section when retrying to avoid malformed partial edits."}}
{"run":65,"commit":"6f6ee89","metric":147.660932,"metrics":{"best_ms":139.119944,"quality_sum":2.491129377057,"quality_min":0.589775903809,"team_count":4},"status":"discard","description":"Tried a gentler scored-combination cap by lowering MAX_SCORED_COMBINATION_EXPANSION from 4 to 3 (instead of 1) to reduce ranking work while preserving semantics, but median runtime regressed.","timestamp":1775184207759,"segment":0,"confidence":40.484536562210494,"iterationTokens":1516,"asi":{"hypothesis":"A smaller but non-extreme scored expansion factor could keep behavior stable while trimming candidate scoring overhead.","rollback_reason":"Despite passing checks, the median slowed notably versus current best.","next_action_hint":"Keep expansion factor at 4 unless a more targeted adaptive policy is introduced with evidence."}}
{"run":66,"commit":"6f6ee89","metric":148.715298,"metrics":{"best_ms":148.280886,"quality_sum":2.491129377057,"quality_min":0.589775903809,"team_count":4},"status":"checks_failed","description":"Attempted adaptive scored-combination expansion (halve expansion when team_size>=4) to reduce candidate enumeration for benchmark-sized teams, but this violated large-team scored-cap invariants and failed candidate_combinations regression checks.","timestamp":1775184282031,"segment":0,"confidence":45.05535004576362,"iterationTokens":1147,"asi":{"hypothesis":"Reducing scored shortlist expansion only for larger teams could preserve most semantics while trimming work on the capped compat workload.","rollback_reason":"Adaptive budget under-enumerated combinations for large team sizes, breaking test expectations for candidate cap behavior.","next_action_hint":"Any adaptive expansion policy must preserve the `DEFAULT_MAX_CANDIDATE_TEAMS` output-size guarantees in large-team scored-candidate tests.","failure_surface":"tests/test_form_teams.py::test_candidate_combinations_limits_scored_enumeration_for_large_teams"}}
{"run":67,"commit":"6f6ee89","metric":147.300909,"metrics":{"best_ms":145.736387,"quality_sum":2.491129377057,"quality_min":0.589775903809,"team_count":4},"status":"checks_failed","description":"Rewrote compat perfect-matching feasibility check to use precomputed member positive bitmasks with integer seen-mask recursion (augmenting-path style) to avoid float-row scans, but Ruff rejected the explicit loop style (SIM110) and the run was reverted.","timestamp":1775184394111,"segment":0,"confidence":51.6091445965789,"iterationTokens":4626,"asi":{"hypothesis":"Bitmask-based augmenting path matching should reduce overhead in _compat_has_perfect_positive_matching.","rollback_reason":"Lint failure (SIM110) blocked validation; benchmark trend was also slower than current best.","next_action_hint":"If retried, use lint-compliant `all(...)` form, but prioritize only if profiling shows this check is still worth targeting.","failure_surface":"ruff SIM110 in src/team2form/scoring.py"}}
{"run":68,"commit":"6f6ee89","metric":143.563618,"metrics":{"best_ms":142.046145,"quality_sum":2.491129377057,"quality_min":0.589775903809,"team_count":4},"status":"discard","description":"Retried local-binding `isclose = math.isclose` in _compat_member_task_analysis via a clean full-block rewrite to remove global attribute lookups in the hottest loop, but end-to-end runtime still regressed.","timestamp":1775184487108,"segment":0,"confidence":51.292772338376636,"iterationTokens":2986,"asi":{"hypothesis":"Local aliasing of math.isclose would reduce lookup overhead across ~1M+ calls in compat analysis.","rollback_reason":"Even with a clean implementation and passing checks, the benchmark was slower than current best.","next_action_hint":"Drop the local-isclose alias idea; focus on algorithmic reductions rather than lookup micro-optimizations."}}
{"run":69,"commit":"6f6ee89","metric":145.62359,"metrics":{"best_ms":141.972325,"quality_sum":2.491129377057,"quality_min":0.589775903809,"team_count":4},"status":"discard","description":"Added an early return in _compat_sort_member_assignments when all members have <=1 assigned skill (skip task-order map and sorting entirely), but this regressed median runtime despite seeming workload alignment.","timestamp":1775184638573,"segment":0,"confidence":50.044277180647,"iterationTokens":676,"asi":{"hypothesis":"In the benchmark, compat assignment lists are usually length 1, so skipping sorting work entirely should speed _compat_sort_member_assignments.","rollback_reason":"Additional all(...) scan/branch overhead outweighed saved sorting/mapping work end-to-end.","next_action_hint":"Do not add precheck-heavy short-circuits in this helper; keep straightforward sort path."}}
{"run":70,"commit":"6f6ee89","metric":148.708032,"metrics":{"best_ms":147.409873,"quality_sum":2.491129377057,"quality_min":0.589775903809,"team_count":4},"status":"checks_failed","description":"Attempted to cut _compat_member_task_analysis second-pass comparisons by precomputing each task's unique best member index and building other_member_best_values from copied best-values rows with targeted overrides, but lint failed (SIM108) and runtime trend was slower anyway.","timestamp":1775184770194,"segment":0,"confidence":54.44364812875481,"iterationTokens":4988,"asi":{"hypothesis":"Replacing per-member/per-task isclose checks in the second pass with unique-best index overrides would reduce analysis overhead.","rollback_reason":"Ruff SIM108 style violation in the unique-best update block; benchmark also regressed versus current best.","next_action_hint":"If revisiting, use lint-compliant ternary assignment and only proceed if microbench indicates a real gain.","failure_surface":"src/team2form/scoring.py SIM108"}}
{"run":71,"commit":"6f6ee89","metric":141.677667,"metrics":{"best_ms":141.344666,"quality_sum":2.491129377057,"quality_min":0.589775903809,"team_count":4},"status":"discard","description":"Tested order-insensitive score_cache keys based on sorted person.id strings (instead of sorted object identities) to avoid id() calls, but this remained slower than the current best identity-based canonical key.","timestamp":1775184842328,"segment":0,"confidence":52.58600229423568,"iterationTokens":1492,"asi":{"hypothesis":"String-id canonicalization might outperform id()-based key construction while preserving order-insensitive cache hits.","rollback_reason":"String sorting/comparison was still slower than the existing sorted identity tuple approach.","next_action_hint":"Keep sorted identity key strategy in cached_score_team."}}
{"run":72,"commit":"6f6ee89","metric":145.320576,"metrics":{"best_ms":142.724479,"quality_sum":2.491129377057,"quality_min":0.589775903809,"team_count":4},"status":"discard","description":"Replaced tuple-based candidate priority construction in _assign_task_skills_compat with manual lexicographic scalar comparisons to avoid per-candidate tuple allocations, but this branch-heavy rewrite regressed median runtime.","timestamp":1775184931958,"segment":0,"confidence":51.6293737005825,"iterationTokens":2466,"asi":{"hypothesis":"Eliminating tuple allocation/comparison in the hottest compat candidate-selection loop should reduce overhead.","rollback_reason":"Manual nested comparisons introduced more Python branch cost than tuple comparisons saved.","next_action_hint":"Keep tuple-based priority comparisons in _assign_task_skills_compat."}}
{"run":73,"commit":"6f6ee89","metric":146.120582,"metrics":{"best_ms":144.785775,"quality_sum":2.491129377057,"quality_min":0.589775903809,"team_count":4},"status":"discard","description":"Added a lightweight `precomputed_weights` parameter to individual_fit and passed shortlist_scorers' pre-resolved weights to avoid repeated resolve_weights allocations per person, but this still regressed median runtime.","timestamp":1775185206291,"segment":0,"confidence":53.53684793983381,"iterationTokens":5853,"asi":{"hypothesis":"Eliminating repeated resolve_weights calls in individual_fit should reduce shortlist scorer overhead.","rollback_reason":"Extra optional-parameter plumbing/branching outweighed savings from skipping resolve_weights.","next_action_hint":"Keep individual_fit simple; avoid optional-parameter precompute patterns that add per-call branching."}}
{"run":74,"commit":"6f6ee89","metric":150.745367,"metrics":{"best_ms":148.745471,"quality_sum":2.491129377057,"quality_min":0.589775903809,"team_count":4},"status":"discard","description":"Added request-scoped task lookup cache (`task_id -> Task`) and replaced repeated linear task scans in task_hardness/individual_fit/score_team with dictionary lookups, but this regressed median runtime.","timestamp":1775185348736,"segment":0,"confidence":54.07239372211355,"iterationTokens":3748,"asi":{"hypothesis":"Avoiding repeated `next(... for task in request.tasks)` scans in hot paths should reduce score_team overhead.","rollback_reason":"Dictionary-cache plumbing and lookups were slower than tiny list scans for this workload's small task count.","next_action_hint":"Keep direct task scans; task lookup caching is not profitable here."}}
{"run":75,"commit":"6f6ee89","metric":156.507569,"metrics":{"best_ms":154.927728,"quality_sum":2.491129377057,"quality_min":0.589775903809,"team_count":4},"status":"discard","description":"Tried removing sort work from cached_score_team keys (ordered identity tuples) while canonicalizing swap/replacement teams in improve_allocations via `_canonical_people_tuple(...)`; this reduced cross-order key churn but added heavy tuple sorting in swap loops and regressed badly.","timestamp":1775185494082,"segment":0,"confidence":54.06539102089999,"iterationTokens":5176,"asi":{"hypothesis":"Canonicalizing only swap-generated teams could preserve most order-insensitive cache reuse while avoiding per-call key sorting in cached_score_team.","rollback_reason":"Sorting whole team tuples inside improvement loops dominated and made runtime much worse.","next_action_hint":"Keep order-insensitive key sorting inside cached_score_team; avoid canonicalizing every swap tuple."}}
{"run":76,"commit":"6f6ee89","metric":149.008209,"metrics":{"best_ms":148.644851,"quality_sum":2.491129377057,"quality_min":0.589775903809,"team_count":4},"status":"discard","description":"Added a 4-person fast path in cached_score_team key canonicalization that skips sorting when object identities are already monotonic (`id0<=id1<=id2<=id3`) and only sorts unsorted quartets, but this branch-heavy path regressed runtime.","timestamp":1775185609916,"segment":0,"confidence":57.17714845957694,"iterationTokens":2872,"asi":{"hypothesis":"Since most 4-person tuples are already monotonic by object id, a direct comparison fast path should beat unconditional sorted(...).","rollback_reason":"Extra branching/comparison overhead outweighed savings from skipped sorts.","next_action_hint":"Keep unconditional sorted identity tuple canonicalization in cached_score_team."}}
{"run":77,"commit":"6f6ee89","metric":152.330189,"metrics":{"best_ms":146.527413,"quality_sum":2.491129377057,"quality_min":0.589775903809,"team_count":4},"status":"discard","description":"Switched top-partner aggregation in candidate_social_potential and candidate_personality_potential from full `sorted(..., reverse=True)[:k]` to `heapq.nlargest(k, ...)`, but this regressed runtime for the benchmark’s small candidate lists.","timestamp":1775185704656,"segment":0,"confidence":59.98698658369703,"iterationTokens":2024,"asi":{"hypothesis":"Selecting only the top `team_size-1` pair scores via nlargest should beat full sorting in shortlist potential calculations.","rollback_reason":"For these small lists, nlargest overhead exceeded full sort slicing performance.","next_action_hint":"Keep the current sorted-slice implementation in candidate potential helpers."}}
{"run":78,"commit":"6f6ee89","metric":153.11209,"metrics":{"best_ms":150.337436,"quality_sum":2.491129377057,"quality_min":0.589775903809,"team_count":4},"status":"discard","description":"Added a safe early-continue in improve_allocations single-replacement loop: skip objective recomputation when rescored allocation quality is <= current allocation quality (cannot improve lexicographic objective with other teams unchanged), but this regressed runtime.","timestamp":1775185788691,"segment":0,"confidence":63.32444507373421,"iterationTokens":1664,"asi":{"hypothesis":"Many replacement trials are non-improving; bypassing trial list/objective construction for guaranteed non-improvers should reduce improve_allocations overhead.","rollback_reason":"Extra branch/check overhead exceeded saved objective computations on this workload.","next_action_hint":"Keep existing straightforward improvement check; this pruning gate is not profitable."}}
{"run":79,"commit":"6f6ee89","metric":153.994561,"metrics":{"best_ms":151.951352,"quality_sum":2.491129377057,"quality_min":0.589775903809,"team_count":4},"status":"discard","description":"Changed _compat_member_priority_order rich-priority key construction from list-comprehension input to generator input for sorted(..., reverse=True) to reduce intermediate list allocation, but this regressed runtime.","timestamp":1775185955391,"segment":0,"confidence":71.07510055134574,"iterationTokens":1664,"asi":{"hypothesis":"Generator-fed sorted() in rich priority key should reduce allocation overhead in a hot helper.","rollback_reason":"Generator path was slower than the explicit list comprehension in this workload.","next_action_hint":"Keep list-comprehension sorted input for rich priority keys."}}
{"run":80,"commit":"6f6ee89","metric":165.160624,"metrics":{"best_ms":155.645614,"quality_sum":2.491129377057,"quality_min":0.589775903809,"team_count":4},"status":"discard","description":"Added a len==4 specialization for cached_score_team key canonicalization that sorts an explicit 4-tuple of person identities instead of a generator expression, but this caused a major regression.","timestamp":1775186029466,"segment":0,"confidence":61.769666897029104,"iterationTokens":909,"asi":{"hypothesis":"Explicit 4-item tuple sorting in cached_score_team could beat generator-based sorted identity canonicalization for the benchmark’s common team size.","rollback_reason":"Branching and explicit tuple path performed significantly worse end-to-end.","next_action_hint":"Keep the original generator-based sorted identity key path."}}
{"run":81,"commit":"6f6ee89","metric":155.34787,"metrics":{"best_ms":152.532568,"quality_sum":2.491129377057,"quality_min":0.589775903809,"team_count":4},"status":"discard","description":"Added a small-combination fast path in candidate_combinations scored mode (full score+sort when C(shortlist,team)<=2*max_candidate_teams; heap only for larger spaces), but this regressed significantly on the benchmark.","timestamp":1775186113983,"segment":0,"confidence":62.32398995715598,"iterationTokens":1541,"asi":{"hypothesis":"For near-budget scored spaces (e.g., 1001 combos for top-1000), full sort should beat per-item heap maintenance.","rollback_reason":"Full materialization/sort overhead was worse than the existing heap path.","next_action_hint":"Keep heap-based top-k selection in scored candidate_combinations."}}
{"run":82,"commit":"6f6ee89","metric":156.23465,"metrics":{"best_ms":153.089563,"quality_sum":2.491129377057,"quality_min":0.589775903809,"team_count":4},"status":"discard","description":"Bound `other_member_best_values[member_index]` once per member in _assign_task_skills_compat to avoid repeated nested indexing in candidate priority construction, but this regressed runtime.","timestamp":1775186191888,"segment":0,"confidence":62.01904402868178,"iterationTokens":1110,"asi":{"hypothesis":"Reducing nested list indexing in the hot candidate-priority loop should shave compat assignment overhead.","rollback_reason":"Local-binding change did not help and measured slower end-to-end.","next_action_hint":"Keep direct indexing form; this micro-local binding is not profitable."}}
{"run":83,"commit":"6f6ee89","metric":162.839849,"metrics":{"best_ms":159.749416,"quality_sum":2.491129377057,"quality_min":0.589775903809,"team_count":4},"status":"discard","description":"Added a specialized `has_explicit_social_preference_to(...)` helper and replaced singleton-set checks inside candidate_social_potential to avoid per-call `{id}` allocations, but this significantly regressed runtime.","timestamp":1775186282279,"segment":0,"confidence":61.604502771493905,"iterationTokens":1913,"asi":{"hypothesis":"Avoiding singleton-set construction in candidate_social_potential should reduce overhead from frequent social-preference checks.","rollback_reason":"The extra helper-call path and preference scan shape performed much worse than the previous implementation.","next_action_hint":"Keep existing has_explicit_social_preferences usage in candidate_social_potential; avoid this specialization."}}
{"run":84,"commit":"6f6ee89","metric":161.353223,"metrics":{"best_ms":153.835296,"quality_sum":2.491129377057,"quality_min":0.589775903809,"team_count":4},"status":"discard","description":"Refactored _compat_member_priority_order to define only the needed priority-key closure per call (rich path or scarce path) instead of defining both unconditionally, but this worsened runtime.","timestamp":1775186435213,"segment":0,"confidence":61.388325941598815,"iterationTokens":5235,"asi":{"hypothesis":"Avoiding construction of an unused closure in _compat_member_priority_order should trim helper overhead.","rollback_reason":"Branching/nested-definition layout regressed performance compared with the original structure.","next_action_hint":"Keep the original dual-closure implementation; this refactor is not beneficial."}}
{"run":85,"commit":"6f6ee89","metric":157.074821,"metrics":{"best_ms":156.356921,"quality_sum":2.491129377057,"quality_min":0.589775903809,"team_count":4},"status":"discard","description":"Memoized full scorer tuples in shortlist_scorers and changed alternate rankings to read cached personality/social components via `lambda person: scorer(person)[idx]`, aiming to avoid separate alternate scorer work, but this regressed heavily.","timestamp":1775186528812,"segment":0,"confidence":60.91322640064704,"iterationTokens":2137,"asi":{"hypothesis":"Reusing cached primary scorer outputs for alternate ranking keys should reduce shortlist ranking overhead.","rollback_reason":"Extra scorer-cache lookups and lambda indirection outweighed any saved alternate scoring work.","next_action_hint":"Keep dedicated alternate scorer functions; avoid scorer-tuple memo wiring."}}
