{"run":365,"commit":"6c7a58d","metric":29.761435,"metrics":{"best_ms":28.719985,"quality_sum":2.491129377057,"quality_min":0.589775903809,"team_count":4},"status":"discard","description":"A/B check against parent behavior: reverted shortlist pairwise-potential precompute in `shortlist_scorers` (keeping geometric_mean single-pass) to test whether 6c7a58d was a false positive.","timestamp":1775376700049,"segment":0,"confidence":30.200438526650686,"iterationTokens":3994,"asi":{"hypothesis":"If 6c7a58d is overfit/noise, reverting to the prior lazy per-person potential computation should match or beat it in current regime.","rollback_reason":"Reverted variant was slower than the kept code in current host regime.","next_action_hint":"Keep 6c7a58d as baseline; pursue additional wins on top of pairwise precompute + single-pass geometric_mean.","ab_note":"This run provides direct same-regime A/B evidence favoring 6c7a58d."}}
{"run":366,"commit":"c53d72c","metric":25.407704,"metrics":{"best_ms":24.876048,"quality_sum":2.491129377057,"quality_min":0.589775903809,"team_count":4},"status":"keep","description":"Lazily compute shortlist scorers in `greedy_allocations`: skip `shortlist_scorers(...)` for tasks where `task_total <= max_candidate_teams` (scorer is never used because `candidate_combinations` returns direct combinations in that branch).","timestamp":1775376844465,"segment":0,"confidence":29.895065779727915,"iterationTokens":12746,"asi":{"hypothesis":"`shortlist_scorers` work on <=cap tasks is dead overhead in the current path; deferring scorer construction to only `task_total > max_candidate_teams` should reduce per-task setup cost.","result":"Primary metric improved into mid-25ms band with checks passing and unchanged quality outputs.","safety_notes":"Behavior preserved because scorers are only consumed in capped-shortlist branches; fallback scorer is never used when direct-combination paths short-circuit."}}
{"run":367,"commit":"c53d72c","metric":25.987441,"metrics":{"best_ms":25.332742,"quality_sum":2.491129377057,"quality_min":0.589775903809,"team_count":4},"status":"discard","description":"No-code confirmation rerun on kept lazy-shortlist-scorer commit c53d72c.","timestamp":1775376888101,"segment":0,"confidence":30.003964335695077,"iterationTokens":791,"asi":{"hypothesis":"If c53d72c improvement is robust, repeat should remain in low/mid-25ms range.","rollback_reason":"No code change; confirmation-only run.","next_action_hint":"Use c53d72c as active baseline and target remaining setup overhead in paths that still build unused data for <=cap tasks.","noise_observation":"Repeat stayed in same improved regime (~26ms)."}}
{"run":368,"commit":"b3e3c24","metric":25.128817,"metrics":{"best_ms":24.957423,"quality_sum":2.491129377057,"quality_min":0.589775903809,"team_count":4},"status":"keep","description":"Restricted COMPAT upper-bound prep maps to relevant people sets: in `greedy_allocations` (<=cap branch) build task-preference logs and task-skill value vectors for `remaining_people` only; in cap+1 shortlist path build the same maps from `people` instead of all `request.people`.","timestamp":1775376995870,"segment":0,"confidence":30.127968305250505,"iterationTokens":4623,"asi":{"hypothesis":"Upper-bound prep currently computes per-person maps for all request members even when many are no longer eligible; limiting to candidate-reachable people should trim setup overhead.","result":"Primary metric improved further with checks passing and unchanged quality monitors.","safety_notes":"Candidates only reference ids from `remaining_people`/`people`, so narrowing prep domains does not change scoring semantics."}}
{"run":369,"commit":"b3e3c24","metric":25.025806,"metrics":{"best_ms":24.835707,"quality_sum":2.491129377057,"quality_min":0.589775903809,"team_count":4},"status":"discard","description":"No-code confirmation rerun on kept relevant-people upper-bound prep commit b3e3c24.","timestamp":1775377038875,"segment":0,"confidence":30.226580539240455,"iterationTokens":816,"asi":{"hypothesis":"If b3e3c24 gain is robust, repeat should stay near ~25ms with unchanged quality.","rollback_reason":"No code change; validation-only run.","next_action_hint":"Use b3e3c24 as active baseline; prioritize pruning setup overhead still paid on <=cap tasks.","noise_observation":"Repeat remained in the same improved ~25ms band."}}
{"run":370,"commit":"e82a215","metric":23.095503,"metrics":{"best_ms":22.958745,"quality_sum":2.491129377057,"quality_min":0.589775903809,"team_count":4},"status":"keep","description":"Optimized COMPAT skill-upper computation in pruning paths: replaced per-candidate `task_skill_rows` list materialization + zero-init max scan with first-member-initialized max accumulation over remaining members in `_compat_candidate_quality_upper_bound` and both cheap-bound loops.","timestamp":1775377157038,"segment":0,"confidence":30.266024701082642,"iterationTokens":5614,"asi":{"hypothesis":"Upper-bound helper and cheap-bound loops still spend noticeable time building/iterating temporary row lists for per-task skill maxima; first-row initialization should reduce allocations and comparisons.","result":"Large additional speedup into low-23ms band with checks passing and unchanged quality monitors.","safety_notes":"Mathematically equivalent per-task max computation; only loop structure/allocation pattern changed."}}
{"run":371,"commit":"e82a215","metric":23.395088,"metrics":{"best_ms":23.072678,"quality_sum":2.491129377057,"quality_min":0.589775903809,"team_count":4},"status":"discard","description":"No-code confirmation rerun on kept skill-upper loop-structure optimization commit e82a215.","timestamp":1775377198468,"segment":0,"confidence":30.30557194271908,"iterationTokens":768,"asi":{"hypothesis":"If e82a215 gain is real, repeat should remain near low-23ms band.","rollback_reason":"No code change; validation-only run.","next_action_hint":"Use e82a215 as active baseline and continue targeting remaining upper-bound and swap-loop overhead.","noise_observation":"Repeat stayed close to initial run, supporting robustness."}}
{"run":372,"commit":"e82a215","metric":27.902073,"metrics":{"best_ms":22.445044,"quality_sum":2.491129377057,"quality_min":0.589775903809,"team_count":4},"status":"discard","description":"Added per-task upper-bound memoization in `improve_allocations` swap loop (`team_signature -> upper_bound`) to reuse repeated `_compat_candidate_quality_upper_bound` evaluations.","timestamp":1775377352751,"segment":0,"confidence":30.33938637882704,"iterationTokens":12447,"asi":{"hypothesis":"Swap loop repeats many task/team upper-bound evaluations; memoizing them per task should cut repeated bound cost.","rollback_reason":"End-to-end median regressed substantially; extra signature construction/cache plumbing outweighed saved bound calls under this workload.","next_action_hint":"Avoid additional swap-loop caching layers unless repeat frequency is much higher or key construction can be made near-zero cost.","observation":"Best sample was low but median worsened, indicating unstable/overhead-heavy behavior."}}
{"run":373,"commit":"e82a215","metric":23.052934,"metrics":{"best_ms":22.869317,"quality_sum":2.491129377057,"quality_min":0.589775903809,"team_count":4},"status":"discard","description":"No-code baseline rerun after reverting swap-loop upper-bound memoization attempt.","timestamp":1775377397502,"segment":0,"confidence":30.373276358357877,"iterationTokens":742,"asi":{"hypothesis":"Reverting failed memoization should restore e82a215 low-23ms baseline.","rollback_reason":"No code change; confirmation-only run.","next_action_hint":"Keep e82a215 as active baseline and focus on low-overhead loop-structure wins rather than extra caching in swap loops.","noise_observation":"Baseline returned to low-23ms regime, confirming memoization variant was the regression source."}}
{"run":374,"commit":"e82a215","metric":27.5862,"metrics":{"best_ms":24.005082,"quality_sum":2.491129377057,"quality_min":0.589775903809,"team_count":4},"status":"checks_failed","description":"Collapsed two-stage COMPAT pruning into single exact-upper pass by computing social upper in cheap loop and removing subsequent `_compat_candidate_quality_upper_bound` call in cap+1 and <=cap branches.","timestamp":1775377551467,"segment":0,"confidence":30.36044562439405,"iterationTokens":9403,"asi":{"hypothesis":"Given cheap stage already computes personality/task-preference/skill terms, adding social upper there should make the bound exact and eliminate expensive duplicate exact-bound passes.","rollback_reason":"Checks failed on Ruff B007 (`team_signature` loop variable became unused after exact-stage removal).","next_action_hint":"If retrying, fix unused loop-variable lint and remeasure; current benchmark also showed regression risk.","error_excerpt":"Ruff B007 at formation.py lines 799 and 1440."}}
{"run":375,"commit":"e82a215","metric":25.416644,"metrics":{"best_ms":24.374822,"quality_sum":2.491129377057,"quality_min":0.589775903809,"team_count":4},"status":"discard","description":"No-code baseline rerun after reverting single-stage social-inclusive bound attempt.","timestamp":1775377599361,"segment":0,"confidence":30.347625726154163,"iterationTokens":985,"asi":{"hypothesis":"Reverting failed single-stage bound collapse should return to e82a215 behavior band.","rollback_reason":"No code change; confirmation-only run.","next_action_hint":"Treat current host as slower regime; continue with structural improvements but require paired confirmations.","noise_observation":"Recovered from failed variant but in a slower ambient band than earlier ~23ms samples."}}
{"run":376,"commit":"e82a215","metric":23.276032,"metrics":{"best_ms":23.076493,"quality_sum":2.491129377057,"quality_min":0.589775903809,"team_count":4},"status":"discard","description":"Refactored swap candidate construction in `improve_allocations` to build swapped tuples and team-signature tuples in a single pass (replacing tuple-comprehension + separate signature generator passes).","timestamp":1775377702616,"segment":0,"confidence":30.262602292132698,"iterationTokens":4628,"asi":{"hypothesis":"Single-pass swapped-team/signature construction should cut per-swap overhead in the refinement loop.","rollback_reason":"No measurable primary-metric improvement over current baseline; result landed slightly slower/within noise.","next_action_hint":"Do not pursue swap tuple/signature micro-structure rewrites further without stronger profiling evidence."}}
{"run":377,"commit":"e82a215","metric":16.217279,"metrics":{"best_ms":15.882385,"quality_sum":2.491129377057,"quality_min":0.589775903809,"team_count":4},"status":"discard","description":"No-code baseline rerun after discarding swap tuple/signature rewrite.","timestamp":1775377745990,"segment":0,"confidence":30.25604118597724,"iterationTokens":697,"asi":{"hypothesis":"Baseline should remain stable after reverting failed micro-optimization.","rollback_reason":"No code change; confirmation-only run.","next_action_hint":"Host regime shifted dramatically faster; require paired A/B in same window before accepting marginal deltas.","noise_observation":"Observed large ambient speed shift (down to ~16ms) without code changes."}}
{"run":378,"commit":"e82a215","metric":24.948056,"metrics":{"best_ms":23.84586,"quality_sum":2.491129377057,"quality_min":0.589775903809,"team_count":4},"status":"discard","description":"Second no-code baseline rerun to characterize host variance after observed fast outlier.","timestamp":1775377789435,"segment":0,"confidence":30.228951027720907,"iterationTokens":656,"asi":{"hypothesis":"Additional repeat should clarify whether ~16ms run was a transient outlier.","rollback_reason":"No code change; variance characterization run.","next_action_hint":"Use paired immediate A/B (candidate vs baseline back-to-back) for future keeps under this unstable host regime.","noise_observation":"Runtime snapped back to ~25ms band, confirming severe short-term host noise."}}
{"run":379,"commit":"e82a215","metric":23.030495,"metrics":{"best_ms":22.82192,"quality_sum":2.491129377057,"quality_min":0.589775903809,"team_count":4},"status":"discard","description":"Introduced request-scoped cached COMPAT bound prep (`_request_compat_bound_data_by_task_id`) and reused cached per-task preference logs + member task-value maps across cap+1 pruning, <=cap pruning, and swap-bound setup.","timestamp":1775377937542,"segment":0,"confidence":30.314917443567786,"iterationTokens":6633,"asi":{"hypothesis":"Eliminating repeated per-task bound-prep loops by caching immutable request/task data should reduce setup overhead across greedy and refinement phases.","rollback_reason":"Observed gain was too small/noisy relative to added cache complexity under highly volatile host conditions.","next_action_hint":"Keep simpler baseline unless paired A/B under stable host shows clear benefit from this caching layer.","noise_observation":"Result landed in existing low-23ms band without clear separation from baseline variance."}}
{"run":380,"commit":"e82a215","metric":23.969282,"metrics":{"best_ms":23.853332,"quality_sum":2.491129377057,"quality_min":0.589775903809,"team_count":4},"status":"discard","description":"No-code baseline rerun after discarding request-scoped COMPAT bound-prep cache layer.","timestamp":1775377985706,"segment":0,"confidence":30.26029958272998,"iterationTokens":1068,"asi":{"hypothesis":"Baseline should remain near low-20ms band after reverting cache-layer experiment.","rollback_reason":"No code change; confirmation-only run.","next_action_hint":"Given persistent host volatility, prioritize larger structural deltas and validate with immediate no-code reruns.","noise_observation":"Runtime remained within broad low/mid-20ms band."}}
{"run":381,"commit":"f7bd42e","metric":22.87346,"metrics":{"best_ms":22.385777,"quality_sum":2.491129377057,"quality_min":0.589775903809,"team_count":4},"status":"keep","description":"Added a small hot-path specialization in `scoring.geometric_mean(...)` for 4-item `list[float]` inputs (common COMPAT case): direct 4-value positivity/log accumulation branch with generic iterable fallback.","timestamp":1775378083030,"segment":0,"confidence":30.24516303534143,"iterationTokens":2759,"asi":{"hypothesis":"A dedicated 4-value list fast path should reduce residual geometric_mean overhead after prior single-pass rewrite, especially in COMPAT upper-bound loops.","result":"Primary metric improved with checks passing and unchanged quality monitors.","safety_notes":"Behavior preserved for non-positive and empty inputs; non-4-list inputs still use generic path."}}
{"run":382,"commit":"f7bd42e","metric":23.43339,"metrics":{"best_ms":23.342869,"quality_sum":2.491129377057,"quality_min":0.589775903809,"team_count":4},"status":"discard","description":"No-code confirmation rerun on kept geometric_mean 4-item list specialization commit f7bd42e.","timestamp":1775378130596,"segment":0,"confidence":30.137447147175717,"iterationTokens":797,"asi":{"hypothesis":"If f7bd42e is robust, repeats should stay around the improved low-23ms range.","rollback_reason":"No code change; validation-only run.","next_action_hint":"Treat f7bd42e as tentative baseline and rely on paired A/B under current high host variance before stacking marginal micro-optimizations.","noise_observation":"Repeat drifted upward, indicating the gain is smaller than current noise envelope."}}
{"run":383,"commit":"f7bd42e","metric":23.883813,"metrics":{"best_ms":22.898548,"quality_sum":2.491129377057,"quality_min":0.589775903809,"team_count":4},"status":"discard","description":"A/B check against parent behavior: reverted geometric_mean 4-item list specialization to the prior single-pass generic loop.","timestamp":1775378184154,"segment":0,"confidence":29.88445910393812,"iterationTokens":1156,"asi":{"hypothesis":"If f7bd42e is noise-only, reverting to the previous geometric_mean implementation should match or beat it in the current regime.","rollback_reason":"Reverted variant was slower in direct A/B.","next_action_hint":"Keep f7bd42e as baseline; avoid further geometric_mean branching tweaks unless larger, stable gains appear.","ab_note":"This same-window comparison supports retaining the 4-item list fast path."}}
{"run":384,"commit":"f7bd42e","metric":23.952944,"metrics":{"best_ms":22.731912,"quality_sum":2.491129377057,"quality_min":0.589775903809,"team_count":4},"status":"discard","description":"No-code baseline rerun after A/B revert check for geometric_mean specialization.","timestamp":1775378229745,"segment":0,"confidence":29.854021763634083,"iterationTokens":706,"asi":{"hypothesis":"Post-A/B baseline should remain near current low/mid-20ms regime on kept commit f7bd42e.","rollback_reason":"No code change; confirmation-only run.","next_action_hint":"Continue only with structural ideas or clearly profile-backed hotspots due high ambient noise.","noise_observation":"Run remained in same broad band, with best sample still low-22ms."}}
{"run":385,"commit":"e6c3a3d","metric":23.081766,"metrics":{"best_ms":22.710614,"quality_sum":2.491129377057,"quality_min":0.589775903809,"team_count":4},"status":"keep","description":"In `greedy_allocations` <=cap COMPAT pruning path, bypassed `candidate_combinations(...)` and iterate `itertools.combinations(remaining_people, team_size)` directly (same candidate order) since shortlist scoring is unused there.","timestamp":1775378342334,"segment":0,"confidence":29.82364636114669,"iterationTokens":4704,"asi":{"hypothesis":"`candidate_combinations` setup is dead overhead for use_upper_bound_pruning (total<=cap direct-combination case); direct iteration should reduce per-task setup cost.","result":"Primary metric improved with checks passing and unchanged quality outputs.","safety_notes":"Preserves candidate enumeration order and tie semantics in this branch because both paths use plain combinations over remaining people."}}
{"run":386,"commit":"e6c3a3d","metric":21.764112,"metrics":{"best_ms":21.286828,"quality_sum":2.491129377057,"quality_min":0.589775903809,"team_count":4},"status":"discard","description":"No-code confirmation rerun on kept direct-combinations <=cap pruning commit e6c3a3d.","timestamp":1775378384825,"segment":0,"confidence":29.76990227956999,"iterationTokens":830,"asi":{"hypothesis":"If e6c3a3d is robust, repeat should remain in the same or better low-20ms regime.","rollback_reason":"No code change; validation-only run.","next_action_hint":"Keep e6c3a3d as active baseline and continue favoring branch-elimination wins over cache-heavy micro-optimizations.","noise_observation":"Repeat was faster, but host variance remains high; continue paired confirmations."}}
{"run":387,"commit":"e29f294","metric":22.931392,"metrics":{"best_ms":22.383434,"quality_sum":2.491129377057,"quality_min":0.589775903809,"team_count":4},"status":"keep","description":"Hoisted invariant pair-level objective terms in `improve_allocations` swap loop (`pair_product_factor`, `pair_sum_base`) to remove repeated divisions/subtractions inside each candidate swap evaluation.","timestamp":1775378455878,"segment":0,"confidence":29.716351549973616,"iterationTokens":2114,"asi":{"hypothesis":"Swap loop still evaluates many member-pair candidates; precomputing pair-constant arithmetic should shave repeated objective math overhead.","result":"Checks passed with unchanged quality metrics and a modest primary-metric improvement.","safety_notes":"Objective comparisons are algebraically identical; only computation order was refactored."}}
{"run":388,"commit":"e29f294","metric":23.704575,"metrics":{"best_ms":23.027744,"quality_sum":2.491129377057,"quality_min":0.589775903809,"team_count":4},"status":"discard","description":"No-code confirmation rerun on kept swap-loop pair-constant arithmetic hoist commit e29f294.","timestamp":1775378505221,"segment":0,"confidence":29.680933317887987,"iterationTokens":748,"asi":{"hypothesis":"If e29f294 improvement is robust, repeat should stay near the improved ~23ms band.","rollback_reason":"No code change; validation-only run.","next_action_hint":"Treat e29f294 as tentative baseline under current noise and prioritize only larger deltas.","noise_observation":"Repeat drifted upward, suggesting gain size is near current variance envelope."}}
{"run":389,"commit":"e29f294","metric":22.966808,"metrics":{"best_ms":22.659587,"quality_sum":2.491129377057,"quality_min":0.589775903809,"team_count":4},"status":"discard","description":"A/B check against parent behavior: reverted swap-loop pair-level arithmetic hoist (`pair_product_factor`/`pair_sum_base`) to original per-swap objective calculations.","timestamp":1775378579205,"segment":0,"confidence":29.676091574688208,"iterationTokens":2694,"asi":{"hypothesis":"If e29f294 is noise-only, removing the arithmetic hoist should match or beat it in same-window runs.","rollback_reason":"Reverted variant was not better (slightly slower, within noise).","next_action_hint":"Keep e29f294 for now but treat impact as marginal; prioritize larger structural optimizations.","ab_note":"Difference is small, indicating this micro change has limited leverage under current noise."}}
