{"run":633,"commit":"5d84b90","metric":0.123995,"metrics":{"best_ms":0.120158,"quality_sum":2.491129377057,"quality_min":0.589775903809,"team_count":4},"status":"discard","description":"No-code confirmation rerun on kept greedy-allocation memoization commit 5d84b90.","timestamp":1775486151812,"segment":0,"confidence":8.930415236057575,"iterationTokens":1003,"asi":{"hypothesis":"If greedy memoization is robust on warm request reuse, immediate rerun should remain in ~0.12–0.14ms band.","rollback_reason":"No code change; validation-only rerun.","next_action_hint":"Use 5d84b90 as active baseline and prioritize overfitting guardrails (fresh-request diagnostics, cache lifecycle checks).","noise_observation":"Rerun improved further and maintained stable quality metrics."}}
{"run":634,"commit":"5d84b90","metric":0.13758,"metrics":{"best_ms":0.123143,"quality_sum":2.491129377057,"quality_min":0.589775903809,"team_count":4},"status":"discard","description":"No-code baseline rerun after ideas pruning/update for new 5d84b90 chain and overfitting guardrails.","timestamp":1775486222407,"segment":0,"confidence":8.955102267279878,"iterationTokens":2759,"asi":{"hypothesis":"Ideas-only updates should preserve runtime in the new ~0.12–0.14ms band.","rollback_reason":"No code change; metadata maintenance and baseline validation only.","next_action_hint":"Continue with high-signal structural experiments on warm-path overhead while cross-checking fresh-request behavior periodically.","noise_observation":"Median remained in-band with stable quality metrics."}}
{"run":635,"commit":"5d84b90","metric":0.130306,"metrics":{"best_ms":0.119977,"quality_sum":2.491129377057,"quality_min":0.589775903809,"team_count":4},"status":"discard","description":"Tried deterministic request-scoped `form_teams` allocation memoization (cache final allocations by request/config and reuse them to skip exact/greedy/improve stages on warm calls).","timestamp":1775486374526,"segment":0,"confidence":8.9384438313409,"iterationTokens":7747,"asi":{"hypothesis":"After greedy+improve memoization keeps, skipping full allocation pipeline via form-level allocations cache could further cut warm-call overhead.","rollback_reason":"Observed gain was marginal/inconclusive versus existing 5d84b90 variance band and adds broader request-reuse coupling close to full-result memoization.","next_action_hint":"Prefer narrower warm-path reductions with clearer signal or robustness improvements (bounded cache lifecycle) over broader form-level memoization layers.","overfit_note":"This direction amplifies request-object reuse dependence and risks benchmark-specific optimization."}}
{"run":636,"commit":"5d84b90","metric":0.133152,"metrics":{"best_ms":0.12185,"quality_sum":2.491129377057,"quality_min":0.589775903809,"team_count":4},"status":"discard","description":"No-code baseline rerun after pruning marginal form-level allocations cache attempt.","timestamp":1775486422611,"segment":0,"confidence":8.937309772913206,"iterationTokens":1366,"asi":{"hypothesis":"Reverted baseline should stay near ~0.12–0.14ms warm-call regime.","rollback_reason":"No code change; validation-only rerun after idea pruning.","next_action_hint":"Continue with targeted warm-path reductions that preserve clearer separation from full form-result memoization.","noise_observation":"Run remained in expected fast band with stable quality metrics."}}
{"run":637,"commit":"5d84b90","metric":0.146066,"metrics":{"best_ms":0.134725,"quality_sum":2.491129377057,"quality_min":0.589775903809,"team_count":4},"status":"discard","description":"Replaced final allocation ordering sort with task-order lookup map (`allocations_by_task_id` + iterate `request.tasks`) to avoid per-call `sorted(..., key=...)` in response assembly.","timestamp":1775486493165,"segment":0,"confidence":8.88841772132043,"iterationTokens":1968,"asi":{"hypothesis":"With warm-path memoization, output assembly is relatively larger; replacing sort+lambda with direct task-order lookup could reduce response-path overhead.","rollback_reason":"Regressed significantly; extra dict construction/lookups outweighed savings from removing the tiny sort.","next_action_hint":"Keep existing sort-based ordering; avoid output-path map rewrites unless they eliminate more work than they add.","observation":"Checks and quality metrics unchanged."}}
{"run":638,"commit":"5d84b90","metric":0.140516,"metrics":{"best_ms":0.134204,"quality_sum":2.491129377057,"quality_min":0.589775903809,"team_count":4},"status":"discard","description":"No-code baseline rerun after pruning regressed output ordering-map rewrite.","timestamp":1775486548735,"segment":0,"confidence":8.850016591207371,"iterationTokens":899,"asi":{"hypothesis":"After rollback, baseline should return to established ~0.12–0.14ms band.","rollback_reason":"No code change; validation-only run.","next_action_hint":"Explore output-path changes only when they remove model-validation or payload work directly; avoid extra mapping layers.","noise_observation":"Result returned to expected band with stable quality monitors."}}
{"run":639,"commit":"5d84b90","metric":0.125888,"metrics":{"best_ms":0.120508,"quality_sum":2.491129377057,"quality_min":0.589775903809,"team_count":4},"status":"discard","description":"Tried request-scoped teams-payload cache in `form_teams` keyed by ordered allocation object ids, reusing prebuilt payload dicts before `TeamsResponse.model_validate(...)`.","timestamp":1775486650642,"segment":0,"confidence":8.842772605210568,"iterationTokens":3031,"asi":{"hypothesis":"With greedy/improve memoization active, response payload construction is relatively prominent; caching payload dicts for identical ordered allocations should reduce warm-call assembly overhead.","rollback_reason":"Signal was inconclusive against existing variance band and adds another request-reuse cache layer with mutable payload concerns.","next_action_hint":"Avoid payload-object reuse caches unless a clearly repeatable improvement appears; focus on safer structural reductions or lifecycle hygiene.","overfit_note":"This optimization is strongly warm-object dependent and close to output-level memoization."}}
{"run":640,"commit":"5d84b90","metric":0.136057,"metrics":{"best_ms":0.12649,"quality_sum":2.491129377057,"quality_min":0.589775903809,"team_count":4},"status":"discard","description":"No-code baseline rerun after pruning inconclusive teams-payload cache attempt.","timestamp":1775486696104,"segment":0,"confidence":8.835244289423116,"iterationTokens":1153,"asi":{"hypothesis":"Rollback should keep runtime within established ~0.12–0.14ms warm band.","rollback_reason":"No code change; validation-only rerun.","next_action_hint":"Continue only with high-signal candidates; treat output-level cache layers as low-priority due inconclusive gains and added complexity.","noise_observation":"Result remains in expected fast band with stable quality metrics."}}
{"run":641,"commit":"ce00bb2","metric":0.12152,"metrics":{"best_ms":0.116871,"quality_sum":2.491129377057,"quality_min":0.589775903809,"team_count":4},"status":"keep","description":"Added optional `team_signature` field to `ScoredAllocation` (populated by `score_team`) and reused it in `improve_allocations` memoization key construction to avoid rebuilding member-id tuples on warm-path cache probes.","timestamp":1775486798304,"segment":0,"confidence":8.816215105884298,"iterationTokens":3107,"asi":{"hypothesis":"Warm-path overhead now includes repeated improve-cache key assembly; reusing precomputed canonical team signatures from scored allocations should cut per-call key-building work.","result":"Primary metric improved to a new low with checks passing and unchanged quality metrics.","safety_notes":"`team_signature` is optional with default `None`, preserving compatibility for monkeypatched/custom `score_team` return values; fallback path still reconstructs ids when absent."}}
{"run":642,"commit":"ce00bb2","metric":0.149273,"metrics":{"best_ms":0.124796,"quality_sum":2.491129377057,"quality_min":0.589775903809,"team_count":4},"status":"discard","description":"First no-code confirmation rerun on kept `team_signature` warm-key optimization commit ce00bb2.","timestamp":1775486840393,"segment":0,"confidence":8.825516912784785,"iterationTokens":811,"asi":{"hypothesis":"If ce00bb2 is robust, rerun should remain near ~0.12–0.14ms.","rollback_reason":"No code change; validation-only rerun.","next_action_hint":"Run an additional no-code sample to disambiguate host jitter before drawing conclusions on ce00bb2 magnitude.","noise_observation":"Median spiked to 0.149ms while best remained fast, suggesting transient host variance."}}
{"run":643,"commit":"ce00bb2","metric":0.152519,"metrics":{"best_ms":0.128663,"quality_sum":2.491129377057,"quality_min":0.589775903809,"team_count":4},"status":"discard","description":"Second no-code confirmation rerun on ce00bb2 to check prior spike; remained slower (~0.15ms median).","timestamp":1775486884969,"segment":0,"confidence":8.808929335512428,"iterationTokens":779,"asi":{"hypothesis":"A second rerun would clarify whether the first slow confirmation was an outlier.","rollback_reason":"No code change; validation-only rerun.","next_action_hint":"A/B against direct reversion of ce00bb2 (`team_signature` field + improve-cache-key fallback) to verify whether keep should be retained.","noise_observation":"Two consecutive confirmations in ~0.149–0.153ms suggest ce00bb2 gain may be non-robust under current host conditions."}}
{"run":644,"commit":"ce00bb2","metric":0.150074,"metrics":{"best_ms":0.124215,"quality_sum":2.491129377057,"quality_min":0.589775903809,"team_count":4},"status":"discard","description":"A/B reversion check for ce00bb2: removed `ScoredAllocation.team_signature` and restored original improve-cache-key member-id tuple construction.","timestamp":1775486939962,"segment":0,"confidence":8.843348604782925,"iterationTokens":1296,"asi":{"hypothesis":"If ce00bb2 was a false keep, directly reverting it should recover faster medians than the recent ~0.15ms confirmations.","rollback_reason":"Reversion did not improve median (remained ~0.15ms), so evidence is insufficient to justify undoing ce00bb2.","next_action_hint":"Retain ce00bb2 for now; continue paired sampling before any further cache-key micro changes.","observation":"Best_ms remained similarly low, indicating high host jitter in this regime."}}
{"run":645,"commit":"ce00bb2","metric":0.156005,"metrics":{"best_ms":0.116952,"quality_sum":2.491129377057,"quality_min":0.589775903809,"team_count":4},"status":"discard","description":"No-code baseline rerun after pruning notes for ce00bb2 A/B reversion check.","timestamp":1775486988555,"segment":0,"confidence":8.801006027738785,"iterationTokens":1019,"asi":{"hypothesis":"Metadata-only changes should keep runtime in current warm-band; sampling helps track regime drift.","rollback_reason":"No code change; validation-only run.","next_action_hint":"Given widening warm-band jitter, require larger effect sizes (or repeated paired samples) before new keeps.","noise_observation":"Median drifted higher while best remained very low, reinforcing high variance in this tiny-runtime regime."}}
{"run":646,"commit":"7361b06","metric":0.11105,"metrics":{"best_ms":0.108966,"quality_sum":2.491129377057,"quality_min":0.589775903809,"team_count":4},"status":"keep","description":"Added request-scoped cache for task original-order map (`task.id -> index`) via `_request_task_original_order(...)` and reused it in final allocation sort path instead of rebuilding the dict each call.","timestamp":1775487092206,"segment":0,"confidence":8.759215814119516,"iterationTokens":3271,"asi":{"hypothesis":"After warm-path memoization shifts, tiny per-call overhead in response assembly becomes material; caching the task original-order map can remove repeated dict construction on every call.","result":"Primary metric improved materially with checks passing and unchanged quality monitors.","safety_notes":"Cache is request-scoped and immutable for a stable request object, preserving output ordering semantics exactly.","context_note":"This optimization was previously neutral/regressive before warm-path memoization became dominant; regime shift made it high-impact."}}
{"run":647,"commit":"7361b06","metric":0.130447,"metrics":{"best_ms":0.115038,"quality_sum":2.491129377057,"quality_min":0.589775903809,"team_count":4},"status":"discard","description":"No-code confirmation rerun on kept task-original-order cache commit 7361b06.","timestamp":1775487140634,"segment":0,"confidence":8.760196241697843,"iterationTokens":797,"asi":{"hypothesis":"If 7361b06 is robust, rerun should remain below prior ~0.13–0.15ms band with stable best_ms/quality.","rollback_reason":"No code change; validation-only rerun.","next_action_hint":"Take additional paired samples before relying on single-run low outliers in this high-jitter sub-0.2ms regime.","noise_observation":"Median regressed from the keep outlier but best stayed very low; likely high host variance."}}
{"run":648,"commit":"7361b06","metric":0.123904,"metrics":{"best_ms":0.108936,"quality_sum":2.491129377057,"quality_min":0.589775903809,"team_count":4},"status":"discard","description":"Second no-code confirmation sample on 7361b06 to disambiguate prior slower rerun.","timestamp":1775487187888,"segment":0,"confidence":8.78148256214439,"iterationTokens":693,"asi":{"hypothesis":"Additional sample will clarify whether 7361b06 improvement survives jitter.","rollback_reason":"No code change; validation-only sampling.","next_action_hint":"Treat 7361b06 as retained but continue demanding multi-sample evidence for future micro/warm-path changes.","noise_observation":"Median returned to lower band (~0.124ms), indicating substantial short-run variance rather than deterministic regression."}}
{"run":649,"commit":"7361b06","metric":0.133192,"metrics":{"best_ms":0.116811,"quality_sum":2.491129377057,"quality_min":0.589775903809,"team_count":4},"status":"discard","description":"No-code baseline rerun after ideas pruning/update for new keeps ce00bb2 and 7361b06.","timestamp":1775487255116,"segment":0,"confidence":8.822063051710556,"iterationTokens":1897,"asi":{"hypothesis":"Ideas-only edits should keep runtime in current ~0.12–0.14ms warm regime.","rollback_reason":"No source-code change; metadata maintenance only.","next_action_hint":"Given persistent jitter, prioritize only experiments with larger expected effect or stronger semantic value (e.g., lifecycle safety) over micro warm-path tweaks.","noise_observation":"Median remained in-band and quality monitors stable."}}
{"run":650,"commit":"7361b06","metric":0.180111,"metrics":{"best_ms":0.144794,"quality_sum":2.491129377057,"quality_min":0.589775903809,"team_count":4},"status":"discard","description":"Retested module-level alias for response validation (`_TEAMS_RESPONSE_MODEL_VALIDATE = TeamsResponse.model_validate`) and switched final return to alias call.","timestamp":1775487349094,"segment":0,"confidence":8.83960981677672,"iterationTokens":2468,"asi":{"hypothesis":"With warm-path memoization making output validation dominant, bypassing repeated class attribute lookup for `model_validate` might shave call overhead.","rollback_reason":"Strong regression; alias indirection did not help and worsened runtime substantially in this regime.","next_action_hint":"Keep direct `TeamsResponse.model_validate(...)` call; avoid callable-alias rewrites in output path.","observation":"Checks passed and quality metrics unchanged."}}
{"run":651,"commit":"7361b06","metric":0.13762,"metrics":{"best_ms":0.12668,"quality_sum":2.491129377057,"quality_min":0.589775903809,"team_count":4},"status":"discard","description":"No-code baseline rerun after pruning regressed model_validate-alias retest.","timestamp":1775487415606,"segment":0,"confidence":8.850790400269876,"iterationTokens":869,"asi":{"hypothesis":"After reverting alias regression, runtime should return to established warm band.","rollback_reason":"No code change; validation-only rerun.","next_action_hint":"Avoid output call-shape micro-optimizations already shown regressive; focus on larger structural or lifecycle improvements.","noise_observation":"Median recovered to prior ~0.13–0.14ms band with stable quality metrics."}}
{"run":652,"commit":"7361b06","metric":0.14768,"metrics":{"best_ms":0.127872,"quality_sum":2.491129377057,"quality_min":0.589775903809,"team_count":4},"status":"discard","description":"Retested task-order reuse without per-call list copy: kept cached tuple for deterministic path and only materialized list when `init_random` requires shuffle.","timestamp":1775487497983,"segment":0,"confidence":8.860977864352225,"iterationTokens":2256,"asi":{"hypothesis":"With warm-path overhead dominant, avoiding repeated tuple->list copy for cached task order should reduce per-call setup cost.","rollback_reason":"Regressed notably in current regime; tuple-path refactor introduced overhead and did not beat existing behavior.","next_action_hint":"Keep current list-copy approach in `form_teams`; avoid further task-order container-shape rewrites.","observation":"Checks passed and quality metrics unchanged."}}
{"run":653,"commit":"7361b06","metric":0.150605,"metrics":{"best_ms":0.132601,"quality_sum":2.491129377057,"quality_min":0.589775903809,"team_count":4},"status":"discard","description":"No-code baseline rerun after pruning task-order tuple-reuse retest.","timestamp":1775487558110,"segment":0,"confidence":8.852003330463672,"iterationTokens":822,"asi":{"hypothesis":"Rollback should return to normal warm-band behavior.","rollback_reason":"No code change; validation-only rerun.","next_action_hint":"Given sustained ~0.13–0.15ms jitter, require larger deltas before accepting additional micro warm-path tweaks.","noise_observation":"Sample remained in elevated warm band while quality stayed stable."}}
{"run":654,"commit":"7361b06","metric":0.130568,"metrics":{"best_ms":0.129104,"quality_sum":2.491129377057,"quality_min":0.589775903809,"team_count":4},"status":"discard","description":"Added request-scoped cache inside `capped_candidate_search_is_exact` keyed by `(request id, max_candidate_teams)` to avoid recomputing combinatorial exactness checks each call.","timestamp":1775487658152,"segment":0,"confidence":8.845474746513199,"iterationTokens":2662,"asi":{"hypothesis":"Warm-path setup still re-evaluates capped exactness each call; memoizing this deterministic check should shave repeated comb/division overhead.","rollback_reason":"Improvement signal was inconclusive in current jitter band and not clearly better than baseline.","next_action_hint":"Prefer experiments with larger expected effect than single small helper-cache additions in this regime.","observation":"Checks passed and quality metrics unchanged."}}
{"run":655,"commit":"7361b06","metric":0.139104,"metrics":{"best_ms":0.132581,"quality_sum":2.491129377057,"quality_min":0.589775903809,"team_count":4},"status":"discard","description":"No-code baseline rerun after pruning inconclusive capped-exactness cache attempt.","timestamp":1775487717956,"segment":0,"confidence":8.866478774446405,"iterationTokens":845,"asi":{"hypothesis":"Rollback baseline should stay in current ~0.12–0.15ms warm band.","rollback_reason":"No code change; validation-only run.","next_action_hint":"Shift to experiments with clearer structural leverage or run periodic fresh-request diagnostics to avoid overfitting drift.","noise_observation":"Median stayed in-band; quality monitors unchanged."}}
{"run":656,"commit":"7361b06","metric":0.126519,"metrics":{"best_ms":0.121841,"quality_sum":2.491129377057,"quality_min":0.589775903809,"team_count":4},"status":"discard","description":"Tried request-scoped ordered-allocation cache in output path: memoize sorted `allocations` tuple by `(request id, allocation object-id tuple)` to skip repeated final sort on warm hits.","timestamp":1775487820869,"segment":0,"confidence":8.866857031146054,"iterationTokens":3544,"asi":{"hypothesis":"With warm-path memoization, final allocation sorting cost may be avoidable via cached ordered tuples keyed by stable allocation identities.","rollback_reason":"Observed gain was modest/inconclusive in jitter band and adds another request-reuse cache layer with object-identity coupling.","next_action_hint":"Prefer fewer cache layers unless effect is clearly larger than host variance.","observation":"Checks passed and quality metrics unchanged."}}
{"run":657,"commit":"7361b06","metric":0.141097,"metrics":{"best_ms":0.130226,"quality_sum":2.491129377057,"quality_min":0.589775903809,"team_count":4},"status":"discard","description":"No-code baseline rerun after pruning inconclusive ordered-allocation output cache attempt.","timestamp":1775487874590,"segment":0,"confidence":8.86548104602781,"iterationTokens":893,"asi":{"hypothesis":"Rollback should preserve current warm-band behavior.","rollback_reason":"No code change; validation-only rerun.","next_action_hint":"Prioritize experiments with larger expected effect than output-sort memoization layers.","noise_observation":"Median remained in the same ~0.13–0.15ms band with stable quality metrics."}}
