{"run":441,"commit":"d94ba9f","metric":14.111908,"metrics":{"best_ms":13.312112,"quality_sum":2.491129377057,"quality_min":0.589775903809,"team_count":4},"status":"discard","description":"No-code baseline rerun after reverting `geometric_mean` alias-default experiment.","timestamp":1775396309442,"segment":0,"confidence":24.41346790720701,"iterationTokens":682,"asi":{"hypothesis":"Rollback should recover baseline after failed geometric_mean alias-default variant.","rollback_reason":"No code change; baseline anchoring run.","next_action_hint":"Use d94ba9f baseline and avoid further geometric_mean alias micro-variants.","noise_observation":"Baseline returned to mid/low-14ms band with low best sample."}}
{"run":442,"commit":"d94ba9f","metric":13.070655,"metrics":{"best_ms":12.685676,"quality_sum":2.491129377057,"quality_min":0.589775903809,"team_count":4},"status":"discard","description":"Additional no-code baseline rerun on active head d94ba9f to sample current host regime.","timestamp":1775396406122,"segment":0,"confidence":24.27401777197837,"iterationTokens":2146,"asi":{"hypothesis":"Current baseline should remain near low-13ms after recent variability checks.","rollback_reason":"No code change; measurement-only run.","next_action_hint":"Treat baseline as low-13ms with bursty variance; keep immediate A/B confirmation discipline.","noise_observation":"Run returned to low-13ms band after prior higher-latency samples."}}
{"run":443,"commit":"d94ba9f","metric":14.195673,"metrics":{"best_ms":12.637058,"quality_sum":2.491129377057,"quality_min":0.589775903809,"team_count":4},"status":"discard","description":"Changed `geometric_mean` list-4 hot path from log/exp aggregation to equivalent `sqrt(sqrt(a*b*c*d))` formulation.","timestamp":1775396712604,"segment":0,"confidence":23.99213600055289,"iterationTokens":2146,"asi":{"hypothesis":"For fixed 4-value positive inputs, nested sqrt of product should be cheaper than four logs plus exp in geometric_mean hotspot.","rollback_reason":"No clear primary improvement in end-to-end benchmark under current host conditions; median sat above recent baseline band.","next_action_hint":"Treat this as neutral/regressive for now; only revisit with tightly paired A/B if profiling later shows geometric_mean dominates again.","result":"Checks passed and quality unchanged."}}
{"run":444,"commit":"d94ba9f","metric":12.714064,"metrics":{"best_ms":12.580721,"quality_sum":2.491129377057,"quality_min":0.589775903809,"team_count":4},"status":"discard","description":"No-code baseline rerun after discarding geometric_mean sqrt-product variant.","timestamp":1775396751129,"segment":0,"confidence":23.724018856343434,"iterationTokens":935,"asi":{"hypothesis":"If prior geometric_mean variant was not beneficial, rollback should recover lower baseline quickly.","rollback_reason":"No code change; baseline anchoring run.","next_action_hint":"Use current low-12ms run as fresh anchor and continue with structural candidate-space reductions.","noise_observation":"Host returned to fast low-12ms band, reinforcing need for paired A/B on marginal edits."}}
{"run":445,"commit":"d94ba9f","metric":13.062614,"metrics":{"best_ms":12.834281,"quality_sum":2.491129377057,"quality_min":0.589775903809,"team_count":4},"status":"discard","description":"Added `@lru_cache`-backed `_geometric_mean_four_values(...)` helper and routed `geometric_mean` list-4 hot path through it to reuse repeated 4-value geometric means.","timestamp":1775397133089,"segment":0,"confidence":23.47839190097355,"iterationTokens":32835,"asi":{"hypothesis":"List-4 geometric_mean inputs repeat heavily in COMPAT workload; caching 4-value results should cut repeated log/exp cost.","rollback_reason":"No clear primary improvement over active baseline; median remained above best recent no-code anchors.","next_action_hint":"Avoid cache-layer additions in geometric_mean for now; focus on reducing candidate upper-bound evaluations instead.","result":"Checks passed and quality unchanged."}}
{"run":446,"commit":"d94ba9f","metric":13.444138,"metrics":{"best_ms":13.143237,"quality_sum":2.491129377057,"quality_min":0.589775903809,"team_count":4},"status":"discard","description":"No-code baseline rerun after discarding geometric_mean 4-value LRU cache experiment.","timestamp":1775397178552,"segment":0,"confidence":22.578917856822947,"iterationTokens":771,"asi":{"hypothesis":"Rollback should remain within current baseline variance band.","rollback_reason":"No code change; baseline characterization run.","next_action_hint":"Continue with ideas targeting reduced exact upper-bound/score invocations rather than added memoization layers.","noise_observation":"Baseline drifted to mid-13ms band, consistent with ongoing host volatility."}}
{"run":447,"commit":"d94ba9f","metric":12.720243,"metrics":{"best_ms":12.522018,"quality_sum":2.491129377057,"quality_min":0.589775903809,"team_count":4},"status":"discard","description":"Added 4-member task-preference-log fast paths in COMPAT pruning loops (`_best_scored_shortlist_candidate_with_compat_pruning`, greedy <=cap cheap stage, and `_compat_candidate_quality_upper_bound`) to replace per-member loops with direct 4-log loads.","timestamp":1775397293182,"segment":0,"confidence":22.51069044038663,"iterationTokens":5147,"asi":{"hypothesis":"Most benchmark candidates are 4-member teams; unrolling task-preference log aggregation should reduce dict/loop overhead in pruning hot paths.","rollback_reason":"Result was effectively neutral versus best recent baseline anchor; no clear primary improvement to justify complexity.","next_action_hint":"Keep generic loop form for maintainability unless paired A/B repeatedly shows a consistent gain.","result":"Checks passed and quality unchanged."}}
{"run":448,"commit":"23b25ec","metric":12.142132,"metrics":{"best_ms":12.068712,"quality_sum":2.491129377057,"quality_min":0.589775903809,"team_count":4},"status":"keep","description":"Refactored COMPAT pruning exact stage in cap+1 and <=cap greedy paths to reuse cheap-stage non-social bound (`alpha*skill + beta*personality + gamma*task_pref`) and compute only social upper bound in exact pass via new `_compat_candidate_social_upper_bound(...)`, eliminating repeated skill/personality/task-preference recomputation.","timestamp":1775397928497,"segment":0,"confidence":22.46252045002682,"iterationTokens":13160,"asi":{"hypothesis":"Exact upper-bound stage was redundantly recomputing non-social components already computed in cheap stage; carrying non-social bound forward and evaluating only social upper should cut hot-path work materially.","result":"Primary metric improved notably with checks passing and unchanged quality monitors.","safety_notes":"Upper-bound math remains admissible/equivalent: cheap ordering unchanged, and exact bound now equals stored non-social component plus `delta * social_upper` from identical social helper logic."}}
{"run":449,"commit":"23b25ec","metric":12.863398,"metrics":{"best_ms":12.539024,"quality_sum":2.491129377057,"quality_min":0.589775903809,"team_count":4},"status":"discard","description":"No-code confirmation rerun on kept non-social-bound reuse refactor commit 23b25ec.","timestamp":1775397977437,"segment":0,"confidence":22.4001456364768,"iterationTokens":908,"asi":{"hypothesis":"If 23b25ec gain is robust, reruns should remain in low-12ms band with unchanged quality.","rollback_reason":"No code change; validation-only rerun.","next_action_hint":"Use 23b25ec as new baseline; continue pruning-stage restructuring that removes duplicated exact-stage work.","noise_observation":"Rerun stayed in improved low-12ms regime despite expected host drift."}}
{"run":450,"commit":"78ce3d9","metric":12.059215,"metrics":{"best_ms":11.813801,"quality_sum":2.491129377057,"quality_min":0.589775903809,"team_count":4},"status":"keep","description":"Added per-task swap-phase upper-bound memoization in `improve_allocations`: cache `_compat_candidate_quality_upper_bound(...)` by team signature for each task to reuse repeated swapped-team bounds within swap rounds.","timestamp":1775398147365,"segment":0,"confidence":22.341181719901957,"iterationTokens":10240,"asi":{"hypothesis":"After moving cheap-stage loops off `_compat_candidate_quality_upper_bound`, remaining calls in swap improvement repeat team signatures enough that task-local bound memoization should pay off.","result":"Primary metric improved with checks passing and unchanged quality monitors.","safety_notes":"Bound values are deterministic pure-function outputs keyed by task + team signature; caching reuses identical results without changing decision logic."}}
{"run":451,"commit":"78ce3d9","metric":14.23782,"metrics":{"best_ms":13.350189,"quality_sum":2.491129377057,"quality_min":0.589775903809,"team_count":4},"status":"discard","description":"No-code confirmation rerun on kept swap-phase upper-bound memoization commit 78ce3d9.","timestamp":1775398196387,"segment":0,"confidence":20.749164078377657,"iterationTokens":1556,"asi":{"hypothesis":"If 78ce3d9 gain is robust, reruns should stay near low-12ms band.","rollback_reason":"No code change; validation-only rerun.","next_action_hint":"Given severe host drift in this sample, run additional no-code anchors before judging small follow-up changes.","noise_observation":"Rerun jumped to a slower band (~14.2ms), likely environmental variance rather than immediate code effect."}}
{"run":452,"commit":"78ce3d9","metric":13.678251,"metrics":{"best_ms":12.372428,"quality_sum":2.491129377057,"quality_min":0.589775903809,"team_count":4},"status":"discard","description":"Additional no-code baseline rerun on active head 78ce3d9 after high-latency outlier.","timestamp":1775398242172,"segment":0,"confidence":19.900891597792373,"iterationTokens":675,"asi":{"hypothesis":"Follow-up baseline run should clarify whether prior 14.2ms sample was transient.","rollback_reason":"No code change; variance characterization run.","next_action_hint":"Treat current regime as broad (~12.3 best to ~14 median spikes); require paired confirmations for marginal deltas.","noise_observation":"Median improved versus prior run but remains above fastest low-12ms samples, confirming instability."}}
{"run":453,"commit":"78ce3d9","metric":15.089182,"metrics":{"best_ms":13.796835,"quality_sum":2.491129377057,"quality_min":0.589775903809,"team_count":4},"status":"discard","description":"Further no-code baseline rerun on 78ce3d9 to sample current host band.","timestamp":1775398286113,"segment":0,"confidence":19.73361598913997,"iterationTokens":673,"asi":{"hypothesis":"Additional repeat should bound current variance envelope before next code change.","rollback_reason":"No code change; baseline sampling run.","next_action_hint":"Given recurrent high-latency spikes, evaluate next candidates with immediate same-commit repeat before keep/discard.","noise_observation":"Observed another slow-band median (~15.1ms), indicating substantial environmental drift."}}
{"run":454,"commit":"78ce3d9","metric":12.693654,"metrics":{"best_ms":11.962069,"quality_sum":2.491129377057,"quality_min":0.589775903809,"team_count":4},"status":"discard","description":"Added `_COMPAT_MEMBER_PRIORITY_ORDER_CACHE` keyed by `(require_all_members, task_skill_ids, task_capable_counts, member_task_values)` to memoize full `_compat_member_priority_order(...)` outputs and skip repeated key-sort work.","timestamp":1775398546855,"segment":0,"confidence":19.703612854115722,"iterationTokens":17506,"asi":{"hypothesis":"Full-order memoization should reduce `_compat_member_priority_order` overhead after cache warmup across repeated benchmark calls.","rollback_reason":"No convincing end-to-end gain; additional cache-key construction/list copy overhead offset expected savings.","next_action_hint":"Keep existing rich-priority-task caching only; avoid extra full-order cache layer.","result":"Checks passed and quality unchanged."}}
{"run":455,"commit":"78ce3d9","metric":12.866803,"metrics":{"best_ms":12.043142,"quality_sum":2.491129377057,"quality_min":0.589775903809,"team_count":4},"status":"discard","description":"No-code baseline rerun after discarding full `_compat_member_priority_order` output memoization experiment.","timestamp":1775398588849,"segment":0,"confidence":19.935055801557517,"iterationTokens":701,"asi":{"hypothesis":"Rollback should return to 78ce3d9 behavior after failed priority-order cache layer.","rollback_reason":"No code change; baseline anchoring run.","next_action_hint":"Focus on reducing remaining `_compat_candidate_quality_upper_bound` miss cost in swap pruning rather than new broad caches.","noise_observation":"Baseline landed mid-12ms with low best sample, still within volatile band."}}
{"run":456,"commit":"78ce3d9","metric":13.478121,"metrics":{"best_ms":12.126069,"quality_sum":2.491129377057,"quality_min":0.589775903809,"team_count":4},"status":"discard","description":"Canonicalized swap-phase upper-bound memo keys in `improve_allocations` (`tuple(sorted(swapped_*_signature))`) and reused canonical signatures for bound-cache lookups / `_compat_candidate_quality_upper_bound` calls to merge permutation-equivalent teams.","timestamp":1775398672322,"segment":0,"confidence":20.061130466279394,"iterationTokens":2382,"asi":{"hypothesis":"Order-invariant signatures should increase swap bound-cache hit rate and cut duplicate upper-bound computations.","rollback_reason":"End-to-end runtime did not improve in this window; canonicalization overhead likely offset limited additional cache hits.","next_action_hint":"Keep unsorted swap signatures for upper-bound memoization; avoid added per-candidate sorting in swap loop.","result":"Checks passed and quality unchanged."}}
{"run":457,"commit":"78ce3d9","metric":12.977673,"metrics":{"best_ms":12.445875,"quality_sum":2.491129377057,"quality_min":0.589775903809,"team_count":4},"status":"discard","description":"Added 4-member task-preference-log unroll in `_compat_candidate_quality_upper_bound` (improve-phase bound path) to replace per-member loop with direct 4-log aggregation.","timestamp":1775398729245,"segment":0,"confidence":20.066967062254257,"iterationTokens":1584,"asi":{"hypothesis":"With upper-bound calls concentrated in swap improvement and team size fixed at 4, unrolling task-preference aggregation in `_compat_candidate_quality_upper_bound` might reduce miss cost.","rollback_reason":"No clear end-to-end gain in this run; extra branch/unrolled code did not beat generic loop path.","next_action_hint":"Keep generic task-preference aggregation in `_compat_candidate_quality_upper_bound`.","result":"Checks passed and quality unchanged."}}
{"run":458,"commit":"78ce3d9","metric":11.948363,"metrics":{"best_ms":11.806024,"quality_sum":2.491129377057,"quality_min":0.589775903809,"team_count":4},"status":"discard","description":"No-code baseline rerun on active head 78ce3d9 after discard of `_compat_candidate_quality_upper_bound` task-preference unroll.","timestamp":1775398770915,"segment":0,"confidence":19.96432096695938,"iterationTokens":680,"asi":{"hypothesis":"Rollback run should re-anchor current baseline after failed upper-bound unroll.","rollback_reason":"No code change; baseline anchoring run.","next_action_hint":"Use this low-11.9ms sample as fast-band anchor; validate future marginal edits with immediate paired reruns.","noise_observation":"Host returned to very fast band, reinforcing substantial environmental variance."}}
{"run":459,"commit":"78ce3d9","metric":13.214461,"metrics":{"best_ms":12.400279,"quality_sum":2.491129377057,"quality_min":0.589775903809,"team_count":4},"status":"discard","description":"Hoisted swap-phase COMPAT bound data/cache lookups in `improve_allocations` from per-candidate inner loop to per-pair setup (`left/right` bound tuples + upper-bound caches), leaving only signature lookups inside candidate loop.","timestamp":1775398851393,"segment":0,"confidence":19.937194959455773,"iterationTokens":4217,"asi":{"hypothesis":"Removing repeated per-candidate task-bound tuple unpacking and cache-map retrieval in swap loops should trim inner-loop overhead.","rollback_reason":"No end-to-end improvement observed; added branch/assert and wider-scope locals likely offset micro-savings.","next_action_hint":"Keep existing inline retrieval layout in swap loop; pursue larger call-count reductions instead of lookup hoists.","result":"Checks passed and quality unchanged."}}
{"run":460,"commit":"78ce3d9","metric":19.057098,"metrics":{"best_ms":18.135302,"quality_sum":2.491129377057,"quality_min":0.589775903809,"team_count":4},"status":"discard","description":"Replaced `max(x, 1e-12)` clamps with inline ternary clamps (`x if x >= 1e-12 else 1e-12`) across allocation objective/product computations and swap-trial product calculations.","timestamp":1775398963964,"segment":0,"confidence":19.914766353132105,"iterationTokens":4013,"asi":{"hypothesis":"Inline ternary clamps may outperform repeated built-in `max` calls in product-heavy objective paths.","rollback_reason":"Severe end-to-end regression; expanded branch expressions/attribute repetition did not translate to real workload gains.","next_action_hint":"Keep concise `max(..., 1e-12)` clamps; avoid this ternary rewrite pattern.","result":"Checks passed and quality unchanged but runtime degraded dramatically in this run."}}
{"run":461,"commit":"78ce3d9","metric":18.445309,"metrics":{"best_ms":18.190837,"quality_sum":2.491129377057,"quality_min":0.589775903809,"team_count":4},"status":"discard","description":"No-code baseline rerun after discarding clamp-ternary rewrite, to verify current host regime.","timestamp":1775399010092,"segment":0,"confidence":19.791640581102016,"iterationTokens":734,"asi":{"hypothesis":"Rollback should recover baseline behavior; follow-up run distinguishes code regression from ambient slowdown.","rollback_reason":"No code change; variance characterization run.","next_action_hint":"Current environment is in a very slow band; postpone marginal keep decisions until latency returns near prior low-12ms regime or use tighter paired A/B.","noise_observation":"Baseline remained in ~18ms band immediately after rollback, indicating external slowdown dominated recent readings."}}
{"run":462,"commit":"78ce3d9","metric":18.495054,"metrics":{"best_ms":18.065019,"quality_sum":2.491129377057,"quality_min":0.589775903809,"team_count":4},"status":"discard","description":"Additional no-code baseline rerun to confirm sustained slow host regime.","timestamp":1775399055830,"segment":0,"confidence":19.50293316280959,"iterationTokens":665,"asi":{"hypothesis":"If environment remains throttled, repeated baseline runs should stay near high-latency band.","rollback_reason":"No code change; environment sampling run.","next_action_hint":"Avoid trusting small deltas until host exits slow regime; prioritize documenting/pruning stale ideas meanwhile.","noise_observation":"Second consecutive baseline remained near ~18.5ms, confirming sustained slowdown."}}
{"run":463,"commit":"78ce3d9","metric":18.602327,"metrics":{"best_ms":18.250941,"quality_sum":2.491129377057,"quality_min":0.589775903809,"team_count":4},"status":"discard","description":"No-code baseline rerun after ideas-pruning updates; monitor host latency before further micro-optimization attempts.","timestamp":1775399129324,"segment":0,"confidence":19.445301368934704,"iterationTokens":4492,"asi":{"hypothesis":"If host remains throttled, baseline should stay in high-latency band regardless of code stability.","rollback_reason":"No code change; environment monitoring run.","next_action_hint":"Delay marginal micro-experiments until latency normalizes; prioritize only larger structural hypotheses meanwhile.","noise_observation":"Third consecutive baseline in ~18.5ms band confirms sustained environmental slowdown."}}
{"run":464,"commit":"78ce3d9","metric":23.71044,"metrics":{"best_ms":23.001256,"quality_sum":2.551629599253,"quality_min":0.619513977267,"team_count":4},"status":"checks_failed","description":"Tried a new `max_skills_per_member == 1` COMPAT assignment path in `_assign_task_skills_compat` that pre-ranks each member's positive tasks once and selects first eligible uncovered task from that ranking.","timestamp":1775399565333,"segment":0,"confidence":19.385834188601375,"iterationTokens":9582,"asi":{"hypothesis":"Pre-ranking per-member task choices should remove repeated inner candidate scans/comparisons and speed dominant single-capacity COMPAT assignments.","rollback_reason":"Correctness checks failed: assignment tie/overlap behavior changed (partial-overlap compat tests now expect different skill allocations).","next_action_hint":"Do not pre-rank-and-pick for single-capacity compat assignment without a proof of exact tie/overlap equivalence; preserve current dynamic selection semantics.","error_excerpt":"Failed tests: test_form_teams_preserves_partial_compat_overlap_ranking, test_compat_assignment_does_not_rebalance_overlap_heavy_team, test_compat_skill_score_keeps_partial_overlap_coverage."}}
{"run":465,"commit":"78ce3d9","metric":17.821636,"metrics":{"best_ms":17.318773,"quality_sum":2.491129377057,"quality_min":0.589775903809,"team_count":4},"status":"discard","description":"No-code baseline rerun after reverting failed single-capacity pre-ranked COMPAT assignment attempt.","timestamp":1775399612198,"segment":0,"confidence":19.23166249156454,"iterationTokens":1629,"asi":{"hypothesis":"Rollback should restore baseline quality/behavior after failed assignment-semantics experiment.","rollback_reason":"No code change; post-failure baseline anchor.","next_action_hint":"Avoid assignment-order refactors in `_assign_task_skills_compat` without explicit tie-behavior proof and targeted tests.","noise_observation":"Host remains in elevated-latency regime (~17–18ms), so benchmark deltas are currently coarse."}}
