{"run":204,"commit":"681e558","metric":110.19385,"metrics":{"best_ms":110.027305,"quality_sum":2.491129377057,"quality_min":0.589775903809,"team_count":4},"status":"discard","description":"Consolidated request-scoped task caches into a single `_request_task_data` structure (tasks-by-id + filtered task-preference maps) and made `_request_tasks_by_id`/`_request_task_preferences_by_task_id` thin accessors. This regressed vs current best.","timestamp":1775199178249,"segment":0,"confidence":71.79184681544697,"iterationTokens":2419,"asi":{"hypothesis":"A single cache lookup for immutable task data may reduce duplicated per-call cache checks across score_team helpers.","rollback_reason":"Extra tuple unpack/accessor overhead outweighed any cache consolidation benefit.","next_action_hint":"Keep separate specialized task/task-preference caches."}}
{"run":205,"commit":"681e558","metric":116.070229,"metrics":{"best_ms":112.328923,"quality_sum":2.491129377057,"quality_min":0.589775903809,"team_count":4},"status":"discard","description":"Changed `_request_resolved_weights` cache shape from direct composite-key map to per-request nested map (`id(request)` -> `{(mode,preset,normalize): weights}`) to reduce composite key construction on each lookup. This regressed significantly.","timestamp":1775199257412,"segment":0,"confidence":71.40347578694595,"iterationTokens":1515,"asi":{"hypothesis":"Nested per-request cache should reduce lookup-key overhead for repeated weight retrieval in score_team/shortlist_scorers.","rollback_reason":"Extra branching/nested-dict indirection outweighed any saved key-construction cost.","next_action_hint":"Keep simpler direct composite-key `_request_resolved_weights` cache."}}
{"run":206,"commit":"681e558","metric":166.237629,"metrics":{"best_ms":157.989429,"quality_sum":2.491129377057,"quality_min":0.589775903809,"team_count":4},"status":"discard","description":"Added an early shortcut in `candidate_combinations` to skip shortlist ranking/round-robin work when `shortlist_size >= len(people)` (use full input list directly). This unexpectedly regressed heavily.","timestamp":1775199416543,"segment":0,"confidence":70.57146364109599,"iterationTokens":1515,"asi":{"hypothesis":"When shortlist would include everyone, bypassing ranking/merge logic should save sorting and dedup overhead.","rollback_reason":"End-to-end metric regressed severely; likely no practical hit-path benefit in this workload and extra branching hurt.","next_action_hint":"Do not pursue this shortlist_size>=len shortcut further without concrete hit-rate profiling."}}
{"run":207,"commit":"681e558","metric":170.04889,"metrics":{"best_ms":163.688566,"quality_sum":2.491129377057,"quality_min":0.589775903809,"team_count":4},"status":"discard","description":"Added request-scoped cache of per-person explicit teammate-id tuples and used it in score_team’s social-preference-presence detection (replacing `has_explicit_social_preferences` helper scans on cache misses). This regressed drastically.","timestamp":1775199580733,"segment":0,"confidence":70.27702090058634,"iterationTokens":2178,"asi":{"hypothesis":"Precomputing explicit preference ids per person should accelerate repeated team social-preference checks in score_team.","rollback_reason":"Tuple cache lookup plus nested Python loops performed much worse than existing helper-based scans.","next_action_hint":"Keep current social-preference presence check implementation; do not add explicit-preference-id cache."}}
{"run":208,"commit":"681e558","metric":170.301628,"metrics":{"best_ms":158.7213,"quality_sum":2.491129377057,"quality_min":0.589775903809,"team_count":4},"status":"discard","description":"Changed `_compat_member_priority_order` key builders to list-comprehension + conditional in-place `.sort()` (only when len>1) instead of `sorted(...)` calls, aiming to skip sort overhead for tiny positive-task lists. This regressed drastically.","timestamp":1775199678692,"segment":0,"confidence":69.98502493686586,"iterationTokens":1681,"asi":{"hypothesis":"Many members have <=1 positive tasks, so avoiding unconditional sorted() calls should reduce priority-key overhead.","rollback_reason":"Conditional list/sort path was far slower than existing sorted-based implementation in this workload.","next_action_hint":"Keep current `_compat_member_priority_order` sorted() formulation."}}
{"run":209,"commit":"681e558","metric":162.948214,"metrics":{"best_ms":159.035956,"quality_sum":2.491129377057,"quality_min":0.589775903809,"team_count":4},"status":"discard","description":"Added `_compat_task_skill_meta` cache (task-skill ids + order map) and reused it in `_assign_task_skills_compat` / `_compat_sort_member_assignments` to avoid rebuilding per-call task-skill metadata. This regressed heavily.","timestamp":1775199815430,"segment":0,"confidence":66.8399221784562,"iterationTokens":4557,"asi":{"hypothesis":"Task-skill metadata is immutable per task list, so caching should remove repeated tuple/dict construction in compat assignment paths.","rollback_reason":"Cache lookup/identity-guard overhead outweighed tiny metadata construction costs.","next_action_hint":"Keep direct local task-skill metadata construction; avoid this cache layer."}}
{"run":210,"commit":"681e558","metric":151.34919,"metrics":{"best_ms":122.982714,"quality_sum":2.491129377057,"quality_min":0.589775903809,"team_count":4},"status":"discard","description":"Tweaked hot key/signature construction: switched score_team team-signature build to list-comprehension `sorted([...])` and cached_score_team key canonicalization to `sorted(map(id, people))`. This regressed badly.","timestamp":1775199906355,"segment":0,"confidence":69.50052502629903,"iterationTokens":1114,"asi":{"hypothesis":"Alternate small iterable forms for sorted canonicalization might shave Python generator overhead in hot paths.","rollback_reason":"These iterable-form changes were significantly slower than existing generator forms.","next_action_hint":"Keep current generator-based sorted canonicalization code."}}
{"run":211,"commit":"681e558","metric":178.740549,"metrics":{"best_ms":131.035924,"quality_sum":2.491129377057,"quality_min":0.589775903809,"team_count":4},"status":"discard","description":"No-code-change confirmation run on current HEAD to gauge noise floor after recent large swings. Result was a severe slowdown outlier versus neighboring runs, indicating high transient system noise/load.","timestamp":1775200017727,"segment":0,"confidence":66.00798893284609,"iterationTokens":3369,"asi":{"hypothesis":"Re-running unchanged baseline should estimate current benchmark variance/confidence before drawing conclusions from micro-tweaks.","rollback_reason":"Unchanged code produced a large outlier; measurement appears noise-dominated under current host conditions.","next_action_hint":"Take replicate runs for any prospective keep to confirm signal; prefer larger deltas over micro wins right now.","noise_observation":"total_ms spiked despite no code change"}}
{"run":212,"commit":"681e558","metric":126.616695,"metrics":{"best_ms":119.7905,"quality_sum":2.491129377057,"quality_min":0.589775903809,"team_count":4},"status":"discard","description":"Second no-code-change probe run on HEAD after prior outlier; runtime remained far above prior best, confirming high benchmark variance/system load in current environment window.","timestamp":1775200094491,"segment":0,"confidence":63.96534188931298,"iterationTokens":705,"asi":{"hypothesis":"A repeat unchanged run should clarify whether prior slowdown was a one-off spike or persistent noise band.","rollback_reason":"Observed large variance on unchanged code; cannot trust small deltas right now.","next_action_hint":"Require replicated confirmation before keeping additional micro-optimizations.","noise_observation":"baseline HEAD fluctuated from ~108ms to ~126-179ms without code changes"}}
{"run":213,"commit":"681e558","metric":112.810743,"metrics":{"best_ms":108.416992,"quality_sum":2.491129377057,"quality_min":0.589775903809,"team_count":4},"status":"discard","description":"Extended `_assign_task_skills_compat` singleton-capacity fast path (`max_skills_per_member==1`) to handle uncovered positive skills inline: build `uncovered_skill_ids` once, fill empty members directly, and bypass `_compat_fill_uncovered_assignments` even when rescue values exist. This regressed.","timestamp":1775200199454,"segment":0,"confidence":64.13490518759492,"iterationTokens":3101,"asi":{"hypothesis":"Inlining uncovered fill for the dominant one-skill-per-member case should remove repeated finalize scans/counting and speed compat assignment.","rollback_reason":"Additional uncovered list plumbing and branch logic outweighed avoided helper calls.","next_action_hint":"Keep the narrower singleton fast path (no rescued values) from current best."}}
{"run":214,"commit":"681e558","metric":163.227603,"metrics":{"best_ms":161.614478,"quality_sum":2.491129377057,"quality_min":0.589775903809,"team_count":4},"status":"discard","description":"Inlined `_compat_member_task_values` logic directly inside `_assign_task_skills_compat` to avoid ~4 function calls per assignment (cache check + first-level extraction built inline). This regressed heavily.","timestamp":1775200282439,"segment":0,"confidence":63.896088454188934,"iterationTokens":1729,"asi":{"hypothesis":"Removing repeated helper-call overhead in the hottest compat path should reduce runtime.","rollback_reason":"Larger inline block increased overhead/instruction footprint and performed much worse than the compact helper call path.","next_action_hint":"Keep `_compat_member_task_values` helper call in `_assign_task_skills_compat`."}}
{"run":215,"commit":"681e558","metric":111.955914,"metrics":{"best_ms":110.331257,"quality_sum":2.491129377057,"quality_min":0.589775903809,"team_count":4},"status":"discard","description":"Applied request-scoped task lookup cache to `individual_fit` only (`_request_tasks_by_id(request)[task_id]`) to remove repeated per-call linear task-id scan in shortlist scoring. This regressed.","timestamp":1775200370396,"segment":0,"confidence":64.06805832158621,"iterationTokens":1701,"asi":{"hypothesis":"Even in lower-frequency shortlist scoring, replacing task-id linear scans with cached dict lookup should add small gains.","rollback_reason":"Additional helper/cache lookup overhead outweighed saved linear scan at this call frequency.","next_action_hint":"Keep task-id cache usage limited to `score_team` hot path."}}
{"run":216,"commit":"681e558","metric":114.789371,"metrics":{"best_ms":112.10623,"quality_sum":2.491129377057,"quality_min":0.589775903809,"team_count":4},"status":"discard","description":"Refined singleton-capacity compat path: only materialize `uncovered_skill_ids` when `max_skills_per_member==1` and uncovered tasks exist, then inline uncovered-skill fill + return without `_compat_fill_uncovered_assignments` for all singleton cases. This still regressed.","timestamp":1775200498195,"segment":0,"confidence":64.24095636613025,"iterationTokens":3762,"asi":{"hypothesis":"Targeted uncovered-id materialization only on singleton-capacity cases should reduce prior overhead and make inline finalize path net-positive.","rollback_reason":"Even targeted singleton inline finalize path underperformed existing helper-based flow.","next_action_hint":"Retain current best singleton fast path limited to no-rescue case."}}
{"run":217,"commit":"681e558","metric":162.260816,"metrics":{"best_ms":160.780252,"quality_sum":2.491129377057,"quality_min":0.589775903809,"team_count":4},"status":"discard","description":"Tried local-binding optimization in `_compat_member_priority_order` (bind `task_capable_counts`/`task_skill_ids` and per-member task vectors to locals inside key builders) to reduce closure/global lookup overhead. This regressed heavily.","timestamp":1775200604827,"segment":0,"confidence":63.54236126821174,"iterationTokens":2493,"asi":{"hypothesis":"Local references in hot key-builder closures may reduce lookup overhead in compat priority sorting.","rollback_reason":"Extra local plumbing made performance much worse; current key-builder structure is preferable.","next_action_hint":"Do not pursue further local-binding micro-tweaks in `_compat_member_priority_order`."}}
{"run":218,"commit":"681e558","metric":160.305904,"metrics":{"best_ms":158.72979,"quality_sum":2.491129377057,"quality_min":0.589775903809,"team_count":4},"status":"discard","description":"Third no-code-change probe run on current HEAD after repeated extreme variance; runtime again landed in ~160ms band, reinforcing that current benchmark environment is highly unstable.","timestamp":1775200666084,"segment":0,"confidence":62.85879661321518,"iterationTokens":703,"asi":{"hypothesis":"Additional unchanged replicate should verify whether variance persists before trusting new micro-optimizations.","rollback_reason":"Persistent high variance on unchanged code makes small effects non-actionable right now.","next_action_hint":"Pause micro-optimization attempts until runtime stabilizes or use multiple replicates per candidate.","noise_observation":"unchanged HEAD continues oscillating widely versus prior ~108ms best"}}
{"run":219,"commit":"681e558","metric":145.460812,"metrics":{"best_ms":144.7574,"quality_sum":2.491129377057,"quality_min":0.589775903809,"team_count":4},"status":"discard","description":"Introduced scoring-core helper (`_calculate_team_quality_for_people_core`) and switched `score_team` to use it directly, avoiding `QualityBreakdown` model construction on the hot path while preserving `calculate_team_quality_for_people` API via wrapper. This unexpectedly regressed heavily.","timestamp":1775200894051,"segment":0,"confidence":63.54236126821174,"iterationTokens":703,"asi":{"hypothesis":"Bypassing Pydantic `QualityBreakdown` creation in score_team should reduce hot-path overhead substantially.","rollback_reason":"Observed major regression in benchmark despite expected model-allocation savings; likely additional helper/dataclass overhead and call structure outweighed savings under this workload.","next_action_hint":"Keep existing direct call path; avoid this core-helper refactor."}}
{"run":220,"commit":"681e558","metric":133.429649,"metrics":{"best_ms":112.865959,"quality_sum":2.491129377057,"quality_min":0.589775903809,"team_count":4},"status":"discard","description":"Changed score-team component cache signatures from sorted member-id strings to sorted request-person indices (`tuple[int,...]`) with new request-scoped person-order map, aiming to reduce string sort/comparison cost in personality/social/social-presence caches. This regressed heavily.","timestamp":1775200991401,"segment":0,"confidence":63.254856107676275,"iterationTokens":2191,"asi":{"hypothesis":"Integer team signatures based on stable request order may be cheaper than string-id signatures for repeated cache keys.","rollback_reason":"Extra person-order map lookup and integer-signature construction overhead outweighed any key-comparison benefit.","next_action_hint":"Keep string-id team signatures for team-component caches."}}
{"run":221,"commit":"681e558","metric":162.138103,"metrics":{"best_ms":161.072586,"quality_sum":2.491129377057,"quality_min":0.589775903809,"team_count":4},"status":"discard","description":"Added request-scoped per-task cached `task_skill_ids` and threaded them through `calculate_team_quality_for_people` → `assign_task_skills` → `_assign_task_skills_compat` to avoid rebuilding `tuple(task_skill.id...)` on every score. This regressed heavily.","timestamp":1775201222446,"segment":0,"confidence":62.937311963877264,"iterationTokens":10333,"asi":{"hypothesis":"Reusing immutable task-skill id tuples per task should reduce hot-path tuple construction overhead in compat assignment.","rollback_reason":"Extra cache lookups and plumbing overshadowed tiny tuple-construction savings.","next_action_hint":"Keep local `task_skill_ids` construction inside `_assign_task_skills_compat`."}}
{"run":222,"commit":"681e558","metric":173.971251,"metrics":{"best_ms":172.74013,"quality_sum":2.491129377057,"quality_min":0.589775903809,"team_count":4},"status":"discard","description":"No-code-change stability probe on current HEAD under continued variance; runtime spiked again into ~174ms range, reinforcing that current benchmark host conditions are highly unstable.","timestamp":1775201295853,"segment":0,"confidence":62.62294008611997,"iterationTokens":694,"asi":{"hypothesis":"Another unchanged replicate should validate whether current measurements are noise-dominated before trusting any marginal optimization.","rollback_reason":"Repeated extreme drift on unchanged code confirms instability; small effects are not trustworthy right now.","next_action_hint":"When conditions stabilize, rerun head multiple times to re-establish noise floor before evaluating micro changes.","noise_observation":"unchanged HEAD repeatedly oscillates between ~108ms and ~174ms"}}
{"run":223,"commit":"681e558","metric":162.852055,"metrics":{"best_ms":159.827157,"quality_sum":2.491129377057,"quality_min":0.589775903809,"team_count":4},"status":"discard","description":"Reworked `_compat_member_task_values` cache to a nested per-member structure (store `first_levels` once and a per-task-skill-id tuple map) to avoid composite `(id(member), task_skill_ids)` key construction and repeated first-level extraction. This regressed heavily.","timestamp":1775201420561,"segment":0,"confidence":61.77572807427063,"iterationTokens":2846,"asi":{"hypothesis":"Two-level per-member cache should reduce key-construction overhead and reuse precomputed member skill-level dicts in hot compat value lookups.","rollback_reason":"Nested-cache indirection and larger mutable structures were much slower than the existing flat cache scheme.","next_action_hint":"Keep flat `_COMPAT_MEMBER_TASK_VALUES_CACHE` keyed by `(id(member), task_skill_ids)`."}}
{"run":224,"commit":"681e558","metric":167.769928,"metrics":{"best_ms":158.702107,"quality_sum":2.491129377057,"quality_min":0.589775903809,"team_count":4},"status":"discard","description":"Added optional `covered_mask`/`max_skills_per_member` fast-path parameters to `_compat_fill_uncovered_assignments` and threaded them from `_assign_task_skills_compat` so singleton-capacity paths can derive uncovered skills from bitmasks without assigned-count scans. This regressed heavily.","timestamp":1775201714135,"segment":0,"confidence":61.88444714694516,"iterationTokens":7281,"asi":{"hypothesis":"Using caller-known bitmask state in `_compat_fill_uncovered_assignments` should avoid repeated counting/scanning work in frequent singleton-capacity compat finalize paths.","rollback_reason":"Extra function parameters/branching and bitmask-derived uncovered handling slowed execution significantly under current benchmark conditions.","next_action_hint":"Keep current `_compat_fill_uncovered_assignments` signature and logic; bitmask-threading approach is not worthwhile."}}
{"run":225,"commit":"681e558","metric":167.509034,"metrics":{"best_ms":165.94878,"quality_sum":2.491129377057,"quality_min":0.589775903809,"team_count":4},"status":"discard","description":"No-code-change stability probe after latest regressions; unchanged HEAD remained in ~167ms band, confirming persistent benchmark instability in current environment.","timestamp":1775201774356,"segment":0,"confidence":61.83271390728321,"iterationTokens":758,"asi":{"hypothesis":"Re-running unchanged code should distinguish real regressions from host-noise spikes.","rollback_reason":"Unchanged code continues to show severe drift, so micro-level optimization signals are not reliable right now.","next_action_hint":"Use multi-run confirmation before accepting/rejecting small deltas; prioritize only large structural effects until environment stabilizes.","noise_observation":"unchanged HEAD currently far slower than prior best despite no code changes"}}
{"run":226,"commit":"681e558","metric":114.954894,"metrics":{"best_ms":112.130376,"quality_sum":2.491129377057,"quality_min":0.589775903809,"team_count":4},"status":"discard","description":"Refactored request-scoped team-component caches from flat tuple-key maps to nested maps (`mode -> {team_signature: personality}` and `compat_default -> {team_signature: social}`) to avoid per-call tuple key construction in score_team cache lookups. This regressed.","timestamp":1775202060597,"segment":0,"confidence":61.781067089743814,"iterationTokens":7589,"asi":{"hypothesis":"Nested per-dimension maps should reduce tuple-allocation/hash overhead for hot personality/social cache lookups in score_team.","rollback_reason":"Extra dictionary indirection/setup outweighed any tuple-key savings.","next_action_hint":"Keep current flat tuple-key caches for team components."}}
{"run":227,"commit":"681e558","metric":162.447389,"metrics":{"best_ms":160.647441,"quality_sum":2.491129377057,"quality_min":0.589775903809,"team_count":4},"status":"discard","description":"Rewrote score_team’s social-preference-presence cache-miss check to avoid teammate set creation/helper calls: scan member preferences directly against `team_signature` tuple membership. This regressed heavily.","timestamp":1775202152297,"segment":0,"confidence":61.409135800500145,"iterationTokens":1569,"asi":{"hypothesis":"For team size 4, direct tuple membership checks over sorted team_signature may be cheaper than building a teammate-id set and calling has_explicit_social_preferences.","rollback_reason":"Inline nested loops with tuple membership performed much worse than existing set+helper approach.","next_action_hint":"Keep current social-preference miss-path implementation using teammate-id set + helper."}}
