{"run":228,"commit":"681e558","metric":160.312807,"metrics":{"best_ms":158.982417,"quality_sum":2.491129377057,"quality_min":0.589775903809,"team_count":4},"status":"discard","description":"Redesigned `_compat_member_priority_order` to iterate only positive task bits from precomputed `member_positive_masks` (no full enumerate/value>0 scans), building priority lists from mask iteration before sorting. This regressed heavily.","timestamp":1775202247630,"segment":0,"confidence":61.07701239096963,"iterationTokens":1855,"asi":{"hypothesis":"Using positive-bit masks should remove a whole class of zero-value checks in compat member-priority ranking.","rollback_reason":"Bitmask iteration/list building overhead was much slower than the existing enumerate/filter approach.","next_action_hint":"Keep current `_compat_member_priority_order` implementation; mask-driven iteration is not beneficial."}}
{"run":229,"commit":"681e558","metric":161.42877,"metrics":{"best_ms":160.421342,"quality_sum":2.491129377057,"quality_min":0.589775903809,"team_count":4},"status":"discard","description":"No-code-change stability check on HEAD; runtime remained in ~161ms band, consistent with recent noisy/slower cluster and far above historical best.","timestamp":1775202313348,"segment":0,"confidence":61.065447332250386,"iterationTokens":1036,"asi":{"hypothesis":"Additional unchanged replicate to monitor current noise floor before interpreting optimization attempts.","rollback_reason":"Persistent slowdown on unchanged code indicates environment instability; cannot infer meaningful micro effects.","next_action_hint":"Hold for larger structural experiments and require repeated confirmation before any keep.","noise_observation":"unchanged HEAD still clustered around ~160ms"}}
{"run":230,"commit":"681e558","metric":161.246836,"metrics":{"best_ms":160.270737,"quality_sum":2.491129377057,"quality_min":0.589775903809,"team_count":4},"status":"discard","description":"In `improve_allocations`, replaced per-trial tuple comprehensions with precomputed member-position maps plus tuple slicing replacement (`people[:idx] + (new,) + people[idx+1:]`) for both unused-member substitutions and cross-team swaps. This regressed heavily.","timestamp":1775202433688,"segment":0,"confidence":60.75663899403053,"iterationTokens":3945,"asi":{"hypothesis":"Index-based tuple replacement should remove repeated id-comparison comprehensions in swap loops and reduce improve_allocations overhead.","rollback_reason":"Position-map/slicing approach performed much worse than existing tuple-comprehension replacements.","next_action_hint":"Keep current comprehension-based team replacement/swapping in improve_allocations."}}
{"run":231,"commit":"681e558","metric":164.9057,"metrics":{"best_ms":160.922436,"quality_sum":2.491129377057,"quality_min":0.589775903809,"team_count":4},"status":"discard","description":"Broader shortlist redesign: inlined `individual_fit` math into `shortlist_scorers` and precomputed per-task invariants once (task lookup, similarity index, filtered task preferences, skills_per_person, total_importance, task preference default) instead of recomputing them per person through individual_fit. This regressed heavily.","timestamp":1775202710718,"segment":0,"confidence":60.98173511680998,"iterationTokens":3165,"asi":{"hypothesis":"Removing repeated per-person invariant setup in shortlist scoring should substantially reduce candidate scoring overhead.","rollback_reason":"Inlining and larger scorer closure performed significantly worse under benchmark conditions.","next_action_hint":"Keep existing individual_fit-based scorer path; this broad inline refactor is not beneficial."}}
{"run":232,"commit":"681e558","metric":109.552982,"metrics":{"best_ms":108.915815,"quality_sum":2.491129377057,"quality_min":0.589775903809,"team_count":4},"status":"discard","description":"Reworked greedy best-candidate selection to single-pass streaming max (avoid building `scored_candidates` list) with explicit tie-break logic for non-random mode equivalent to `(quality, sorted(member.id...))`. This was close but still slower than current best.","timestamp":1775202800475,"segment":0,"confidence":60.680612542764116,"iterationTokens":1544,"asi":{"hypothesis":"Avoiding `scored_candidates` list allocation should reduce overhead in greedy candidate evaluation.","rollback_reason":"Despite small gap, measured total_ms remained above incumbent best.","next_action_hint":"Keep existing list+max path unless combined with another independent gain."}}
{"run":233,"commit":"681e558","metric":163.417641,"metrics":{"best_ms":161.766765,"quality_sum":2.491129377057,"quality_min":0.589775903809,"team_count":4},"status":"discard","description":"Added request-scoped similarity-index cache (`_request_similarity_index`) and used it in `task_hardness` to avoid rebuilding `similarity_lookup(request.similarities)` during task ordering. This regressed heavily.","timestamp":1775202972110,"segment":0,"confidence":60.505278162591104,"iterationTokens":4653,"asi":{"hypothesis":"Caching similarity index at request scope should remove repeated lookup-map construction in task_hardness.","rollback_reason":"Extra cache lookup/identity guard overhead outweighed tiny one-time savings in this path.","next_action_hint":"Keep direct similarity_lookup inside task_hardness; do not extend similarity cache into cold ordering path."}}
{"run":234,"commit":"681e558","metric":114.53154,"metrics":{"best_ms":111.38924,"quality_sum":2.491129377057,"quality_min":0.589775903809,"team_count":4},"status":"discard","description":"In `calculate_team_quality_for_people`, inlined assignment dispatch for mode (direct COMPAT call to `_assign_task_skills_compat`, else partitioned) to bypass `assign_task_skills` wrapper call on hot path. This regressed.","timestamp":1775203160812,"segment":0,"confidence":60.65672904690346,"iterationTokens":4653,"asi":{"hypothesis":"Avoiding the extra assignment wrapper call in the dominant COMPAT path should shave hot-path overhead.","rollback_reason":"Dispatch inlining did not help and increased runtime relative to current best.","next_action_hint":"Keep existing `assign_task_skills` call in `calculate_team_quality_for_people`."}}
{"run":235,"commit":"681e558","metric":174.700076,"metrics":{"best_ms":167.353545,"quality_sum":2.491129377057,"quality_min":0.589775903809,"team_count":4},"status":"checks_failed","description":"Tried removing known-person filtering from task preference lookups (both individual_fit and request-scoped task-preference cache), assuming validated requests make filtering redundant. This changed malformed-input fallback semantics and failed regression expecting unknown task preferences to be ignored in COMPAT scoring.","timestamp":1775203340514,"segment":0,"confidence":59.95643496030023,"iterationTokens":3639,"asi":{"hypothesis":"Skipping `valid_person_ids` filtering in preference_lookup should reduce overhead in task-preference setup.","rollback_reason":"Behavioral regression: unknown task preferences were no longer ignored in malformed-request scenarios used by tests.","next_action_hint":"Retain explicit valid-person filtering for score_team compatibility semantics.","failure_surface":"tests/test_form_teams.py::test_score_team_ignores_unknown_task_preferences_for_compat_defaults"}}
{"run":236,"commit":"681e558","metric":125.062161,"metrics":{"best_ms":121.681068,"quality_sum":2.491129377057,"quality_min":0.589775903809,"team_count":4},"status":"discard","description":"Updated `individual_fit` to reuse request-scoped filtered task-preference cache (`_request_task_preferences_by_task_id`) instead of rebuilding `valid_person_ids` + `preference_lookup(...)` per call. Semantics preserved, but runtime regressed under current benchmark conditions.","timestamp":1775203437402,"segment":0,"confidence":60.53626631261978,"iterationTokens":1732,"asi":{"hypothesis":"Reusing cached per-task preferences in individual_fit should remove repeated set-building/filtering overhead during shortlist scoring.","rollback_reason":"Observed regression versus current best; any saved work did not translate to end-to-end gain.","next_action_hint":"Keep existing individual_fit preference lookup path or only revisit with broader shortlist redesign."}}
{"run":237,"commit":"681e558","metric":173.517407,"metrics":{"best_ms":168.478755,"quality_sum":2.491129377057,"quality_min":0.589775903809,"team_count":4},"status":"discard","description":"Changed candidate_combinations shortlist dedup/reconstruction to use integer person positions (`person_positions` map + `seen_positions` set) instead of string-id membership, then rebuilt shortlist by enumerated indices. This regressed heavily.","timestamp":1775203533843,"segment":0,"confidence":59.2000916442099,"iterationTokens":1331,"asi":{"hypothesis":"Integer position membership checks might be cheaper than string-id set membership in shortlist selection/reconstruction.","rollback_reason":"Extra position-map construction and integer-set path performed substantially worse than existing id-set approach.","next_action_hint":"Keep current `seen_ids` string-set shortlist logic."}}
{"run":238,"commit":"681e558","metric":167.263164,"metrics":{"best_ms":165.526715,"quality_sum":2.491129377057,"quality_min":0.589775903809,"team_count":4},"status":"discard","description":"Unchanged-code stability run on HEAD to monitor noise after recent regressions; metric remained in high ~167ms band, still far above historical best despite no code change.","timestamp":1775203600880,"segment":0,"confidence":59.17703532342015,"iterationTokens":658,"asi":{"hypothesis":"No-change rerun helps distinguish true code effects from current host/runtime variance.","rollback_reason":"Persistent instability makes micro-optimization signals unreliable.","next_action_hint":"Continue favoring only large structural changes and replicate confirmation before keep decisions.","noise_observation":"unchanged HEAD clustered around ~160-175ms in this environment window"}}
{"run":239,"commit":"681e558","metric":167.70506,"metrics":{"best_ms":164.611372,"quality_sum":2.491129377057,"quality_min":0.589775903809,"team_count":4},"status":"checks_failed","description":"Tried a broader scored-candidate redesign: candidate_combinations now ranks by `(quality, team_signature, -index)` and greedy non-random capped path takes first ranked candidate directly (skip rescoring full list). This changed tie behavior for equal-quality teams and failed specialist-preservation regression.","timestamp":1775203727796,"segment":0,"confidence":58.39461118163267,"iterationTokens":3079,"asi":{"hypothesis":"If candidate_combinations already returns candidates in final objective tie order, greedy can avoid rescoring all candidates and pick first directly.","rollback_reason":"Behavioral regression on equal-quality tie handling (`dominant-a` vs `dominant-b` selection) failed existing test expectations.","next_action_hint":"Do not alter scored-cap tie ordering semantics in candidate_combinations; preserve current index-based tie behavior.","failure_surface":"tests/test_form_teams.py::test_form_teams_uses_scored_cap_without_dropping_lower_ranked_specialist"}}
{"run":240,"commit":"681e558","metric":142.581816,"metrics":{"best_ms":115.025235,"quality_sum":2.491129377057,"quality_min":0.589775903809,"team_count":4},"status":"discard","description":"Unchanged-code stability probe after tie-behavior experiment revert; runtime remained far from historical best and fluctuated strongly, confirming unstable benchmark environment.","timestamp":1775203794190,"segment":0,"confidence":57.97118338969007,"iterationTokens":1518,"asi":{"hypothesis":"No-change rerun should recheck environment noise before evaluating additional micro/structural changes.","rollback_reason":"Large uncontrolled variance persists on unchanged code.","next_action_hint":"Favor only substantial architectural changes and verify with repeat runs before keep.","noise_observation":"unchanged HEAD still highly volatile (~108 to ~170ms observed)"}}
{"run":241,"commit":"681e558","metric":170.917443,"metrics":{"best_ms":169.471846,"quality_sum":2.491129377057,"quality_min":0.589775903809,"team_count":4},"status":"discard","description":"Added a guarded fast path in `_compat_fill_uncovered_assignments` for `max_skills_per_member==1` and unique task-skill ids: derive uncovered skills via set membership and fill empty members directly, falling back to existing count-based logic otherwise. This regressed heavily.","timestamp":1775204041613,"segment":0,"confidence":57.80139943389878,"iterationTokens":1518,"asi":{"hypothesis":"In dominant singleton-capacity + unique-skill workloads, set-based uncovered detection should be cheaper than count/decrement scans.","rollback_reason":"Extra branching/set/list work plus fallback checks performed substantially worse in aggregate.","next_action_hint":"Do not pursue this unique-skill singleton fast path further."}}
{"run":242,"commit":"681e558","metric":142.485033,"metrics":{"best_ms":117.926919,"quality_sum":2.491129377057,"quality_min":0.589775903809,"team_count":4},"status":"discard","description":"Unchanged-code stability probe after additional regressions; runtime remained far from historical best and still highly variable, underscoring current benchmark noise.","timestamp":1775204132706,"segment":0,"confidence":57.632607088428415,"iterationTokens":2106,"asi":{"hypothesis":"No-change rerun needed to gauge whether host noise has subsided before pursuing further micro-optimizations.","rollback_reason":"Variance remains large and unstable on unchanged code.","next_action_hint":"Favor only large expected-impact experiments with replicate confirmation.","noise_observation":"unchanged HEAD still oscillating widely (~108–175ms window)"}}
{"run":243,"commit":"681e558","metric":163.096734,"metrics":{"best_ms":162.141485,"quality_sum":2.491129377057,"quality_min":0.589775903809,"team_count":4},"status":"discard","description":"Switched candidate social/personality potential top-k aggregation from `sorted(..., reverse=True)[:partner_count]` to `heapq.nlargest(partner_count, pair_scores)` to avoid full sorting for small partner counts. This regressed heavily.","timestamp":1775204254277,"segment":0,"confidence":57.48504015458426,"iterationTokens":1413,"asi":{"hypothesis":"`heapq.nlargest` may be cheaper than full sort-slice when selecting only top `team_size-1` pair scores.","rollback_reason":"`nlargest` overhead was significantly worse than existing sorted-slice path.","next_action_hint":"Keep sorted-slice implementation for candidate potential aggregation."}}
{"run":244,"commit":"681e558","metric":164.890541,"metrics":{"best_ms":164.285265,"quality_sum":2.491129377057,"quality_min":0.589775903809,"team_count":4},"status":"discard","description":"Added request-scoped similarity-index cache and reused it in both `task_hardness` and `individual_fit` to avoid repeated `similarity_lookup(request.similarities)` map construction. This regressed heavily.","timestamp":1775204437522,"segment":0,"confidence":57.04763286943655,"iterationTokens":4072,"asi":{"hypothesis":"Caching similarity lookup map should remove repeated small dict rebuilds across task ordering and shortlist individual scoring.","rollback_reason":"Additional global cache lookups/identity guards outweighed map-construction savings in these paths.","next_action_hint":"Keep direct `similarity_lookup(...)` calls in task_hardness/individual_fit."}}
{"run":245,"commit":"681e558","metric":162.126527,"metrics":{"best_ms":159.721553,"quality_sum":2.491129377057,"quality_min":0.589775903809,"team_count":4},"status":"discard","description":"Unchanged-code stability check; runtime still in high ~160ms cluster, confirming continued benchmark host variance and poor comparability with earlier low-100ms runs.","timestamp":1775204502360,"segment":0,"confidence":57.07516367888302,"iterationTokens":642,"asi":{"hypothesis":"No-change rerun to monitor current variance band before trusting additional optimization outcomes.","rollback_reason":"Persistent elevated/noisy baseline makes small deltas unreliable.","next_action_hint":"Only accept future changes with large repeated gains under current conditions.","noise_observation":"unchanged HEAD repeatedly clusters around ~160-170ms now"}}
{"run":246,"commit":"681e558","metric":155.367714,"metrics":{"best_ms":138.55743,"quality_sum":2.491129377057,"quality_min":0.589775903809,"team_count":4},"status":"discard","description":"Added COMPAT-mode fast path in `task_hardness` and `individual_fit`: skip building similarity lookup map (`similarity_lookup(request.similarities)`) and use empty lookup since skill_similarity ignores similarity table in COMPAT except exact-id matches. This regressed under current benchmark conditions.","timestamp":1775204712872,"segment":0,"confidence":57.14704178590689,"iterationTokens":642,"asi":{"hypothesis":"In COMPAT mode, repeated similarity-index construction in task_hardness/individual_fit is redundant and can be removed safely.","rollback_reason":"Despite semantic validity, measured runtime worsened significantly in current noisy environment.","next_action_hint":"Keep existing similarity-index setup unless revalidated under more stable benchmark conditions."}}
{"run":247,"commit":"681e558","metric":164.256738,"metrics":{"best_ms":163.117752,"quality_sum":2.491129377057,"quality_min":0.589775903809,"team_count":4},"status":"discard","description":"Added a specialized `max_skills_per_member==1` branch in `_assign_task_skills_compat` that skips per-member available/member-mask bookkeeping and runs a single candidate-selection pass per member (with existing tie rules), keeping general loop for multi-skill cases. This regressed heavily.","timestamp":1775204844136,"segment":0,"confidence":57.44923476570492,"iterationTokens":3644,"asi":{"hypothesis":"Dominant one-skill-per-member workload should benefit from removing inner-loop mask bookkeeping and second-loop structure in compat assignment.","rollback_reason":"Specialized branch increased code-path overhead and performed worse than existing unified loop.","next_action_hint":"Keep current unified member assignment loop; avoid this branch specialization."}}
{"run":248,"commit":"681e558","metric":160.643635,"metrics":{"best_ms":159.794117,"quality_sum":2.491129377057,"quality_min":0.589775903809,"team_count":4},"status":"discard","description":"Unchanged-code stability probe; runtime stayed in elevated ~160ms range, continuing the recent high-variance/noisy environment pattern.","timestamp":1775204925758,"segment":0,"confidence":57.79997959820291,"iterationTokens":721,"asi":{"hypothesis":"No-change rerun to monitor current noise floor and avoid overfitting to transient improvements/regressions.","rollback_reason":"Unchanged code still unstable and far from historical lows, so small effect sizes remain non-actionable.","next_action_hint":"Require repeated confirmation for any future keep under current variance.","noise_observation":"current environment remains in ~160-170ms cluster on unchanged head"}}
{"run":249,"commit":"681e558","metric":168.252525,"metrics":{"best_ms":161.545203,"quality_sum":2.491129377057,"quality_min":0.589775903809,"team_count":4},"status":"discard","description":"Refactored `_compat_member_task_analysis` to return precomputed `has_member_without_positive` boolean and reused it in `_assign_task_skills_compat` (replacing repeated `any(member_mask==0 ...)` scans). This regressed heavily.","timestamp":1775205147055,"segment":0,"confidence":57.41976561331865,"iterationTokens":3179,"asi":{"hypothesis":"Precomputing member-without-positive flag in analysis should avoid repeated list scans in compat assignment exits.","rollback_reason":"Additional return value/plumbing overhead outweighed tiny saved scans.","next_action_hint":"Keep existing direct `any(member_mask == 0 ...)` checks in assignment path."}}
{"run":250,"commit":"681e558","metric":109.544388,"metrics":{"best_ms":109.092843,"quality_sum":2.491129377057,"quality_min":0.589775903809,"team_count":4},"status":"discard","description":"Unchanged-code stability probe: runtime dropped back near historical lows (~109ms), confirming large environmental variance and that recent ~160ms runs were transient noise/load rather than code effects.","timestamp":1775205218572,"segment":0,"confidence":56.926977945033265,"iterationTokens":656,"asi":{"hypothesis":"Repeated unchanged runs are needed to map current noise band before judging candidate patches.","rollback_reason":"No code change; result used for variance monitoring only.","next_action_hint":"For future keeps, require at least one confirmatory rerun due bimodal noise behavior.","noise_observation":"unchanged HEAD oscillates between ~109ms and ~170ms"}}
{"run":251,"commit":"681e558","metric":0,"metrics":{"best_ms":0,"quality_sum":0,"quality_min":0,"team_count":0},"status":"crash","description":"Attempted to memoize first-pass scored allocations by candidate tuple object in build_scored_candidates/greedy_allocations (store in dict during combination_scorer then reuse to avoid second cached_score_team lookups). Crashed because `tuple[Person,...]` is unhashable (Person models are unhashable).","timestamp":1775205336266,"segment":0,"confidence":56.926977945033265,"iterationTokens":2560,"asi":{"hypothesis":"Using candidate-tuple keyed map should avoid repeated cached_score_team calls after combination scoring.","rollback_reason":"Runtime crash: TypeError `unhashable type: 'Person'` when using candidate tuple as dict key.","next_action_hint":"If retried, key by stable hashable signature (e.g., sorted person ids/identities) without expensive overhead, or avoid extra map entirely.","error_type":"TypeError","failure_surface":"formation.py combination_quality scored_by_candidate[candidate]"}}
