{"run":866,"commit":"0dfd343","metric":0.147228,"metrics":{"best_ms":0.137821,"quality_sum":2.491129377057,"quality_min":0.589775903809,"team_count":4},"status":"discard","description":"Additional no-code baseline sample as warm regime trends downward from recent elevated band.","timestamp":1775556140010,"segment":0,"confidence":38.233413470337624,"iterationTokens":580,"asi":{"hypothesis":"If host contention eases, baseline medians should drift back toward lower band before testing new micro-candidates.","rollback_reason":"No source-code change; validation-only run.","next_action_hint":"Consider resuming selective candidate testing once low-band consistency returns across multiple samples.","noise_observation":"Median improved further; still volatile but moving toward lower warm range."}}
{"run":867,"commit":"0dfd343","metric":0.148481,"metrics":{"best_ms":0.14786,"quality_sum":2.491129377057,"quality_min":0.589775903809,"team_count":4},"status":"discard","description":"No-code baseline sample as warm regime continues recovering from earlier elevated volatility window.","timestamp":1775556228522,"segment":0,"confidence":38.275404680350306,"iterationTokens":1906,"asi":{"hypothesis":"Further baseline samples help confirm whether warm timing is stabilizing enough for meaningful marginal candidate testing.","rollback_reason":"No source-code change; validation-only run.","next_action_hint":"Resume candidate experiments only with stronger expected signal while continuing paired baseline checks.","noise_observation":"Median near mid-low band; quality metrics unchanged."}}
{"run":868,"commit":"0dfd343","metric":0.163889,"metrics":{"best_ms":0.159922,"quality_sum":2.491129377057,"quality_min":0.589775903809,"team_count":4},"status":"discard","description":"Changed output fallback path to iterate `allocation.assignments.items()` view directly (when `assignment_items is None`) instead of materializing `tuple(assignments.items())` first.","timestamp":1775556350023,"segment":0,"confidence":38.31748822846478,"iterationTokens":2151,"asi":{"hypothesis":"Avoiding tuple materialization in rare assignment-items fallback path may reduce output assembly overhead.","rollback_reason":"Regressed/near-noise in current regime; branch/path change did not improve measured warm calls.","next_action_hint":"Keep tuple materialization fallback as implemented; avoid further fallback-shape micro tweaks.","observation":"Checks passed and quality metrics unchanged."}}
{"run":869,"commit":"0dfd343","metric":0.165243,"metrics":{"best_ms":0.159202,"quality_sum":2.491129377057,"quality_min":0.589775903809,"team_count":4},"status":"discard","description":"No-code baseline rerun after pruning regressed direct-items-view assignment fallback variant.","timestamp":1775556421513,"segment":0,"confidence":38.96865775252214,"iterationTokens":834,"asi":{"hypothesis":"Ideas-only rollback should preserve warm-path behavior while tracking current volatility.","rollback_reason":"No source-code change; validation-only run.","next_action_hint":"Maintain current assignment fallback and continue focusing only on higher-signal opportunities.","noise_observation":"Median stayed in elevated band; quality unchanged."}}
{"run":870,"commit":"0dfd343","metric":0.167488,"metrics":{"best_ms":0.159543,"quality_sum":2.491129377057,"quality_min":0.589775903809,"team_count":4},"status":"discard","description":"Additional no-code baseline sample to confirm persistent elevated warm-band behavior.","timestamp":1775556476602,"segment":0,"confidence":39.64218890796988,"iterationTokens":616,"asi":{"hypothesis":"Repeated baseline sampling remains necessary to separate host drift from candidate effects before further micro trials.","rollback_reason":"No source-code change; validation-only run.","next_action_hint":"Continue baseline bundling and reserve code changes for materially different, higher-leverage ideas.","noise_observation":"Median and best remained in elevated band; quality metrics unchanged."}}
{"run":871,"commit":"0dfd343","metric":0.192154,"metrics":{"best_ms":0.162979,"quality_sum":2.491129377057,"quality_min":0.589775903809,"team_count":4},"status":"discard","description":"Tried deterministic output branch specialization for default swap path: when `score_team is _ORIGINAL_SCORE_TEAM and swap_rounds > 0`, assert non-None `assignment_items` and skip per-allocation fallback checks.","timestamp":1775556729861,"segment":0,"confidence":40.40870209898325,"iterationTokens":1072,"asi":{"hypothesis":"Benchmark default (`swap_rounds=8`, original scorer) should allow a no-fallback deterministic output loop and avoid per-allocation None checks.","rollback_reason":"Regressed in current regime; added branch/assert path did not improve output assembly.","next_action_hint":"Keep simpler per-allocation fallback deterministic output loop.","observation":"Checks passed and quality metrics unchanged."}}
{"run":872,"commit":"0dfd343","metric":0.192694,"metrics":{"best_ms":0.164531,"quality_sum":2.491129377057,"quality_min":0.589775903809,"team_count":4},"status":"discard","description":"No-code baseline rerun after pruning regressed swap-rounds-gated deterministic output specialization.","timestamp":1775556828423,"segment":0,"confidence":41.206075729371776,"iterationTokens":909,"asi":{"hypothesis":"Ideas-only rollback should preserve behavior while sampling current warm-band level after regressive branch experiment.","rollback_reason":"No source-code change; validation-only run.","next_action_hint":"Avoid further deterministic output branch gating variants; keep current fallback path.","noise_observation":"Median remains in elevated warm band with unchanged quality metrics."}}
{"run":873,"commit":"0dfd343","metric":0.199252,"metrics":{"best_ms":0.180707,"quality_sum":2.491129377057,"quality_min":0.589775903809,"team_count":4},"status":"discard","description":"No-code baseline monitoring run as elevated warm-band volatility persists.","timestamp":1775556939748,"segment":0,"confidence":41.53898754005532,"iterationTokens":821,"asi":{"hypothesis":"Further baseline-only sampling is needed to avoid overfitting candidate decisions to transient host slowdowns.","rollback_reason":"No source-code change; validation-only run.","next_action_hint":"Keep paired/no-code bundles until warm band tightens; avoid marginal micro keeps in current regime.","noise_observation":"Median and best remain elevated, confirming continued transient slowdown."}}
{"run":874,"commit":"0dfd343","metric":0.151485,"metrics":{"best_ms":0.127339,"quality_sum":2.491129377057,"quality_min":0.589775903809,"team_count":4},"status":"discard","description":"Changed `_REQUEST_IMPROVED_ALLOCATIONS` key to use allocation object-identity signature (`tuple(id(allocation) ...)`) instead of `(task_id, team_signature)` tuples.","timestamp":1775557301613,"segment":0,"confidence":41.87612445409432,"iterationTokens":821,"asi":{"hypothesis":"Warm-path improve-cache lookup may be faster with compact int-id tuple signatures than nested string/tuple signatures.","rollback_reason":"Single-sample result is not a clear improvement versus existing low-band baselines; treat as noise-risk and revert.","next_action_hint":"If revisiting, require paired A/B bundles showing repeatable gain before keeping id-signature keys.","observation":"Checks passed; quality metrics unchanged."}}
{"run":875,"commit":"0dfd343","metric":0.12724,"metrics":{"best_ms":0.121649,"quality_sum":2.491129377057,"quality_min":0.589775903809,"team_count":4},"status":"discard","description":"No-code baseline rerun after pruning inconclusive improve-cache id-signature key variant.","timestamp":1775557348722,"segment":0,"confidence":42.05797572852871,"iterationTokens":1219,"asi":{"hypothesis":"Ideas-only update should preserve behavior and clarify whether host has returned to low-latency warm band.","rollback_reason":"No source-code change; validation-only run.","next_action_hint":"Warm band appears recovered; resume higher-signal candidates with immediate paired validation.","noise_observation":"Median/best dropped sharply into low band, indicating prior elevated regime likely host-driven."}}
{"run":876,"commit":"0dfd343","metric":0.139094,"metrics":{"best_ms":0.121871,"quality_sum":2.491129377057,"quality_min":0.589775903809,"team_count":4},"status":"discard","description":"Removed warm-hit list copies from request-scoped greedy/improve caches (return cached lists directly instead of `.copy()`).","timestamp":1775557500863,"segment":0,"confidence":42.242368827445574,"iterationTokens":8518,"asi":{"hypothesis":"Eliminating three warm-hit list copies per call (2 greedy + 1 improve) should reduce warm-path overhead.","rollback_reason":"Not a clear improvement versus recovered low-band baseline; potential mutation-risk tradeoff not justified.","next_action_hint":"Retain copy-on-hit cache contract unless paired A/B clearly shows gain with unchanged semantics.","observation":"Checks passed and quality metrics unchanged."}}
{"run":877,"commit":"0dfd343","metric":0.128944,"metrics":{"best_ms":0.122703,"quality_sum":2.491129377057,"quality_min":0.589775903809,"team_count":4},"status":"discard","description":"No-code baseline rerun after pruning direct no-copy warm-cache-return variant as non-winning/risky.","timestamp":1775557561651,"segment":0,"confidence":42.31496403720446,"iterationTokens":912,"asi":{"hypothesis":"Ideas-only rollback should return to baseline if no-copy cache-return variant was non-beneficial.","rollback_reason":"No source-code change; validation-only run.","next_action_hint":"Keep copy-on-hit contract and continue with only materially different warm-path reductions.","noise_observation":"Run returned to low warm band, supporting prior candidate discard."}}
{"run":878,"commit":"0dfd343","metric":0.119457,"metrics":{"best_ms":0.117243,"quality_sum":2.491129377057,"quality_min":0.589775903809,"team_count":4},"status":"discard","description":"Rewrote warm-path greedy/improve cache-key tuple builders from generator expressions to explicit list-append loops before tuple conversion.","timestamp":1775557680470,"segment":0,"confidence":42.387747965473224,"iterationTokens":3323,"asi":{"hypothesis":"Removing generator-expression overhead in per-call cache-key construction may reduce warm-path latency.","rollback_reason":"Single-sample gain during a shifting host band is insufficient to keep; needs paired validation to avoid noise overfit.","next_action_hint":"Retry this exact patch in an immediate paired A/B bundle (candidate + no-code + candidate) before considering keep.","observation":"Checks passed; quality metrics unchanged; sample landed in exceptionally low warm band."}}
{"run":879,"commit":"0dfd343","metric":0.115618,"metrics":{"best_ms":0.113695,"quality_sum":2.491129377057,"quality_min":0.589775903809,"team_count":4},"status":"discard","description":"Paired retest of explicit list-loop cache-key builders for greedy/improve warm paths (second sample after prior low result).","timestamp":1775557747042,"segment":0,"confidence":42.43127218500809,"iterationTokens":1466,"asi":{"hypothesis":"If generator-elision key building is real, repeated candidate runs should stay below baseline band.","rollback_reason":"Still lacks immediate baseline-without-patch confirmation in the same host window; avoiding premature keep.","next_action_hint":"Run no-code baseline immediately after this discard; keep only if candidate remains consistently lower than reverted baseline.","observation":"Second consecutive low sample with checks passing and unchanged quality metrics."}}
{"run":880,"commit":"0dfd343","metric":0.128613,"metrics":{"best_ms":0.119526,"quality_sum":2.491129377057,"quality_min":0.589775903809,"team_count":4},"status":"discard","description":"Immediate no-code baseline after reverting explicit-loop cache-key builder candidate (A/B confirmation step).","timestamp":1775557796486,"segment":0,"confidence":42.47488587873888,"iterationTokens":934,"asi":{"hypothesis":"Reverted baseline should rebound if candidate change was providing real warm-path benefit.","rollback_reason":"No source-code change; validation-only run.","next_action_hint":"Reapply candidate once more for direct B-in-same-window check; keep only if low band repeats.","noise_observation":"Baseline rebounded above the two preceding candidate samples, suggesting potential real signal."}}
{"run":881,"commit":"baebf2b","metric":0.120678,"metrics":{"best_ms":0.11631,"quality_sum":2.491129377057,"quality_min":0.589775903809,"team_count":4},"status":"keep","description":"Replaced generator-expression cache-key builders in warm paths with explicit list loops before tuple conversion in `greedy_allocations` and `improve_allocations`.","timestamp":1775557863975,"segment":0,"confidence":42.70133966797854,"iterationTokens":1224,"asi":{"hypothesis":"Generator-elision in per-call cache-key construction reduces warm-path overhead on cached greedy/improve runs.","validation":"Observed repeated low candidate samples (0.119, 0.116, 0.121 ms) versus immediate reverted baseline rebound (~0.129 ms) in the same host window.","risk_note":"Semantics unchanged; only key-construction mechanics differ, with all checks passing."}}
{"run":882,"commit":"baebf2b","metric":0.134514,"metrics":{"best_ms":0.117912,"quality_sum":2.491129377057,"quality_min":0.589775903809,"team_count":4},"status":"discard","description":"Post-keep no-code monitoring sample after generator-elision cache-key builder change.","timestamp":1775557919472,"segment":0,"confidence":42.930221065350594,"iterationTokens":865,"asi":{"hypothesis":"Immediate follow-up baseline validates whether the new keep remains robust under normal run-to-run jitter.","rollback_reason":"No source-code change; validation-only run.","next_action_hint":"Continue paired monitoring around new keep; prioritize materially different ideas over additional micro key-builder tweaks.","noise_observation":"Run moved upward versus keep sample but remained in low warm band with unchanged quality."}}
{"run":883,"commit":"baebf2b","metric":0.130476,"metrics":{"best_ms":0.114957,"quality_sum":2.491129377057,"quality_min":0.589775903809,"team_count":4},"status":"discard","description":"No-code baseline run after updating ideas backlog metadata to new keep-chain head (`baebf2b`).","timestamp":1775557984615,"segment":0,"confidence":43.025928455420335,"iterationTokens":5180,"asi":{"hypothesis":"Ideas-file maintenance should not affect runtime; this run re-samples post-keep low-band behavior.","rollback_reason":"No source-code change; validation-only run.","next_action_hint":"Keep validating baebf2b under paired runs and pursue only materially different warm-path opportunities.","noise_observation":"Warm median remains in low band with stable quality metrics."}}
{"run":884,"commit":"baebf2b","metric":0.114796,"metrics":{"best_ms":0.113434,"quality_sum":2.491129377057,"quality_min":0.589775903809,"team_count":4},"status":"discard","description":"Follow-up to kept cache-key loop rewrite: switched explicit append loops to list comprehensions for greedy/improve cache-key list construction before tuple conversion.","timestamp":1775558054580,"segment":0,"confidence":43.122063533526095,"iterationTokens":2434,"asi":{"hypothesis":"List comprehensions may outperform manual append loops for tiny per-call cache-key list construction.","rollback_reason":"Single low sample needs immediate reverted-baseline comparison before keeping.","next_action_hint":"Run no-code baseline now, then optionally retry this exact patch for an A/B/A decision.","observation":"Checks passed and quality metrics unchanged."}}
{"run":885,"commit":"baebf2b","metric":0.128852,"metrics":{"best_ms":0.124143,"quality_sum":2.491129377057,"quality_min":0.589775903809,"team_count":4},"status":"discard","description":"Immediate no-code baseline after reverting list-comprehension cache-key builder follow-up.","timestamp":1775558105360,"segment":0,"confidence":43.20577865371946,"iterationTokens":709,"asi":{"hypothesis":"If list-comprehension variant is real, reverted baseline should rebound upward in the same host window.","rollback_reason":"No source-code change; validation-only run.","next_action_hint":"Reapply list-comprehension variant once more; keep only if low band repeats.","noise_observation":"Baseline rebounded to ~0.129ms, notably above candidate sample."}}
