{"run":658,"commit":"7361b06","metric":0.281893,"metrics":{"best_ms":0.229364,"quality_sum":2.491129377057,"quality_min":0.589775903809,"team_count":4},"status":"discard","description":"Tried deterministic request-scoped full-response cache in `form_teams`: return cached `TeamsResponse.model_copy(deep=True)` on warm hits and store validated response on misses.","timestamp":1775487966477,"segment":0,"confidence":8.864115432929221,"iterationTokens":3101,"asi":{"hypothesis":"Bypassing repeated allocation/output assembly and validation with cached response + deep copy could reduce warm-call overhead while preserving response isolation.","rollback_reason":"Large regression; `model_copy(deep=True)` dominates and is much slower than current warm path.","next_action_hint":"Avoid full-response caching with deep-copy semantics; it is not viable for this workload.","observation":"Checks passed and quality metrics unchanged."}}
{"run":659,"commit":"7361b06","metric":0.146748,"metrics":{"best_ms":0.129796,"quality_sum":2.491129377057,"quality_min":0.589775903809,"team_count":4},"status":"discard","description":"No-code baseline rerun after pruning regressed deep-copy full-response cache attempt.","timestamp":1775488022013,"segment":0,"confidence":8.846947402461478,"iterationTokens":862,"asi":{"hypothesis":"Rollback should restore baseline warm-path behavior after full-response cache experiment.","rollback_reason":"No source-code change; baseline validation only.","next_action_hint":"Avoid response-level deep-copy caches; continue with targeted hot-path reductions or profiling-guided structural changes.","noise_observation":"Median remains in warm jitter band with stable quality metrics."}}
{"run":660,"commit":"7361b06","metric":0.148921,"metrics":{"best_ms":0.126119,"quality_sum":2.491129377057,"quality_min":0.589775903809,"team_count":4},"status":"discard","description":"Added request-scoped cache for total requested seats (`_request_total_requested_seats`) and used it for form headcount validation to avoid repeated computed-field sum.","timestamp":1775488274598,"segment":0,"confidence":8.851818137028811,"iterationTokens":862,"asi":{"hypothesis":"In warm-path-dominant regime, replacing per-call computed-field sum (`request.total_requested_seats`) with cached request-scoped seat count might reduce setup overhead.","rollback_reason":"Regressed in this sample; extra cache lookup/branching outweighed tiny sum cost.","next_action_hint":"Keep direct lightweight headcount check; avoid adding request caches for very small arithmetic checks.","observation":"Checks passed and behavior monitors unchanged."}}
{"run":661,"commit":"7361b06","metric":0.135296,"metrics":{"best_ms":0.123644,"quality_sum":2.491129377057,"quality_min":0.589775903809,"team_count":4},"status":"discard","description":"Replaced `request.total_requested_seats` computed-field check with local integer accumulation loop over `request.tasks` in `form_teams` headcount validation.","timestamp":1775488379870,"segment":0,"confidence":8.929256736909924,"iterationTokens":4198,"asi":{"hypothesis":"Bypassing Pydantic computed-field/property dispatch for `total_requested_seats` may reduce warm-call overhead in `form_teams` setup.","rollback_reason":"Result is within current warm-band variance and not clearly better than existing baseline.","next_action_hint":"Avoid further micro headcount-check rewrites unless paired A/B samples show a consistent effect.","observation":"Checks and behavior metrics remained unchanged."}}
{"run":662,"commit":"7361b06","metric":0.164682,"metrics":{"best_ms":0.14258,"quality_sum":2.491129377057,"quality_min":0.589775903809,"team_count":4},"status":"checks_failed","description":"Tried replacing `TeamsResponse.model_validate({'teams': teams_payload})` with direct constructor `TeamsResponse(teams=teams_payload)` in output path.","timestamp":1775488462092,"segment":0,"confidence":8.84967673735327,"iterationTokens":1973,"asi":{"hypothesis":"Direct model construction might avoid some model_validate overhead in warm-path output assembly.","rollback_reason":"Type check failed (`teams` expects `list[TeamResult]`, but payload is `list[dict[str, object]]`); benchmark slower as well.","next_action_hint":"Keep `TeamsResponse.model_validate(...)` path; avoid constructor-with-raw-dicts variants.","error_excerpt":"ty invalid-argument-type at formation.py: expected list[TeamResult], found list[dict[str, object]]."}}
{"run":663,"commit":"7361b06","metric":0.140416,"metrics":{"best_ms":0.126128,"quality_sum":2.491129377057,"quality_min":0.589775903809,"team_count":4},"status":"discard","description":"No-code baseline rerun after checks_failed constructor experiment rollback.","timestamp":1775488514734,"segment":0,"confidence":8.86683999933267,"iterationTokens":861,"asi":{"hypothesis":"After rollback from failed constructor variant, baseline should return to established warm band.","rollback_reason":"No code change; baseline validation run.","next_action_hint":"Continue with only ty-safe output-path variants or non-output structural experiments.","noise_observation":"Median returned to ~0.14ms band with stable quality metrics."}}
{"run":664,"commit":"7361b06","metric":0.152398,"metrics":{"best_ms":0.123143,"quality_sum":2.491129377057,"quality_min":0.589775903809,"team_count":4},"status":"discard","description":"No-code baseline rerun after pruning constructor-variant checks_failed idea in backlog.","timestamp":1775488568074,"segment":0,"confidence":8.900697778238742,"iterationTokens":817,"asi":{"hypothesis":"Ideas-file maintenance should not materially affect runtime.","rollback_reason":"No code change; validation-only run.","next_action_hint":"Given elevated jitter, collect paired samples around any future micro-optimizations before keeping.","noise_observation":"Median was on the slower side of current warm band; best remained low and quality stable."}}
{"run":665,"commit":"7361b06","metric":0.160624,"metrics":{"best_ms":0.123494,"quality_sum":2.491129377057,"quality_min":0.589775903809,"team_count":4},"status":"discard","description":"Retested output payload assembly with nested comprehensions (replace explicit append loops) before `TeamsResponse.model_validate(...)`.","timestamp":1775488630321,"segment":0,"confidence":8.91111565369034,"iterationTokens":1386,"asi":{"hypothesis":"With warm-path dominance in output assembly, nested comprehensions might outperform explicit append loops for tiny fixed-size payload construction.","rollback_reason":"Regressed clearly; comprehension rewrite increased overhead in this regime.","next_action_hint":"Keep explicit loop-based payload assembly from current baseline; avoid further comprehension rewrites.","observation":"Checks passed and quality metrics unchanged."}}
{"run":666,"commit":"7361b06","metric":0.157589,"metrics":{"best_ms":0.128393,"quality_sum":2.491129377057,"quality_min":0.589775903809,"team_count":4},"status":"discard","description":"No-code baseline rerun after pruning regressed nested-comprehension output rewrite.","timestamp":1775488700163,"segment":0,"confidence":8.925067394626295,"iterationTokens":802,"asi":{"hypothesis":"Rollback should restore baseline; sample also tracks current warm-band drift.","rollback_reason":"No code change; validation-only run.","next_action_hint":"Warm-band jitter is rising; focus on larger-impact candidates or multi-sample A/B before keeping new micro-changes.","noise_observation":"Median stayed in slower side of warm band while best remained low and quality unchanged."}}
{"run":667,"commit":"77f69d2","metric":0.118284,"metrics":{"best_ms":0.109297,"quality_sum":2.491129377057,"quality_min":0.589775903809,"team_count":4},"status":"keep","description":"Added request-scoped cache of task-order→original-order permutation indices (`_REQUEST_TASK_ORDER_BY_ORIGINAL_INDICES`) and used index-based allocation reordering on deterministic path instead of per-call sort+dict lookups in final output assembly.","timestamp":1775488889410,"segment":0,"confidence":9.020461326421303,"iterationTokens":4519,"asi":{"hypothesis":"With warm-path memoization, final allocation ordering is a meaningful per-call cost. Reusing a precomputed permutation from hardness order to original task order should beat repeated sort key lookups.","result":"Primary metric improved clearly with checks passing and unchanged quality monitors.","safety_notes":"Only used when `init_random` is false and task order is deterministic; randomized path keeps existing shuffle/sort semantics."}}
{"run":668,"commit":"77f69d2","metric":0.122542,"metrics":{"best_ms":0.116109,"quality_sum":2.491129377057,"quality_min":0.589775903809,"team_count":4},"status":"discard","description":"No-code confirmation rerun on kept task-order permutation-index cache commit 77f69d2.","timestamp":1775488945615,"segment":0,"confidence":8.723592012077898,"iterationTokens":781,"asi":{"hypothesis":"If 77f69d2 is robust, immediate rerun should remain in the improved ~0.11–0.13ms band.","rollback_reason":"No code change; validation-only rerun.","next_action_hint":"Use 77f69d2 as new baseline and continue with only high-signal warm-path reductions.","noise_observation":"Rerun stayed in the improved band with stable quality monitors."}}
{"run":669,"commit":"77f69d2","metric":0.146367,"metrics":{"best_ms":0.128403,"quality_sum":2.491129377057,"quality_min":0.589775903809,"team_count":4},"status":"discard","description":"No-code baseline rerun after ideas/backlog update for new keep 77f69d2.","timestamp":1775489014967,"segment":0,"confidence":8.673078236008948,"iterationTokens":2051,"asi":{"hypothesis":"Ideas maintenance should leave performance within current warm jitter band.","rollback_reason":"No source-code change; metadata update only.","next_action_hint":"Given ongoing jitter, seek higher-effect changes or validate with repeated paired runs before keeping marginal deltas.","noise_observation":"Median drifted higher this run while best remained low and quality stable."}}
{"run":670,"commit":"77f69d2","metric":0.139153,"metrics":{"best_ms":0.123574,"quality_sum":2.491129377057,"quality_min":0.589775903809,"team_count":4},"status":"checks_failed","description":"Attempted to precompute and thread improve-cache key fragments from `greedy_allocations` into `improve_allocations` by extending `greedy_allocations` return payload.","timestamp":1775489246535,"segment":0,"confidence":8.63559856442758,"iterationTokens":9019,"asi":{"hypothesis":"Avoiding per-call improve-key tuple generation by reusing greedy-precomputed key fragments could reduce warm-path overhead.","rollback_reason":"Checks failed because tests rely on `greedy_allocations` returning exactly two values; signature expansion broke callers.","next_action_hint":"Preserve `greedy_allocations` public/internal return shape; if precompute is retried, use auxiliary cache keyed by existing greedy cache key instead of changing function return contract.","error_excerpt":"tests/test_form_teams.py unpacking `greedy_allocations(...)` into two values failed (`ValueError: too many values to unpack`)."}}
{"run":671,"commit":"77f69d2","metric":0.129044,"metrics":{"best_ms":0.119957,"quality_sum":2.491129377057,"quality_min":0.589775903809,"team_count":4},"status":"discard","description":"No-code baseline rerun after checks_failed rollback and ideas pruning for greedy return-arity experiment.","timestamp":1775489302543,"segment":0,"confidence":8.595053068923162,"iterationTokens":1742,"asi":{"hypothesis":"After rollback, baseline should return to improved ~0.12–0.14ms regime.","rollback_reason":"No source-code change; validation-only rerun.","next_action_hint":"If reattempting improve-key precompute, keep `greedy_allocations` API unchanged and use side-channel caching.","noise_observation":"Median returned to lower warm band with stable quality metrics."}}
{"run":672,"commit":"77f69d2","metric":0.131068,"metrics":{"best_ms":0.123744,"quality_sum":2.491129377057,"quality_min":0.589775903809,"team_count":4},"status":"discard","description":"Retried improve-key precompute without changing `greedy_allocations` API: stored precomputed improve key fragments in greedy cache entries and passed them to `improve_allocations` via optional parameters.","timestamp":1775489497147,"segment":0,"confidence":8.581808928003158,"iterationTokens":6952,"asi":{"hypothesis":"Reusing improve-cache key fragments from greedy cache should remove repeated signature/unused-id tuple generation in warm calls while preserving public return contracts.","rollback_reason":"No clear improvement over baseline in current jitter band; added complexity for marginal/no gain.","next_action_hint":"Keep simpler improve-key generation path; avoid side-channel precompute plumbing unless effect size is larger.","observation":"Checks passed and quality metrics unchanged."}}
{"run":673,"commit":"77f69d2","metric":0.117532,"metrics":{"best_ms":0.114096,"quality_sum":2.491129377057,"quality_min":0.589775903809,"team_count":4},"status":"discard","description":"No-code baseline rerun after pruning neutral side-channel improve-key precompute variant.","timestamp":1775489553450,"segment":0,"confidence":9.064611173971048,"iterationTokens":915,"asi":{"hypothesis":"Rollback baseline should stay in the improved 77f69d2 regime.","rollback_reason":"No source-code change; validation-only rerun.","next_action_hint":"Continue only with candidates expected to beat ~0.12ms warm band by clear margin.","noise_observation":"Run hit a new low median while quality metrics remained unchanged."}}
{"run":674,"commit":"77f69d2","metric":0.127291,"metrics":{"best_ms":0.117372,"quality_sum":2.491129377057,"quality_min":0.589775903809,"team_count":4},"status":"checks_failed","description":"Tried fast path in `form_teams` to read cached greedy allocations directly (skip exact check + `greedy_allocations` call on deterministic cache hits) while extending greedy cache payload with precomputed improve-key fragments.","timestamp":1775489682082,"segment":0,"confidence":10.009714665092018,"iterationTokens":4347,"asi":{"hypothesis":"Direct form-level reuse of existing greedy cache entries can remove extra function calls/checks on warm hits.","rollback_reason":"Type-check failure: `_REQUEST_GREEDY_ALLOCATIONS` annotation remained 3-tuple while new code expected 5-tuple payload, causing invalid assignment diagnostics.","next_action_hint":"If retried, update cache type + all writers/readers consistently in one atomic change (or avoid payload expansion and keep cached_greedy typed to existing structure).","error_excerpt":"ty invalid-assignment at formation.py: cached_greedy_candidate inferred as 3-tuple, assigned to declared 5-tuple type."}}
{"run":675,"commit":"77f69d2","metric":0.129314,"metrics":{"best_ms":0.126269,"quality_sum":2.491129377057,"quality_min":0.589775903809,"team_count":4},"status":"discard","description":"No-code baseline rerun after checks_failed rollback for direct greedy-cache fast-path attempt.","timestamp":1775489729502,"segment":0,"confidence":10.044551768384618,"iterationTokens":1403,"asi":{"hypothesis":"Rollback should return to current warm baseline after failed type-annotation experiment.","rollback_reason":"No code change; validation-only run.","next_action_hint":"Retry only with fully synchronized cache payload typing/usage or stick to non-payload-expansion variants.","noise_observation":"Returned to expected ~0.12–0.13ms band with stable quality metrics."}}
{"run":676,"commit":"77f69d2","metric":0.13212,"metrics":{"best_ms":0.120088,"quality_sum":2.491129377057,"quality_min":0.589775903809,"team_count":4},"status":"discard","description":"No-code baseline rerun after pruning failed direct greedy-cache fast-path attempt in ideas backlog.","timestamp":1775489792645,"segment":0,"confidence":10.07356863347418,"iterationTokens":854,"asi":{"hypothesis":"Metadata-only ideas update should keep runtime within warm baseline band.","rollback_reason":"No source-code change; validation-only run.","next_action_hint":"Given low remaining headroom, focus on robust/high-signal changes and avoid fragile cache-shape rewrites.","noise_observation":"Median remained in expected warm band with stable quality metrics."}}
{"run":677,"commit":"77f69d2","metric":0.123033,"metrics":{"best_ms":0.119156,"quality_sum":2.491129377057,"quality_min":0.589775903809,"team_count":4},"status":"discard","description":"Added optional `task_order_ids` parameter to `greedy_allocations` and precomputed `task_order_ids` once in `form_teams` to avoid rebuilding the task-id tuple inside greedy cache-key setup.","timestamp":1775489878999,"segment":0,"confidence":11.154306482570394,"iterationTokens":1905,"asi":{"hypothesis":"Reusing precomputed task-order IDs should remove repeated generator/tuple work in warm-path greedy cache lookups.","rollback_reason":"Effect is marginal/inconclusive within current jitter band; added API surface for little clear gain.","next_action_hint":"Keep `greedy_allocations` signature simple unless a larger measured win appears.","observation":"Checks passed and quality metrics remained unchanged."}}
{"run":678,"commit":"77f69d2","metric":0.124736,"metrics":{"best_ms":0.117653,"quality_sum":2.491129377057,"quality_min":0.589775903809,"team_count":4},"status":"discard","description":"No-code baseline rerun after pruning neutral `task_order_ids` precompute experiment in ideas backlog.","timestamp":1775535751493,"segment":0,"confidence":12.674905539741964,"iterationTokens":1905,"asi":{"hypothesis":"Ideas-only update should preserve current warm-path baseline.","rollback_reason":"No source-code change; validation-only run.","next_action_hint":"Continue with only structural candidates likely to beat ~0.12ms band by a clear margin.","noise_observation":"Run remained in the lower warm band with stable quality metrics."}}
{"run":679,"commit":"77f69d2","metric":0.124416,"metrics":{"best_ms":0.110519,"quality_sum":2.491129377057,"quality_min":0.589775903809,"team_count":4},"status":"discard","description":"Added deterministic form-level fast path to read `_REQUEST_GREEDY_ALLOCATIONS` directly in `form_teams` and skip `capped_candidate_search_is_exact` + `greedy_allocations` call when a greedy cache hit is already available.","timestamp":1775535817335,"segment":0,"confidence":12.896326718425707,"iterationTokens":1761,"asi":{"hypothesis":"By bypassing exact-check and greedy function dispatch on warm deterministic hits, form-level overhead should drop further.","rollback_reason":"Median remained near existing baseline; effect is inconclusive in current jitter band.","next_action_hint":"Avoid additional control-flow complexity for near-noise gains; keep simpler call path unless repeated A/B shows clear advantage.","observation":"Checks passed and quality metrics remained stable."}}
{"run":680,"commit":"77f69d2","metric":0.128733,"metrics":{"best_ms":0.114396,"quality_sum":2.491129377057,"quality_min":0.589775903809,"team_count":4},"status":"discard","description":"No-code baseline rerun after pruning neutral direct-greedy-cache shortcut idea.","timestamp":1775535872925,"segment":0,"confidence":13.126668900408827,"iterationTokens":907,"asi":{"hypothesis":"Baseline should remain in current improved warm band after rollback and backlog update.","rollback_reason":"No source-code change; validation-only run.","next_action_hint":"Prioritize larger-effect or non-micro structural candidates; many warm-path control-flow tweaks are now near-noise.","noise_observation":"Run remained within warm-band variance; quality unchanged."}}
{"run":681,"commit":"77f69d2","metric":0.122892,"metrics":{"best_ms":0.120819,"quality_sum":2.491129377057,"quality_min":0.589775903809,"team_count":4},"status":"discard","description":"Added deterministic form-level improve-cache shortcut: build improve cache key in `form_teams`, return cached improved allocations directly on hit, and skip calling `improve_allocations` in that case.","timestamp":1775536024216,"segment":0,"confidence":13.282562346414018,"iterationTokens":907,"asi":{"hypothesis":"Avoiding the `improve_allocations` function call and setup on warm cache hits should reduce per-call overhead in the memoized regime.","rollback_reason":"Result is neutral/inconclusive versus baseline jitter; duplicated key generation in form layer adds complexity for little clear gain.","next_action_hint":"Keep existing simpler call path unless repeated paired A/B shows a robust advantage for form-level improve short-circuiting.","observation":"Checks passed and quality monitors remained unchanged."}}
{"run":682,"commit":"77f69d2","metric":0.137069,"metrics":{"best_ms":0.112282,"quality_sum":2.491129377057,"quality_min":0.589775903809,"team_count":4},"status":"discard","description":"No-code baseline rerun after pruning neutral form-level improve-cache shortcut in ideas backlog.","timestamp":1775536083860,"segment":0,"confidence":13.441633123449982,"iterationTokens":1004,"asi":{"hypothesis":"Ideas-only pruning should preserve baseline behavior in the current warm regime.","rollback_reason":"No source-code change; validation-only run.","next_action_hint":"Continue prioritizing only higher-signal candidates; most control-flow shortcuts are landing in noise.","noise_observation":"Median drifted higher this sample while best stayed low, consistent with ongoing warm-band jitter."}}
