{"type":"config","name":"Optimize form_teams capped-search performance","metricName":"total_ms","metricUnit":"ms","bestDirection":"lower"}
{"run":1,"commit":"f3a1a36","metric":616.363918,"metrics":{},"status":"keep","description":"Baseline capped compat workload harness; profiling points to repeated score_team work, especially personality scoring, Pydantic request construction, and compat skill assignment.","timestamp":1774597534095,"segment":0,"confidence":null,"iterationTokens":105}
{"run":2,"commit":"ee4053c","metric":360.119859,"metrics":{},"status":"keep","description":"Replace statistics.pstdev-based personality scoring with a float-only one-pass implementation; removes heavy stdlib numeric overhead while preserving output on existing tests.","timestamp":1774597663584,"segment":0,"confidence":null,"iterationTokens":3168}
{"run":3,"commit":"9a089ea","metric":248.690001,"metrics":{},"status":"keep","description":"Add a direct scoring fast path for formation that reuses raw Person objects instead of rebuilding Pydantic TeamQualityRequest/TeamMember structures for every candidate; also cache per-member social preference maps inside team_social_score.","timestamp":1774597937302,"segment":0,"confidence":3.299599618981835,"iterationTokens":9234}
{"run":4,"commit":"f5aa465","metric":221.757897,"metrics":{},"status":"keep","description":"Thread a form_teams-level score cache through candidate generation and swap improvement so repeated task/team evaluations are reused instead of rescored; biggest win comes from improve_allocations reusing candidate scores.","timestamp":1774598392288,"segment":0,"confidence":5.7039668315775955,"iterationTokens":24296}
{"run":5,"commit":"f5aa465","metric":226.275764,"metrics":{},"status":"discard","description":"Precompute shortlist-scorer invariants per task to avoid repeated task/preference/weight lookup, but the end-to-end benchmark regressed slightly; remaining cost is dominated more by candidate scoring and compat assignment than by per-person setup.","timestamp":1774598558193,"segment":0,"confidence":14.651882415128068,"iterationTokens":5461}
{"run":6,"commit":"f5aa465","metric":223.624824,"metrics":{},"status":"discard","description":"Cache per-request task lookup and filtered task preferences for score_team, but the improvement was within noise and slightly worse than the current best; static request metadata is not the main bottleneck anymore.","timestamp":1774598744360,"segment":0,"confidence":26.67785106901099,"iterationTokens":5613}
{"run":7,"commit":"79e0e1b","metric":186.045372,"metrics":{},"status":"keep","description":"Cache team-only personality and social components across tasks and swap evaluations, then inject them into the direct scoring path; repeated group compositions were paying the same non-task-dependent costs many times.","timestamp":1774598904770,"segment":0,"confidence":19.198447219059936,"iterationTokens":3555}
{"run":8,"commit":"79e0e1b","metric":183.008319,"metrics":{},"status":"checks_failed","description":"Cache compat member task-value vectors by member identity and ordered task-skill ids; benchmark improved, but lint failed on a long line so the change was reverted for cleanup before retrying.","timestamp":1774599025613,"segment":0,"confidence":13.738401930674694,"iterationTokens":3753}
{"run":9,"commit":"6d008df","metric":182.106077,"metrics":{},"status":"keep","description":"Cache compat member task-value vectors by member identity and ordered task-skill ids so repeated candidate teams stop rebuilding the same per-person skill alignment arrays for each task.","timestamp":1774599111118,"segment":0,"confidence":11.555725746080595,"iterationTokens":1204}
{"run":10,"commit":"6d008df","metric":200.132091,"metrics":{},"status":"discard","description":"Tried a fast-path that skips compat uncovered-skill backfilling when coverage is already complete and only sorts assignments on success, but the benchmark regressed; this helper is not a worthwhile optimization target in the current workload.","timestamp":1774599232486,"segment":0,"confidence":13.864168339156416,"iterationTokens":2229}
{"run":11,"commit":"6d008df","metric":194.058336,"metrics":{},"status":"discard","description":"Rewrote geometric_mean and weighted_geometric_mean as single-pass log accumulators to remove temporary collections, but the benchmark was slower overall; these helpers are not the next bottleneck.","timestamp":1774599349598,"segment":0,"confidence":15.67742683719788,"iterationTokens":1730}
{"run":12,"commit":"6d008df","metric":182.031785,"metrics":{},"status":"discard","description":"Use insertion-order team ids instead of sorted ids for the cross-task personality/social cache key. The measured delta versus the current best was effectively noise-level, so this is not worth keeping as an extra behavioral assumption.","timestamp":1774599442429,"segment":0,"confidence":16.437860548781448,"iterationTokens":1181}
{"run":13,"commit":"6d008df","metric":194.274436,"metrics":{},"status":"checks_failed","description":"Tried collapsing several compat-assignment helper passes into one shared analysis routine, but it changed task assignment behavior on multiple formation regressions and was slower anyway; the helper interactions are more delicate than they look.","timestamp":1774599698294,"segment":0,"confidence":23.991740305384905,"iterationTokens":1181}
{"run":14,"commit":"6d008df","metric":188.4694,"metrics":{},"status":"checks_failed","description":"Replace compat perfect-matching recursion with a bitmask DP over positive-task masks. Behavior held on the benchmark and speed looked promising, but lint failed on formatting so the change was reverted before validation.","timestamp":1774599880796,"segment":0,"confidence":28.693557578439645,"iterationTokens":5055}
{"run":15,"commit":"6d008df","metric":197.26513,"metrics":{},"status":"discard","description":"Replaced compat perfect-matching recursion with a bitmask DP over positive-task masks. It preserved checks but regressed the median, so the square-team feasibility check is not a profitable target on this workload.","timestamp":1774599969870,"segment":0,"confidence":28.646765797309367,"iterationTokens":1454}
{"run":16,"commit":"6d008df","metric":189.495463,"metrics":{},"status":"discard","description":"Thread precomputed task-skill ids, order maps, and max-skills-per-member through compat uncovered-assignment cleanup to avoid rebuilding tiny structures, but the added plumbing slowed the benchmark slightly.","timestamp":1774600240038,"segment":0,"confidence":32.86698560501215,"iterationTokens":11534}
{"run":17,"commit":"6d008df","metric":192.975926,"metrics":{},"status":"discard","description":"Tried making swap improvement compare objectives from quality lists instead of rebuilding temporary allocation lists, but the extra list churn still lost to the baseline; improve_allocations is not the main remaining bottleneck.","timestamp":1774600379475,"segment":0,"confidence":38.54547587247671,"iterationTokens":2790}
{"run":18,"commit":"6d008df","metric":198.653952,"metrics":{},"status":"checks_failed","description":"Tried trimming math.isclose calls inside _compat_other_member_best_values with cheaper equality fast paths, but the benchmark regressed and lint rejected the nested-condition style, so this avenue is not promising.","timestamp":1774600506745,"segment":0,"confidence":38.62494485982858,"iterationTokens":4581}
{"run":19,"commit":"6d008df","metric":193.319026,"metrics":{},"status":"discard","description":"Added a cached task-skill metadata helper so compat scoring could reuse ordered skill ids and sort maps across repeated evaluations of the same task, but the extra cache lookups/regression overhead outweighed the tiny structure rebuilds.","timestamp":1774600709084,"segment":0,"confidence":52.77123145475583,"iterationTokens":1027}
{"run":20,"commit":"6d008df","metric":167.196765,"metrics":{},"status":"checks_failed","description":"Combined compat task-capability counting with other-member-best analysis so _assign_task_skills_compat can reuse one shared per-task pass; this looked like the strongest improvement so far, but ty rejected the optional counts typing and the change was reverted for a cleanup retry.","timestamp":1774600817879,"segment":0,"confidence":45.049641214744646,"iterationTokens":2363}
{"run":21,"commit":"de595fe","metric":181.516276,"metrics":{"best_ms":168.606984,"quality_sum":2.491129377057,"quality_min":0.589775903809,"team_count":4},"status":"keep","description":"Fuse compat member-task analysis into one shared pass (member_has_match + task_capable_counts + other_member_best_values) and reuse the same task_capable_counts in member-priority ordering to remove duplicate scans of the member/task matrix.","timestamp":1775180145843,"segment":0,"confidence":39.35266724024046,"iterationTokens":2363,"asi":{"hypothesis":"Combining compat matrix analyses and eliminating duplicated capable-count passes will cut _assign_task_skills_compat overhead without changing behavior.","result":"Slight median improvement with unchanged quality/team-count metrics."}}
{"run":22,"commit":"d194a8e","metric":165.876361,"metrics":{"best_ms":161.582133,"quality_sum":2.491129377057,"quality_min":0.589775903809,"team_count":4},"status":"keep","description":"Precompute per-member positive task bitmasks and per-task best values in compat analysis, then iterate only positive candidate bits during assignment and reuse precomputed best task values during uncovered rescue scoring.","timestamp":1775180246977,"segment":0,"confidence":40.46968018547034,"iterationTokens":7613,"asi":{"hypothesis":"Bitmask-driven candidate scanning should cut _assign_task_skills_compat inner-loop work by avoiding full task scans and repeated max() rescans.","result":"Large median improvement with unchanged quality/team-count metrics.","hotspot":"_assign_task_skills_compat"}}
{"run":23,"commit":"d194a8e","metric":172.318317,"metrics":{"best_ms":170.651464,"quality_sum":2.603157073494,"quality_min":0.588387245056,"team_count":4},"status":"checks_failed","description":"Attempted a fast-path to skip full uncovered-assignment rebalancing when covered_mask already spans all task skills, plus reused a per-call task_skill_order map. This changed compat assignment semantics (missing rescued skill assignments in overlap-heavy cases), so checks failed and the change was reverted.","timestamp":1775180377736,"segment":0,"confidence":40.17565379098752,"iterationTokens":10120,"asi":{"hypothesis":"Bypassing _compat_fill_uncovered_assignments on full coverage should remove unnecessary assignment recounting/sorting overhead.","rollback_reason":"Fast-path was behaviorally incorrect: it skipped expected compatibility rebalancing that preserves legacy assignment distribution invariants.","next_action_hint":"Keep _compat_fill_uncovered_assignments semantics intact; target micro-optimizations inside it (fewer allocations/lookups) rather than skipping it.","failure_surface":"tests/test_team_quality.py compat assignment invariance and overlap-coverage checks"}}
{"run":24,"commit":"801a37b","metric":153.615554,"metrics":{"best_ms":153.149932,"quality_sum":2.491129377057,"quality_min":0.589775903809,"team_count":4},"status":"keep","description":"Precompute task_skill_ids once per compat assignment call and thread that tuple through member-task value caching, member-priority tie-breaking, and candidate priority generation to remove repeated task-id tuple/list reconstruction overhead.","timestamp":1775180529890,"segment":0,"confidence":41.76977789050827,"iterationTokens":9559,"asi":{"hypothesis":"Eliminating repeated task-skill id reconstruction in hot compat loops will reduce per-candidate overhead without behavior changes.","result":"Strong runtime win with stable quality/team-count metrics.","hotspots_touched":["_compat_member_task_values","_compat_member_priority_order","_assign_task_skills_compat"]}}
{"run":25,"commit":"801a37b","metric":160.328758,"metrics":{"best_ms":157.294028,"quality_sum":2.491129377057,"quality_min":0.589775903809,"team_count":4},"status":"discard","description":"Threaded precomputed task_skill_ids/task_skill_order through compat uncovered-assignment sorting/filling to avoid rebuilding per-call metadata in _compat_fill_uncovered_assignments, but end-to-end median regressed.","timestamp":1775180681437,"segment":0,"confidence":42.28274873286091,"iterationTokens":8132,"asi":{"hypothesis":"Passing precomputed task-skill metadata into fill/sort helpers would reduce string/dict setup overhead in a hot path.","rollback_reason":"Added parameter plumbing and extra argument passing cost more than metadata reconstruction in this workload.","next_action_hint":"Revert this helper-plumbing approach; focus on reducing algorithmic work inside _compat_fill_uncovered_assignments or candidate_combinations instead."}}
{"run":26,"commit":"801a37b","metric":179.97478,"metrics":{"best_ms":174.340143,"quality_sum":2.491129377057,"quality_min":0.589775903809,"team_count":4},"status":"checks_failed","description":"Added per-task local scored-candidate memoization in build_scored_candidates/greedy_allocations to avoid repeated cached_score_team lookups, but Ruff B023 rejected closure capture of loop-scoped memo dictionaries and the attempt was reverted.","timestamp":1775180776012,"segment":0,"confidence":48.907714752923034,"iterationTokens":4279,"asi":{"hypothesis":"A local memo around scored_candidate should cut redundant cache lookups for the same candidate tuples within each task loop.","rollback_reason":"Lint failure (B023) due loop-variable closure capture; benchmark also regressed strongly.","next_action_hint":"If retried, bind memo dict via default argument in closure or use functools.partial; only continue if end-to-end metric improves."}}
{"run":27,"commit":"801a37b","metric":169.321544,"metrics":{"best_ms":165.406394,"quality_sum":2.491129377057,"quality_min":0.589775903809,"team_count":4},"status":"discard","description":"Tried a unique-task-skill fast path in _compat_fill_uncovered_assignments that uses assigned-skill set coverage to skip full count/decrement bookkeeping when all required skills are present, but the extra set construction/regression overhead made the benchmark slower.","timestamp":1775180877174,"segment":0,"confidence":48.60453435956228,"iterationTokens":5310,"asi":{"hypothesis":"Most compat assignments already cover all unique task skills, so a set-coverage fast path should avoid expensive per-skill counting.","rollback_reason":"Fast-path bookkeeping (set build + uniqueness checks) was slower than baseline counting in this workload.","next_action_hint":"Avoid extra prechecks in _compat_fill_uncovered_assignments; target lower-level loop/call overhead or different hotspots."}}
{"run":28,"commit":"801a37b","metric":159.931221,"metrics":{"best_ms":159.293918,"quality_sum":2.491129377057,"quality_min":0.589775903809,"team_count":4},"status":"discard","description":"Replaced sorted team-id cache keys with request-scoped bitmask signatures for personality/social component caches to avoid per-score tuple sorting, but end-to-end runtime regressed.","timestamp":1775180989203,"segment":0,"confidence":44.44977316367283,"iterationTokens":4388,"asi":{"hypothesis":"Bitmask team signatures should be cheaper than sorting IDs for every score_team cache lookup.","rollback_reason":"Extra request-level bit-map lookups and bitwise accumulation outweighed tuple-sort savings on this workload.","next_action_hint":"Revert team-signature bitmasking; prioritize proven compat-assignment hotspots instead."}}
{"run":29,"commit":"801a37b","metric":154.93642,"metrics":{"best_ms":150.853094,"quality_sum":2.491129377057,"quality_min":0.589775903809,"team_count":4},"status":"discard","description":"Reworked compat member-priority key generation to iterate precomputed positive-task bitmasks instead of full value enumeration, but the extra list/mask handling was slightly slower than the original key comprehensions.","timestamp":1775181066532,"segment":0,"confidence":39.67766650081017,"iterationTokens":1956,"asi":{"hypothesis":"Using member_positive_masks in _compat_member_priority_order should reduce zero-value filtering overhead.","rollback_reason":"Bitmask/list conversion overhead offset any gains; median regressed versus the current best.","next_action_hint":"Keep the existing priority-key comprehensions; hunt for wins outside this ordering helper."}}
{"run":30,"commit":"801a37b","metric":160.16807,"metrics":{"best_ms":158.465921,"quality_sum":2.491129377057,"quality_min":0.589775903809,"team_count":4},"status":"discard","description":"Changed compat member-task value cache keys from (member_id, task_skill_ids tuple) to identity-based (id(member), id(task_skills)) with object-identity guards to avoid hashing task-skill-id tuples on every lookup, but median runtime regressed.","timestamp":1775181177170,"segment":0,"confidence":33.27476264098501,"iterationTokens":2242,"asi":{"hypothesis":"Identity-based cache keys should make _compat_member_task_values hits cheaper than tuple-of-strings key hashing.","rollback_reason":"Extra identity-guard indirection and broader cache tuple payload negated lookup savings; benchmark slowed.","next_action_hint":"Keep tuple-key cache design; pursue different hot-path reductions."}}
{"run":31,"commit":"801a37b","metric":159.532251,"metrics":{"best_ms":158.646158,"quality_sum":2.491129377057,"quality_min":0.589775903809,"team_count":4},"status":"discard","description":"Skipped per-member sorting in _compat_sort_member_assignments when a member has 0/1 assigned skills, but this micro-optimization regressed end-to-end runtime.","timestamp":1775181243120,"segment":0,"confidence":32.84997478830944,"iterationTokens":1136,"asi":{"hypothesis":"Avoiding sorted() for tiny assignment lists should trim compat assignment overhead.","rollback_reason":"Branch/check overhead outweighed any saved sorting work on this benchmark.","next_action_hint":"Do not add tiny conditional guards around sort; pursue coarser-grained wins."}}
{"run":32,"commit":"801a37b","metric":159.437162,"metrics":{"best_ms":158.73198,"quality_sum":2.491129377057,"quality_min":0.589775903809,"team_count":4},"status":"discard","description":"Replaced shortlist reordering in candidate_combinations (dict+sort by input positions) with an input-order filter over selected shortlist IDs, but this was slower end-to-end.","timestamp":1775181319332,"segment":0,"confidence":30.038308894678167,"iterationTokens":1337,"asi":{"hypothesis":"Avoiding per-call position dict construction and sort should reduce shortlist overhead.","rollback_reason":"Set construction plus full input-order scan cost more than the small sort in this workload.","next_action_hint":"Keep existing shortlist.sort path; target heavier work than shortlist ordering."}}
{"run":33,"commit":"801a37b","metric":156.524599,"metrics":{"best_ms":153.096857,"quality_sum":2.491129377057,"quality_min":0.589775903809,"team_count":4},"status":"discard","description":"Replaced compat perfect-positive matching check with a member-positive-mask DFS/backtracking solver (sorted by mask sparsity) to avoid float-matrix traversal, but median runtime still regressed.","timestamp":1775181400998,"segment":0,"confidence":29.26646957029018,"iterationTokens":2222,"asi":{"hypothesis":"A bitmask-only perfect-matching feasibility check should be cheaper than augmenting-path traversal over float rows.","rollback_reason":"Even with mask precomputation and sparse-first ordering, recursion overhead remained slower on this workload.","next_action_hint":"Keep existing matching check; focus on higher-impact hotspots like candidate scoring/selection."}}
{"run":34,"commit":"801a37b","metric":140.989877,"metrics":{"best_ms":140.762327,"quality_sum":2.491129377057,"quality_min":0.589775903809,"team_count":4},"status":"checks_failed","description":"Reduced scored shortlist expansion factor from 4 to 1 to cut candidate scoring volume; benchmark improved sharply but this violated shortlist-coverage/caching behavior guarantees and degraded specialist selection quality in regression tests.","timestamp":1775181476569,"segment":0,"confidence":28.235654291982595,"iterationTokens":1548,"asi":{"hypothesis":"Lowering MAX_SCORED_COMBINATION_EXPANSION would materially reduce candidate_combinations work in capped search.","rollback_reason":"Behavior changed too much: shortlist expansion tests, cache reuse expectations, and capped specialist-quality regressions failed.","next_action_hint":"If revisiting candidate caps, preserve tested expansion semantics (or update tests with a principled algorithm change) rather than tuning the global constant blindly.","failure_surface":"tests/test_form_teams.py scored-cap shortlist and specialist-preservation cases"}}
{"run":35,"commit":"801a37b","metric":162.884064,"metrics":{"best_ms":160.307784,"quality_sum":2.491129377057,"quality_min":0.589775903809,"team_count":4},"status":"discard","description":"Refactored candidate_combinations heap ranking loop to compare score/tie-break scalars before constructing replacement tuples, aiming to reduce per-combination tuple churn, but this regressed median runtime.","timestamp":1775181561783,"segment":0,"confidence":27.96421679520784,"iterationTokens":2995,"asi":{"hypothesis":"Avoiding full entry-tuple construction on non-competitive combinations should speed scored shortlist ranking.","rollback_reason":"Extra Python-level branching/indexing cost outweighed tuple-allocation savings.","next_action_hint":"Keep original tuple-comparison heap loop; focus on larger-grain reductions in scored candidate volume or scoring cost."}}
