{"run":708,"commit":"4c2992c","metric":0.156586,"metrics":{"best_ms":0.124226,"quality_sum":2.491129377057,"quality_min":0.589775903809,"team_count":4},"status":"discard","description":"A/B reversion check for 4c2992c: reverted headcount guard to generator-based `sum(task.team_size for task in request.tasks)` expression.","timestamp":1775538321581,"segment":0,"confidence":20.885455255377163,"iterationTokens":2526,"asi":{"hypothesis":"If 4c2992c was a noise keep, reverting to generator-based sum should match or beat current performance.","rollback_reason":"Reversion was substantially slower in this sample; does not support undoing 4c2992c.","next_action_hint":"Keep accumulation-loop headcount guard and avoid further rewrites of this check unless accompanied by multi-sample A/B.","observation":"Quality metrics unchanged; slowdown concentrated in primary runtime."}}
{"run":709,"commit":"4c2992c","metric":0.148621,"metrics":{"best_ms":0.129084,"quality_sum":2.491129377057,"quality_min":0.589775903809,"team_count":4},"status":"discard","description":"No-code baseline rerun after pruning notes from headcount A/B reversion check.","timestamp":1775538386562,"segment":0,"confidence":21.024223070792278,"iterationTokens":969,"asi":{"hypothesis":"Ideas-only update should preserve baseline, while additional sample tracks current jitter envelope.","rollback_reason":"No source-code change; validation-only run.","next_action_hint":"Maintain paired validation discipline; warm-band volatility remains high.","noise_observation":"Sample landed in slower transient band, consistent with intermittent host regime shifts."}}
{"run":710,"commit":"4c2992c","metric":0.16406,"metrics":{"best_ms":0.140376,"quality_sum":2.491129377057,"quality_min":0.589775903809,"team_count":4},"status":"discard","description":"Additional no-code baseline sample to monitor current host regime after recent slow-band drift.","timestamp":1775538437169,"segment":0,"confidence":21.164847231385473,"iterationTokens":599,"asi":{"hypothesis":"Repeat baseline run helps distinguish transient noise from sustained regime shift.","rollback_reason":"No code change; validation-only rerun.","next_action_hint":"Pause micro-tuning when host remains in slower regime; resume candidate testing when baseline re-enters stable low band.","noise_observation":"Both median and best stayed elevated, suggesting current machine load regime is temporarily slower."}}
{"run":711,"commit":"4c2992c","metric":0.14786,"metrics":{"best_ms":0.127772,"quality_sum":2.491129377057,"quality_min":0.589775903809,"team_count":4},"status":"discard","description":"No-code baseline sample while host remains in slower runtime regime.","timestamp":1775538489566,"segment":0,"confidence":21.306565564123137,"iterationTokens":622,"asi":{"hypothesis":"Further baseline sampling can confirm whether slow regime persists before evaluating new micro-candidates.","rollback_reason":"No code change; validation-only run.","next_action_hint":"Defer tiny experiments until baseline variance tightens; otherwise require multi-run A/B bundles per candidate.","noise_observation":"Median remains elevated relative to earlier floor, indicating continued host slowdown."}}
{"run":712,"commit":"4c2992c","metric":0.172969,"metrics":{"best_ms":0.122653,"quality_sum":2.491129377057,"quality_min":0.589775903809,"team_count":4},"status":"discard","description":"No-code baseline rerun after updating ideas note to reflect new warm-band volatility range.","timestamp":1775538553472,"segment":0,"confidence":21.450194562578616,"iterationTokens":966,"asi":{"hypothesis":"Metadata-only update should not affect runtime; run used to track active host regime.","rollback_reason":"No source-code change; validation-only run.","next_action_hint":"Given sustained slow regime, avoid judging micro candidates from single runs; use paired bundles.","noise_observation":"Median spiked further while best remained moderate, reinforcing high variance/host load effects."}}
{"run":713,"commit":"4c2992c","metric":0.177006,"metrics":{"best_ms":0.126881,"quality_sum":2.491129377057,"quality_min":0.589775903809,"team_count":4},"status":"discard","description":"Additional no-code baseline sample to monitor persistent slow host regime.","timestamp":1775538607018,"segment":0,"confidence":21.552416270497385,"iterationTokens":705,"asi":{"hypothesis":"Repeated baseline runs should reveal whether current slowdown persists before continuing micro-tuning.","rollback_reason":"No code change; validation-only run.","next_action_hint":"Postpone micro candidate evaluation until baseline variance normalizes or run bundled A/B groups to average noise.","noise_observation":"Median remained in elevated slow band with only occasional fast best values."}}
{"run":714,"commit":"4c2992c","metric":0.150105,"metrics":{"best_ms":0.126891,"quality_sum":2.491129377057,"quality_min":0.589775903809,"team_count":4},"status":"discard","description":"No-code baseline resample while waiting for host regime normalization.","timestamp":1775538667204,"segment":0,"confidence":21.655616926407234,"iterationTokens":987,"asi":{"hypothesis":"Additional baseline sampling helps characterize current noise regime before evaluating micro candidates.","rollback_reason":"No code change; validation-only run.","next_action_hint":"Keep collecting paired samples and only test candidates with potentially larger effects under slow regime.","noise_observation":"Median improved versus prior spikes but remains above earlier floor."}}
{"run":715,"commit":"4c2992c","metric":0.155457,"metrics":{"best_ms":0.113677,"quality_sum":2.491129377057,"quality_min":0.589775903809,"team_count":4},"status":"discard","description":"Tried storing task-order→original-order indices cache as `list[int]` (instead of tuple) and threading list type through deterministic reordering path.","timestamp":1775538756995,"segment":0,"confidence":21.916117689370896,"iterationTokens":2155,"asi":{"hypothesis":"List-backed cached indices might reduce conversion/iteration overhead versus tuple-backed indices in output reordering path.","rollback_reason":"Primary metric regressed in current regime; container-shape change did not help.","next_action_hint":"Keep tuple-backed index cache from 77f69d2; avoid container-shape micro-variants here.","observation":"Checks passed and quality metrics unchanged."}}
{"run":716,"commit":"4c2992c","metric":0.136389,"metrics":{"best_ms":0.119827,"quality_sum":2.491129377057,"quality_min":0.589775903809,"team_count":4},"status":"discard","description":"No-code baseline rerun after pruning regressed list-backed permutation-index cache variant.","timestamp":1775538818547,"segment":0,"confidence":22.182962016630842,"iterationTokens":825,"asi":{"hypothesis":"Rollback and ideas update should restore baseline after regressed container-shape variant.","rollback_reason":"No source-code change; validation-only run.","next_action_hint":"Avoid additional container-shape micro-variants in output ordering cache.","noise_observation":"Median improved from prior slow samples but remains above earlier floor; quality metrics stable."}}
{"run":717,"commit":"4c2992c","metric":0.155915,"metrics":{"best_ms":0.154052,"quality_sum":2.491129377057,"quality_min":0.589775903809,"team_count":4},"status":"discard","description":"Tried local `tasks = request.tasks` alias in `form_teams` and reused it for headcount accumulation + task-order list creation to reduce repeated attribute access.","timestamp":1775538890755,"segment":0,"confidence":22.230118056219148,"iterationTokens":997,"asi":{"hypothesis":"Reusing a local tasks alias might trim attribute lookup overhead in the warm setup path.","rollback_reason":"Regressed strongly in this sample; aliasing did not help and increased variance exposure.","next_action_hint":"Avoid request-attribute alias micro-optimizations; focus on higher-signal opportunities.","observation":"Checks passed and quality metrics unchanged."}}
{"run":718,"commit":"4c2992c","metric":0.168249,"metrics":{"best_ms":0.149132,"quality_sum":2.491129377057,"quality_min":0.589775903809,"team_count":4},"status":"discard","description":"No-code baseline rerun after pruning regressed local-task-alias micro-variant.","timestamp":1775538962526,"segment":0,"confidence":22.277475009392614,"iterationTokens":816,"asi":{"hypothesis":"Ideas-only pruning should not change behavior; sample tracks current host regime.","rollback_reason":"No source-code change; validation-only run.","next_action_hint":"Current host remains in slow regime; defer micro-tuning or use larger A/B bundles.","noise_observation":"Both median and best were elevated again, indicating continued runtime drift."}}
{"run":719,"commit":"4c2992c","metric":0.15339,"metrics":{"best_ms":0.122923,"quality_sum":2.491129377057,"quality_min":0.589775903809,"team_count":4},"status":"discard","description":"Inlined `validate_max_candidate_teams` check directly in `form_teams` (replace helper call with local guard/raise) to remove one function call from hot entry path.","timestamp":1775539115376,"segment":0,"confidence":22.352040411148742,"iterationTokens":816,"asi":{"hypothesis":"Eliminating the `validate_max_candidate_teams(...)` function call in `form_teams` may slightly reduce warm-path overhead.","rollback_reason":"Primary metric regressed in current regime; local inlining did not produce a usable win.","next_action_hint":"Keep helper call for clarity; avoid further entry-point call-site micro-inlining unless bundled with larger structural simplifications.","observation":"Checks passed and behavior metrics stayed unchanged."}}
{"run":720,"commit":"4c2992c","metric":0.12662,"metrics":{"best_ms":0.123073,"quality_sum":2.491129377057,"quality_min":0.589775903809,"team_count":4},"status":"discard","description":"No-code baseline rerun after pruning inlined-validate micro-variant from ideas backlog.","timestamp":1775539183397,"segment":0,"confidence":22.427106648087044,"iterationTokens":870,"asi":{"hypothesis":"Ideas update should preserve baseline and re-sample current warm band after rollback.","rollback_reason":"No source-code change; validation-only run.","next_action_hint":"Continue focusing on higher-leverage candidates; entry-point call-inlining variants are now exhausted.","noise_observation":"Median returned closer to normal warm band with stable quality metrics."}}
{"run":721,"commit":"4c2992c","metric":0.146759,"metrics":{"best_ms":0.121631,"quality_sum":2.491129377057,"quality_min":0.589775903809,"team_count":4},"status":"discard","description":"Added exact-search quick gate in `form_teams`: when capped and first task combination count already exceeds cap, skip `capped_candidate_search_is_exact(...)` helper call; otherwise fall back to existing full exactness check.","timestamp":1775539287813,"segment":0,"confidence":22.433014083924608,"iterationTokens":3536,"asi":{"hypothesis":"Benchmark workload always fails exactness on the first task combination count; short-circuiting before calling helper may reduce warm entry overhead.","rollback_reason":"Regressed in current regime; extra branching/comb call placement did not help.","next_action_hint":"Keep existing exactness helper path; avoid benchmark-shape-specific exactness shortcuts.","observation":"Checks passed and quality metrics unchanged."}}
{"run":722,"commit":"4c2992c","metric":0.166615,"metrics":{"best_ms":0.125067,"quality_sum":2.491129377057,"quality_min":0.589775903809,"team_count":4},"status":"discard","description":"No-code baseline rerun after pruning regressed exactness quick-gate shortcut idea.","timestamp":1775539355432,"segment":0,"confidence":22.438924632690952,"iterationTokens":858,"asi":{"hypothesis":"Ideas pruning should preserve baseline; run used to monitor continued host drift.","rollback_reason":"No source-code change; validation-only run.","next_action_hint":"Given elevated drift, avoid interpreting single-run medians as signal for micro candidates.","noise_observation":"Median remained in elevated slow band while best stayed relatively low."}}
{"run":723,"commit":"4c2992c","metric":0.167267,"metrics":{"best_ms":0.12654,"quality_sum":2.491129377057,"quality_min":0.589775903809,"team_count":4},"status":"discard","description":"Changed deterministic output reordering container from list comprehension to tuple generator (`ordered_allocations = tuple(...)`) on permutation-index path.","timestamp":1775539428414,"segment":0,"confidence":22.565765798490666,"iterationTokens":897,"asi":{"hypothesis":"Tuple materialization for ordered allocations may reduce overhead versus list construction before payload loop.","rollback_reason":"Regressed in current regime; tuple conversion did not help.","next_action_hint":"Keep list-based ordered allocation construction on permutation-index path.","observation":"Checks passed and behavior metrics unchanged."}}
{"run":724,"commit":"4c2992c","metric":0.193117,"metrics":{"best_ms":0.123003,"quality_sum":2.491129377057,"quality_min":0.589775903809,"team_count":4},"status":"discard","description":"No-code baseline rerun after pruning regressed ordered-allocation tuple-container variant.","timestamp":1775539497634,"segment":0,"confidence":22.694049113909916,"iterationTokens":760,"asi":{"hypothesis":"Ideas-only rollback should preserve behavior; run used to track ongoing host variance.","rollback_reason":"No source-code change; validation-only run.","next_action_hint":"Host is currently in a very noisy/slow regime; continue requiring paired bundles for any candidate evaluation.","noise_observation":"Median spiked sharply while best remained fast, indicating pronounced transient scheduling noise."}}
{"run":725,"commit":"4c2992c","metric":0.154243,"metrics":{"best_ms":0.128303,"quality_sum":2.491129377057,"quality_min":0.589775903809,"team_count":4},"status":"discard","description":"Additional no-code baseline sample to track persistent slow/noisy host regime.","timestamp":1775539552316,"segment":0,"confidence":23.02308742258374,"iterationTokens":614,"asi":{"hypothesis":"Repeated baseline sampling helps identify whether transient spikes are subsiding before new candidate evaluations.","rollback_reason":"No code change; validation-only run.","next_action_hint":"Delay micro-candidate keeps until baseline stabilizes or use bundled A/B averages.","noise_observation":"Median decreased from prior spike but remains above earlier floor."}}
{"run":726,"commit":"4c2992c","metric":0.150616,"metrics":{"best_ms":0.125778,"quality_sum":2.491129377057,"quality_min":0.589775903809,"team_count":4},"status":"discard","description":"No-code baseline rerun after adding fresh-request diagnostic note to ideas backlog.","timestamp":1775539628137,"segment":0,"confidence":23.361807480085474,"iterationTokens":1015,"asi":{"hypothesis":"Ideas-note update should not alter warm benchmark behavior.","rollback_reason":"No source-code change; validation-only run.","next_action_hint":"Continue balancing warm-path optimization with periodic fresh-request diagnostics to guard against overfitting.","noise_observation":"Median remains in slower transient band; quality unchanged."}}
{"run":727,"commit":"4c2992c","metric":0.136509,"metrics":{"best_ms":0.123764,"quality_sum":2.491129377057,"quality_min":0.589775903809,"team_count":4},"status":"discard","description":"Additional no-code baseline sample after continued slow-band drift.","timestamp":1775539686336,"segment":0,"confidence":23.592195232393507,"iterationTokens":917,"asi":{"hypothesis":"Repeated baseline samples help determine whether host is returning toward lower warm band.","rollback_reason":"No code change; validation-only run.","next_action_hint":"If baseline stabilizes near lower band again, resume testing only higher-leverage candidate ideas.","noise_observation":"Median improved versus prior slow samples but still above the best-observed floor."}}
{"run":728,"commit":"4c2992c","metric":0.156778,"metrics":{"best_ms":0.127452,"quality_sum":2.491129377057,"quality_min":0.589775903809,"team_count":4},"status":"discard","description":"Tried hoisting `people_count = len(request.people)` in `form_teams` headcount guard loop and comparing against `requested_seats` after accumulation.","timestamp":1775539901282,"segment":0,"confidence":23.827172285059078,"iterationTokens":3456,"asi":{"hypothesis":"Avoiding repeated len lookups/attribute path in headcount guard may slightly reduce entry overhead.","rollback_reason":"Regressed in current regime; extra local does not improve runtime.","next_action_hint":"Keep simpler direct `len(request.people)` comparison; avoid further headcount micro-variants.","observation":"Checks passed and quality metrics unchanged."}}
{"run":729,"commit":"4c2992c","metric":0.133213,"metrics":{"best_ms":0.12637,"quality_sum":2.491129377057,"quality_min":0.589775903809,"team_count":4},"status":"discard","description":"No-code baseline rerun after pruning regressed `people_count` headcount micro-variant.","timestamp":1775539967469,"segment":0,"confidence":24.01754145287167,"iterationTokens":833,"asi":{"hypothesis":"Ideas-only update should preserve baseline and re-sample current warm band.","rollback_reason":"No source-code change; validation-only run.","next_action_hint":"Continue focusing on non-micro or strongly justified warm-path candidates.","noise_observation":"Median moved back toward mid-band with stable quality metrics."}}
{"run":730,"commit":"4c2992c","metric":0.14798,"metrics":{"best_ms":0.130978,"quality_sum":2.491129377057,"quality_min":0.589775903809,"team_count":4},"status":"discard","description":"Tried deterministic output reordering len-4 specialization: unrolled `task_order_original_indices` unpack + direct 4-element allocation list construction, with fallback loop for other sizes.","timestamp":1775540062930,"segment":0,"confidence":24.21097706075011,"iterationTokens":2385,"asi":{"hypothesis":"In the common 4-task path, unrolled index-based allocation reorder may beat tiny list-comprehension overhead.","rollback_reason":"Regressed in current regime; added branch/unpack overhead did not help.","next_action_hint":"Keep generic indexed list-comprehension reorder and avoid size-specific unrolling here.","observation":"Checks passed and quality metrics unchanged."}}
{"run":731,"commit":"4c2992c","metric":0.148912,"metrics":{"best_ms":0.139675,"quality_sum":2.491129377057,"quality_min":0.589775903809,"team_count":4},"status":"discard","description":"No-code baseline rerun after pruning regressed len-4 output reorder unroll experiment.","timestamp":1775540133608,"segment":0,"confidence":24.28793718206582,"iterationTokens":817,"asi":{"hypothesis":"Rollback and ideas update should restore baseline; sample also tracks current host regime.","rollback_reason":"No source-code change; validation-only run.","next_action_hint":"Keep using paired baselines and avoid additional tiny unrolled output-path tweaks under current volatility.","noise_observation":"Median remained in elevated warm band with stable quality metrics."}}
{"run":732,"commit":"3d82f97","metric":0.128032,"metrics":{"best_ms":0.115439,"quality_sum":2.491129377057,"quality_min":0.589775903809,"team_count":4},"status":"keep","description":"Removed fallback branch in `improve_allocations` memo-key construction on original-score path: replaced `(allocation.team_signature or tuple(member.id ...))` with direct typed reuse of `allocation.team_signature` (`cast`) to avoid per-allocation branch/generator overhead.","timestamp":1775540290411,"segment":0,"confidence":24.36538813425215,"iterationTokens":2850,"asi":{"hypothesis":"On warm calls, improve-cache key construction is hot and allocations from original score path already carry canonical team signatures; removing fallback tuple-generation branch should reduce overhead.","result":"Primary metric improved in the current regime with checks passing and stable quality monitors.","safety_notes":"Change applies only under `score_team is _ORIGINAL_SCORE_TEAM`; allocations produced by this path include canonical `team_signature` values."}}
{"run":733,"commit":"3d82f97","metric":0.130367,"metrics":{"best_ms":0.108736,"quality_sum":2.491129377057,"quality_min":0.589775903809,"team_count":4},"status":"discard","description":"No-code confirmation rerun on kept direct team_signature memo-key reuse commit 3d82f97.","timestamp":1775540343584,"segment":0,"confidence":24.369849283431346,"iterationTokens":1396,"asi":{"hypothesis":"If 3d82f97 is robust, immediate rerun should stay in improved low warm band with unchanged quality metrics.","rollback_reason":"No code change; validation-only rerun.","next_action_hint":"Keep 3d82f97 as active baseline and continue only with high-signal structural candidates.","noise_observation":"Confirmation remained in the same low band and preserved all quality monitors."}}
{"run":734,"commit":"3d82f97","metric":0.143232,"metrics":{"best_ms":0.126299,"quality_sum":2.491129377057,"quality_min":0.589775903809,"team_count":4},"status":"discard","description":"No-code baseline rerun after ideas update for new keep head 3d82f97.","timestamp":1775540415930,"segment":0,"confidence":24.374312066526368,"iterationTokens":1671,"asi":{"hypothesis":"Ideas maintenance should preserve runtime while tracking current host band.","rollback_reason":"No source-code change; validation-only run.","next_action_hint":"Continue with paired samples under current volatile regime and prioritize only high-impact candidates.","noise_observation":"Sample drifted into slower band while quality remained stable."}}
