{"run":788,"commit":"8df9a8e","metric":0.124747,"metrics":{"best_ms":0.109728,"quality_sum":2.491129377057,"quality_min":0.589775903809,"team_count":4},"status":"keep","description":"Changed request-scoped greedy/improve cache payloads from tuples to lists and switched warm-hit returns to `.copy()` list copies (store `allocations.copy()` / `remaining_people.copy()` in caches, return copied lists directly).","timestamp":1775544245823,"segment":0,"confidence":27.328849471999785,"iterationTokens":4860,"asi":{"hypothesis":"Warm path repeatedly copies cached allocation/person containers; storing list payloads and using `.copy()` may be cheaper than tuple storage plus tuple-to-list conversion.","result":"Primary metric improved in current regime with checks passing and unchanged quality monitors.","safety_notes":"Callers still receive fresh mutable lists each hit; cache internals no longer rely on tuple immutability but preserve functional behavior through copy-on-read/write."}}
{"run":789,"commit":"8df9a8e","metric":0.151828,"metrics":{"best_ms":0.12666,"quality_sum":2.491129377057,"quality_min":0.589775903809,"team_count":4},"status":"discard","description":"Immediate no-code confirmation rerun on kept list-backed cache payload copy strategy commit 8df9a8e.","timestamp":1775544292227,"segment":0,"confidence":27.357504372837194,"iterationTokens":899,"asi":{"hypothesis":"If 8df9a8e is robust, follow-up sample should remain near low-band result.","rollback_reason":"No code change; validation-only rerun.","next_action_hint":"Retain 8df9a8e but require additional paired samples due persistent host jitter.","noise_observation":"Median bounced back into slower warm band while quality metrics stayed stable, indicating high transient variance."}}
{"run":790,"commit":"8df9a8e","metric":0.136619,"metrics":{"best_ms":0.125949,"quality_sum":2.491129377057,"quality_min":0.589775903809,"team_count":4},"status":"discard","description":"No-code baseline rerun after ideas update for new keep head 8df9a8e (list-backed cache payload copy strategy).","timestamp":1775544398336,"segment":0,"confidence":27.604892743702937,"iterationTokens":4298,"asi":{"hypothesis":"Ideas maintenance should not alter runtime behavior while re-sampling current warm regime.","rollback_reason":"No source-code change; validation-only run.","next_action_hint":"Retain 8df9a8e and continue paired validation before attributing durable gain under volatile host conditions.","noise_observation":"Median in mid-band with stable quality metrics."}}
{"run":791,"commit":"8df9a8e","metric":0.155094,"metrics":{"best_ms":0.140726,"quality_sum":2.491129377057,"quality_min":0.589775903809,"team_count":4},"status":"discard","description":"Tried list-slice copy returns (`[:]`) on warm greedy/improve cache hits instead of `.copy()` for list-backed cache payloads.","timestamp":1775544464201,"segment":0,"confidence":27.8571361023865,"iterationTokens":1184,"asi":{"hypothesis":"For list-backed cache payloads, slicing copies might be cheaper than `.copy()` on hot returns.","rollback_reason":"Regressed in current regime; slice copying slower than `.copy()` here.","next_action_hint":"Keep `.copy()` return strategy for list-backed greedy/improve cache payloads.","observation":"Checks passed and quality metrics unchanged."}}
{"run":792,"commit":"8df9a8e","metric":0.160143,"metrics":{"best_ms":0.130037,"quality_sum":2.491129377057,"quality_min":0.589775903809,"team_count":4},"status":"discard","description":"No-code baseline rerun after pruning regressed list-slice warm-hit copy variant on list-backed cache payloads.","timestamp":1775544520263,"segment":0,"confidence":27.874261111857685,"iterationTokens":900,"asi":{"hypothesis":"Ideas-only rollback should preserve behavior while re-sampling post-variant host band.","rollback_reason":"No source-code change; validation-only run.","next_action_hint":"Retain `.copy()` as preferred warm-hit copy mechanism for list-backed cache payloads.","noise_observation":"Median remained in slower warm band with stable quality metrics."}}
{"run":793,"commit":"8df9a8e","metric":0.146627,"metrics":{"best_ms":0.130296,"quality_sum":2.491129377057,"quality_min":0.589775903809,"team_count":4},"status":"discard","description":"Direct A/B reversion of 8df9a8e: switched greedy/improve request caches back to tuple payload storage with tuple->list copies on warm hits.","timestamp":1775544587021,"segment":0,"confidence":27.89140718927661,"iterationTokens":1870,"asi":{"hypothesis":"If list-backed cache payloads are overfit/noise, reverting to prior tuple-backed cache representation should recover or improve median runtime.","rollback_reason":"Reversion was slower in this sample; no evidence to drop 8df9a8e.","next_action_hint":"Retain list-backed cache payload strategy (`8df9a8e`) and continue paired stability checks.","ab_note":"This was an explicit A/B validation run against the immediate predecessor representation."}}
{"run":794,"commit":"8df9a8e","metric":0.139684,"metrics":{"best_ms":0.127652,"quality_sum":2.491129377057,"quality_min":0.589775903809,"team_count":4},"status":"discard","description":"No-code baseline rerun after pruning A/B reversion note for 8df9a8e tuple-cache rollback.","timestamp":1775544649150,"segment":0,"confidence":27.979315858217355,"iterationTokens":1033,"asi":{"hypothesis":"Ideas-note update should preserve warm-path behavior while sampling current jitter band.","rollback_reason":"No source-code change; validation-only run.","next_action_hint":"Continue periodic paired baselines before attempting further cache-container rewrites.","noise_observation":"Median stayed in mid warm band; quality unchanged."}}
{"run":795,"commit":"8df9a8e","metric":0.146888,"metrics":{"best_ms":0.123413,"quality_sum":2.491129377057,"quality_min":0.589775903809,"team_count":4},"status":"discard","description":"Partial A/B split of 8df9a8e: kept list-backed `.copy()` for greedy cache but reverted improve cache back to tuple payload + unpack-copy returns.","timestamp":1775544712257,"segment":0,"confidence":28.067780423680937,"iterationTokens":1259,"asi":{"hypothesis":"List-backed copy gains may come mainly from greedy cache; reverting only improve cache might improve net warm-path cost.","rollback_reason":"Regressed in this sample; split strategy slower than full list-backed approach.","next_action_hint":"Keep both greedy and improve caches list-backed with `.copy()` returns as in 8df9a8e.","ab_note":"Targeted partial reversion showed no benefit."}}
{"run":796,"commit":"8df9a8e","metric":0.131349,"metrics":{"best_ms":0.128804,"quality_sum":2.491129377057,"quality_min":0.589775903809,"team_count":4},"status":"discard","description":"No-code baseline rerun after pruning partial split reversion of list-backed cache strategy.","timestamp":1775544768036,"segment":0,"confidence":28.245457909048525,"iterationTokens":878,"asi":{"hypothesis":"Ideas-only update should preserve warm-path behavior while confirming current band after A/B split tests.","rollback_reason":"No source-code change; validation-only run.","next_action_hint":"Retain full 8df9a8e cache representation and shift effort away from cache-container split variants.","noise_observation":"Median returned toward lower-mid warm band with unchanged quality metrics."}}
{"run":797,"commit":"8df9a8e","metric":0.132561,"metrics":{"best_ms":0.127692,"quality_sum":2.491129377057,"quality_min":0.589775903809,"team_count":4},"status":"discard","description":"On list-backed cache payloads, tried warm-hit return copy rewrite from `.copy()` to unpack-list copies (`[*cached_list]`) for greedy/improve caches.","timestamp":1775544834740,"segment":0,"confidence":28.42539922892948,"iterationTokens":1025,"asi":{"hypothesis":"Unpack-list copy might outperform `.copy()` for small cached lists in warm-hit paths.","rollback_reason":"No clear gain in current regime; near-noise/slightly slower.","next_action_hint":"Keep `.copy()` return strategy from 8df9a8e.","observation":"Checks passed and quality metrics unchanged."}}
{"run":798,"commit":"8df9a8e","metric":0.136138,"metrics":{"best_ms":0.128273,"quality_sum":2.491129377057,"quality_min":0.589775903809,"team_count":4},"status":"discard","description":"No-code baseline rerun after pruning unpack-copy variant on list-backed warm cache returns.","timestamp":1775544896185,"segment":0,"confidence":28.45524151148873,"iterationTokens":861,"asi":{"hypothesis":"Ideas-only update should not impact behavior and helps track current warm-band drift.","rollback_reason":"No source-code change; validation-only run.","next_action_hint":"Retain `.copy()` as preferred return-copy path for list-backed caches and move on from copy-form micro-variants.","noise_observation":"Median in mid warm band with stable quality metrics."}}
{"run":799,"commit":"8df9a8e","metric":0.137711,"metrics":{"best_ms":0.12673,"quality_sum":2.491129377057,"quality_min":0.589775903809,"team_count":4},"status":"discard","description":"Tried deterministic output fast path guarded by `score_team is _ORIGINAL_SCORE_TEAM and all(allocation.assignment_items is not None)`, using direct casted assignment-items iteration and fallback branch otherwise.","timestamp":1775545080934,"segment":0,"confidence":28.485146519482804,"iterationTokens":861,"asi":{"hypothesis":"Most warm runs have original scorer allocations with cached assignment items; one upfront guard might remove per-allocation fallback checks.","rollback_reason":"No clear gain in current regime; extra all() scan and branching offset any saved checks.","next_action_hint":"Keep simpler per-allocation fallback path without additional global fast-path guard.","observation":"Checks passed and quality metrics unchanged."}}
{"run":800,"commit":"8df9a8e","metric":0.142009,"metrics":{"best_ms":0.125347,"quality_sum":2.491129377057,"quality_min":0.589775903809,"team_count":4},"status":"discard","description":"No-code baseline rerun after pruning regressed deterministic assignment-items fast-path guard experiment.","timestamp":1775545141882,"segment":0,"confidence":28.4985169791528,"iterationTokens":2006,"asi":{"hypothesis":"Ideas-only update should preserve behavior while re-sampling warm-band drift.","rollback_reason":"No source-code change; validation-only run.","next_action_hint":"Keep current deterministic output path without extra assignment-items global guard.","noise_observation":"Median remained in mid warm band with stable quality metrics."}}
{"run":801,"commit":"8df9a8e","metric":0.156446,"metrics":{"best_ms":0.125828,"quality_sum":2.491129377057,"quality_min":0.589775903809,"team_count":4},"status":"discard","description":"Retried deterministic form-level greedy warm-hit shortcut (simple variant): direct `_REQUEST_GREEDY_ALLOCATIONS` probe in `form_teams`; on hit copy cached lists and skip exact/greedy function calls.","timestamp":1775545232581,"segment":0,"confidence":28.51189999646525,"iterationTokens":2863,"asi":{"hypothesis":"Bypassing `capped_candidate_search_is_exact` and `greedy_allocations` call overhead on deterministic warm hits may improve entry-path latency.","rollback_reason":"Regressed in current regime; extra key build/probe branch did not offset skipped calls.","next_action_hint":"Keep canonical exact->greedy call flow and avoid further deterministic form-level greedy shortcut retries without materially different evidence.","observation":"Checks passed and quality metrics unchanged."}}
{"run":802,"commit":"8df9a8e","metric":0.133743,"metrics":{"best_ms":0.130217,"quality_sum":2.491129377057,"quality_min":0.589775903809,"team_count":4},"status":"discard","description":"No-code baseline rerun after pruning deterministic form-level greedy shortcut retries as neutral/regressive.","timestamp":1775545297792,"segment":0,"confidence":28.8647047568417,"iterationTokens":894,"asi":{"hypothesis":"Ideas-only update should preserve behavior while refreshing current warm-band baseline.","rollback_reason":"No source-code change; validation-only run.","next_action_hint":"Avoid further deterministic greedy shortcut retries; prioritize materially different structural ideas.","noise_observation":"Median returned to mid-low warm band with stable quality metrics."}}
{"run":803,"commit":"8df9a8e","metric":0.144213,"metrics":{"best_ms":0.130748,"quality_sum":2.491129377057,"quality_min":0.589775903809,"team_count":4},"status":"discard","description":"Retried deterministic form-level improved-cache shortcut: direct `_REQUEST_IMPROVED_ALLOCATIONS` probe in `form_teams` (build improve-key, copy cached improved allocations on hit, otherwise call `improve_allocations`).","timestamp":1775545365599,"segment":0,"confidence":29.22635008527623,"iterationTokens":1583,"asi":{"hypothesis":"Skipping `improve_allocations(...)` call on warm hits might reduce function-call overhead in the swap-enabled default path.","rollback_reason":"Regressed/near-noise in current regime; extra key-probe logic at form level did not help.","next_action_hint":"Keep canonical `improve_allocations` call path and avoid further form-level improved-cache shortcut variants without stronger evidence.","observation":"Checks passed and quality metrics unchanged."}}
{"run":804,"commit":"8df9a8e","metric":0.121701,"metrics":{"best_ms":0.113695,"quality_sum":2.491129377057,"quality_min":0.589775903809,"team_count":4},"status":"discard","description":"No-code baseline rerun after pruning repeated form-level improved-cache shortcut retries.","timestamp":1775545422925,"segment":0,"confidence":29.293899901563783,"iterationTokens":905,"asi":{"hypothesis":"Ideas-only update should preserve behavior and provide fresh low-band baseline sample.","rollback_reason":"No source-code change; validation-only run.","next_action_hint":"Stop revisiting direct form-level improved-cache shortcuts; prioritize materially different ideas.","noise_observation":"Sample returned to low warm band; quality metrics unchanged."}}
{"run":805,"commit":"8df9a8e","metric":0.135546,"metrics":{"best_ms":0.129496,"quality_sum":2.491129377057,"quality_min":0.589775903809,"team_count":4},"status":"discard","description":"Added optional `copy_cached_results` flag to `greedy_allocations`/`improve_allocations` and used `False` from `form_teams` to return cached lists directly on warm hits (skip per-hit list copy inside helper functions).","timestamp":1775545612672,"segment":0,"confidence":29.36184802867923,"iterationTokens":7573,"asi":{"hypothesis":"Avoiding helper-level copy-on-cache-hit when called from `form_teams` might reduce warm-path overhead; copies can be skipped safely for internal read-only use.","rollback_reason":"No clear improvement in current regime; added API/branch complexity for near-noise result.","next_action_hint":"Keep existing unconditional helper copy-on-hit behavior and avoid adding internal-only copy flags without stronger signal.","observation":"Checks passed and quality metrics unchanged."}}
{"run":806,"commit":"8df9a8e","metric":0.149283,"metrics":{"best_ms":0.130357,"quality_sum":2.491129377057,"quality_min":0.589775903809,"team_count":4},"status":"discard","description":"No-code baseline rerun after pruning failed `copy_cached_results=False` helper-flag variant.","timestamp":1775545684556,"segment":0,"confidence":29.425525345857565,"iterationTokens":1822,"asi":{"hypothesis":"Ideas-only update should preserve behavior while tracking post-rollback host drift.","rollback_reason":"No source-code change; validation-only run.","next_action_hint":"Retain simpler always-copy helper contract and list-backed cache strategy from 8df9a8e.","noise_observation":"Median moved back into slower warm band; quality metrics unchanged."}}
{"run":807,"commit":"0dfd343","metric":0.125588,"metrics":{"best_ms":0.125037,"quality_sum":2.491129377057,"quality_min":0.589775903809,"team_count":4},"status":"keep","description":"Made `ScoredAllocation.team_signature` non-optional (default `()` + `__post_init__` fill from sorted member ids) and removed runtime `typing.cast(...)` calls in `improve_allocations` cache-key construction (use direct `allocation.team_signature`).","timestamp":1775545839705,"segment":0,"confidence":29.489366566796814,"iterationTokens":5216,"asi":{"hypothesis":"Eliminating per-allocation runtime `cast(...)` in hot improve-cache key generation should reduce warm-path overhead; auto-filled non-optional signatures preserve compatibility for manually constructed allocations.","result":"Primary metric improved with checks passing and stable quality monitors.","safety_notes":"`team_signature` is now always available on `ScoredAllocation` (via explicit score-path value or post-init fallback), preserving previous semantics while removing optional-signature key typing/cast overhead."}}
{"run":808,"commit":"0dfd343","metric":0.125809,"metrics":{"best_ms":0.123755,"quality_sum":2.491129377057,"quality_min":0.589775903809,"team_count":4},"status":"discard","description":"Immediate no-code confirmation rerun on kept non-optional `team_signature` + cast-removal commit 0dfd343.","timestamp":1775545893972,"segment":0,"confidence":29.526569494648857,"iterationTokens":1045,"asi":{"hypothesis":"If 0dfd343 is robust, follow-up sample should remain in low warm band with unchanged quality metrics.","rollback_reason":"No code change; validation-only rerun.","next_action_hint":"Retain 0dfd343 as active baseline and continue with paired validation for future candidates.","noise_observation":"Confirmation stayed in low warm band and preserved all quality monitors."}}
{"run":809,"commit":"0dfd343","metric":0.12149,"metrics":{"best_ms":0.118314,"quality_sum":2.491129377057,"quality_min":0.589775903809,"team_count":4},"status":"discard","description":"No-code baseline rerun after ideas update for new keep head 0dfd343 and cast-removal supersession note.","timestamp":1775545984613,"segment":0,"confidence":29.563866409337166,"iterationTokens":2948,"asi":{"hypothesis":"Ideas maintenance should preserve behavior and provide updated low-band baseline sample at new head.","rollback_reason":"No source-code change; validation-only run.","next_action_hint":"Retain 0dfd343 baseline and continue only with materially different candidates above noise floor.","noise_observation":"Sample remained in low warm band with stable quality metrics."}}
{"run":810,"commit":"0dfd343","metric":0.127843,"metrics":{"best_ms":0.109838,"quality_sum":2.491129377057,"quality_min":0.589775903809,"team_count":4},"status":"discard","description":"Made `ScoredAllocation.assignment_items` non-optional (`()` default + post-init fill from `assignments`) and removed per-allocation None-fallback checks in final output loops.","timestamp":1775546154263,"segment":0,"confidence":29.609795615253336,"iterationTokens":2948,"asi":{"hypothesis":"If `assignment_items` is always normalized at construction, output-loop fallback branches can be removed for lower warm-path overhead.","rollback_reason":"No clear improvement in current regime; slight regression/near-noise versus recent baseline.","next_action_hint":"Keep optional-assignment-items model with explicit output fallback removed only when clear paired evidence exists.","observation":"Checks passed and behavior monitors unchanged."}}
{"run":811,"commit":"0dfd343","metric":0.132461,"metrics":{"best_ms":0.125267,"quality_sum":2.491129377057,"quality_min":0.589775903809,"team_count":4},"status":"discard","description":"No-code baseline rerun after pruning the repeated `assignment_items` post-init normalization retry.","timestamp":1775546217898,"segment":0,"confidence":29.656509969103098,"iterationTokens":996,"asi":{"hypothesis":"Ideas-only update should preserve behavior while resampling current warm-band variance.","rollback_reason":"No source-code change; validation-only run.","next_action_hint":"Keep existing assignment-items fallback approach and move on from constructor-normalization retries.","noise_observation":"Median in mid warm band with stable quality metrics."}}
{"run":812,"commit":"0dfd343","metric":0.134415,"metrics":{"best_ms":0.125107,"quality_sum":2.491129377057,"quality_min":0.589775903809,"team_count":4},"status":"discard","description":"Retried request-scoped cache for `capped_candidate_search_is_exact` keyed by `(request id, max_candidate_teams)` with early cached bool returns.","timestamp":1775546437195,"segment":0,"confidence":29.68272978733729,"iterationTokens":10386,"asi":{"hypothesis":"Warm deterministic calls repeatedly execute exactness guard; caching the result per request/cap might remove repeated comb-loop overhead.","rollback_reason":"No clear gain in current regime; extra cache map traffic offset tiny guard computation.","next_action_hint":"Keep uncached exactness guard path and avoid revisiting this cache without materially different design.","observation":"Checks passed and quality metrics unchanged."}}
{"run":813,"commit":"0dfd343","metric":0.141308,"metrics":{"best_ms":0.122081,"quality_sum":2.491129377057,"quality_min":0.589775903809,"team_count":4},"status":"discard","description":"No-code baseline rerun after pruning repeated exactness-cache retry as inconclusive/regressive.","timestamp":1775546494746,"segment":0,"confidence":29.708996009360636,"iterationTokens":818,"asi":{"hypothesis":"Ideas-only update should preserve behavior while sampling current warm-band drift.","rollback_reason":"No source-code change; validation-only run.","next_action_hint":"Avoid further exactness-result cache retries and focus on materially different warm-path opportunities.","noise_observation":"Median in mid warm band; quality metrics unchanged."}}
