{"run":180,"commit":"4199f88","metric":133.414694,"metrics":{"best_ms":132.635488,"quality_sum":2.491129377057,"quality_min":0.589775903809,"team_count":4},"status":"keep","description":"In `candidate_combinations`, replaced shortlist reordering via `input_positions` dict + `shortlist.sort(key=...)` with direct input-order reconstruction using set membership (`[person for person in people if person.id in seen_ids]`). This preserves ordering semantics while removing per-call key-dict construction and sort overhead; produced a strong new best.","timestamp":1775196728280,"segment":0,"confidence":77.72299252428998,"iterationTokens":1086,"asi":{"hypothesis":"For small people lists, a single linear pass over original order with set membership may be cheaper than building a position map and sorting shortlist by key.","observed_effect":"Large end-to-end win with checks and quality metrics unchanged."}}
{"run":181,"commit":"4199f88","metric":142.922185,"metrics":{"best_ms":137.921607,"quality_sum":2.491129377057,"quality_min":0.589775903809,"team_count":4},"status":"discard","description":"Follow-up shortlist tweak: removed intermediate shortlist list maintenance during round-robin selection (track only `selected_count` + `seen_ids`, then reconstruct shortlist from original people order). This regressed strongly versus current best.","timestamp":1775196803426,"segment":0,"confidence":77.82711941458184,"iterationTokens":1268,"asi":{"hypothesis":"If shortlist is reconstructed at the end anyway, skipping per-add list appends should reduce overhead further.","rollback_reason":"List-append removal plus count-tracking/branch changes unexpectedly slowed the hot loop.","next_action_hint":"Keep explicit shortlist append path together with final input-order reconstruction."}}
{"run":182,"commit":"4199f88","metric":141.661599,"metrics":{"best_ms":138.442795,"quality_sum":2.491129377057,"quality_min":0.589775903809,"team_count":4},"status":"discard","description":"Added a `len(team)==4` fast path in `_task_preference_score` with direct 4-value retrieval/log computation to avoid generic loop overhead on benchmark-dominant team size. This regressed.","timestamp":1775196882960,"segment":0,"confidence":77.93152568049184,"iterationTokens":1481,"asi":{"hypothesis":"Specializing task-preference geometric mean for fixed team size 4 should reduce per-call loop overhead.","rollback_reason":"Extra branching/specialized path overhead outweighed savings from fixed-size unrolling.","next_action_hint":"Keep generic loop implementation in `_task_preference_score`."}}
{"run":183,"commit":"4199f88","metric":150.154851,"metrics":{"best_ms":149.322875,"quality_sum":2.491129377057,"quality_min":0.589775903809,"team_count":4},"status":"checks_failed","description":"Refactored `_compat_member_priority_order` to precompute `(priority_key..., member_index)` rows and sort once, eliminating nested key-function definitions/callback overhead. This regressed and failed type checking due overly-generic tuple typing (`list[object]` return inference).","timestamp":1775196983913,"segment":0,"confidence":78.63311572356292,"iterationTokens":1969,"asi":{"hypothesis":"Building sortable rows explicitly may reduce per-call key-function overhead in hot compat priority ordering.","rollback_reason":"Performance regressed and ty reported invalid return types from `object`-typed tuple rows.","next_action_hint":"If retried, use precise typed row structures to satisfy ty and profile before continuing.","failure_surface":"src/team2form/scoring.py invalid-return-type"}}
{"run":184,"commit":"4199f88","metric":156.831302,"metrics":{"best_ms":150.018573,"quality_sum":2.491129377057,"quality_min":0.589775903809,"team_count":4},"status":"discard","description":"Added request-scoped cache for `valid_person_ids` in score_team (`_request_valid_person_ids`) to avoid rebuilding `{candidate.id ...}` on every compat score evaluation before task-preference filtering. This regressed heavily.","timestamp":1775197073288,"segment":0,"confidence":78.81277273228716,"iterationTokens":2489,"asi":{"hypothesis":"Caching per-request valid person-id sets should remove repeated set-construction overhead in score_team.","rollback_reason":"Global cache lookup/identity-guard overhead outweighed rebuilding this tiny set.","next_action_hint":"Keep direct in-function valid person-id set construction."}}
{"run":185,"commit":"4199f88","metric":140.495972,"metrics":{"best_ms":139.480248,"quality_sum":2.491129377057,"quality_min":0.589775903809,"team_count":4},"status":"discard","description":"Refactored `_compat_sort_member_assignments` to lazily build `task_skill_order` and skip `sorted()` for members with <=1 assigned skill (dominant case), avoiding unconditional map construction and per-member no-op sorts. This regressed.","timestamp":1775197161437,"segment":0,"confidence":78.63311572356292,"iterationTokens":2405,"asi":{"hypothesis":"Most compat assignments are singleton lists, so lazily sorting only multi-skill members should cut finalize overhead.","rollback_reason":"Extra branching/lambda capture overhead outweighed avoided no-op sorts and map creation.","next_action_hint":"Keep the original straightforward `_compat_sort_member_assignments` implementation."}}
{"run":186,"commit":"4199f88","metric":138.268564,"metrics":{"best_ms":137.859119,"quality_sum":2.491129377057,"quality_min":0.589775903809,"team_count":4},"status":"discard","description":"Rewrote `has_explicit_social_preferences` from `any(generator)` to an explicit for-loop with local `member_id`/`person_id` variables to reduce generator overhead in hot social checks. This regressed.","timestamp":1775197258843,"segment":0,"confidence":79.34745285970028,"iterationTokens":2718,"asi":{"hypothesis":"Manual loop with early return may be cheaper than generator+any for frequent social-preference checks.","rollback_reason":"Explicit loop/locals path was slower than the existing generator-based implementation.","next_action_hint":"Keep `any(...)` implementation of `has_explicit_social_preferences`."}}
{"run":187,"commit":"4199f88","metric":142.760469,"metrics":{"best_ms":142.297513,"quality_sum":2.491129377057,"quality_min":0.589775903809,"team_count":4},"status":"discard","description":"Replaced hot `combination_scorer` lambdas in `build_scored_candidates` and `greedy_allocations` with local named functions (`combination_quality`) to reduce lambda-call overhead in candidate scoring paths. This regressed.","timestamp":1775197343345,"segment":0,"confidence":78.51970470560504,"iterationTokens":1552,"asi":{"hypothesis":"Named local functions might be marginally cheaper than lambdas in tight combination scoring loops.","rollback_reason":"Call-path changes offered no benefit and slowed the benchmark.","next_action_hint":"Keep simple lambda wrappers for `combination_scorer`."}}
{"run":188,"commit":"4199f88","metric":128.978288,"metrics":{"best_ms":128.111326,"quality_sum":2.491129377057,"quality_min":0.589775903809,"team_count":4},"status":"checks_failed","description":"Introduced request-scoped task lookup cache (`_request_tasks_by_id`) and switched `score_team` task resolution from repeated linear `next(...)` scan to O(1) lookup by `task_id`. Benchmark showed a major win, but checks failed due missing `Task` type import in new cache annotations.","timestamp":1775197620164,"segment":0,"confidence":77.70904829553896,"iterationTokens":4486,"asi":{"hypothesis":"Replacing repeated per-call task-id linear scans with request-scoped dictionary lookups should materially reduce score_team overhead.","rollback_reason":"Ruff F821: `Task` type not imported for new cache/type annotations.","next_action_hint":"Retry immediately with `Task` added to formation.py imports; reassess metric and checks.","failure_surface":"src/team2form/formation.py F821 undefined name Task"}}
{"run":189,"commit":"1209b0f","metric":127.367588,"metrics":{"best_ms":127.211713,"quality_sum":2.491129377057,"quality_min":0.589775903809,"team_count":4},"status":"keep","description":"Added request-scoped task lookup cache in formation (`_request_tasks_by_id`) and switched `score_team` to O(1) task resolution by `task_id` instead of per-call linear scans over `request.tasks`. With checks passing, this produced a major new best.","timestamp":1775197697344,"segment":0,"confidence":78.55856798062094,"iterationTokens":1871,"asi":{"hypothesis":"score_team is called tens of thousands of times; replacing repeated task-id linear lookup with cached dict lookup should yield a significant cumulative win.","observed_effect":"Very large wall-clock improvement with unchanged quality metrics and passing checks.","followup":"Built on shortlist input-order reconstruction and objective-delta improvements."}}
{"run":190,"commit":"1209b0f","metric":128.221505,"metrics":{"best_ms":127.533512,"quality_sum":2.491129377057,"quality_min":0.589775903809,"team_count":4},"status":"discard","description":"Extended request-scoped task lookup cache usage to `task_hardness` and `individual_fit` (replace remaining `next(...task.id...)` scans with `_request_tasks_by_id(request)[task_id]`). This slightly regressed relative to current best.","timestamp":1775197769229,"segment":0,"confidence":78.43546381050372,"iterationTokens":1208,"asi":{"hypothesis":"Applying the same O(1) task lookup optimization to all task-id resolution sites should stack additional gains.","rollback_reason":"Additional cache lookups in lower-frequency paths did not improve and slightly worsened aggregate runtime.","next_action_hint":"Keep task-lookup caching only on the `score_team` hot path."}}
{"run":191,"commit":"535d7fb","metric":124.525045,"metrics":{"best_ms":124.440796,"quality_sum":2.491129377057,"quality_min":0.589775903809,"team_count":4},"status":"keep","description":"Added request-scoped cache for task preferences filtered to request people (`_request_task_preferences_by_task_id`) and reused it in `score_team` COMPAT mode, eliminating per-score `valid_person_ids` set creation + `preference_lookup(...)` recomputation. Combined with prior task-id lookup cache, this yielded another major best.","timestamp":1775197913799,"segment":0,"confidence":77.59519853366452,"iterationTokens":5029,"asi":{"hypothesis":"score_team repeatedly recomputes identical task-preference maps for each task; caching those maps per request should remove substantial repeated work.","observed_effect":"Very large speedup with identical quality metrics and passing checks."}}
{"run":192,"commit":"535d7fb","metric":124.82881,"metrics":{"best_ms":123.76693,"quality_sum":2.491129377057,"quality_min":0.589775903809,"team_count":4},"status":"discard","description":"Extended request-scoped immutable caches into `individual_fit`: reused `_request_tasks_by_id`, `_request_task_preferences_by_task_id`, and new `_request_similarity_index` instead of rebuilding task lookup/similarity index/task preferences per call. This slightly regressed relative to current best.","timestamp":1775197985029,"segment":0,"confidence":76.15769327009956,"iterationTokens":1456,"asi":{"hypothesis":"Although lower-frequency than score_team, individual_fit still repeats immutable request-level setup work; caching should provide an incremental gain.","rollback_reason":"Extra global cache lookups in this lower-frequency path outweighed rebuilt-structure costs.","next_action_hint":"Keep request-scoped caches focused on score_team hot path only."}}
{"run":193,"commit":"22c623c","metric":116.64334,"metrics":{"best_ms":116.597594,"quality_sum":2.491129377057,"quality_min":0.589775903809,"team_count":4},"status":"keep","description":"Extended request-scoped team-component caches with a team-signature→bool map for COMPAT explicit-social-presence detection, and reused this in `score_team` instead of recomputing `any(has_explicit_social_preferences(...))` for repeated team compositions. This stacked with task/task-preference caches and produced a major additional best.","timestamp":1775198086367,"segment":0,"confidence":75.8441856981392,"iterationTokens":3622,"asi":{"hypothesis":"Repeated scoring of the same team compositions across tasks/swaps should reuse social-preference-presence booleans just like personality/social scores.","observed_effect":"Large incremental speedup with unchanged quality metrics/checks."}}
{"run":194,"commit":"22c623c","metric":114.841628,"metrics":{"best_ms":114.676416,"quality_sum":2.491129377057,"quality_min":0.589775903809,"team_count":4},"status":"checks_failed","description":"Replaced per-candidate tuple-priority construction/comparison in `_assign_task_skills_compat` with manual scalar lexicographic comparison fields (`value`, `capable_count`, `other_member_best`, `skill_id`, `task_index`) to cut inner-loop tuple allocation overhead. Benchmark improved strongly but Ruff SIM114 flagged branch style.","timestamp":1775198194209,"segment":0,"confidence":75.15771686966315,"iterationTokens":3815,"asi":{"hypothesis":"Manual scalar comparisons in the hottest compat candidate loop should outperform repeated tuple creation/comparison.","rollback_reason":"Lint failure (SIM114) due branch structure; needs style-compliant equivalent rewrite.","next_action_hint":"Refactor the manual comparison to a lint-compliant boolean-expression form and rerun.","failure_surface":"src/team2form/scoring.py SIM114"}}
{"run":195,"commit":"5f3e4de","metric":116.159615,"metrics":{"best_ms":115.311177,"quality_sum":2.491129377057,"quality_min":0.589775903809,"team_count":4},"status":"keep","description":"In `_assign_task_skills_compat` candidate-task selection loop, replaced per-iteration tuple priority construction/comparison with branchless-style scalar lexicographic comparison (`value`, `capable_count`, `other_member_best`, `skill_id`, `task_index`) while preserving the same ordering semantics. Lint-compliant rewrite kept checks passing and produced a further best.","timestamp":1775198274990,"segment":0,"confidence":74.95173439024053,"iterationTokens":2502,"asi":{"hypothesis":"Eliminating repeated tuple allocation/comparison in the hottest compat assignment loop should lower Python overhead while preserving tie-break order.","observed_effect":"Additional measurable speedup on top of cached score_team/task-preference optimizations."}}
{"run":196,"commit":"5ecac26","metric":112.02607,"metrics":{"best_ms":111.722886,"quality_sum":2.491129377057,"quality_min":0.589775903809,"team_count":4},"status":"keep","description":"Added request+mode scoped resolved-weights cache in formation (`_request_resolved_weights`) and threaded `resolved_weights` into `calculate_team_quality_for_people`, removing repeated `resolve_weights(...)` work on every score_team call. This produced another strong best with checks passing.","timestamp":1775198450652,"segment":0,"confidence":74.8845261247647,"iterationTokens":6515,"asi":{"hypothesis":"With score_team dominating runtime, eliminating repeated weight resolution should provide cumulative wins when request/mode/preset/normalize are constant.","observed_effect":"Large additional speedup; quality metrics unchanged."}}
{"run":197,"commit":"3f9fcdf","metric":111.210615,"metrics":{"best_ms":110.323807,"quality_sum":2.491129377057,"quality_min":0.589775903809,"team_count":4},"status":"keep","description":"In `_compat_member_priority_order`, stopped converting sorted positive-task priority lists into tuples (now keep native sorted lists as key components). List lexicographic ordering preserves semantics while removing tuple materialization overhead in both scarce-first and rich-first key paths; produced a new best.","timestamp":1775198543630,"segment":0,"confidence":74.9643215791806,"iterationTokens":2468,"asi":{"hypothesis":"Avoiding per-member tuple wrapping of already-sorted task-priority lists should reduce allocation overhead in the hot compat member-priority key computation.","observed_effect":"Further measurable end-to-end speedup with unchanged quality metrics and passing checks."}}
{"run":198,"commit":"3f9fcdf","metric":111.287441,"metrics":{"best_ms":110.884067,"quality_sum":2.491129377057,"quality_min":0.589775903809,"team_count":4},"status":"discard","description":"Changed `_compat_member_task_analysis` best-value multiplicity tracking from `list[int]` counts to `list[bool]` unique-best flags and updated `_assign_task_skills_compat` checks accordingly. This was effectively neutral/slightly worse than current best.","timestamp":1775198617859,"segment":0,"confidence":73.88388787449207,"iterationTokens":1379,"asi":{"hypothesis":"Replacing integer count storage/comparisons with booleans may shave minor overhead in hot compat analysis + assignment checks.","rollback_reason":"No real gain; measured metric was slightly worse than incumbent best.","next_action_hint":"Keep integer-count representation (or avoid this conversion path) and focus on larger hotspots."}}
{"run":199,"commit":"522ea97","metric":110.444275,"metrics":{"best_ms":109.861371,"quality_sum":2.491129377057,"quality_min":0.589775903809,"team_count":4},"status":"keep","description":"Updated `shortlist_scorers` to reuse request-scoped `_request_resolved_weights(...)` instead of calling `resolve_weights(...)` directly, aligning shortlist scoring with score_team’s cached weight resolution and removing repeated resolver work. This yielded another best.","timestamp":1775198713024,"segment":0,"confidence":73.70054557991985,"iterationTokens":1993,"asi":{"hypothesis":"Reusing the new request-scoped resolved-weights cache in shortlist scoring should stack a small but real gain.","observed_effect":"Additional end-to-end speedup with unchanged quality and passing checks."}}
{"run":200,"commit":"522ea97","metric":110.92257,"metrics":{"best_ms":110.221533,"quality_sum":2.491129377057,"quality_min":0.589775903809,"team_count":4},"status":"discard","description":"Applied `_request_resolved_weights` cache to `individual_fit` (replacing direct `resolve_weights` there) so shortlist individual scoring also uses request-scoped resolved weights. This regressed slightly vs current best.","timestamp":1775198806732,"segment":0,"confidence":73.4948796729683,"iterationTokens":2017,"asi":{"hypothesis":"Extending weight-cache reuse to individual_fit should add a small incremental win after shortlist_scorers caching.","rollback_reason":"Lower-frequency individual_fit path did not benefit; extra cache lookup slightly hurt.","next_action_hint":"Keep `_request_resolved_weights` usage in shortlist_scorers/score_team only."}}
{"run":201,"commit":"681e558","metric":108.108872,"metrics":{"best_ms":107.616991,"quality_sum":2.491129377057,"quality_min":0.589775903809,"team_count":4},"status":"keep","description":"Added a focused fast path in `_assign_task_skills_compat` for the dominant case `max_skills_per_member==1` with no uncovered skills (`rescued_values` empty): return assignments directly (or 0.0 on unmatched-member failure) and skip `_compat_fill_uncovered_assignments`/sorting overhead. This produced a new best with checks passing.","timestamp":1775198896643,"segment":0,"confidence":73.33115508660305,"iterationTokens":2302,"asi":{"hypothesis":"When each member can hold at most one skill and no rescue is needed, fill/sort finalization is redundant and can be bypassed safely.","observed_effect":"Another substantial speedup while preserving output quality metrics and checks."}}
{"run":202,"commit":"681e558","metric":109.502311,"metrics":{"best_ms":108.372421,"quality_sum":2.491129377057,"quality_min":0.589775903809,"team_count":4},"status":"discard","description":"Micro-tuned shortlist reconstruction by binding `seen_ids.__contains__` to a local and using it inside the final input-order list comprehension in `candidate_combinations`. This regressed.","timestamp":1775198984533,"segment":0,"confidence":72.31035824038253,"iterationTokens":1999,"asi":{"hypothesis":"Local-binding set membership may shave lookup overhead in shortlist reconstruction after round-robin selection.","rollback_reason":"Method-binding variant was slower than direct `in seen_ids` membership in comprehension.","next_action_hint":"Keep direct set-membership expression in shortlist reconstruction."}}
{"run":203,"commit":"681e558","metric":123.440155,"metrics":{"best_ms":112.281684,"quality_sum":2.491129377057,"quality_min":0.589775903809,"team_count":4},"status":"checks_failed","description":"Retried prefix-only greedy rescoring with a new implementation: when capped scored ordering is guaranteed, stop rescoring once candidate quality drops below current best and only apply signature tie-break within top-quality prefix. This trended worse and failed type checks due treating `candidates` as subscriptable iterator.","timestamp":1775199096808,"segment":0,"confidence":72.02284784369698,"iterationTokens":3177,"asi":{"hypothesis":"In non-random scored-capped tasks, rescoring the full candidate list is unnecessary once quality drops; prefix-only rescoring should save cache-key work.","rollback_reason":"Performance regressed and ty rejected indexing/slicing on candidates' iterable type.","next_action_hint":"Do not pursue this prefix-rescoring strategy further without a fundamentally different design.","failure_surface":"src/team2form/formation.py not-subscriptable"}}
