{"run":585,"commit":"169f4cc","metric":1.303124,"metrics":{"best_ms":1.23749,"quality_sum":2.491129377057,"quality_min":0.589775903809,"team_count":4},"status":"discard","description":"Tried pre-binding `TeamsResponse.model_validate` at module scope (`_TEAMS_RESPONSE_MODEL_VALIDATE`) and calling the bound callable in `form_teams` to avoid repeated attribute/classmethod lookup.","timestamp":1775468472207,"segment":0,"confidence":11.064614266506748,"iterationTokens":1304,"asi":{"hypothesis":"Removing repeated classmethod lookup overhead for final response validation should reduce output-path cost.","rollback_reason":"End-to-end median regressed substantially versus active baseline.","next_action_hint":"Do not pursue model_validate method-binding shortcut; keep direct classmethod call.","observation":"Microbenchmark improvement did not carry over in integrated benchmark."}}
{"run":586,"commit":"169f4cc","metric":1.125188,"metrics":{"best_ms":1.078901,"quality_sum":2.491129377057,"quality_min":0.589775903809,"team_count":4},"status":"discard","description":"Bound built-in `max` to a round-local `max_value` in `improve_allocations` and switched hot clamp call sites (clamped qualities, replacement/swap trial products, swap upper-bound product) to use the local binding.","timestamp":1775468550078,"segment":0,"confidence":10.99301813750208,"iterationTokens":1521,"asi":{"hypothesis":"Reducing repeated global built-in lookup overhead for frequent clamp calls may speed hot swap loops.","rollback_reason":"Primary metric did not beat active baseline.","next_action_hint":"Keep direct built-in `max` calls; local binding here is neutral/regressive under current variance.","observation":"Best sample stayed low but median moved upward versus baseline."}}
{"run":587,"commit":"0f869b6","metric":0.781737,"metrics":{"best_ms":0.761149,"quality_sum":2.491129377057,"quality_min":0.589775903809,"team_count":4},"status":"keep","description":"Hoisted compat upper-bound gating condition out of swap inner loop in `improve_allocations`: precomputed `use_compat_upper_bounds` once per call (`compat_bound_resolved_weights is not None and bool(compat_swap_bound_data_by_task_id)`) and replaced repeated per-swap compound condition checks.","timestamp":1775473563104,"segment":0,"confidence":10.927758220007666,"iterationTokens":8999,"asi":{"hypothesis":"In COMPAT runs the upper-bound branch condition is effectively invariant; precomputing it should remove repeated branch/evaluation overhead in the hottest swap loop.","result":"Primary metric improved strongly with checks passing and unchanged quality monitors.","safety_notes":"Only branch-condition factoring changed; upper-bound logic and scoring paths are unchanged."}}
{"run":588,"commit":"0f869b6","metric":0.758831,"metrics":{"best_ms":0.7482,"quality_sum":2.491129377057,"quality_min":0.589775903809,"team_count":4},"status":"discard","description":"No-code confirmation rerun on kept `use_compat_upper_bounds` hoist commit 0f869b6.","timestamp":1775473622092,"segment":0,"confidence":10.904296800806183,"iterationTokens":1007,"asi":{"hypothesis":"If 0f869b6 gain is robust, immediate rerun should remain in the new sub-1ms band with unchanged quality metrics.","rollback_reason":"No code change; validation-only rerun.","next_action_hint":"Use 0f869b6 as active baseline and continue only structural high-signal changes.","noise_observation":"Rerun improved further and stayed tightly clustered, supporting a genuine win rather than transient jitter."}}
{"run":589,"commit":"524dcfd","metric":0.740424,"metrics":{"best_ms":0.739682,"quality_sum":2.491129377057,"quality_min":0.589775903809,"team_count":4},"status":"keep","description":"Simplified exact-bound pruning loops in both COMPAT cap+1 shortlist path and greedy <=cap path by removing redundant `best is not None` guards on break checks. Rely on existing `best_quality=-inf` sentinel so `_objective_component_less(exact_upper_bound, best_quality)` is safely false before first incumbent.","timestamp":1775473697086,"segment":0,"confidence":10.881666149294656,"iterationTokens":2037,"asi":{"hypothesis":"Removing hot per-candidate `best is not None` branch checks in exact-bound scans should reduce branch overhead with identical pruning behavior under `best_quality` sentinel initialization.","result":"Primary metric improved with checks passing and unchanged quality monitors.","safety_notes":"Before first incumbent, `best_quality` is `-inf` so break cannot trigger; after incumbent is set, behavior matches prior guarded logic."}}
{"run":590,"commit":"524dcfd","metric":0.745744,"metrics":{"best_ms":0.731146,"quality_sum":2.491129377057,"quality_min":0.589775903809,"team_count":4},"status":"discard","description":"No-code confirmation rerun on kept sentinel-based exact-bound break simplification commit 524dcfd.","timestamp":1775473743507,"segment":0,"confidence":10.734205198489128,"iterationTokens":803,"asi":{"hypothesis":"If 524dcfd gain is robust, immediate rerun should remain in the new ~0.74–0.75ms band with unchanged quality metrics.","rollback_reason":"No code change; validation-only rerun.","next_action_hint":"Use 524dcfd as active baseline; continue only clear structural wins and keep paired confirmations.","noise_observation":"Rerun remained tightly clustered, supporting stability of this optimization."}}
{"run":591,"commit":"524dcfd","metric":0.751807,"metrics":{"best_ms":0.743953,"quality_sum":2.491129377057,"quality_min":0.589775903809,"team_count":4},"status":"discard","description":"Removed redundant non-None guards in tie-break branches where control flow already guarantees incumbents exist (`best`, `best_first_k`, `best_candidate_people`) across cap+1 and greedy selection paths.","timestamp":1775473832915,"segment":0,"confidence":10.590687394192862,"iterationTokens":2863,"asi":{"hypothesis":"Eliminating logically redundant `... is not None` checks in hot tie branches should reduce branch overhead without changing behavior.","rollback_reason":"Primary metric did not improve versus active baseline.","next_action_hint":"Avoid further branch-elision micro-tweaks in tie logic; focus on larger structural reductions.","observation":"Change remained within/above current noise band with no clear gain."}}
{"run":592,"commit":"524dcfd","metric":0.766162,"metrics":{"best_ms":0.7491,"quality_sum":2.491129377057,"quality_min":0.589775903809,"team_count":4},"status":"discard","description":"Extended `cached_score_team` with raw-order cache-key fast path: check `(task_id, raw_signature)` before canonicalized signature key, memoize raw->scored aliases on canonical hits/misses, and only canonicalize on raw misses.","timestamp":1775474126775,"segment":0,"confidence":10.268669397784956,"iterationTokens":9252,"asi":{"hypothesis":"Many repeated lookups may reuse identical member order; probing raw signature before canonical sort could reduce cache-key canonicalization overhead.","rollback_reason":"Median regressed versus active baseline.","next_action_hint":"Do not add dual-key score-cache aliases; extra key checks/inserts outweigh reduced canonicalization work.","observation":"Extra dictionary traffic and larger cache footprint negated potential sort savings."}}
{"run":593,"commit":"524dcfd","metric":0.746475,"metrics":{"best_ms":0.740474,"quality_sum":2.491129377057,"quality_min":0.589775903809,"team_count":4},"status":"discard","description":"No-code baseline rerun on active 524dcfd after recent regressing attempts.","timestamp":1775474185683,"segment":0,"confidence":10.089491554757371,"iterationTokens":1451,"asi":{"hypothesis":"Baseline should remain near the new ~0.74ms band after reverting experiments.","rollback_reason":"No code change; validation-only run.","next_action_hint":"Treat 524dcfd as stable baseline and keep focusing on structural wins only.","noise_observation":"Run stayed tightly aligned with prior confirmation, indicating current low-band stability."}}
{"run":594,"commit":"524dcfd","metric":1.202748,"metrics":{"best_ms":1.099162,"quality_sum":2.491129377057,"quality_min":0.589775903809,"team_count":4},"status":"discard","description":"Replaced swap upper-bound cache hit checks from `dict.get(...)/is None` to `try: cache[key] except KeyError` for left/right signature lookups in `improve_allocations`.","timestamp":1775474805598,"segment":0,"confidence":10.068249265488245,"iterationTokens":13328,"asi":{"hypothesis":"Upper-bound cache lookups are hot and mostly hits; `__getitem__` with rare-KeyError path may beat `.get(...)` + sentinel branching.","rollback_reason":"End-to-end median regressed strongly versus active baseline.","next_action_hint":"Keep `.get(...)` lookup form for swap upper-bound caches; avoid try/except access in this hotspot.","observation":"Exception-path scaffolding or changed branch profile likely hurt despite potential hit-path gains."}}
{"run":595,"commit":"524dcfd","metric":0.813261,"metrics":{"best_ms":0.79199,"quality_sum":2.491129377057,"quality_min":0.589775903809,"team_count":4},"status":"discard","description":"No-code baseline rerun on active 524dcfd after regressing cache-lookup experiment.","timestamp":1775474863393,"segment":0,"confidence":10.047096234795271,"iterationTokens":710,"asi":{"hypothesis":"Post-revert baseline check to re-anchor current host band before next code change.","rollback_reason":"No code change; monitoring run.","next_action_hint":"Continue using paired confirmations; current band shows renewed variance around sub-1ms levels.","noise_observation":"Median rebounded from regressed trial but stayed above earlier ~0.74ms samples, indicating residual host jitter."}}
{"run":596,"commit":"524dcfd","metric":0.774687,"metrics":{"best_ms":0.746233,"quality_sum":2.491129377057,"quality_min":0.589775903809,"team_count":4},"status":"discard","description":"No-code baseline rerun after ideas pruning/update on active 524dcfd baseline.","timestamp":1775474936804,"segment":0,"confidence":9.762979323017777,"iterationTokens":1473,"asi":{"hypothesis":"Metadata-only idea updates should not affect runtime; run also refreshes current baseline under host variance.","rollback_reason":"No code change; validation-only run.","next_action_hint":"Keep 524dcfd as working baseline and require paired confirmations for any future marginal keep decisions.","noise_observation":"Baseline remained in expected recent sub-1ms band (~0.75–0.81ms)."}}
{"run":597,"commit":"524dcfd","metric":0.80303,"metrics":{"best_ms":0.750351,"quality_sum":2.491129377057,"quality_min":0.589775903809,"team_count":4},"status":"discard","description":"Removed `best is None` branches from hot candidate-quality update points in cap+1 and greedy <=cap exact-bound loops, relying on `best_quality=-inf` sentinel so first scored candidate initializes incumbent implicitly.","timestamp":1775475126414,"segment":0,"confidence":9.494489311665768,"iterationTokens":1473,"asi":{"hypothesis":"Eliminating per-candidate `best is None` checks in incumbent update branches should reduce branch overhead in hot pruning loops.","rollback_reason":"Primary median regressed versus active baseline.","next_action_hint":"Keep explicit incumbent-initialization branch in these loops; sentinel-only update rewrite is not beneficial here.","observation":"Even with unchanged semantics, branch-profile change hurt end-to-end median."}}
{"run":598,"commit":"524dcfd","metric":0.817075,"metrics":{"best_ms":0.787579,"quality_sum":2.491129377057,"quality_min":0.589775903809,"team_count":4},"status":"discard","description":"Changed task-order cache payload from tuple to shared list and removed unconditional per-call copy for `init_random=false`: reuse cached list directly, copying only when shuffle is needed.","timestamp":1775475317199,"segment":0,"confidence":9.430931982259372,"iterationTokens":4366,"asi":{"hypothesis":"Avoiding per-call task-order list copies should reduce overhead while preserving ordering semantics.","rollback_reason":"Primary median regressed versus active baseline.","next_action_hint":"Keep existing tuple-backed task-order cache with per-call copy; shared-list reuse is not beneficial.","observation":"Potential aliasing/branch overhead outweighed any saved copy cost."}}
{"run":599,"commit":"524dcfd","metric":0.754968,"metrics":{"best_ms":0.720954,"quality_sum":2.491129377057,"quality_min":0.589775903809,"team_count":4},"status":"discard","description":"Hoisted swap-pair invariant compat bound data/cache retrievals out of inner member-swap loop in `improve_allocations`: preloaded left/right task bound tuples and per-task upper-bound cache dicts once per allocation pair.","timestamp":1775475455044,"segment":0,"confidence":9.36821991638285,"iterationTokens":3057,"asi":{"hypothesis":"Reducing repeated dict lookups/unpacking inside the hottest swap loop should cut overhead while preserving pruning semantics.","rollback_reason":"Primary metric did not beat active baseline (slightly worse median despite lower best sample).","next_action_hint":"Keep current in-loop retrieval structure; this hoist is at best noise under current regime.","observation":"Likely within variance or offset by added per-pair setup cost."}}
{"run":600,"commit":"524dcfd","metric":0.770407,"metrics":{"best_ms":0.748897,"quality_sum":2.491129377057,"quality_min":0.589775903809,"team_count":4},"status":"discard","description":"Hoisted hot helper lookups in `improve_allocations` to locals (`objective_component_less`, `objective_component_close`, `cached_score`) and switched inner-loop calls to local bindings.","timestamp":1775475677829,"segment":0,"confidence":9.358359137892089,"iterationTokens":7199,"asi":{"hypothesis":"Reducing global name lookups for heavily used helpers in the swap/replacement loops should lower interpreter overhead.","rollback_reason":"Primary metric remained above active baseline.","next_action_hint":"Avoid further local-binding micro-tweaks in `improve_allocations`; prioritize structural changes only.","observation":"Change produced near-baseline best samples but no median improvement."}}
{"run":601,"commit":"524dcfd","metric":0.806004,"metrics":{"best_ms":0.755058,"quality_sum":2.491129377057,"quality_min":0.589775903809,"team_count":4},"status":"discard","description":"No-code baseline rerun after ideas pruning updates on active 524dcfd baseline.","timestamp":1775475756365,"segment":0,"confidence":9.334704969075952,"iterationTokens":1166,"asi":{"hypothesis":"Metadata-only idea updates should not affect runtime; run refreshes baseline under current host variance.","rollback_reason":"No code change; monitoring-only rerun.","next_action_hint":"Continue with only high-signal structural candidates and require immediate paired confirmation for any keep.","noise_observation":"Median drifted upward while best stayed near low band, indicating persistent jitter."}}
{"run":602,"commit":"524dcfd","metric":0.789553,"metrics":{"best_ms":0.774444,"quality_sum":2.491129377057,"quality_min":0.589775903809,"team_count":4},"status":"discard","description":"Switched `cached_score_team` cache-hit path from `dict.get(...)/None-check` to `try: score_cache[key] except KeyError` for direct-hit retrieval.","timestamp":1775475901101,"segment":0,"confidence":9.304919336411055,"iterationTokens":1924,"asi":{"hypothesis":"Score-cache lookups are mostly hits in repeated calls; direct `__getitem__` should reduce hit-path overhead versus `.get` sentinel checks.","rollback_reason":"Primary median regressed versus active baseline.","next_action_hint":"Keep `.get`-based cache lookup in `cached_score_team`; try/except retrieval is not beneficial end-to-end.","observation":"Likely miss-path exception overhead and branch-profile effects outweighed hit-path micro-gain."}}
{"run":603,"commit":"47de6e8","metric":0.741632,"metrics":{"best_ms":0.73515,"quality_sum":2.491129377057,"quality_min":0.589775903809,"team_count":4},"status":"keep","description":"Consolidated swap signature fast-path branching in `improve_allocations`: compute pair-level `signatures_are_fixed_len_four` once and use a single per-swap branch to build both left/right signatures, replacing two separate `len(... ) == 4` checks.","timestamp":1775475974130,"segment":0,"confidence":9.296944694456835,"iterationTokens":1788,"asi":{"hypothesis":"Given dominant 4-member workload, collapsing two per-swap length checks into one pair-level fast-path branch should reduce inner-loop branching overhead.","result":"Primary metric improved with checks passing and unchanged quality monitors.","safety_notes":"Signature values are unchanged for both fixed-len and fallback paths; only branch structure changed."}}
{"run":604,"commit":"47de6e8","metric":0.746992,"metrics":{"best_ms":0.728608,"quality_sum":2.491129377057,"quality_min":0.589775903809,"team_count":4},"status":"discard","description":"No-code confirmation rerun on kept consolidated swap signature fast-path branch commit 47de6e8.","timestamp":1775476037577,"segment":0,"confidence":9.271232841146192,"iterationTokens":765,"asi":{"hypothesis":"If 47de6e8 gain is robust, rerun should remain near improved ~0.74–0.75ms band with unchanged quality metrics.","rollback_reason":"No code change; validation-only rerun.","next_action_hint":"Use 47de6e8 as active baseline; continue only structural changes with immediate paired confirmation.","noise_observation":"Rerun stayed in-band and preserved metrics, supporting stability of the branch-structure change."}}
{"run":605,"commit":"47de6e8","metric":0.736094,"metrics":{"best_ms":0.716136,"quality_sum":2.491129377057,"quality_min":0.589775903809,"team_count":4},"status":"discard","description":"No-code baseline rerun after ideas pruning/update on active 47de6e8 baseline.","timestamp":1775476162839,"segment":0,"confidence":9.245662814233912,"iterationTokens":2435,"asi":{"hypothesis":"Metadata-only updates should keep runtime in current low sub-1ms band and refresh baseline stability.","rollback_reason":"No code change; validation-only rerun.","next_action_hint":"Use 47de6e8 as active baseline; continue structural changes only with immediate paired confirmation.","noise_observation":"Baseline remained in low ~0.74ms band with improved best sample, indicating stable fast regime."}}
{"run":606,"commit":"586180e","metric":0.714132,"metrics":{"best_ms":0.700507,"quality_sum":2.491129377057,"quality_min":0.589775903809,"team_count":4},"status":"keep","description":"Refactored swap-loop construction to delay swapped team tuple materialization until needed: for fixed len-4 teams, compute swapped signatures directly from member indices/ids first, use signatures for upper-bound cache probes, and only build `swapped_left/swapped_right` tuples on bound-cache misses or when rescoring survives pruning.","timestamp":1775476507499,"segment":0,"confidence":9.216054235835626,"iterationTokens":1493,"asi":{"hypothesis":"Upper-bound pruning/caching rejects many swaps; constructing full swapped tuples before cache probes wastes work. Signature-first + lazy tuple materialization should remove dead inner-loop allocations.","result":"Primary metric improved materially with checks passing and unchanged quality monitors.","safety_notes":"Swap candidates/signatures are computed to the same values as before; only evaluation order changed (lazy tuple build), so scoring/pruning semantics remain equivalent."}}
{"run":607,"commit":"586180e","metric":0.730383,"metrics":{"best_ms":0.707279,"quality_sum":2.491129377057,"quality_min":0.589775903809,"team_count":4},"status":"discard","description":"No-code confirmation rerun on kept lazy swap-tuple materialization commit 586180e.","timestamp":1775476573435,"segment":0,"confidence":9.186244886796896,"iterationTokens":823,"asi":{"hypothesis":"If 586180e is robust, rerun should stay in improved ~0.71–0.73ms band with stable quality metrics.","rollback_reason":"No code change; validation-only rerun.","next_action_hint":"Use 586180e as active baseline and continue structural dead-work elimination in swap hot loop only.","noise_observation":"Rerun stayed near keep sample and preserved all quality monitors, supporting a stable gain."}}
{"run":608,"commit":"586180e","metric":0.732597,"metrics":{"best_ms":0.682252,"quality_sum":2.491129377057,"quality_min":0.589775903809,"team_count":4},"status":"discard","description":"No-code baseline rerun after ideas pruning/update on active 586180e baseline.","timestamp":1775476669083,"segment":0,"confidence":9.149968330308548,"iterationTokens":1265,"asi":{"hypothesis":"Metadata-only ideas update should preserve runtime in the current ~0.71–0.73ms band.","rollback_reason":"No code change; validation-only rerun.","next_action_hint":"Continue with high-signal structural candidates only and pair each keep with immediate no-code confirmation.","noise_observation":"Median remained in-band and best improved, suggesting stable fast regime."}}
{"run":609,"commit":"47de6e8","metric":0,"metrics":{"best_ms":0,"quality_sum":0,"quality_min":0,"team_count":0},"status":"crash","description":"Attempted swap-score cache fast path: for fixed-len-4 swaps, canonicalized swapped signatures and probed `score_cache` directly before constructing swapped tuples/calling `cached_score_team`, building tuples only on misses.","timestamp":1775476853386,"segment":0,"confidence":9.149968330308548,"iterationTokens":6310,"asi":{"hypothesis":"Many post-bound swaps should hit `score_cache`; direct signature-key probing could avoid swapped-tuple materialization and rescoring call overhead.","rollback_reason":"Runtime assertion failure in benchmark quality consistency check due incorrect behavior after signature fast-path rewrite.","next_action_hint":"Retry with corrected variable scoping in canonicalization (avoid mutating base team-id locals used for subsequent signature construction).","error_excerpt":"./autoresearch.sh failed with AssertionError during repeated response quality_sum consistency check."}}
