{"run":683,"commit":"77f69d2","metric":0.129004,"metrics":{"best_ms":0.126539,"quality_sum":2.491129377057,"quality_min":0.589775903809,"team_count":4},"status":"discard","description":"Reworked output assembly to avoid materializing `ordered_allocations` list on deterministic permutation-index path: build `teams_payload` directly from `allocations[task_index]` in branch-specific loops.","timestamp":1775536174706,"segment":0,"confidence":13.565495940281457,"iterationTokens":2621,"asi":{"hypothesis":"Skipping intermediate ordered-allocation list creation on warm deterministic path could reduce output overhead.","rollback_reason":"No clear win versus baseline jitter; branch duplication increased code complexity for negligible effect.","next_action_hint":"Keep simpler shared output-loop structure unless a materially larger ordering-path optimization appears.","observation":"Checks passed and behavior metrics stayed unchanged."}}
{"run":684,"commit":"77f69d2","metric":0.111221,"metrics":{"best_ms":0.10553,"quality_sum":2.491129377057,"quality_min":0.589775903809,"team_count":4},"status":"discard","description":"No-code baseline rerun after pruning neutral branch-specific output-loop experiment.","timestamp":1775536235725,"segment":0,"confidence":13.691854696337629,"iterationTokens":830,"asi":{"hypothesis":"Ideas-only update should preserve current warm baseline and help resample jitter band.","rollback_reason":"No source-code change; validation-only run.","next_action_hint":"Proceed with only high-signal candidates; use repeated samples for any sub-0.01ms deltas.","noise_observation":"Run hit a new low, reinforcing high jitter and the need for multi-sample confirmation."}}
{"run":685,"commit":"77f69d2","metric":0.127992,"metrics":{"best_ms":0.116881,"quality_sum":2.491129377057,"quality_min":0.589775903809,"team_count":4},"status":"discard","description":"Consolidated task-order caches by extending `_REQUEST_TASK_ORDER_BY_HARDNESS` entries to store both sorted task tuple and cached original-order permutation indices, removing the separate `_REQUEST_TASK_ORDER_BY_ORIGINAL_INDICES` lookup path.","timestamp":1775536364939,"segment":0,"confidence":13.718530849576593,"iterationTokens":4843,"asi":{"hypothesis":"Combining task-order and permutation-index caches should remove one dict lookup/branch per call in the warm path.","rollback_reason":"No clear performance gain versus baseline jitter; cache-structure refactor adds complexity without robust benefit.","next_action_hint":"Keep separate, simpler cache responsibilities unless future profiling shows lookup consolidation is material.","observation":"Checks passed and quality metrics unchanged."}}
{"run":686,"commit":"77f69d2","metric":0.111882,"metrics":{"best_ms":0.101984,"quality_sum":2.491129377057,"quality_min":0.589775903809,"team_count":4},"status":"discard","description":"No-code baseline rerun after pruning neutral task-order cache consolidation attempt.","timestamp":1775536418502,"segment":0,"confidence":13.744957976979997,"iterationTokens":860,"asi":{"hypothesis":"Ideas pruning only; baseline should remain in the current low warm band.","rollback_reason":"No source-code change; validation-only run.","next_action_hint":"Given repeated low outliers, use multi-sample confirmation for any future marginal keep candidates.","noise_observation":"New best sample suggests significant host variance in sub-0.12ms regime."}}
{"run":687,"commit":"77f69d2","metric":0.112063,"metrics":{"best_ms":0.099368,"quality_sum":2.491129377057,"quality_min":0.589775903809,"team_count":4},"status":"discard","description":"Added deterministic warm-hit shortcut in `form_teams` that checks greedy cache and (when `swap_rounds>0`) checks improved-allocation cache directly, skipping exact/greedy/improve calls when both caches hit.","timestamp":1775536567000,"segment":0,"confidence":13.816403551627607,"iterationTokens":6784,"asi":{"hypothesis":"Directly consuming existing greedy+improve caches from `form_teams` should cut control-flow/function-call overhead on warm deterministic hits.","rollback_reason":"Median was effectively neutral versus recent baseline noise, despite a low outlier best; complexity increase is not justified without stronger signal.","next_action_hint":"Require repeated paired wins before adopting form-level cache short-circuit layering.","noise_observation":"Best sample improved materially but median overlaps current jitter floor."}}
{"run":688,"commit":"77f69d2","metric":0.118794,"metrics":{"best_ms":0.114256,"quality_sum":2.491129377057,"quality_min":0.589775903809,"team_count":4},"status":"discard","description":"No-code baseline rerun after pruning combined warm-hit shortcut attempt in ideas backlog.","timestamp":1775536618592,"segment":0,"confidence":13.888595747916613,"iterationTokens":1299,"asi":{"hypothesis":"Metadata-only pruning should keep baseline within the warm jitter band.","rollback_reason":"No source-code change; validation-only run.","next_action_hint":"Continue favoring only clearly repeatable wins; most remaining warm-path control-flow tweaks are near-noise.","noise_observation":"Median stayed in expected low band with stable quality monitors."}}
{"run":689,"commit":"77f69d2","metric":0.112783,"metrics":{"best_ms":0.0951,"quality_sum":2.491129377057,"quality_min":0.589775903809,"team_count":4},"status":"discard","description":"Retried deterministic request-scoped form-level allocations memoization: cache final post-improvement allocations in `form_teams` by request/config and bypass exact+greedy+improve pipeline on warm hits.","timestamp":1775536725711,"segment":0,"confidence":15.688828672920046,"iterationTokens":4193,"asi":{"hypothesis":"Form-level allocation memoization may remove residual control-flow/setup overhead beyond existing greedy/improve caches.","rollback_reason":"Median remains within existing jitter band and gain is not robust enough to justify broader request-reuse coupling.","next_action_hint":"Keep form-level allocation memoization pruned unless repeated paired runs show a clear median shift beyond noise.","overfit_note":"This path is strongly benchmark-warm-object dependent and close to full pipeline memoization."}}
{"run":690,"commit":"77f69d2","metric":0.121039,"metrics":{"best_ms":0.11596,"quality_sum":2.491129377057,"quality_min":0.589775903809,"team_count":4},"status":"discard","description":"No-code baseline rerun after updating ideas note on repeated form-level allocations cache retest.","timestamp":1775536783269,"segment":0,"confidence":18.025005282435384,"iterationTokens":956,"asi":{"hypothesis":"Ideas-only update should preserve baseline in the current warm-jitter range.","rollback_reason":"No source-code change; validation-only rerun.","next_action_hint":"Continue with only high-signal paths; avoid repeatedly retesting near-noise form-level memoization variants.","noise_observation":"Median remained within expected warm band with stable quality metrics."}}
{"run":691,"commit":"77f69d2","metric":0.153841,"metrics":{"best_ms":0.151016,"quality_sum":2.491129377057,"quality_min":0.589775903809,"team_count":4},"status":"discard","description":"Retested output-path full model-construct flow: build `AssignedPerson`/`TeamResult` via `model_construct(...)` and return `TeamsResponse.model_construct(...)` instead of dict payload + `TeamsResponse.model_validate(...)`.","timestamp":1775536911149,"segment":0,"confidence":18.226546983360798,"iterationTokens":3029,"asi":{"hypothesis":"Skipping validation dispatch entirely in the final response path might outperform dict payload + `model_validate` in warm-cache regime.","rollback_reason":"Large regression; repeated per-model `model_construct` calls were substantially slower in end-to-end benchmark.","next_action_hint":"Keep current dict payload + single `TeamsResponse.model_validate(...)` strategy; avoid nested model_construct output rewrites.","observation":"Checks passed and quality metrics unchanged."}}
{"run":692,"commit":"77f69d2","metric":0.118965,"metrics":{"best_ms":0.107744,"quality_sum":2.491129377057,"quality_min":0.589775903809,"team_count":4},"status":"discard","description":"No-code baseline rerun after pruning regressed full model_construct output-path retest.","timestamp":1775536971656,"segment":0,"confidence":18.432381426275935,"iterationTokens":923,"asi":{"hypothesis":"Rollback should restore baseline after output model_construct regression.","rollback_reason":"No source-code change; validation-only run.","next_action_hint":"Keep single-shot `TeamsResponse.model_validate` approach and avoid per-model output construction paths.","noise_observation":"Median returned to low warm band and best remained near floor with stable quality metrics."}}
{"run":693,"commit":"77f69d2","metric":0.116089,"metrics":{"best_ms":0.114587,"quality_sum":2.491129377057,"quality_min":0.589775903809,"team_count":4},"status":"checks_failed","description":"Attempted to precompute per-allocation response payload entries in `ScoredAllocation.people_payload` during scoring and reuse them in final output assembly to avoid rebuilding person payload dicts each call.","timestamp":1775537115808,"segment":0,"confidence":18.966556553430312,"iterationTokens":3409,"asi":{"hypothesis":"Warm-path output loops repeatedly rebuild the same person payload dicts; precomputing and reusing payload tuples from cached allocations should cut output overhead.","rollback_reason":"Type check failed due invariant dict value typing mismatch (`tuple[dict[str, str|list[str]], ...]` not assignable to annotated `tuple[dict[str, object], ...]`).","next_action_hint":"If retried, adjust `people_payload` field typing (or use explicit cast/typed alias) to satisfy `ty` before benchmarking performance.","error_excerpt":"ty invalid-argument-type at formation.py: people_payload expected tuple[dict[str, object], ...] | None."}}
{"run":694,"commit":"77f69d2","metric":0.12182,"metrics":{"best_ms":0.11617,"quality_sum":2.491129377057,"quality_min":0.589775903809,"team_count":4},"status":"checks_failed","description":"Retried `ScoredAllocation.people_payload` precompute with typed payload alias and final output reuse fallback, but check phase failed on Ruff import-format rule (extra blank line before alias).","timestamp":1775537296072,"segment":0,"confidence":19.533900883625563,"iterationTokens":3549,"asi":{"hypothesis":"Typed payload precompute/reuse might reduce repeated output dict construction overhead while remaining type-safe.","rollback_reason":"Checks failed due Ruff I001 formatting issue (`would fix` import block/blank-line layout), so candidate cannot be kept.","next_action_hint":"If retried, apply Ruff formatting (single blank line after imports) and re-benchmark to evaluate true performance impact.","error_excerpt":"ruff I001 on formation.py import block; diff removed one extra blank line before `PeoplePayloadEntry` alias."}}
{"run":695,"commit":"77f69d2","metric":0.125086,"metrics":{"best_ms":0.116851,"quality_sum":2.491129377057,"quality_min":0.589775903809,"team_count":4},"status":"discard","description":"Type-safe retry of `ScoredAllocation.people_payload` precompute/reuse in output path (with Ruff-clean formatting): precompute person payload tuples during scoring and reuse in final response assembly with fallback.","timestamp":1775537388145,"segment":0,"confidence":19.69844869644824,"iterationTokens":3226,"asi":{"hypothesis":"Precomputing person payload entries once per scored allocation should reduce repeated warm-path payload dict construction.","rollback_reason":"After fixing checks, end-to-end median regressed versus baseline; precompute/storage overhead outweighed output-loop savings.","next_action_hint":"Keep payload construction in final loop; avoid storing response-oriented payload blobs in `ScoredAllocation`.","observation":"Checks passed and quality metrics unchanged."}}
{"run":696,"commit":"77f69d2","metric":0.121299,"metrics":{"best_ms":0.109878,"quality_sum":2.491129377057,"quality_min":0.589775903809,"team_count":4},"status":"discard","description":"No-code baseline rerun after pruning regressed `ScoredAllocation.people_payload` precompute/reuse attempt.","timestamp":1775537447661,"segment":0,"confidence":19.8657922642562,"iterationTokens":889,"asi":{"hypothesis":"Rollback and ideas update should preserve baseline warm-path behavior.","rollback_reason":"No source-code change; validation-only run.","next_action_hint":"Given repeated regressions in output-memoization variants, prioritize only materially different structural ideas or broaden validation focus.","noise_observation":"Median remained in current low warm band; quality metrics stable."}}
{"run":697,"commit":"77f69d2","metric":0.122372,"metrics":{"best_ms":0.113154,"quality_sum":2.491129377057,"quality_min":0.589775903809,"team_count":4},"status":"discard","description":"Tried deterministic request-scoped `teams_payload` cache in `form_teams` keyed by request/config (without allocation-id keying): reuse prebuilt payload list before final `TeamsResponse.model_validate(...)`.","timestamp":1775537560893,"segment":0,"confidence":19.927153392142714,"iterationTokens":3640,"asi":{"hypothesis":"Config-keyed payload reuse may cut warm-path output-loop overhead with lower key-construction cost than allocation-identity payload caching.","rollback_reason":"No robust gain over baseline jitter; additional mutable payload cache layer increases complexity/risk for near-noise effect.","next_action_hint":"Keep payload caching pruned; stick with straightforward payload rebuild + single validation call.","observation":"Checks passed and quality metrics unchanged."}}
{"run":698,"commit":"77f69d2","metric":0.115138,"metrics":{"best_ms":0.107954,"quality_sum":2.491129377057,"quality_min":0.589775903809,"team_count":4},"status":"discard","description":"No-code baseline rerun after pruning config-keyed teams_payload cache attempt.","timestamp":1775537627715,"segment":0,"confidence":19.987550141353893,"iterationTokens":919,"asi":{"hypothesis":"Ideas-only pruning should preserve current warm-path baseline.","rollback_reason":"No source-code change; validation-only sample.","next_action_hint":"Most output-cache variants are exhausted; prioritize materially different paths only.","noise_observation":"Sample landed in lower end of warm band with stable quality metrics."}}
{"run":699,"commit":"6d9fc2f","metric":0.108966,"metrics":{"best_ms":0.104798,"quality_sum":2.491129377057,"quality_min":0.589775903809,"team_count":4},"status":"keep","description":"Replaced `request.total_requested_seats` computed-field access in `form_teams` with direct local sum expression (`sum(task.team_size for task in request.tasks)`) for the headcount guard.","timestamp":1775537689533,"segment":0,"confidence":20.09766824079471,"iterationTokens":850,"asi":{"hypothesis":"Bypassing computed-field/property dispatch for `total_requested_seats` may reduce warm-path setup overhead with equivalent semantics.","result":"Primary metric improved to a new low with checks passing and unchanged quality monitors.","safety_notes":"Guard logic is algebraically identical (`sum(task.team_size)` compared against people count) and does not alter downstream behavior."}}
{"run":700,"commit":"6d9fc2f","metric":0.118224,"metrics":{"best_ms":0.110108,"quality_sum":2.491129377057,"quality_min":0.589775903809,"team_count":4},"status":"discard","description":"No-code confirmation rerun on headcount-guard sum rewrite keep (6d9fc2f).","timestamp":1775537742446,"segment":0,"confidence":20.20893731882403,"iterationTokens":797,"asi":{"hypothesis":"If the guard rewrite effect is robust, follow-up sample should remain in the improved low warm band.","rollback_reason":"No code change; validation-only rerun.","next_action_hint":"Retain 6d9fc2f but continue using multi-sample confirmation for small warm-path deltas.","noise_observation":"Median regressed from outlier low but stayed within warm-band variance; best remained near floor."}}
{"run":701,"commit":"6d9fc2f","metric":0.112964,"metrics":{"best_ms":0.10588,"quality_sum":2.491129377057,"quality_min":0.589775903809,"team_count":4},"status":"discard","description":"No-code baseline rerun after ideas update for new keep head 6d9fc2f.","timestamp":1775537819650,"segment":0,"confidence":20.291162156149056,"iterationTokens":2184,"asi":{"hypothesis":"Ideas maintenance should leave runtime within the current low warm band.","rollback_reason":"No source-code change; validation-only run.","next_action_hint":"Continue with only high-signal candidates and paired confirmations due persistent sub-0.02ms jitter.","noise_observation":"Median remained near floor with stable quality metrics."}}
{"run":702,"commit":"4c2992c","metric":0.111762,"metrics":{"best_ms":0.102634,"quality_sum":2.491129377057,"quality_min":0.589775903809,"team_count":4},"status":"keep","description":"Replaced generator `sum(task.team_size for task in request.tasks)` headcount guard with explicit tiny accumulation loop (`requested_seats += task.team_size`) in `form_teams`.","timestamp":1775537886234,"segment":0,"confidence":20.374058829361775,"iterationTokens":959,"asi":{"hypothesis":"In the current warm regime, explicit accumulation may beat generator-based `sum(...)` for the headcount guard due lower iterator overhead.","result":"Primary metric improved modestly with checks passing and unchanged quality monitors.","safety_notes":"Headcount comparison semantics are identical; only arithmetic expression form changed."}}
{"run":703,"commit":"4c2992c","metric":0.113625,"metrics":{"best_ms":0.108044,"quality_sum":2.491129377057,"quality_min":0.589775903809,"team_count":4},"status":"discard","description":"No-code confirmation rerun on headcount accumulation-loop keep (4c2992c).","timestamp":1775537938853,"segment":0,"confidence":20.579475023063022,"iterationTokens":803,"asi":{"hypothesis":"If 4c2992c is robust, follow-up sample should remain in the low warm band near the prior keep.","rollback_reason":"No code change; validation-only rerun.","next_action_hint":"Retain 4c2992c but treat headcount-guard micro deltas as noise-sensitive; require multi-sample evidence for future arithmetic rewrites.","noise_observation":"Median drifted up modestly yet stayed in-band; best remained near floor with unchanged quality."}}
{"run":704,"commit":"4c2992c","metric":0.160153,"metrics":{"best_ms":0.157608,"quality_sum":2.491129377057,"quality_min":0.589775903809,"team_count":4},"status":"discard","description":"No-code baseline rerun after ideas update for new head 4c2992c.","timestamp":1775538019168,"segment":0,"confidence":20.789117594145104,"iterationTokens":2040,"asi":{"hypothesis":"Ideas-only maintenance should not alter runtime; sample used to track current jitter envelope.","rollback_reason":"No source-code change; validation-only run.","next_action_hint":"Sub-0.2ms regime remains highly volatile; require multiple paired samples before trusting apparent regressions or gains.","noise_observation":"Run spiked into slower band with both median and best elevated, indicating transient host regime shift."}}
{"run":705,"commit":"4c2992c","metric":0.118394,"metrics":{"best_ms":0.107263,"quality_sum":2.491129377057,"quality_min":0.589775903809,"team_count":4},"status":"discard","description":"Additional no-code baseline sample after transient slow-band spike to re-check current regime.","timestamp":1775538069051,"segment":0,"confidence":20.823172928666786,"iterationTokens":658,"asi":{"hypothesis":"Follow-up no-code run should clarify whether prior 0.16ms sample was transient host noise.","rollback_reason":"No source-code change; validation-only rerun.","next_action_hint":"Treat recent spike as noise and continue paired validation for any micro candidate.","noise_observation":"Median returned to low band with fast best_ms, confirming volatile host regime shifts."}}
{"run":706,"commit":"4c2992c","metric":0.140776,"metrics":{"best_ms":0.123424,"quality_sum":2.491129377057,"quality_min":0.589775903809,"team_count":4},"status":"discard","description":"Tried hoisting `request_id = id(request)` once in `form_teams` and reusing it for form-score and task-order cache keys (remove repeated `id(request)` calls).","timestamp":1775538161587,"segment":0,"confidence":20.85734002057998,"iterationTokens":1996,"asi":{"hypothesis":"In sub-0.2ms regime, removing repeated `id(request)` calls in hot setup path may shave overhead.","rollback_reason":"Regressed significantly in this sample; added local plumbing did not help and likely sits in noise/negative territory.","next_action_hint":"Avoid further `id(...)` hoist micro-variants; focus on larger structural paths only.","observation":"Checks passed and quality metrics unchanged."}}
{"run":707,"commit":"4c2992c","metric":0.124856,"metrics":{"best_ms":0.123113,"quality_sum":2.491129377057,"quality_min":0.589775903809,"team_count":4},"status":"discard","description":"No-code baseline rerun after pruning regressed `request_id` hoist micro-variant.","timestamp":1775538220840,"segment":0,"confidence":20.87138816968084,"iterationTokens":879,"asi":{"hypothesis":"Ideas-only pruning should return runtime to normal warm band after regressed micro change rollback.","rollback_reason":"No code change; validation-only run.","next_action_hint":"At current floor, avoid cache-key micro-hoists and favor only materially different experiments.","noise_observation":"Sample returned to typical low warm band with stable quality metrics."}}
