{"run":135,"commit":"d58c8db","metric":152.060879,"metrics":{"best_ms":146.43663,"quality_sum":2.491129377057,"quality_min":0.589775903809,"team_count":4},"status":"checks_failed","description":"Tried canonicalizing people order inside cached_score_team on cache misses (sort by object identity) and then made score_team team_signature use insertion order to avoid per-call signature sorting, but this changed returned allocation member order and broke init-random tie-behavior regressions.","timestamp":1775192026326,"segment":0,"confidence":76.83147889138233,"iterationTokens":4312,"asi":{"hypothesis":"Canonicalizing people once in cached_score_team could eliminate repeated team_signature sorting while preserving scores.","rollback_reason":"Behavioral break: score_team outputs now reflect canonicalized member order, violating tests that assert shuffled tie-breaking order preservation.","next_action_hint":"Do not reorder `people` before score_team; any signature optimization must keep allocation.people order unchanged.","failure_surface":"tests/test_form_teams.py::test_greedy_allocations_preserves_shuffled_tie_breaking_when_init_random"}}
{"run":136,"commit":"d58c8db","metric":160.463608,"metrics":{"best_ms":142.650071,"quality_sum":2.491129377057,"quality_min":0.589775903809,"team_count":4},"status":"discard","description":"Added memoization cache in weights.resolve_weights keyed by `(alpha,beta,gamma,delta,mode,preset,normalize)` to reuse immutable Weights objects across repeated calls, but this regressed median runtime substantially.","timestamp":1775192136657,"segment":0,"confidence":75.53964585499249,"iterationTokens":3150,"asi":{"hypothesis":"resolve_weights is called tens of thousands of times; returning cached Weights objects should reduce allocations and improve throughput.","rollback_reason":"Global cache lookup/management overhead outweighed object-construction savings in this workload.","next_action_hint":"Keep resolve_weights uncached; this helper is too lightweight for global memoization."}}
{"run":137,"commit":"d58c8db","metric":149.829884,"metrics":{"best_ms":143.584299,"quality_sum":2.491129377057,"quality_min":0.589775903809,"team_count":4},"status":"discard","description":"Precomputed compat pairwise explicit-social booleans once per shortlist_scorers call and reused them in candidate_social_potential to avoid repeated has_explicit_social_preferences checks for mirrored pairs, but this regressed.","timestamp":1775192334041,"segment":0,"confidence":76.83147889138233,"iterationTokens":3150,"asi":{"hypothesis":"A per-shortlist pair map should halve explicit-social check work in candidate_social_potential without affecting semantics.","rollback_reason":"Building and consulting the pair map introduced more overhead than the repeated direct checks it replaced.","next_action_hint":"Do not pursue pair-map precompute in shortlist_scorers; keep direct social check path."}}
{"run":138,"commit":"d58c8db","metric":151.840521,"metrics":{"best_ms":148.481932,"quality_sum":2.491129377057,"quality_min":0.589775903809,"team_count":4},"status":"discard","description":"Added a global singleton-teammate cache in has_explicit_social_preferences (keyed by member identity + teammate id, with identity guard) to reuse dominant one-to-one social checks in candidate_social_potential, but this regressed.","timestamp":1775192443890,"segment":0,"confidence":78.10733859085674,"iterationTokens":2338,"asi":{"hypothesis":"Most social checks are singleton teammate queries, so caching these boolean results should reduce repeated preference scans.","rollback_reason":"Cache lookup/bookkeeping overhead exceeded savings from repeated singleton scans.","next_action_hint":"Keep has_explicit_social_preferences stateless; avoid global singleton cache."}}
{"run":139,"commit":"d58c8db","metric":144.507387,"metrics":{"best_ms":143.16226,"quality_sum":2.491129377057,"quality_min":0.589775903809,"team_count":4},"status":"checks_failed","description":"Attempted to unify score-cache key and team-component signature by using sorted person-id tuple keys and passing a precomputed team_signature into score_team to avoid duplicate sorting, but this changed score_team call signature and broke monkeypatched test stubs.","timestamp":1775192614359,"segment":0,"confidence":78.51713577728665,"iterationTokens":2082,"asi":{"hypothesis":"Sharing a single sorted person-id signature between cached_score_team and score_team should reduce redundant sorting and remain behaviorally identical.","rollback_reason":"Added optional score_team parameter (`team_signature`) broke tests that monkeypatch score_team with fixed kwargs.","next_action_hint":"Avoid extending score_team signature; if retried, keep signature unchanged and compute shared values internally.","failure_surface":"tests/test_form_teams.py monkeypatched fake_score_team unexpected kwarg"}}
{"run":140,"commit":"d58c8db","metric":143.618615,"metrics":{"best_ms":140.248964,"quality_sum":2.491129377057,"quality_min":0.589775903809,"team_count":4},"status":"discard","description":"Added local method bindings (`seen_ids.__contains__`, `seen_ids.add`) and person_id local extraction in candidate_combinations shortlist dedup loop to reduce repeated attribute lookups, but this regressed.","timestamp":1775192708036,"segment":0,"confidence":75.41511732988961,"iterationTokens":2119,"asi":{"hypothesis":"Local binding of set operations in the shortlist merge loop should shave Python lookup overhead.","rollback_reason":"Method binding/extra locals did not improve loop throughput and slowed end-to-end runtime.","next_action_hint":"Keep straightforward set membership/add operations in candidate_combinations."}}
{"run":141,"commit":"d58c8db","metric":159.343998,"metrics":{"best_ms":151.883513,"quality_sum":2.491129377057,"quality_min":0.589775903809,"team_count":4},"status":"checks_failed","description":"Attempted to skip shortlist_scorers setup in greedy_allocations when `C(remaining_people, team_size) <= max_candidate_teams` by supplying a trivial scorer (unused by candidate_combinations in this branch), but lint failed on long nested type line and benchmark trend was slower anyway.","timestamp":1775192804768,"segment":0,"confidence":77.9174843066457,"iterationTokens":1794,"asi":{"hypothesis":"For uncapped greedy tasks, avoiding shortlist_scorers should remove unnecessary scorer/potential computation overhead.","rollback_reason":"Ruff E501 formatting failure plus poor runtime trend made the change non-viable.","next_action_hint":"If retried, use a lint-compliant helper function or callable alias and confirm runtime before keeping.","failure_surface":"src/team2form/formation.py E501"}}
{"run":142,"commit":"d58c8db","metric":147.70933,"metrics":{"best_ms":145.557546,"quality_sum":2.491129377057,"quality_min":0.589775903809,"team_count":4},"status":"discard","description":"Implemented a fixed-size 4-item integer sorting network in cached_score_team for the dominant team-size case to avoid generic sorted() during score-cache key canonicalization, but this regressed.","timestamp":1775192899822,"segment":0,"confidence":76.5425367319286,"iterationTokens":1717,"asi":{"hypothesis":"A compare-swap sorting network for four identities should beat generic Timsort on tiny fixed-size keys.","rollback_reason":"Extra Python branching/swaps were slower than built-in sorted() for this hot path.","next_action_hint":"Keep generic sorted identity tuple canonicalization in cached_score_team."}}
{"run":143,"commit":"d58c8db","metric":147.639858,"metrics":{"best_ms":146.332272,"quality_sum":2.491129377057,"quality_min":0.589775903809,"team_count":4},"status":"discard","description":"Added early-return fast path in `_assign_task_skills_compat` for square teams when greedy matching already covers every task with positive assignments (`len(task_skills)==len(team)==len(matched_values)`), skipping uncovered/rescue/perfect-matching checks. This regressed.","timestamp":1775193069799,"segment":0,"confidence":74.28503460517473,"iterationTokens":1717,"asi":{"hypothesis":"When all skills are already positively matched in square-team compat cases, downstream uncovered/rescue/perfect-matching checks are redundant and can be skipped.","rollback_reason":"Fast-path branch plus changed control flow did not improve throughput in aggregate benchmark.","next_action_hint":"Keep existing `_assign_task_skills_compat` flow; this early-return shortcut is not beneficial."}}
{"run":144,"commit":"d58c8db","metric":152.892203,"metrics":{"best_ms":150.245271,"quality_sum":2.491129377057,"quality_min":0.589775903809,"team_count":4},"status":"discard","description":"Replaced manual top-k heap maintenance in candidate_combinations scored path with `heapq.nlargest(max_candidate_teams, enumerate(combinations), key=...)` to push ranking selection into stdlib helper, but this regressed.","timestamp":1775193137951,"segment":0,"confidence":75.25653903193226,"iterationTokens":1272,"asi":{"hypothesis":"`heapq.nlargest` might reduce Python-level heap maintenance overhead versus explicit push/replace loop.","rollback_reason":"`nlargest` key-function/tuple handling overhead made the scored top-k path slower.","next_action_hint":"Keep explicit heappush/heapreplace loop for scored candidate selection."}}
{"run":145,"commit":"d58c8db","metric":151.156346,"metrics":{"best_ms":150.153607,"quality_sum":2.491129377057,"quality_min":0.589775903809,"team_count":4},"status":"discard","description":"Adjusted `_compat_member_priority_order` rich-first key construction to sort a generator instead of first materializing a list comprehension, aiming to trim temporary list allocation overhead. This regressed.","timestamp":1775193201581,"segment":0,"confidence":75.57231192337733,"iterationTokens":1184,"asi":{"hypothesis":"Eliminating an intermediate list in rich-first priority key generation should reduce allocation overhead in compat assignment ranking.","rollback_reason":"Generator-based sorted path was slower than the prior list-comprehension variant in aggregate runtime.","next_action_hint":"Keep list-comprehension input for rich-first priority sorted() call."}}
{"run":146,"commit":"d58c8db","metric":148.536093,"metrics":{"best_ms":145.6029,"quality_sum":2.491129377057,"quality_min":0.589775903809,"team_count":4},"status":"discard","description":"Optimized `_compat_has_perfect_positive_matching` to reuse a tokenized `seen_tasks` array instead of allocating a fresh boolean list for each augmenting-path attempt. End-to-end benchmark regressed.","timestamp":1775193302798,"segment":0,"confidence":80.31395911313635,"iterationTokens":4157,"asi":{"hypothesis":"Eliminating per-member `seen_tasks` list allocations in perfect-matching checks should reduce hot-path overhead.","rollback_reason":"Token bookkeeping and extra comparisons did not outperform the previous simple list-based approach.","next_action_hint":"Keep current augmenting-path implementation; this tokenization variant is slower."}}
{"run":147,"commit":"d58c8db","metric":141.827612,"metrics":{"best_ms":141.264285,"quality_sum":2.491129377057,"quality_min":0.589775903809,"team_count":4},"status":"discard","description":"Conditioned expensive `_compat_has_perfect_positive_matching` call on `rescued_values` being non-empty in square-team compat path (skip matching check when greedy already positively covered every task). Runtime improved versus other recent attempts but still did not beat current best.","timestamp":1775193368287,"segment":0,"confidence":78.31438822297872,"iterationTokens":1304,"asi":{"hypothesis":"If no rescue values are needed, greedy already established a positive one-to-one cover in square teams, so perfect-matching verification is redundant.","rollback_reason":"Despite being faster than many alternatives, end-to-end median remained above incumbent best commit.","next_action_hint":"Keep as a possible revisit only if combined with a larger compat-path change that further reduces assignment overhead."}}
{"run":148,"commit":"d58c8db","metric":145.554297,"metrics":{"best_ms":144.664763,"quality_sum":2.491129377057,"quality_min":0.589775903809,"team_count":4},"status":"discard","description":"Bound `math.isclose` to a local `isclose` inside `_compat_member_task_analysis` and switched hot comparisons to that local reference to reduce repeated global attribute lookups. This regressed.","timestamp":1775193447994,"segment":0,"confidence":76.41196500088019,"iterationTokens":1986,"asi":{"hypothesis":"Local-binding `math.isclose` should trim overhead in the hottest compat-analysis comparisons.","rollback_reason":"Lookup savings were negligible and did not offset added local plumbing in this workload.","next_action_hint":"Keep direct `math.isclose` calls in `_compat_member_task_analysis`."}}
{"run":149,"commit":"d58c8db","metric":154.71928,"metrics":{"best_ms":154.052558,"quality_sum":2.491129377057,"quality_min":0.589775903809,"team_count":4},"status":"discard","description":"Replaced string task-skill tie-break fields with precomputed integer lexical ranks in compat member-priority and candidate-priority tuples (`task_skill_sort_keys`) to reduce string comparisons, but this regressed.","timestamp":1775193552560,"segment":0,"confidence":78.31438822297872,"iterationTokens":5309,"asi":{"hypothesis":"Using integer tie-break keys instead of strings should speed repeated tuple comparisons in `_compat_member_priority_order` and `_assign_task_skills_compat`.","rollback_reason":"Extra per-call rank-map construction outweighed any comparison-time savings.","next_action_hint":"Keep direct `task_skill_ids` string tie-break fields unless sort-key preprocessing can be amortized across many calls."}}
{"run":150,"commit":"d58c8db","metric":159.535549,"metrics":{"best_ms":154.141196,"quality_sum":2.491129377057,"quality_min":0.589775903809,"team_count":4},"status":"discard","description":"Introduced an uncapped-greedy shortcut in `greedy_allocations`: when `C(remaining_people, team_size) <= max_candidate_teams`, skip `shortlist_scorers` and pass a zero scorer (unused by candidate_combinations early-return branch). This regressed substantially.","timestamp":1775193642481,"segment":0,"confidence":75.91284790361445,"iterationTokens":3269,"asi":{"hypothesis":"Avoiding shortlist scorer construction for tasks that already enumerate all combinations should remove unnecessary per-task potential calculations.","rollback_reason":"Extra branch/combination counting plus altered control flow produced worse overall runtime despite seeming to skip work.","next_action_hint":"Do not reattempt this uncapped shortcut in current shape; keep direct shortlist_scorers path."}}
{"run":151,"commit":"d58c8db","metric":162.438325,"metrics":{"best_ms":157.79838,"quality_sum":2.491129377057,"quality_min":0.589775903809,"team_count":4},"status":"checks_failed","description":"Rewrote `_compat_member_task_analysis` outer scan to iterate task columns via `enumerate(zip(*member_task_values))` instead of per-member indexing (`task_values[task_index]`), aiming to reduce indexing overhead. This regressed and failed Ruff B905 (`zip` strictness requirement).","timestamp":1775193727684,"segment":0,"confidence":73.34223992049,"iterationTokens":2360,"asi":{"hypothesis":"Column-wise iteration with `zip(*member_task_values)` could cut inner-loop indexing overhead in compat analysis.","rollback_reason":"Performance regressed heavily and lint policy requires explicit `strict=` on zip usage.","next_action_hint":"Avoid this zip-based rewrite; any future column iteration must satisfy B905 and justify overhead.","failure_surface":"src/team2form/scoring.py B905"}}
{"run":152,"commit":"d58c8db","metric":154.491609,"metrics":{"best_ms":151.822626,"quality_sum":2.491129377057,"quality_min":0.589775903809,"team_count":4},"status":"discard","description":"In `_compat_fill_uncovered_assignments`, moved `max_skills_per_member` earlier and added no-uncovered fast path that returns assignments directly when `max_skills_per_member==1` (avoiding `_compat_sort_member_assignments` on single-item lists). This regressed.","timestamp":1775193794961,"segment":0,"confidence":75.25653903193226,"iterationTokens":1556,"asi":{"hypothesis":"Sorting per-member assignment lists is unnecessary when each member can hold at most one skill, so skipping sort in the no-uncovered case should reduce overhead.","rollback_reason":"Added branch/reordered flow did not improve performance and slowed benchmark.","next_action_hint":"Keep existing no-uncovered path with `_compat_sort_member_assignments`; this singleton shortcut is not worthwhile."}}
{"run":153,"commit":"d58c8db","metric":149.182858,"metrics":{"best_ms":146.601911,"quality_sum":2.491129377057,"quality_min":0.589775903809,"team_count":4},"status":"checks_failed","description":"Refactored compat analysis to also compute per-member positive task-index lists and reused them in `_compat_member_priority_order` to avoid re-scanning full member task vectors. Initial attempt failed type checking due outdated empty-return arity.","timestamp":1775193952054,"segment":0,"confidence":75.57231192337733,"iterationTokens":1556,"asi":{"hypothesis":"Computing positive task indices once in `_compat_member_task_analysis` and reusing them should remove repeated `if value > 0` scans in priority ordering.","rollback_reason":"Refactor had a ty type error (`_compat_member_task_analysis` empty-path return missing new tuple element).","next_action_hint":"Retry with corrected empty-return shape and re-benchmark.","failure_surface":"src/team2form/scoring.py invalid-return-type"}}
{"run":154,"commit":"d58c8db","metric":145.177714,"metrics":{"best_ms":143.811939,"quality_sum":2.491129377057,"quality_min":0.589775903809,"team_count":4},"status":"discard","description":"Retried and fixed the compat refactor that computes per-member positive task-index lists once in `_compat_member_task_analysis` and reuses them in `_compat_member_priority_order` (eliminating repeated full-vector `value > 0` scans). Checks passed but runtime regressed.","timestamp":1775194022925,"segment":0,"confidence":75.91284790361445,"iterationTokens":2234,"asi":{"hypothesis":"Reusing precomputed positive task indices should reduce repeated scan work in compat priority ordering.","rollback_reason":"Extra list/tuple construction in analysis outweighed savings from reduced scan conditions.","next_action_hint":"Do not add positive-index list materialization in this path; look for reductions that avoid new per-call allocations."}}
{"run":155,"commit":"d58c8db","metric":146.504266,"metrics":{"best_ms":144.622133,"quality_sum":2.491129377057,"quality_min":0.589775903809,"team_count":4},"status":"discard","description":"Added an early-return in `_compat_sort_member_assignments` that skips task-order sorting when every member has 0/1 assigned skills (sorting would be a no-op). End-to-end runtime still regressed.","timestamp":1775194112729,"segment":0,"confidence":78.00888635876547,"iterationTokens":2149,"asi":{"hypothesis":"Many compat assignments are singleton per member, so bypassing redundant sorted() calls should cut `_compat_fill_uncovered_assignments` overhead.","rollback_reason":"Extra pre-check branch/all() scan outweighed savings from skipped tiny sort calls.","next_action_hint":"Keep direct sort path; singleton-noop detection is not profitable here."}}
{"run":156,"commit":"d58c8db","metric":148.22259,"metrics":{"best_ms":144.788938,"quality_sum":2.491129377057,"quality_min":0.589775903809,"team_count":4},"status":"discard","description":"Added a dedicated singleton helper `has_explicit_social_preference_for_teammate(member, teammate_id)` and used it in `candidate_social_potential` to avoid allocating `{teammate_id}` sets on every COMPAT pair check. This still regressed.","timestamp":1775194219302,"segment":0,"confidence":80.22395941425474,"iterationTokens":3931,"asi":{"hypothesis":"Avoiding per-call singleton set construction in social-explicit checks should reduce candidate_social_potential overhead.","rollback_reason":"Extra helper call/dispatch overhead outweighed savings from removing tiny set allocations.","next_action_hint":"Keep existing set-based explicit-social check path; singleton helper split is not beneficial."}}
{"run":157,"commit":"d58c8db","metric":149.384416,"metrics":{"best_ms":145.688378,"quality_sum":2.491129377057,"quality_min":0.589775903809,"team_count":4},"status":"discard","description":"Threaded precomputed `uncovered_skill_ids` from `_assign_task_skills_compat` into `_compat_fill_uncovered_assignments` to avoid rebuilding assigned-count/uncovered-scan state in every return path. This regressed.","timestamp":1775194374996,"segment":0,"confidence":81.37156377957068,"iterationTokens":7387,"asi":{"hypothesis":"Reusing already-known uncovered task IDs should remove repeated dictionary/count scans inside `_compat_fill_uncovered_assignments`.","rollback_reason":"Added plumbing/list materialization across all paths outweighed the avoided recomputation.","next_action_hint":"Keep `_compat_fill_uncovered_assignments` self-contained; this uncovered-threading refactor is not profitable."}}
