{"run":415,"commit":"e35386b","metric":13.551224,"metrics":{"best_ms":13.472946,"quality_sum":2.491129377057,"quality_min":0.589775903809,"team_count":4},"status":"keep","description":"Optimized shortlist pair-potential aggregation: replaced `sum(sorted(..., reverse=True)[:partner_count])` with a branchy top-k accumulator (`partner_count` 1/2/3 fast paths + sorted fallback) when deriving per-person personality/social potentials.","timestamp":1775393723279,"segment":0,"confidence":27.824937653696335,"iterationTokens":4137,"asi":{"hypothesis":"Shortlist precompute still pays repeated small-list sorting cost; direct top-k accumulation for small partner counts should reduce scorer setup overhead.","result":"Primary metric improved with checks passing and unchanged quality outputs.","safety_notes":"Computes the same top-partner averages as sorting-based logic; fallback preserves behavior for larger partner counts."}}
{"run":416,"commit":"e35386b","metric":13.862684,"metrics":{"best_ms":13.494647,"quality_sum":2.491129377057,"quality_min":0.589775903809,"team_count":4},"status":"discard","description":"No-code confirmation rerun on kept shortlist top-k aggregation commit e35386b.","timestamp":1775393774692,"segment":0,"confidence":27.698554269758493,"iterationTokens":743,"asi":{"hypothesis":"If e35386b gain is robust, repeat should remain in the low-13ms band.","rollback_reason":"No code change; validation-only rerun.","next_action_hint":"Use e35386b as active baseline and continue paired A/B for marginal micro-optimizations under current host regime.","noise_observation":"Repeat remained in same low-13ms regime, with mild median drift."}}
{"run":417,"commit":"039c22f","metric":13.489043,"metrics":{"best_ms":13.260861,"quality_sum":2.491129377057,"quality_min":0.589775903809,"team_count":4},"status":"keep","description":"Added a specialized `len(team)==2` fast path to `scoring.team_personality_score(...)` (COMPAT and PAPER formulas) to bypass generic list/set/stddev scaffolding used for larger teams.","timestamp":1775393902967,"segment":0,"confidence":27.57615801133812,"iterationTokens":5480,"asi":{"hypothesis":"Shortlist pair-potential precompute calls `team_personality_score` heavily on 2-person teams; a dedicated 2-member path should reduce per-call overhead.","result":"Primary metric improved with checks passing and unchanged quality outputs.","safety_notes":"Fast path uses algebraically equivalent formulas for two-member teams; generic path unchanged for larger teams."}}
{"run":418,"commit":"039c22f","metric":13.462202,"metrics":{"best_ms":13.330493,"quality_sum":2.491129377057,"quality_min":0.589775903809,"team_count":4},"status":"discard","description":"No-code confirmation rerun on kept 2-member `team_personality_score` fast-path commit 039c22f.","timestamp":1775393956122,"segment":0,"confidence":27.53063435869092,"iterationTokens":721,"asi":{"hypothesis":"If 039c22f gain is robust, repeat should remain in the same low-13ms band.","rollback_reason":"No code change; validation-only rerun.","next_action_hint":"Use 039c22f as active baseline and continue targeting hot 2-member scoring/shortlist helper paths.","noise_observation":"Repeat remained in the same improved band, strengthening confidence."}}
{"run":419,"commit":"2636424","metric":13.384375,"metrics":{"best_ms":13.073677,"quality_sum":2.491129377057,"quality_min":0.589775903809,"team_count":4},"status":"keep","description":"Added `len(team)==2` fast path in `scoring.team_social_score(...)`: compute two member scores directly from pair preferences and return geometric mean, bypassing generic mapping/loop scaffolding.","timestamp":1775394026277,"segment":0,"confidence":27.490032610302734,"iterationTokens":1549,"asi":{"hypothesis":"Shortlist social pair-potential precompute frequently scores 2-person teams; direct two-member social scoring should reduce overhead.","result":"Primary metric improved with checks passing and unchanged quality metrics.","safety_notes":"Two-member path is algebraically equivalent to generic formula; larger-team behavior unchanged."}}
{"run":420,"commit":"2636424","metric":13.744768,"metrics":{"best_ms":13.568164,"quality_sum":2.491129377057,"quality_min":0.589775903809,"team_count":4},"status":"discard","description":"No-code confirmation rerun on kept 2-member `team_social_score` fast-path commit 2636424.","timestamp":1775394074511,"segment":0,"confidence":27.463236694151266,"iterationTokens":691,"asi":{"hypothesis":"If 2636424 gain is robust, repeat should stay in the same low-13ms regime.","rollback_reason":"No code change; validation-only rerun.","next_action_hint":"Use 2636424 as active baseline and continue with 2-member shortlist helper optimizations only when algebraic equivalence is clear.","noise_observation":"Repeat remained in low-13ms band but with moderate median drift."}}
{"run":421,"commit":"5c76f8c","metric":13.248778,"metrics":{"best_ms":12.972354,"quality_sum":2.491129377057,"quality_min":0.589775903809,"team_count":4},"status":"keep","description":"Refined `team_social_score` 2-member fast path: replaced `preference_lookup(...)` dict construction with direct preference-list scan for the single counterpart id per member.","timestamp":1775394190096,"segment":0,"confidence":27.40275186511007,"iterationTokens":1580,"asi":{"hypothesis":"In 2-member social scoring, building full preference maps is unnecessary overhead; scanning for the single counterpart preference should be cheaper.","result":"Primary metric improved with checks passing and unchanged quality monitors.","safety_notes":"Semantics preserved: first matching preference for counterpart id is used, fallback remains `compat_default` when absent."}}
{"run":422,"commit":"5c76f8c","metric":13.693962,"metrics":{"best_ms":13.118391,"quality_sum":2.491129377057,"quality_min":0.589775903809,"team_count":4},"status":"discard","description":"No-code confirmation rerun on kept 2-member social-preference scan optimization commit 5c76f8c.","timestamp":1775394248635,"segment":0,"confidence":27.289099827998356,"iterationTokens":679,"asi":{"hypothesis":"If 5c76f8c gain is robust, repeat should remain near the improved low-13ms band.","rollback_reason":"No code change; validation-only rerun.","next_action_hint":"Use 5c76f8c as active baseline and continue with pair-team scoring fast paths where algebraic equivalence is straightforward.","noise_observation":"Repeat remained in the low-13ms regime with moderate variance."}}
{"run":423,"commit":"2b5d9c3","metric":13.136277,"metrics":{"best_ms":12.872037,"quality_sum":2.491129377057,"quality_min":0.589775903809,"team_count":4},"status":"keep","description":"Further optimized `team_social_score` 2-member fast path: replaced `geometric_mean([a, b])` with equivalent guarded `sqrt(a * b)` computation.","timestamp":1775394331344,"segment":0,"confidence":27.18145593194348,"iterationTokens":1468,"asi":{"hypothesis":"For two-member social scores, direct square-root geometric mean should beat list construction plus log/exp path.","result":"Primary metric improved with checks passing and unchanged quality metrics.","safety_notes":"Equivalent for positive inputs; preserves zero behavior with explicit non-positive guard."}}
{"run":424,"commit":"2b5d9c3","metric":12.866156,"metrics":{"best_ms":12.78899,"quality_sum":2.491129377057,"quality_min":0.589775903809,"team_count":4},"status":"discard","description":"No-code confirmation rerun on kept sqrt-based 2-member social geometric-mean commit 2b5d9c3.","timestamp":1775394388225,"segment":0,"confidence":26.983317898705998,"iterationTokens":670,"asi":{"hypothesis":"If 2b5d9c3 gain is robust, repeat should stay at or below prior low-13ms range.","rollback_reason":"No code change; validation-only rerun.","next_action_hint":"Use 2b5d9c3 as active baseline and continue targeting algebraically exact pair-team scoring reductions.","noise_observation":"Repeat improved further, indicating a stable low-13ms regime."}}
{"run":425,"commit":"2b5d9c3","metric":14.487957,"metrics":{"best_ms":13.717809,"quality_sum":2.491129377057,"quality_min":0.589775903809,"team_count":4},"status":"discard","description":"Replaced `_compat_gender_bonus(team)` call inside `team_personality_score` 2-member COMPAT fast path with inlined two-member gender-bonus arithmetic.","timestamp":1775394462770,"segment":0,"confidence":26.96589998121144,"iterationTokens":1552,"asi":{"hypothesis":"Inlining two-member gender-bonus math should remove small helper/sum overhead in pair-personality scoring.","rollback_reason":"Runtime regressed materially; extra branch/math work inlined into hot pair path outweighed helper-call savings.","next_action_hint":"Keep helper call in 2-member personality path; avoid further inlining of compat gender bonus math.","result":"Checks passed and quality unchanged, but median worsened."}}
{"run":426,"commit":"2b5d9c3","metric":13.497762,"metrics":{"best_ms":13.069481,"quality_sum":2.491129377057,"quality_min":0.589775903809,"team_count":4},"status":"discard","description":"No-code baseline rerun after reverting inlined two-member gender-bonus experiment.","timestamp":1775394521847,"segment":0,"confidence":26.82753798861255,"iterationTokens":665,"asi":{"hypothesis":"Reverting failed gender-bonus inline should restore 2b5d9c3 baseline regime.","rollback_reason":"No code change; baseline anchoring run.","next_action_hint":"Use 2b5d9c3 baseline and keep 2-member personality fast path simple.","noise_observation":"Baseline returned to low-13ms band after rollback."}}
{"run":427,"commit":"04e5013","metric":12.938903,"metrics":{"best_ms":12.770213,"quality_sum":2.491129377057,"quality_min":0.589775903809,"team_count":4},"status":"keep","description":"Added `len(team)==2` fast path in `_compat_gender_bonus(...)` with precomputed constants (balanced and one-unknown cases), avoiding generic counting/sine work for pair teams.","timestamp":1775394647655,"segment":0,"confidence":26.69932168658738,"iterationTokens":3411,"asi":{"hypothesis":"Pair-team personality scoring still calls `_compat_gender_bonus`; a dedicated 2-member branch with constants should reduce per-call overhead.","result":"Primary metric improved with checks passing and unchanged quality monitors.","safety_notes":"Two-member branch is algebraically equivalent to the generic formula; larger-team path unchanged."}}
{"run":428,"commit":"04e5013","metric":14.849684,"metrics":{"best_ms":13.184287,"quality_sum":2.491129377057,"quality_min":0.589775903809,"team_count":4},"status":"discard","description":"No-code confirmation rerun on kept 2-member `_compat_gender_bonus` fast path commit 04e5013.","timestamp":1775394714227,"segment":0,"confidence":26.640245397965895,"iterationTokens":689,"asi":{"hypothesis":"If 04e5013 gain is robust, repeat should stay near low-13ms band.","rollback_reason":"No code change; validation-only rerun.","next_action_hint":"Run another no-code sample before additional micro-optimizations to re-anchor current host regime.","noise_observation":"Observed large median jump despite low best sample, indicating significant short-term variance."}}
{"run":429,"commit":"04e5013","metric":13.202342,"metrics":{"best_ms":12.973107,"quality_sum":2.491129377057,"quality_min":0.589775903809,"team_count":4},"status":"discard","description":"Second no-code confirmation rerun after variance spike on commit 04e5013.","timestamp":1775394775576,"segment":0,"confidence":26.581429962619712,"iterationTokens":653,"asi":{"hypothesis":"Additional repeat should distinguish transient host spike from real regression.","rollback_reason":"No code change; variance characterization run.","next_action_hint":"Treat current baseline as low-13ms with occasional outliers; keep paired/no-code confirmations for micro changes.","noise_observation":"Median returned to low-13ms regime, confirming prior run was a high-latency outlier."}}
{"run":430,"commit":"d94ba9f","metric":12.670601,"metrics":{"best_ms":12.544021,"quality_sum":2.491129377057,"quality_min":0.589775903809,"team_count":4},"status":"keep","description":"Tightened `team_personality_score` 2-member fast path by hoisting personality axes into local scalars and computing COMPAT/PAPER ETJ + introvert terms from those scalars, reducing repeated attribute access/branch overhead.","timestamp":1775394939550,"segment":0,"confidence":26.422552189002683,"iterationTokens":4615,"asi":{"hypothesis":"Even with a 2-member fast path, repeated attribute access in pair personality scoring remains overhead; scalar hoisting should reduce it.","result":"Primary metric improved with checks passing and unchanged quality monitors.","safety_notes":"Algebraic formula unchanged; only local variable extraction and equivalent comparisons were introduced."}}
{"run":431,"commit":"d94ba9f","metric":12.825825,"metrics":{"best_ms":12.754851,"quality_sum":2.491129377057,"quality_min":0.589775903809,"team_count":4},"status":"discard","description":"No-code confirmation rerun on kept scalar-hoisted 2-member personality fast-path commit d94ba9f.","timestamp":1775394998114,"segment":0,"confidence":26.268568650446376,"iterationTokens":708,"asi":{"hypothesis":"If d94ba9f gain is robust, repeat should remain near the improved ~12.7–12.9ms band.","rollback_reason":"No code change; validation-only rerun.","next_action_hint":"Use d94ba9f as active baseline; continue pair-team scoring simplifications with strict algebraic equivalence.","noise_observation":"Repeat remained in the same low-12ms regime with minor drift."}}
{"run":432,"commit":"d94ba9f","metric":13.682937,"metrics":{"best_ms":13.271849,"quality_sum":2.491129377057,"quality_min":0.589775903809,"team_count":4},"status":"discard","description":"Inlined 2-member COMPAT gender-bonus branch logic directly in `team_personality_score` fast path (replace `_compat_gender_bonus(team)` call).","timestamp":1775395133695,"segment":0,"confidence":26.110893808669605,"iterationTokens":1657,"asi":{"hypothesis":"After adding a 2-member gender-bonus fast path, inlining that branch in pair personality scoring may trim remaining call overhead.","rollback_reason":"Runtime regressed; extra inline branching did not outperform helper call path.","next_action_hint":"Keep `_compat_gender_bonus(team)` call in pair personality fast path; avoid further inlining here.","result":"Checks passed and quality unchanged, but median worsened."}}
{"run":433,"commit":"d94ba9f","metric":16.467287,"metrics":{"best_ms":14.811503,"quality_sum":2.491129377057,"quality_min":0.589775903809,"team_count":4},"status":"discard","description":"In `shortlist_scorers` social pair precompute, replaced per-pair `team_social_score((left,right), compat_default=0.5)` calls with direct map-based pair preference retrieval + sqrt formula, using precomputed per-person preference maps.","timestamp":1775395337267,"segment":0,"confidence":25.937013090237908,"iterationTokens":3781,"asi":{"hypothesis":"Reusing precomputed per-person preference maps should beat repeated pair helper calls for social pair scores.","rollback_reason":"Runtime regressed substantially; additional map layers/assertions/inline arithmetic in pair loop outweighed expected savings.","next_action_hint":"Keep calling `team_social_score` in shortlist pair loop; avoid additional per-shortlist preference-map scaffolding.","result":"Checks passed and quality unchanged, but median degraded materially."}}
{"run":434,"commit":"d94ba9f","metric":15.679847,"metrics":{"best_ms":14.458445,"quality_sum":2.491129377057,"quality_min":0.589775903809,"team_count":4},"status":"discard","description":"No-code baseline rerun after reverting shortlist social pair map-based rewrite.","timestamp":1775395408507,"segment":0,"confidence":25.84008844539114,"iterationTokens":693,"asi":{"hypothesis":"Rollback should restore active baseline behavior after failed social-pair rewrite.","rollback_reason":"No code change; baseline anchoring run.","next_action_hint":"Given current latency drift, perform immediate paired A/B for future micro changes before keep decisions.","noise_observation":"Host appears to have shifted to a slower band (~15ms median) versus prior ~13ms runs."}}
{"run":435,"commit":"d94ba9f","metric":14.307238,"metrics":{"best_ms":13.819926,"quality_sum":2.491129377057,"quality_min":0.589775903809,"team_count":4},"status":"discard","description":"Additional no-code baseline rerun to characterize current host regime.","timestamp":1775395487744,"segment":0,"confidence":25.708793228577253,"iterationTokens":643,"asi":{"hypothesis":"Further repeat should clarify whether prior ~15.7ms reading was a transient outlier.","rollback_reason":"No code change; variance characterization run.","next_action_hint":"Treat ambient regime as broad ~13.8–15.7ms; require paired A/B before accepting marginal changes.","noise_observation":"Median moved back down but remains above fastest earlier samples, confirming volatility."}}
{"run":436,"commit":"d94ba9f","metric":0,"metrics":{"best_ms":0,"quality_sum":0,"quality_min":0,"team_count":0},"status":"crash","description":"Attempted to inline COMPAT pair-personality scoring directly inside `shortlist_scorers` pair loop (bypass `team_personality_score` call) but referenced `_compat_gender_bonus` from `formation.py` without importing it.","timestamp":1775395679960,"segment":0,"confidence":25.708793228577253,"iterationTokens":2213,"asi":{"hypothesis":"Eliminating per-pair `team_personality_score` calls in shortlist precompute could reduce overhead by inlining the two-member COMPAT formula.","rollback_reason":"Experiment crashed with NameError due missing `_compat_gender_bonus` symbol in `formation.py`.","next_action_hint":"If retrying this direction, either import `_compat_gender_bonus` safely from scoring or inline equivalent gender-bonus branch locally; then re-run with checks.","error_excerpt":"NameError: name '_compat_gender_bonus' is not defined at formation.py:442 in shortlist_scorers."}}
{"run":437,"commit":"d94ba9f","metric":14.368024,"metrics":{"best_ms":13.111916,"quality_sum":2.491129377057,"quality_min":0.589775903809,"team_count":4},"status":"checks_failed","description":"Retried inline COMPAT pair-personality scoring in `shortlist_scorers` with local gender-bonus branch (no external helper dependency).","timestamp":1775395787005,"segment":0,"confidence":25.47374880449385,"iterationTokens":2405,"asi":{"hypothesis":"Inlining pair personality formula in shortlist precompute may cut `team_personality_score` call overhead.","rollback_reason":"Checks failed on Ruff SIM108 style rule in new gender-bonus branch.","next_action_hint":"If retried, apply Ruff-compliant ternary expression for the equal-gender branch and remeasure with paired A/B.","error_excerpt":"SIM108 at formation.py:441 (if/else could be ternary)."}}
{"run":438,"commit":"d94ba9f","metric":14.671708,"metrics":{"best_ms":14.549006,"quality_sum":2.491129377057,"quality_min":0.589775903809,"team_count":4},"status":"discard","description":"Inlined COMPAT pair-personality formula in `shortlist_scorers` pair loop (with Ruff-compliant gender-bonus branch) to bypass `team_personality_score((left,right), mode=COMPAT)` calls.","timestamp":1775395977545,"segment":0,"confidence":25.303640423954036,"iterationTokens":1893,"asi":{"hypothesis":"Directly computing COMPAT pair personality in shortlist precompute should remove function-call overhead and reduce runtime.","rollback_reason":"Despite passing checks, end-to-end runtime regressed materially; inline branch-heavy math was slower than calling optimized helper.","next_action_hint":"Do not inline pair personality scoring in shortlist loop; keep `team_personality_score` call path.","result":"Quality metrics unchanged but primary metric worsened."}}
{"run":439,"commit":"d94ba9f","metric":14.131956,"metrics":{"best_ms":12.917555,"quality_sum":2.491129377057,"quality_min":0.589775903809,"team_count":4},"status":"discard","description":"No-code baseline rerun after discarding inline COMPAT pair-personality loop rewrite.","timestamp":1775396040469,"segment":0,"confidence":25.186317691220584,"iterationTokens":685,"asi":{"hypothesis":"Rollback should return to active baseline behavior after failed inline rewrite.","rollback_reason":"No code change; baseline anchoring run.","next_action_hint":"Given current volatility, evaluate future micro changes with immediate A/B and multiple no-code anchors.","noise_observation":"Median remained elevated while best sample stayed low, indicating unstable host conditions."}}
{"run":440,"commit":"d94ba9f","metric":16.901803,"metrics":{"best_ms":13.549191,"quality_sum":2.491129377057,"quality_min":0.589775903809,"team_count":4},"status":"discard","description":"Reworked `geometric_mean` internals to use module-level math aliases with default-bound local parameters (`_log`, `_exp`) instead of per-call local binding assignments.","timestamp":1775396255615,"segment":0,"confidence":25.070077893349296,"iterationTokens":3666,"asi":{"hypothesis":"Default-bound local aliases for log/exp might be a slightly cheaper hot-path setup than rebinding locals each call.","rollback_reason":"End-to-end median regressed sharply in current window; any micro gain was dominated by observed slowdown.","next_action_hint":"Keep existing local-binding implementation; avoid further aliasing strategy tweaks in `geometric_mean`.","result":"Checks passed and quality unchanged, but primary metric worsened."}}
