{"run":390,"commit":"e29f294","metric":16.252194,"metrics":{"best_ms":15.519847,"quality_sum":2.491129377057,"quality_min":0.589775903809,"team_count":4},"status":"checks_failed","description":"Specialized `_compat_candidate_quality_upper_bound` for current call patterns by requiring precomputed task-preference logs and explicit team signatures, removing optional/fallback branches and redundant parameters.","timestamp":1775378721781,"segment":0,"confidence":29.629963900713697,"iterationTokens":6643,"asi":{"hypothesis":"All current call sites already supply logs/signatures; deleting unused fallback branches should trim per-call overhead in a hotspot helper.","rollback_reason":"Checks failed due unused `_task_preference_score` import after branch removal (ruff F401).","next_action_hint":"If retried, remove now-unused import and rerun paired baseline comparison.","error_excerpt":"formation.py:17 F401 unused import `_task_preference_score`."}}
{"run":391,"commit":"e29f294","metric":23.582915,"metrics":{"best_ms":23.293938,"quality_sum":2.491129377057,"quality_min":0.589775903809,"team_count":4},"status":"discard","description":"Retried `_compat_candidate_quality_upper_bound` specialization with lint fixes: removed optional task-preference/team-signature fallback branches and tightened call signatures to current precomputed-log usage.","timestamp":1775378835803,"segment":0,"confidence":29.58397940328257,"iterationTokens":4291,"asi":{"hypothesis":"Removing never-used fallback branches/params in a hotspot helper should reduce per-call overhead.","rollback_reason":"No clear primary-metric improvement; landed slower in current regime.","next_action_hint":"Do not further specialize helper signatures unless accompanied by stronger branch-elimination wins elsewhere.","result":"Checks passed and behavior metrics unchanged."}}
{"run":392,"commit":"e29f294","metric":22.702275,"metrics":{"best_ms":22.315162,"quality_sum":2.491129377057,"quality_min":0.589775903809,"team_count":4},"status":"discard","description":"No-code baseline rerun after discarding helper-signature specialization attempt.","timestamp":1775378879959,"segment":0,"confidence":29.476579024412487,"iterationTokens":657,"asi":{"hypothesis":"Reverted baseline should recover prior performance envelope if specialization attempt had no benefit.","rollback_reason":"No code change; confirmation-only run.","next_action_hint":"Use e29f294 as active baseline and target larger algorithmic reductions rather than helper-signature surgery.","noise_observation":"Baseline returned to low-22ms band."}}
{"run":393,"commit":"e29f294","metric":23.420936,"metrics":{"best_ms":23.247307,"quality_sum":2.491129377057,"quality_min":0.589775903809,"team_count":4},"status":"discard","description":"Added request-scoped cached task-order-by-hardness helper and switched `form_teams` to rebuild `task_order` from cached task ids instead of sorting tasks every call.","timestamp":1775379010190,"segment":0,"confidence":29.369955628051542,"iterationTokens":4442,"asi":{"hypothesis":"Caching deterministic hardness ordering across repeated calls should remove repeated `task_hardness` computation/sort overhead.","rollback_reason":"Primary metric regressed; cache lookup + task-id remapping overhead outweighed saved sorting under current workload.","next_action_hint":"Avoid task-order caching layers unless profiling shows `task_hardness` is a dominant cost in target regimes."}}
{"run":394,"commit":"e29f294","metric":22.655307,"metrics":{"best_ms":22.218389,"quality_sum":2.491129377057,"quality_min":0.589775903809,"team_count":4},"status":"discard","description":"No-code baseline rerun after reverting task-order-by-hardness cache experiment.","timestamp":1775379056662,"segment":0,"confidence":29.308810535764195,"iterationTokens":688,"asi":{"hypothesis":"If task-order caching was the regression source, baseline should recover after revert.","rollback_reason":"No code change; confirmation-only run.","next_action_hint":"Keep e29f294 baseline and avoid request-level task-order caches for this workload.","noise_observation":"Baseline returned to low-22ms band."}}
{"run":395,"commit":"e29f294","metric":23.588512,"metrics":{"best_ms":22.696895,"quality_sum":2.491129377057,"quality_min":0.589775903809,"team_count":4},"status":"discard","description":"Inlined a 4-skill geometric-mean fast path directly at COMPAT skill-upper call sites (cap+1 cheap loop, <=cap cheap loop, and `_compat_candidate_quality_upper_bound`) to avoid `geometric_mean(...)` call overhead.","timestamp":1775379284265,"segment":0,"confidence":29.32627056150625,"iterationTokens":688,"asi":{"hypothesis":"Direct inline math for 4-skill upper-bound lists should beat helper-call overhead in high-frequency bound loops.","rollback_reason":"End-to-end median regressed; duplicated branch/math at call sites increased overhead/code size without net gain.","next_action_hint":"Keep shared `geometric_mean` specialization only; avoid additional inlining of the same logic into bound loops.","result":"Checks passed and quality unchanged, but primary metric worsened."}}
{"run":396,"commit":"d245f39","metric":22.22384,"metrics":{"best_ms":22.158006,"quality_sum":2.491129377057,"quality_min":0.589775903809,"team_count":4},"status":"keep","description":"Optimized `scoring.geometric_mean(...)` by binding `math.log`/`math.exp` to local variables (`log`, `exp`) and reusing them in both fast and generic paths to reduce repeated global attribute lookups in this hotspot.","timestamp":1775379422631,"segment":0,"confidence":29.428862747575472,"iterationTokens":5287,"asi":{"hypothesis":"`geometric_mean` remains heavily called; local binding of math functions should reduce call-site overhead without semantic changes.","result":"Primary metric improved with checks passing and unchanged quality metrics.","safety_notes":"Pure evaluation-order/local-binding optimization; behavior for empty/non-positive inputs is unchanged."}}
{"run":397,"commit":"d245f39","metric":25.57753,"metrics":{"best_ms":24.256128,"quality_sum":2.491129377057,"quality_min":0.589775903809,"team_count":4},"status":"discard","description":"No-code confirmation rerun on kept geometric_mean local-binding commit d245f39.","timestamp":1775379467471,"segment":0,"confidence":29.436165162050333,"iterationTokens":762,"asi":{"hypothesis":"If d245f39 gain is robust, repeat should remain near prior low-22ms range.","rollback_reason":"No code change; validation-only rerun under volatile host conditions.","next_action_hint":"Use immediate paired A/B checks for marginal micro-optimizations before stacking additional changes.","noise_observation":"Observed large upward drift on repeat, indicating substantial short-term host variance."}}
{"run":398,"commit":"d245f39","metric":23.515085,"metrics":{"best_ms":22.779371,"quality_sum":2.491129377057,"quality_min":0.589775903809,"team_count":4},"status":"discard","description":"A/B check against kept d245f39: reverted geometric_mean local bindings (`log`/`exp`) back to direct `math.log`/`math.exp` calls.","timestamp":1775379549129,"segment":0,"confidence":29.454023569263857,"iterationTokens":1459,"asi":{"hypothesis":"If d245f39 local-binding optimization is real, reverting to direct attribute lookups should be slower in same-window comparison.","rollback_reason":"Result was inconclusive under current host variance (between recent fast and slow samples), so not enough evidence to undo kept commit.","next_action_hint":"Retain d245f39 for now; prioritize larger structural changes and use paired A/B for any further micro-optimizations.","ab_note":"Reverted variant did not clearly outperform kept commit."}}
{"run":399,"commit":"8a60794","metric":20.975176,"metrics":{"best_ms":19.277742,"quality_sum":2.491129377057,"quality_min":0.589775903809,"team_count":4},"status":"keep","description":"Specialized unsorted team-signature construction for 4-member teams in hot COMPAT loops: replaced generator-based `tuple(member.id for member in ...)` with indexed tuple assembly in cap+1 cheap-bound loop, <=cap cheap-bound loop, and swap-phase bound signatures.","timestamp":1775379827118,"segment":0,"confidence":29.39662469611021,"iterationTokens":7696,"asi":{"hypothesis":"Generator-based signature tuple construction is a non-trivial hotspot; fixed-size tuple assembly for common team size 4 should cut overhead materially while preserving ordering semantics.","result":"Large primary-metric improvement with checks passing and unchanged quality metrics.","safety_notes":"Signatures preserve the same candidate-member order as before; generic fallback path remains for non-4 team sizes."}}
{"run":400,"commit":"8a60794","metric":21.809365,"metrics":{"best_ms":21.405691,"quality_sum":2.491129377057,"quality_min":0.589775903809,"team_count":4},"status":"discard","description":"No-code confirmation rerun on kept 4-member signature-construction specialization commit 8a60794.","timestamp":1775379876954,"segment":0,"confidence":29.386554538273792,"iterationTokens":770,"asi":{"hypothesis":"If 8a60794 gain is robust, repeat should remain in low-20ms band.","rollback_reason":"No code change; validation-only rerun.","next_action_hint":"Use 8a60794 as active baseline and continue with structural hotspot cuts; keep paired A/B validation due host variance.","noise_observation":"Repeat stayed in improved range, supporting robustness despite variance."}}
{"run":401,"commit":"8a60794","metric":22.250982,"metrics":{"best_ms":21.657277,"quality_sum":2.491129377057,"quality_min":0.589775903809,"team_count":4},"status":"discard","description":"Added 4-member task-preference-log unrolled paths (dict lookups by indexed signature ids) in cap+1 cheap loop, <=cap cheap loop, and `_compat_candidate_quality_upper_bound` fallback-logs branch.","timestamp":1775380097190,"segment":0,"confidence":29.376491277375557,"iterationTokens":10144,"asi":{"hypothesis":"Unrolling 4-member task-preference log aggregation should reduce loop overhead in bound hot paths.","rollback_reason":"No end-to-end gain; extra branching/local-variable churn offset any loop savings.","next_action_hint":"Avoid further task-preference unrolling micro-optimizations; focus on reducing bound call volume instead.","result":"Checks passed and quality unchanged, but runtime regressed relative to active baseline."}}
{"run":402,"commit":"8a60794","metric":24.94406,"metrics":{"best_ms":24.53175,"quality_sum":2.491129377057,"quality_min":0.589775903809,"team_count":4},"status":"discard","description":"Changed cheap-bound sorting tuples to store `-index` and use plain `sort(reverse=True)` (removing lambda key) in both cap+1 and <=cap COMPAT pruning paths.","timestamp":1775380189976,"segment":0,"confidence":29.256908721632655,"iterationTokens":2062,"asi":{"hypothesis":"Avoiding per-sort key-function calls by pre-encoding tie order (`-index`) should reduce sorting overhead in candidate bound ranking.","rollback_reason":"End-to-end runtime regressed materially; tuple reshaping/extra negation did not beat the existing lambda-key sort path.","next_action_hint":"Do not pursue cheap-bounded sort-key micro rewrites further without stronger profiling evidence.","result":"Checks passed and behavior metrics unchanged."}}
{"run":403,"commit":"8a60794","metric":21.744262,"metrics":{"best_ms":21.017837,"quality_sum":2.491129377057,"quality_min":0.589775903809,"team_count":4},"status":"discard","description":"Removed defensive `allocations.copy()` calls on accepted replacement/swap moves in `improve_allocations` and mutate `allocations` in place (list is local and loop breaks immediately after mutation).","timestamp":1775380274138,"segment":0,"confidence":29.138295785624194,"iterationTokens":1581,"asi":{"hypothesis":"Eliminating list-copy churn in swap/refinement accepted-move paths should reduce improvement-loop overhead.","rollback_reason":"Observed effect was marginal/inconclusive under current noise; not enough evidence for a robust win.","next_action_hint":"Keep simpler baseline unless a paired A/B in a stable regime shows consistent gain from in-place mutation.","result":"Checks passed with unchanged quality metrics."}}
{"run":404,"commit":"8a60794","metric":22.709948,"metrics":{"best_ms":21.576273,"quality_sum":2.491129377057,"quality_min":0.589775903809,"team_count":4},"status":"discard","description":"Hoisted COMPAT weight components (`alpha/beta/gamma/delta`) into local scalar variables in cap+1 cheap loop, <=cap cheap loop, and `_compat_candidate_quality_upper_bound` return composition to avoid repeated attribute lookups.","timestamp":1775380439803,"segment":0,"confidence":28.94367970670368,"iterationTokens":5139,"asi":{"hypothesis":"Replacing repeated `resolved_weights.<field>` attribute lookups with local scalar bindings should reduce tight-loop overhead in upper-bound paths.","rollback_reason":"No net win in end-to-end benchmark; added local setup/assignments did not pay off under current workload.","next_action_hint":"Avoid further resolved-weight attribute micro-tuning; pursue changes that reduce candidate/bound evaluation counts instead.","result":"Checks passed and quality unchanged, but runtime worsened versus active baseline."}}
{"run":405,"commit":"8a60794","metric":20.866119,"metrics":{"best_ms":20.7875,"quality_sum":2.491129377057,"quality_min":0.589775903809,"team_count":4},"status":"discard","description":"No-code baseline rerun after reverting weight-local-hoist experiment.","timestamp":1775380503293,"segment":0,"confidence":28.939328381993153,"iterationTokens":729,"asi":{"hypothesis":"Reverted baseline should recover if previous regression was code-induced.","rollback_reason":"No code change; baseline anchoring run.","next_action_hint":"Use 8a60794 baseline around low-21ms and require paired confirmations for marginal deltas.","noise_observation":"Baseline returned to low-21ms range."}}
{"run":406,"commit":"290a04e","metric":20.580658,"metrics":{"best_ms":20.328511,"quality_sum":2.491129377057,"quality_min":0.589775903809,"team_count":4},"status":"keep","description":"Added 4x4 fast-path skill-upper aggregation in COMPAT pruning hotspots (cap+1 cheap loop, <=cap cheap loop, and `_compat_candidate_quality_upper_bound`): for 4-member teams with 4 task-skill dimensions, compute per-dimension maxima directly via indexed rows, with generic fallback for other shapes.","timestamp":1775380711780,"segment":0,"confidence":28.831830189589155,"iterationTokens":7217,"asi":{"hypothesis":"Nested member×skill loops for skill upper bounds remain hot; direct 4x4 maxima computation should reduce comparisons/loop overhead in the dominant workload while preserving generic behavior.","result":"Primary metric improved with checks passing and unchanged quality monitors.","safety_notes":"Fast path is gated on exact shape `(team_size==4 and task_skill_count==4)` and returns mathematically identical maxima; all other shapes use prior generic logic."}}
{"run":407,"commit":"290a04e","metric":20.456674,"metrics":{"best_ms":20.189056,"quality_sum":2.491129377057,"quality_min":0.589775903809,"team_count":4},"status":"discard","description":"No-code confirmation rerun on kept 4x4 skill-upper fast-path commit 290a04e.","timestamp":1775380763520,"segment":0,"confidence":28.69770601683245,"iterationTokens":824,"asi":{"hypothesis":"If 290a04e gain is robust, repeat should stay in low-20ms band with unchanged quality.","rollback_reason":"No code change; validation-only rerun.","next_action_hint":"Use 290a04e as active baseline; continue with similarly shape-guarded structural reductions in hot pruning loops.","noise_observation":"Repeat remained in same improved band and slightly improved further."}}
{"run":408,"commit":"290a04e","metric":20.873409,"metrics":{"best_ms":19.662636,"quality_sum":2.491129377057,"quality_min":0.589775903809,"team_count":4},"status":"discard","description":"Replaced 4x4 skill-upper fast-path `max(...)` calls with manual comparison chains per dimension in cap+1/<=cap cheap loops and `_compat_candidate_quality_upper_bound`.","timestamp":1775381055271,"segment":0,"confidence":28.68034639206704,"iterationTokens":11501,"asi":{"hypothesis":"Manual comparisons should beat repeated `builtins.max` call overhead in the 4x4 maxima fast path.","rollback_reason":"No end-to-end improvement; additional Python branching/assignments offset reduced builtins.max calls.","next_action_hint":"Keep simpler 4x4 maxima formulation with `max(...)`; avoid further manual-compare expansions.","result":"Checks passed and quality unchanged, but median did not improve."}}
{"run":409,"commit":"290a04e","metric":20.719638,"metrics":{"best_ms":19.561606,"quality_sum":2.491129377057,"quality_min":0.589775903809,"team_count":4},"status":"discard","description":"Adjusted 4x4 skill-upper fast path to compute geometric mean directly from four maxima (with non-positive guard), avoiding intermediate `task_skill_bests` list + `geometric_mean(...)` call in fast-path branches.","timestamp":1775381204949,"segment":0,"confidence":28.663007756741518,"iterationTokens":6258,"asi":{"hypothesis":"Direct 4-value log/exp composition from precomputed maxima should beat list materialization plus helper call in 4x4 fast path.","rollback_reason":"No net end-to-end gain; extra branching/math in fast path did not outperform the simpler list+helper approach.","next_action_hint":"Keep previous 4x4 maxima fast path shape and avoid deeper arithmetic inlining at these call sites.","result":"Checks passed with unchanged quality metrics, but median regressed versus active baseline."}}
{"run":410,"commit":"290a04e","metric":23.420853,"metrics":{"best_ms":22.519766,"quality_sum":2.491129377057,"quality_min":0.589775903809,"team_count":4},"status":"discard","description":"Added index-based 4-member swap-team construction in `improve_allocations` (replace tuple-comprehension/id-compare generation with index-conditioned tuple assembly for `swapped_left/right`, with generic fallback).","timestamp":1775381371768,"segment":0,"confidence":28.277015655408277,"iterationTokens":7753,"asi":{"hypothesis":"For 4-member teams, index-conditioned tuple assembly should reduce swap-loop generator/id-comparison overhead.","rollback_reason":"End-to-end runtime regressed materially; added branch complexity and tuple assembly overhead outweighed benefits.","next_action_hint":"Do not pursue swap-team construction rewrites further unless supported by a stricter same-window A/B profile.","result":"Checks passed and quality unchanged, but median degraded strongly."}}
{"run":411,"commit":"290a04e","metric":20.808075,"metrics":{"best_ms":20.408669,"quality_sum":2.491129377057,"quality_min":0.589775903809,"team_count":4},"status":"discard","description":"No-code baseline rerun after reverting swap-team index-based construction attempt.","timestamp":1775381423378,"segment":0,"confidence":27.90128138759905,"iterationTokens":714,"asi":{"hypothesis":"Baseline should recover after rollback of failed swap-loop rewrite.","rollback_reason":"No code change; baseline anchoring run.","next_action_hint":"Keep 290a04e as active baseline and continue with pruning/search-structure ideas instead of swap construction micro-tweaks.","noise_observation":"Returned to low-20ms band, confirming prior regression was code-induced."}}
{"run":412,"commit":"4f82018","metric":13.910726,"metrics":{"best_ms":13.787663,"quality_sum":2.491129377057,"quality_min":0.589775903809,"team_count":4},"status":"keep","description":"In 4x4 COMPAT skill-upper fast paths, bound `max` to local `max_value` before per-dimension maxima composition in cap+1 cheap loop, <=cap cheap loop, and `_compat_candidate_quality_upper_bound`.","timestamp":1775393433388,"segment":0,"confidence":28.041119620655408,"iterationTokens":714,"asi":{"hypothesis":"Local binding of `max` in the heavily used 4x4 maxima blocks should reduce repeated builtins lookup overhead.","result":"Very large measured primary-metric gain with checks passing and unchanged quality metrics.","safety_notes":"No algorithmic change; only local name binding in existing fast-path computations.","caution":"Magnitude may include host-regime shift; run immediate no-code confirmation."}}
{"run":413,"commit":"4f82018","metric":13.768447,"metrics":{"best_ms":13.561226,"quality_sum":2.491129377057,"quality_min":0.589775903809,"team_count":4},"status":"discard","description":"No-code confirmation rerun on kept local-`max` binding commit 4f82018.","timestamp":1775393482733,"segment":0,"confidence":27.97473951752665,"iterationTokens":852,"asi":{"hypothesis":"If 4f82018 gain is real, immediate repeat should stay in the same very-low band.","rollback_reason":"No code change; validation-only rerun.","next_action_hint":"Use 4f82018 as new baseline and continue with high-leverage structural work; keep paired confirmations due environment volatility.","noise_observation":"Repeat stayed in same low-13ms regime, indicating a robust shift."}}
{"run":414,"commit":"4f82018","metric":13.815424,"metrics":{"best_ms":13.616408,"quality_sum":2.491129377057,"quality_min":0.589775903809,"team_count":4},"status":"discard","description":"A/B check against kept 4f82018: reverted local `max_value` aliasing in 4x4 skill-upper fast paths back to direct `max(...)` calls.","timestamp":1775393594935,"segment":0,"confidence":27.893783793600715,"iterationTokens":4995,"asi":{"hypothesis":"If local `max` binding matters, reverting to direct `max(...)` should be slower in same-window runs.","rollback_reason":"Reverted variant did not clearly beat kept commit; slight regression within noise.","next_action_hint":"Retain 4f82018 for now and prioritize larger structural opportunities rather than further `max` call micro-tuning.","ab_note":"Same-window A/B indicates at most a small edge for the kept variant."}}
